2224|Comfortable with the Basics|Get 3 stars in all levels in World 1|12759|10 Jul 2018 2:47:27 PM|1493|3665|40.74|Uncommon|Bronze
2224|Learning the Ropes|Achieve with 3 stars on any level|12758|10 Jul 2018 2:25:31 PM|3352|3665|91.46|Common|Bronze
5402|To the Promised Place|100% Completed Steins;Gate 0.|12757|10 Jul 2018 11:43:13 AM|2867|4044|70.9|Common|Platinum
5402|Enki the All-Knowing|Saw all TIPS.|12756|10 Jul 2018 11:43:13 AM|2891|4044|71.49|Common|Gold
5402|100% CG Unlocked|Saw all CG.|12755|10 Jul 2018 11:20:10 AM|2966|4044|73.34|Common|Gold
5402|Vega and Altair|Cleared “Vega and Altair”.|12754|10 Jul 2018 11:20:09 AM|3094|4044|76.51|Common|Gold
5402|Milky-way Crossing|Cleared “Milky-way Crossing”.|12753|10 Jul 2018 11:20:09 AM|2993|4044|74.01|Common|Gold
6431|Cynical master|Unlock all trophies in Demetrios.|12752|10 Jul 2018 6:40:18 AM|1124|1341|83.82|Common|Platinum
6431|Leaving without closing the faucet|Forget to close the faucet before leaving Paris|12751|10 Jul 2018 6:40:18 AM|1158|1341|86.35|Common|Bronze
6431|Insulting the parents|Sandra insults her parents in her postcard|12750|10 Jul 2018 6:39:56 AM|1144|1341|85.31|Common|Bronze
6431|Chapter 6 complete|Finish the game|12749|10 Jul 2018 6:38:08 AM|1178|1341|87.84|Common|Gold
6431|Game Over expert|Experience all of the Game Overs|12748|10 Jul 2018 6:35:53 AM|1137|1341|84.79|Common|Gold
6431|Insulting the statue|Insult the statue in the last room|12747|10 Jul 2018 6:34:07 AM|1156|1341|86.2|Common|Bronze
6431|Lick that!|Order Sandra to lick the statue|12746|10 Jul 2018 6:33:49 AM|1173|1341|87.47|Common|Bronze
6431|Doctor Frankenstein|Create a clone of Bjorn and Caroline|12745|10 Jul 2018 6:33:03 AM|1167|1341|87.02|Common|Bronze
6431|Cookie expert|Get all the game cookies|12744|10 Jul 2018 6:32:20 AM|1147|1341|85.53|Common|Gold
6431|I wanna live!|Decide not to commit suicide after being poisoned|12743|9 Jul 2018 11:27:22 PM|1159|1341|86.43|Common|Bronze
6431|Chapter 5 complete|Finish Chapter 5|12742|9 Jul 2018 11:26:07 PM|1179|1341|87.92|Common|Silver
6431|Play on tombs|Win 10,000 points on the pinball tombstone|12741|9 Jul 2018 11:21:25 PM|1168|1341|87.1|Common|Silver
6431|I hate little girls|Get rid of Caroline at the hideout|12740|9 Jul 2018 11:00:12 PM|1162|1341|86.65|Common|Bronze
6431|Chapter 4 complete|Finish Chapter 4|12739|9 Jul 2018 10:57:04 PM|1192|1341|88.89|Common|Silver
6431|Insulting the hotel|Sandra write insults about the hotel|12738|9 Jul 2018 10:52:46 PM|1162|1341|86.65|Common|Bronze
6431|Oops, I fell|Fall from the roof accidentally|12737|9 Jul 2018 10:50:03 PM|1164|1341|86.8|Common|Bronze
6431|Game Over fan|Experience half of the Game Overs|12736|9 Jul 2018 10:46:01 PM|1186|1341|88.44|Common|Silver
4389|One Is Better Than None|Purchase one skill.|12735|9 Jul 2018 10:29:41 PM|42939|58019|74.01|Common|Bronze
4389|Gone to Hell|Complete Chapter 1 in Leon's campaign.|12734|9 Jul 2018 10:27:50 PM|40057|58019|69.04|Common|Bronze
4389|Lifesaver|Help or rescue your partner ten times.|12733|9 Jul 2018 10:20:21 PM|35646|58019|61.44|Common|Bronze
4389|The Longest Night|Complete the tutorial.|12732|9 Jul 2018 8:35:09 PM|53461|58019|92.14|Common|Bronze
6431|I thought that would work!|Put the entire plant in the sorcerer's glass|12731|9 Jul 2018 8:10:14 PM|1182|1341|88.14|Common|Bronze
6431|Flood the museum ground|Spill all the water in the container at the museum|12730|9 Jul 2018 8:08:47 PM|1181|1341|88.07|Common|Bronze
6431|Chapter 3 complete|Finish Chapter 3|12729|9 Jul 2018 8:00:48 PM|1204|1341|89.78|Common|Silver
6431|Will you wake up?!|Try disturbing things on Henri|12728|9 Jul 2018 7:59:18 PM|1182|1341|88.14|Common|Bronze
6431|Please help!|Use at least 10 cookies|12727|9 Jul 2018 7:51:23 PM|1229|1341|91.65|Common|Bronze
6431|Just die, I don't care|Refuse to help Henri|12726|9 Jul 2018 7:44:22 PM|1181|1341|88.07|Common|Bronze
6431|Chapter 2 complete|Finish Chapter 2|12725|9 Jul 2018 7:38:08 PM|1229|1341|91.65|Common|Silver
6431|Funfair complete|Get all funfair items|12724|9 Jul 2018 7:32:56 PM|1201|1341|89.56|Common|Gold
6431|Let's get them all|Win all the plushes at the funfair claw machines|12723|9 Jul 2018 7:32:25 PM|1243|1341|92.69|Common|Silver
6431|Bad luck!|Turn the wheel and die|12722|9 Jul 2018 7:27:42 PM|1237|1341|92.24|Common|Bronze
6431|Trophy Pet Shoot|Win the Pet Shoot trophy|12721|9 Jul 2018 7:27:00 PM|1223|1341|91.2|Common|Bronze
6431|Trophy Plate Shoot|Win the Plate Shoot trophy|12720|9 Jul 2018 7:25:46 PM|1204|1341|89.78|Common|Bronze
6431|Mommy, let's go to the funfair!|Win 100 coins at the funfair|12719|9 Jul 2018 7:18:15 PM|1242|1341|92.62|Common|Silver
6431|Trophy Horse Race|Win the Horse Race trophy|12718|9 Jul 2018 7:17:13 PM|1244|1341|92.77|Common|Bronze
6431|Trophy Worm Race|Win the Worm Race trophy|12717|9 Jul 2018 7:16:21 PM|1242|1341|92.62|Common|Bronze
6431|Cookie eater|Get half of the game cookies|12716|9 Jul 2018 7:15:24 PM|1220|1341|90.98|Common|Silver
6431|I love to die|Die ten times|12715|9 Jul 2018 7:00:40 PM|1249|1341|93.14|Common|Silver
6431|Chapter 1 complete|Finish Chapter 1|12714|9 Jul 2018 6:57:08 PM|1282|1341|95.6|Common|Silver
6431|I love to eat rotten things|Eat 3 rotten things on the floor|12713|9 Jul 2018 6:50:02 PM|1279|1341|95.38|Common|Bronze
6431|No respect for the police|Do dirty things at the police station|12712|9 Jul 2018 6:47:57 PM|1328|1341|99.03|Common|Bronze
5402|Presage or Recognize|Cleared “Presage or Recognize”.|12711|9 Jul 2018 6:56:14 AM|3102|4044|76.71|Common|Silver
6030|Totale Brutale|You have unlocked every trick, secret and note that the mansion has to offer.|12710|8 Jul 2018 8:31:53 PM|2563|5139|49.87|Uncommon|Platinum
6030|The Tale of the Sexy Brutale|The pieces are in place. But the picture is still not complete…|12709|8 Jul 2018 8:31:53 PM|3111|5139|60.54|Common|Gold
6030|A Full Deck|You collected every card available within the mansion. Someone will be very pleased …|12708|8 Jul 2018 8:21:14 PM|2574|5139|50.09|Common|Gold
6030|The Gang's All Here|You possess every invite sent to every guest. It is a full — if macabre — collection.|12707|8 Jul 2018 8:20:05 PM|2606|5139|50.71|Common|Gold
6030|Finding Forever|You spilled the deepest secrets at the heart of the Sexy Brutale.|12706|8 Jul 2018 8:01:59 PM|2858|5139|55.61|Common|Silver
6030|…Into the Fire|You have survived the burning mansion. For some reason, it feels hotter than ever.|12705|8 Jul 2018 7:51:08 PM|3128|5139|60.87|Common|Bronze
6030|The King in Red|You encountered the deep Lord of the mansion. A prison in his own bloodied tears.|12704|8 Jul 2018 7:45:22 PM|3135|5139|61.0|Common|Gold
6030|Out of the Frying Pan…|You saved Aurum and Thanos. The secrets of the mansion are yours to learn.|12703|8 Jul 2018 7:12:14 PM|3156|5139|61.41|Common|Gold
6030|The Light Fantastic|You smashed a priceless chandelier with your voice. Vandalism!|12702|8 Jul 2018 6:31:05 PM|3221|5139|62.68|Common|Bronze
6030|Stories and Studies of Strange Things|You discovered the library. What secrets does it hide?|12701|8 Jul 2018 6:29:08 PM|3229|5139|62.83|Common|Silver
6030|How Scenical! How Scenical!|You discovered the mansion grounds. A beautiful, terrible sight.|12700|8 Jul 2018 6:23:51 PM|3212|5139|62.5|Common|Silver
6030|An Electric Performance!|You saved Greyson and Redd. The locks of the mansion open for you.|12699|8 Jul 2018 6:16:59 PM|3263|5139|63.49|Common|Gold
6030|A (Stylish) Sense of Dread|You have encountered a chilling figure in the heart of the mansion.|12698|8 Jul 2018 5:52:58 PM|3335|5139|64.9|Common|Bronze
6030|Tequila, Down the Hatch|You saved Tequila Belle. Glass shatters at your word.|12697|8 Jul 2018 5:50:44 PM|3337|5139|64.93|Common|Silver
6030|The Devil and the Blue|You saved Willow Blue. You can see things that should remain unseen.|12696|8 Jul 2018 5:32:56 PM|3490|5139|67.91|Common|Silver
6030|The Door of Old Habits…|You have unlocked the door to a deep, dark place. Some things never die.|12695|8 Jul 2018 5:15:18 PM|2870|5139|55.85|Common|Gold
6030|To Defeat the Spider's Curse…|You saved Trinity and Clay. The quietest of sounds are clear to you.|12694|8 Jul 2018 4:57:38 PM|4028|5139|78.38|Common|Gold
6030|Sixpence None the Wiser|You saved Reginald Sixpence. The mansion clocks are yours to command.|12693|8 Jul 2018 4:33:42 PM|4645|5139|90.39|Common|Silver
6030|The End of the Beginning|You saw everything the Bloody Girl has to show you. Time to get to work.|12692|8 Jul 2018 4:22:44 PM|4959|5139|96.5|Common|Bronze
6563|Platinum|Unlock every Trophy.|12691|8 Jul 2018 3:42:48 PM|1280|1501|85.28|Common|Platinum
6563|Dragonslayer|Deal with a dragon once and for all.|12690|8 Jul 2018 3:42:48 PM|1357|1501|90.41|Common|Gold
6563|Sheriff|Protect the spirits.|12689|8 Jul 2018 3:23:11 PM|1368|1501|91.14|Common|Silver
6563|Master Healer|Complete the game on expert difficulty|12688|8 Jul 2018 3:12:50 PM|1324|1501|88.21|Common|Gold
6563|Save the day|Complete the game.|12687|8 Jul 2018 3:12:45 PM|1389|1501|92.54|Common|Gold
6563|No crystal ball|Finish all Hidden Object Puzzles without using hints.|12686|8 Jul 2018 3:11:40 PM|1343|1501|89.47|Common|Gold
6563|Skip? Never!|Finish all Mini-Games without skipping.|12685|8 Jul 2018 3:10:54 PM|1335|1501|88.94|Common|Gold
6563|True Herbalist|Find all Healer's Sigils.|12684|8 Jul 2018 3:06:20 PM|1296|1501|86.34|Common|Gold
6563|Forgotten story|Witness the stories through the golden feathers.|12683|8 Jul 2018 2:57:24 PM|1391|1501|92.67|Common|Silver
6563|To dungeons deep|Enter Dark Castle Dungeon.|12682|8 Jul 2018 2:49:13 PM|1391|1501|92.67|Common|Bronze
6563|Kindred Spirit|Get help from the Forest Spirit.|12681|8 Jul 2018 2:27:25 PM|1399|1501|93.2|Common|Bronze
6563|Save the child|Find the kidnapped prince.|12680|8 Jul 2018 2:12:28 PM|1405|1501|93.6|Common|Silver
6563|Eagle Eye|Finish 6 Hidden Object Puzzles in a row without using hints.|12679|8 Jul 2018 2:01:39 PM|1389|1501|92.54|Common|Silver
6563|Apprentice|Find half of all Healer's Sigils.|12678|8 Jul 2018 1:56:06 PM|1354|1501|90.21|Common|Silver
6563|Buried secrets|Open the Passage to the Forest Cavern.|12677|8 Jul 2018 1:55:41 PM|1409|1501|93.87|Common|Bronze
6563|Otter Friend|Get help from an Otter.|12676|8 Jul 2018 1:50:46 PM|1410|1501|93.94|Common|Bronze
6563|Row your boat|Prepare the swan boat for the journey.|12675|8 Jul 2018 1:46:28 PM|1403|1501|93.47|Common|Silver
6563|Like a wind|Finish Hidden Object Puzzle in less than 30 seconds.|12674|8 Jul 2018 1:34:19 PM|1396|1501|93.0|Common|Silver
6563|Surgical Aim|Finish any Hidden Object Puzzle with less than 4 mistakes.|12673|8 Jul 2018 1:34:19 PM|1408|1501|93.8|Common|Bronze
6563|Entomophobia|Scare 6 butterflies.|12672|8 Jul 2018 1:31:35 PM|1409|1501|93.87|Common|Bronze
6563|One per second|Find 3 hidden-objects within 3 seconds.|12671|8 Jul 2018 1:29:57 PM|1434|1501|95.54|Common|Bronze
6563|Fresh Air|Enter the Garden.|12670|8 Jul 2018 1:28:50 PM|1410|1501|93.94|Common|Bronze
6563|True Player|Finish 4 Mini-Games in a row without skipping.|12669|8 Jul 2018 1:22:08 PM|1407|1501|93.74|Common|Silver
6563|That was quick|Finish any Mini-Game in less than 1 minute.|12668|8 Jul 2018 1:20:19 PM|1422|1501|94.74|Common|Bronze
6563|Little Birdie|Get help from a Swallow.|12667|8 Jul 2018 1:18:50 PM|1417|1501|94.4|Common|Bronze
6563|Keep Calm|Prepare the Calming Brew.|12666|8 Jul 2018 1:12:56 PM|1427|1501|95.07|Common|Bronze
6563|Health Inspector|Find a Healer's Sigil.|12665|8 Jul 2018 1:06:58 PM|1440|1501|95.94|Common|Bronze
5402|Gehenna's Stigma.|Cleared “Gehenna's Stigma”.|12664|8 Jul 2018 6:54:54 AM|3166|4044|78.29|Common|Silver
6833|Platinum|Earn all other trophies|12663|7 Jul 2018 8:14:49 PM|1318|15310|8.61|Very Rare|Platinum
6833|Case Closed|The Trapper is arrested|12662|7 Jul 2018 8:14:49 PM|2830|15310|18.48|Rare|Silver
6833|Dead or Alive|The Trapper dies|12661|7 Jul 2018 7:55:05 PM|3170|15310|20.71|Uncommon|Silver
6833|Goodbye World|The Trapper tries to commit suicide|12660|7 Jul 2018 7:55:04 PM|1719|15310|11.23|Rare|Silver
6833|Rat in the Trap|Felicity tricks the killer into an ambush|12659|7 Jul 2018 7:52:17 PM|2603|15310|17.0|Rare|Silver
6833|Bomb Squad|Becky defuses a bomb|12658|7 Jul 2018 7:34:59 PM|5529|15310|36.11|Uncommon|Bronze
6833|Partners in Crime|Becky's partner helps her escape the cops|12657|7 Jul 2018 7:34:57 PM|4847|15310|31.66|Uncommon|Silver
6833|Echoes|Daniella Cárdenas identifies the Trapper|12656|7 Jul 2018 7:24:10 PM|5329|15310|34.81|Uncommon|Silver
6833|Trust|Finn leads Becky to Adam|12655|7 Jul 2018 7:16:22 PM|3456|15310|22.57|Uncommon|Silver
6833|Movie Night|Complete Story Mode|12654|7 Jul 2018 5:27:57 PM|8709|15310|56.88|Common|Gold
6833|Fourth Degree|Felicity burns to death|12653|7 Jul 2018 5:27:50 PM|1641|15310|10.72|Rare|Silver
6833|Wipeout|Becky and Felicity both die|12652|7 Jul 2018 5:27:50 PM|2099|15310|13.71|Rare|Silver
6833|Antitrust|Finn teams up with Adam|12651|7 Jul 2018 5:27:13 PM|1832|15310|11.97|Rare|Silver
6833|Gross Misconduct|Becky murders her sergeant|12650|7 Jul 2018 5:26:09 PM|1689|15310|11.03|Rare|Silver
6833|The Killer Unmasked|Simon is revealed as the Trapper|12649|7 Jul 2018 5:12:25 PM|5101|15310|33.32|Uncommon|Silver
6833|Night Moves|Felicity breaks into Simon's residence|12648|7 Jul 2018 5:08:49 PM|4630|15310|30.24|Uncommon|Silver
6833|Stalker|Becky catches a prowler in the cabin|12647|7 Jul 2018 5:00:11 PM|7609|15310|49.7|Uncommon|Bronze
6833|Blue Movies|Becky finds the spycam|12646|7 Jul 2018 4:58:27 PM|9262|15310|60.5|Common|Silver
6833|Dressed to Kill|Becky links the hooker to two previous murders|12645|7 Jul 2018 4:47:45 PM|7587|15310|49.56|Uncommon|Silver
6833|Fugitive|Finn escapes from police custody|12644|7 Jul 2018 4:44:09 PM|6526|15310|42.63|Uncommon|Silver
6833|Truth Hurts|Becky tells Finn about Calvary's murder|12643|7 Jul 2018 4:40:53 PM|3398|15310|22.19|Uncommon|Bronze
6833|Sins of the Father|Becky finds Father Rominski's "Play Room"|12642|7 Jul 2018 4:29:01 PM|8698|15310|56.81|Common|Bronze
6833|Open and Shut|Unanimously agree on a Trust question|12641|7 Jul 2018 3:23:05 PM|7997|15310|52.23|Common|Bronze
6833|Mercy Kill|Becky shoots Judge Vanstone|12640|7 Jul 2018 3:16:59 PM|4094|15310|26.74|Uncommon|Bronze
6833|Mastermind|Complete an Endgame Agenda|12639|7 Jul 2018 3:08:19 PM|3269|15310|21.35|Uncommon|Silver
6833|The Rivals|Complete Competitive Mode|12638|7 Jul 2018 3:08:15 PM|3735|15310|24.4|Uncommon|Gold
6833|Gun Shy|Complete the game without ever using a weapon|12637|7 Jul 2018 3:08:14 PM|5111|15310|33.38|Uncommon|Silver
6833|Chinatown|The investigation hits a deadend|12636|7 Jul 2018 3:08:07 PM|6369|15310|41.6|Uncommon|Bronze
6833|Red Wire, Blue Wire|Becky dies in an explosion|12635|7 Jul 2018 3:06:53 PM|3798|15310|24.81|Uncommon|Bronze
6833|Mickey Finn|Becky is drugged|12634|7 Jul 2018 2:56:37 PM|6248|15310|40.81|Uncommon|Bronze
6833|Butter Fingers|Vernon LeMay falls to his death|12633|7 Jul 2018 2:40:03 PM|4382|15310|28.62|Uncommon|Bronze
6833|Bad Blood|Becky uncovers Adam's backstory|12632|7 Jul 2018 2:29:45 PM|8854|15310|57.83|Common|Bronze
6833|The F Bomb|Becky swears at her partner|12631|7 Jul 2018 2:13:13 PM|7557|15310|49.36|Uncommon|Bronze
6833|CSI|Find every clue in a single search|12630|7 Jul 2018 1:58:27 PM|12557|15310|82.02|Common|Bronze
6833|Ace in the Hole|Felicity convinces Judge Vanstone to release Finn|12629|7 Jul 2018 1:52:27 PM|10665|15310|69.66|Common|Bronze
6833|No Dice|Foil a Hidden Agenda|12628|7 Jul 2018 1:48:47 PM|5455|15310|35.63|Uncommon|Bronze
6833|Busted|Unanimously identify who has the Hidden Agenda|12627|7 Jul 2018 1:41:24 PM|4817|15310|31.46|Uncommon|Bronze
6833|Deception|Win a Hidden Agenda|12626|7 Jul 2018 1:41:17 PM|5958|15310|38.92|Uncommon|Bronze
6833|Peacemaker|Don't shoot during a combat event|12625|7 Jul 2018 1:26:45 PM|11497|15310|75.09|Common|Bronze
6833|Double Jeopardy|Takeover a takeover|12624|7 Jul 2018 1:25:37 PM|6559|15310|42.84|Uncommon|Bronze
6833|Fastest Finger|Succeed on a Quick Time Event|12623|7 Jul 2018 1:25:20 PM|14217|15310|92.86|Common|Bronze
6833|Choose Wisely|Make your first choice|12622|7 Jul 2018 1:24:31 PM|14661|15310|95.76|Common|Bronze
5402|Pandora's Box|Cleared “Pandora's Box”.|12621|7 Jul 2018 11:38:25 AM|3265|4044|80.74|Common|Silver
5402|75% CG Unlocked|Saw 75% of CG.|12620|7 Jul 2018 11:22:58 AM|3055|4044|75.54|Common|Silver
5885|Platinum|Unlock every Trophy.|12619|6 Jul 2018 10:23:51 PM|1804|2507|71.96|Common|Platinum
5885|Game, set, match|Finish all of the Domino games!|12618|6 Jul 2018 10:23:51 PM|1823|2507|72.72|Common|Gold
5885|Equally matched|Finish half of the Domino games!|12617|6 Jul 2018 9:43:50 PM|1868|2507|74.51|Common|Silver
5885|Speed reach|Beat a domino game in under a minute!|12616|6 Jul 2018 8:47:23 PM|1875|2507|74.79|Common|Silver
5885|The story's end|Finish the bonus adventure.|12615|6 Jul 2018 8:30:52 PM|2115|2507|84.36|Common|Gold
5885|Finisher|Solve all of the puzzles without skipping even once!|12614|6 Jul 2018 8:30:02 PM|2019|2507|80.53|Common|Gold
5885|Seer|Finish all the Hidden-Object Puzzles with no hints!|12613|6 Jul 2018 8:23:04 PM|1928|2507|76.9|Common|Gold
5885|The bottom|Pass The Golden Gate of the Phoenix.|12612|6 Jul 2018 8:10:51 PM|2120|2507|84.56|Common|Silver
5885|Finally together!|Finish the game.|12611|6 Jul 2018 7:48:18 PM|2167|2507|86.44|Common|Gold
5885|The hard way|Finish the game on Expert Mode!|12610|6 Jul 2018 7:48:18 PM|1980|2507|78.98|Common|Gold
5885|The wheel turns|Approach the Abyss edge.|12609|6 Jul 2018 7:25:23 PM|2168|2507|86.48|Common|Silver
5885|I thee wed|Reveal the true nature of your enemy.|12608|6 Jul 2018 7:14:24 PM|2173|2507|86.68|Common|Silver
5402|X-Day Protocol|Cleared “X-Day Protocol”.|12607|6 Jul 2018 3:24:28 PM|3293|4044|81.43|Common|Silver
5885|Dungeoner|Pass the underground labyrinth.|12606|5 Jul 2018 9:06:38 PM|2189|2507|87.32|Common|Silver
5885|Cheating death|Make a salve.|12605|5 Jul 2018 8:34:21 PM|2215|2507|88.35|Common|Bronze
5885|Piercing gaze|Finish 3 Hidden-Object Puzzles in a row with no hints!|12604|5 Jul 2018 8:18:11 PM|2182|2507|87.04|Common|Silver
5885|Marksman|Finish a Hidden-Object Puzzle with barely any mistakes!|12603|5 Jul 2018 8:13:00 PM|2151|2507|85.8|Common|Bronze
5885|Quick one|Nail a Hidden-Object Puzzle in under a minute.|12602|5 Jul 2018 8:12:59 PM|2153|2507|85.88|Common|Silver
5885|Puzzle master|Finish a puzzle in under a minute!|12601|5 Jul 2018 8:01:44 PM|2200|2507|87.75|Common|Silver
5885|Master hunter|Track your prey to its lair.|12600|5 Jul 2018 8:00:12 PM|2248|2507|89.67|Common|Silver
5885|Don't skip|Solve 3 Puzzles in a row without skipping.|12599|5 Jul 2018 7:58:57 PM|2258|2507|90.07|Common|Silver
5885|3-IN-3|Find 3 Hidden Objects in just 3 seconds!|12598|5 Jul 2018 7:40:25 PM|2247|2507|89.63|Common|Bronze
5885|Strike!|Topple the trunk over the ravine.|12597|5 Jul 2018 7:38:14 PM|2330|2507|92.94|Common|Bronze
5885|Gossip queen|Chat with all the villagers.|12596|5 Jul 2018 7:29:25 PM|2292|2507|91.42|Common|Bronze
5885|Fuzzy lil' fellow|Gain the little helper.|12595|5 Jul 2018 7:25:01 PM|2383|2507|95.05|Common|Bronze
5402|Message of Oblivion Renvoir|Read and ignored a message.|12594|5 Jul 2018 4:47:12 PM|2994|4044|74.04|Common|Bronze
5402|Twin Automata|Cleared “Twin Automata”.|12593|5 Jul 2018 4:47:10 PM|3075|4044|76.04|Common|Silver
5402|50% CG Unlocked|Saw 50% of CG.|12592|5 Jul 2018 3:55:43 PM|3183|4044|78.71|Common|Bronze
5402|Promised Rinascimento|Cleared “Promised Rinascimento”.|12591|5 Jul 2018 1:19:30 PM|3079|4044|76.14|Common|Gold
7778|マンガ・カ・ケータ|マンガ・カ・ケールを極めた証。あなたの作品を待ちわびる人たちがきっといるはずです。|12590|4 Jul 2018 7:58:14 PM|399|505|79.01|Common|Platinum
7778|マンガ家生活１ヶ月目|マンガ家生活を１ヶ月目の証。あなたはもう立派なマンガ家です。|12589|4 Jul 2018 7:58:14 PM|402|505|79.6|Common|Gold
7778|マンガ家生活３週間目|マンガ家生活を３週間目の証。熟練の技が光ります。|12588|4 Jul 2018 7:54:06 PM|405|505|80.2|Common|Gold
7778|マンガ家生活２週間目|マンガ家生活を２週間目の証。そろそろマンガ・カ・ケールが習慣になってきたのではないでしょうか。|12587|4 Jul 2018 7:50:38 PM|411|505|81.39|Common|Silver
7778|マンガ家生活１週間目|マンガ家生活を１週間目の証。手慣れた手つきに慣れを感じます。|12586|4 Jul 2018 7:46:27 PM|422|505|83.56|Common|Silver
7778|マンガ家生活５日目|マンガ家生活を５日目の証。マンガ道はまだまだこれからです。|12585|4 Jul 2018 7:45:31 PM|429|505|84.95|Common|Silver
7778|マンガ家生活３日目|マンガ家生活を３日目の証。目指せ、脱三日坊主！|12584|4 Jul 2018 7:44:25 PM|432|505|85.54|Common|Bronze
7778|待望のマンガ家デビュー！|投稿サイトにマンガを投稿した証。これであなたもクリエイター。|12583|4 Jul 2018 7:40:05 PM|436|505|86.34|Common|Gold
7778|走る筆は止まらない|新しいコマを追加した証。|12582|4 Jul 2018 7:38:07 PM|454|505|89.9|Common|Silver
7778|構図のセンス|コマにアイテムを置いた証。|12581|4 Jul 2018 7:37:34 PM|445|505|88.12|Common|Bronze
7778|感情の表現者|コマに漫符を置いた証。|12580|4 Jul 2018 7:37:12 PM|449|505|88.91|Common|Bronze
7778|迫力の１コマ|コマに効果を置いた証。|12579|4 Jul 2018 7:36:44 PM|449|505|88.91|Common|Bronze
7778|美しい背景美術|コマに背景を置いた証。|12578|4 Jul 2018 7:36:29 PM|459|505|90.89|Common|Bronze
7778|絵に音を与える|コマに描き文字を置いた証。|12577|4 Jul 2018 7:34:59 PM|449|505|88.91|Common|Bronze
7778|絶妙なセリフまわし|コマにふきだしを置いて、セリフを入れた証。|12576|4 Jul 2018 7:34:32 PM|456|505|90.3|Common|Silver
7778|キャラクターの生みの親|新しいキャラクターを設定した証。|12575|4 Jul 2018 7:33:37 PM|467|505|92.48|Common|Silver
7778|秘密の素材|パスワードを入力してマンガ素材を得た証。あなたのマンガに新しい魅力をプラスします。|12574|4 Jul 2018 7:31:08 PM|434|505|85.94|Common|Silver
7778|売れっ子バトルマンガ家|第一話ジェネレーターの超能力編をクリアして、サイキックバトルマンガを生成した証。|12573|4 Jul 2018 7:30:35 PM|435|505|86.14|Common|Gold
7778|国民的ミステリー作家|第一話ジェネレーターのサスペンス編をクリアして、ミステリーマンガを生成した証。|12572|4 Jul 2018 7:26:46 PM|446|505|88.32|Common|Gold
7778|野球マンガの巨匠|第一話ジェネレーターの野球編をクリアして、野球マンガを生成した証。|12571|4 Jul 2018 7:21:41 PM|435|505|86.14|Common|Gold
7778|はじめてのマンガ制作|マンガを作って保存した証。あなたの処女作です。|12570|4 Jul 2018 7:17:51 PM|471|505|93.27|Common|Bronze
7778|人気恋愛マンガ家|第一話ジェネレーターの恋愛編をクリアして、恋愛マンガを生成した証。|12569|4 Jul 2018 7:14:10 PM|451|505|89.31|Common|Gold
7778|運命の分かれ道|第一話ジェネレーターで、生成するマンガの内容が決まった証。あなたの選択で、さまざまなマンガが生まれます。|12568|4 Jul 2018 7:11:16 PM|478|505|94.65|Common|Bronze
7778|これであなたも先生|自分にペンネームをつけた証。あなたの名前が世に広まることでしょう。|12567|4 Jul 2018 7:05:29 PM|500|505|99.01|Common|Bronze
7778|アシスタントを雇う|アシスタントを雇った証。マンガ家生活の第一歩です。|12566|4 Jul 2018 7:05:22 PM|500|505|99.01|Common|Bronze
5402|Those Who Seek Movement|Opened Movie Library.|12565|4 Jul 2018 5:05:34 PM|3225|4044|79.75|Common|Bronze
5402|Those Who Seek Sound|Opened Sound Library.|12564|4 Jul 2018 5:05:21 PM|3223|4044|79.7|Common|Bronze
5402|Those Who Seek Art|Opened CG Library.|12563|4 Jul 2018 5:05:09 PM|3236|4044|80.02|Common|Bronze
5402|Those Who Seek History|Opened Clear List.|12562|4 Jul 2018 5:04:57 PM|3238|4044|80.07|Common|Bronze
5402|Recursive Mother Goose|Cleared “Recursive Mother Goose”.|12561|4 Jul 2018 5:04:20 PM|3043|4044|75.25|Common|Silver
5402|Antinomic Dual|Cleared “Anitomic Dual”.|12560|4 Jul 2018 12:00:51 PM|3130|4044|77.4|Common|Silver
4295|Firewatch|Completed Day 79|12559|3 Jul 2018 8:23:46 PM|22072|27778|79.46|Common|Gold
4295|"Burn the place down."|Completed Day 77|12558|3 Jul 2018 7:42:14 PM|22421|27778|80.71|Common|Gold
4295|Bee Plot|Got stung by a bee. It happens.|12557|3 Jul 2018 7:24:42 PM|9542|10456|55.99|Common|Bronze
4295|Ol' Shoshone|Listened to the tape of "Ol' Shoshone." Cavorted among the aspens.|12556|3 Jul 2018 7:06:00 PM|4460|10456|26.17|Uncommon|Bronze
4295|The Life and Times of Raccoon Carter|Got attacked by a raccoon; probably didn't get rabies.|12555|3 Jul 2018 7:03:24 PM|5082|10456|29.82|Uncommon|Bronze
4295|"Someone's out here."|Completed Day 76|12554|3 Jul 2018 6:55:35 PM|22786|27778|82.03|Common|Gold
7504|Platinum-explosion|Complete all the trophies|12553|3 Jul 2018 11:36:27 AM|1334|1558|85.62|Common|Platinum
7504|Kill them all|Kill 100 enemies in Arena Mode|12552|3 Jul 2018 11:36:27 AM|1340|1558|86.01|Common|Gold
7504|Without any mercy|Kill 75 enemies in Arena Mode|12551|3 Jul 2018 11:35:39 AM|1352|1558|86.78|Common|Gold
7504|Brave|Kill your first enemy in hard mode|12550|3 Jul 2018 11:25:44 AM|1345|1558|86.33|Common|Gold
7504|Getting used|Kill 50 enemies in Arena Mode|12549|3 Jul 2018 11:24:48 AM|1358|1558|87.16|Common|Gold
7504|Kill or get killed|Kill 25 enemies in Arena Mode|12548|3 Jul 2018 11:23:52 AM|1362|1558|87.42|Common|Gold
7504|Unlock the Arena Mode|Reach 100,000 points in Classic Mode|12547|3 Jul 2018 11:20:32 AM|1362|1558|87.42|Common|Gold
