5723|Chapter Two Cleared!|Cleared Chapter Two|12983|31 Jul 2018 8:04:29 PM|3894|12526|31.09|Uncommon|Bronze
5723|Moneybags!|Acquired over 100,000 bits|12982|31 Jul 2018 7:37:38 PM|3693|12526|29.48|Uncommon|Bronze
5723|Heavy Attacker!|Inflicted 9,999 damage in one attack|12981|31 Jul 2018 7:20:20 PM|4665|12526|37.24|Uncommon|Silver
5723|Good Friend!|Maximum value for DigiFriend|12980|30 Jul 2018 10:10:02 PM|4135|12526|33.01|Uncommon|Bronze
4318|Ankheg Annihilator|Defeat the Ankheg.|12979|30 Jul 2018 12:13:25 PM|4287|7353|58.3|Common|Bronze
4318|Vampire Vanquisher|Defeat the Vampire.|12978|30 Jul 2018 11:00:53 AM|4862|7353|66.12|Common|Bronze
4318|Hydra Harrier|Defeat the Hydra.|12977|30 Jul 2018 10:22:26 AM|5226|7353|71.07|Common|Bronze
4318|Jackal Jaw-breaker|Defeat the Jackal.|12976|30 Jul 2018 8:59:25 AM|7166|7353|97.46|Common|Bronze
5723|Town Revitalized!|Prosperity at level 50|12975|29 Jul 2018 8:28:33 PM|4489|12526|35.84|Uncommon|Bronze
5723|Rookie with Promise!|First Colosseum victory|12974|29 Jul 2018 8:04:29 PM|4227|12526|33.75|Uncommon|Bronze
5037|The Night Alone|Earned all other trophies|12973|29 Jul 2018 8:56:15 AM|507|2684|18.89|Rare|Platinum
5037|Long Night|Played a total of 50 hours|12972|29 Jul 2018 8:56:15 AM|535|2684|19.93|Rare|Silver
5723|Old-Timer!|Partner reached age 20|12971|29 Jul 2018 7:39:44 AM|5031|12526|40.16|Uncommon|Bronze
5723|Chapter One Cleared!|Cleared Chapter One|12970|28 Jul 2018 9:09:29 PM|5568|12526|44.45|Uncommon|Bronze
5723|Legendary Tamer!|First Digivolution to Mega|12969|28 Jul 2018 8:21:14 PM|6229|12526|49.73|Uncommon|Bronze
5723|Hunter King!|First king-sized foe defeated|12968|28 Jul 2018 8:08:17 PM|6149|12526|49.09|Uncommon|Bronze
5723|First Camp!|First camp|12967|28 Jul 2018 7:25:43 PM|6141|12526|49.03|Uncommon|Bronze
5723|Unconstrained!|All skills for Partner Digimon at 1,000|12966|28 Jul 2018 5:30:27 PM|6530|12526|52.13|Common|Silver
5723|First-Class Tamer!|First Digivolution to Ultimate|12965|28 Jul 2018 12:17:01 PM|8479|12526|67.69|Common|Bronze
5723|Hardcore Attacker!|Inflicted 1,000 damage in one attack|12964|28 Jul 2018 8:12:42 AM|8377|12526|66.88|Common|Bronze
5723|Best Friend!|Maximum value for Bond|12963|27 Jul 2018 9:30:38 PM|8878|12526|70.88|Common|Bronze
5723|Hang in There...|First training mistake|12962|27 Jul 2018 9:14:31 PM|10108|12526|80.7|Common|Bronze
5723|Capable Tamer!|First Digivolution to Champion|12961|27 Jul 2018 8:58:46 PM|9898|12526|79.02|Common|Bronze
5723|Started Fishing|First fish caught|12960|27 Jul 2018 7:41:33 PM|8350|12526|66.66|Common|Bronze
5723|Signs of Improvement!|First Tamer level|12959|27 Jul 2018 7:11:39 PM|10168|12526|81.18|Common|Bronze
5723|Figured It Out!|Finished a battle with no damage|12958|27 Jul 2018 7:02:40 PM|10868|12526|86.76|Common|Bronze
5723|First Acquisition!|First materials acquired|12957|27 Jul 2018 1:28:18 PM|11144|12526|88.97|Common|Bronze
5723|Strategic Retreat!|First time fleeing from a fight|12956|27 Jul 2018 1:19:50 PM|9631|12526|76.89|Common|Bronze
5723|First Ingredient!|First food ingredient item picked up|12955|27 Jul 2018 1:18:24 PM|11154|12526|89.05|Common|Bronze
5723|First Contribution!|Prosperity at level 1|12954|27 Jul 2018 1:17:02 PM|11324|12526|90.4|Common|Bronze
5723|Rookie Tamer!|First Digivolution to Rookie|12953|27 Jul 2018 1:11:05 PM|11509|12526|91.88|Common|Bronze
5723|Trainer Debut!|First training|12952|27 Jul 2018 1:01:04 PM|11720|12526|93.57|Common|Bronze
5723|Rebirth!|First Partner Digimon reborn as DigiEgg|12951|27 Jul 2018 12:53:28 PM|12130|12526|96.84|Common|Bronze
5025|Our Journey ends|Climb to the top.|12950|26 Jul 2018 9:28:40 AM|4269|5980|71.39|Common|Platinum
5025|Perfect memory|The pictures are complete.|12949|26 Jul 2018 9:28:40 AM|4360|5980|72.91|Common|Gold
5025|Treasure hunter|A completed memento in the desert.|12948|26 Jul 2018 9:28:39 AM|4439|5980|74.23|Common|Gold
5025|Solaris Master|All the grids are blue now.|12947|26 Jul 2018 9:25:34 AM|4340|5980|72.58|Common|Silver
5025|Acceptance|Follow the light.|12946|26 Jul 2018 9:25:33 AM|4585|5980|76.67|Common|Silver
5025|Completion Serenity|No puzzle left undone.|12945|26 Jul 2018 9:25:31 AM|4292|5980|71.77|Common|Gold
5025|Bringing everything together|Six fragments of a memory.|12944|26 Jul 2018 9:22:25 AM|4523|5980|75.64|Common|Silver
5025|Depression|Exit the basement.|12943|26 Jul 2018 9:19:37 AM|4606|5980|77.02|Common|Silver
5025|Vivid recollection|A completed memento in the hospital.|12942|26 Jul 2018 9:17:47 AM|4416|5980|73.85|Common|Gold
5025|Opening the gates|Gain access to the large staircase.|12941|26 Jul 2018 9:17:11 AM|4621|5980|77.27|Common|Bronze
5025|Cherish the past|Six fragments of a memory.|12940|26 Jul 2018 8:49:47 AM|4545|5980|76.0|Common|Silver
5025|Gnocchi Thursday|Lunch is served on Thursday.|12939|26 Jul 2018 8:43:47 AM|4416|5980|73.85|Common|Gold
5025|Bargain|Exit the forest.|12938|26 Jul 2018 8:28:23 AM|4715|5980|78.85|Common|Silver
5025|It's all coming back to me|A completed memento in the forest.|12937|26 Jul 2018 8:27:07 AM|4425|5980|74.0|Common|Gold
5025|Timber!|Find a way to cross the canyon.|12936|26 Jul 2018 8:23:19 AM|4732|5980|79.13|Common|Bronze
5025|I had forgotten so much|Six fragments of memory.|12935|26 Jul 2018 8:11:54 AM|4546|5980|76.02|Common|Silver
5025|Anger|Exit the caves.|12934|26 Jul 2018 7:54:20 AM|5128|5980|85.75|Common|Silver
5025|These are precious to me|A completed memento in the caves.|12933|26 Jul 2018 7:50:40 AM|4502|5980|75.28|Common|Gold
5025|Together again|Go on sweetie, run to your father.|12932|26 Jul 2018 7:39:41 AM|5248|5980|87.76|Common|Bronze
5025|Denial|See no evil, hear no evil, speak no evil.|12931|26 Jul 2018 7:34:20 AM|5338|5980|89.26|Common|Bronze
5025|Do you remember these?|Six fragments of a memory.|12930|26 Jul 2018 7:29:20 AM|4917|5980|82.22|Common|Silver
5025|Sphere of Light|Become a light unto yourself|12929|26 Jul 2018 7:24:22 AM|5551|5980|92.83|Common|Bronze
5025|Journey Begins|Solve the first puzzle.|12928|26 Jul 2018 7:19:09 AM|5725|5980|95.74|Common|Bronze
5025|My First Memento|A fragment of a memory.|12927|26 Jul 2018 7:16:40 AM|5609|5980|93.8|Common|Bronze
6050|Lend Me 50,000 Yen?|Completed all Silver Case trophies.|12926|25 Jul 2018 3:35:26 PM|467|1471|31.75|Uncommon|Platinum
6050|White Out prologue|Survived the White Out prologue case.|12925|25 Jul 2018 3:35:26 PM|539|1471|36.64|Uncommon|Gold
6050|A 25th Ward?|Learned about the attempt to build a 25th ward.|12924|25 Jul 2018 3:32:44 PM|537|1471|36.51|Uncommon|Silver
6050|Darkness|Completed the YAMI investigation.|12923|25 Jul 2018 3:26:17 PM|540|1471|36.71|Uncommon|Gold
6050|Light|Completed the HIKARI investigation.|12922|25 Jul 2018 3:20:02 PM|539|1471|36.64|Uncommon|Gold
6050|Love|Completed the AI investigation.|12921|25 Jul 2018 2:52:18 PM|543|1471|36.91|Uncommon|Silver
6050|Moon|Completed the TSUKI investigation.|12920|25 Jul 2018 2:03:10 PM|551|1471|37.46|Uncommon|Silver
5147|Collector|Add all secret shells to your collection.|12919|24 Jul 2018 2:28:23 PM|9158|59769|15.32|Rare|Gold
5147|Reflection|Complete the adventure.|12918|24 Jul 2018 2:27:58 PM|27721|59769|46.38|Uncommon|Silver
5147|Leviathan|Breach the water on the back of a blue whale.|12917|24 Jul 2018 2:25:37 PM|13832|59769|23.14|Uncommon|Bronze
5147|Arctic Explorer|Discover the polar region.|12916|24 Jul 2018 2:23:53 PM|11532|59769|19.29|Rare|Bronze
5147|Connection|Ride the Great White Shark.|12915|24 Jul 2018 2:12:03 PM|23548|59769|39.4|Uncommon|Bronze
5147|Zen Master|Find all the meditation statues.|12914|24 Jul 2018 2:02:15 PM|10231|59769|17.12|Rare|Silver
5147|Ecosystem|Release fish from all the hidden pools.|12913|24 Jul 2018 2:01:14 PM|9218|59769|15.42|Rare|Silver
5147|Kraken|Discover those that lurk in the abyss.|12912|24 Jul 2018 1:41:42 PM|21232|59769|35.52|Uncommon|Bronze
5147|Jetstream|Burst 15 fish schools in the jetstream.|12911|24 Jul 2018 12:59:04 PM|37978|59769|63.54|Common|Bronze
5147|Food Chain|Witness predation while meditating.|12910|24 Jul 2018 12:33:56 PM|30672|59769|51.32|Common|Bronze
5147|Ballet|Perform a flip while riding a creature.|12909|24 Jul 2018 12:26:16 PM|23620|59769|39.52|Uncommon|Bronze
5147|Breach|Leap from the water.|12908|24 Jul 2018 12:24:56 PM|43785|59769|73.26|Common|Bronze
6050|Flower|Completed the HANA investigation.|12907|24 Jul 2018 11:46:39 AM|566|1471|38.48|Uncommon|Silver
6050|Turtle Lover|Talked to Red 50 times.|12906|24 Jul 2018 11:10:11 AM|518|1471|35.21|Uncommon|Silver
6050|Dream|Completed the YUME investigation.|12905|24 Jul 2018 11:06:06 AM|614|1471|41.74|Uncommon|Bronze
6050|Resolution?|Survived the Danwa case.|12904|24 Jul 2018 10:15:20 AM|578|1471|39.29|Uncommon|Gold
6050|A New Birth?|Survived the Lifecut case.|12903|24 Jul 2018 9:48:25 AM|583|1471|39.63|Uncommon|Gold
6050|Dancer in the Dark|Collected both volumes of Kurayami Dance.|12902|24 Jul 2018 9:23:23 AM|513|1471|34.87|Uncommon|Silver
6050|Behind the Net|Survived the Kamuidrome case.|12901|24 Jul 2018 8:15:01 AM|596|1471|40.52|Uncommon|Silver
6050|Grand Marshal|Survived the Parade case.|12900|23 Jul 2018 8:59:50 PM|612|1471|41.6|Uncommon|Silver
6050|Investigate Orderly|Read the Mikumo village documents in order.|12899|23 Jul 2018 8:54:47 PM|501|1471|34.06|Uncommon|Bronze
5037|Kidnapped|Kidnapped by Mr. Yomawari|12898|23 Jul 2018 3:52:06 PM|661|2684|24.63|Uncommon|Bronze
5037|Offering|Made an offering to Jizo Statues a total of 50 times|12897|23 Jul 2018 3:33:07 PM|625|2684|23.29|Uncommon|Bronze
5037|Collector|Collected all items|12896|23 Jul 2018 3:28:40 PM|558|2684|20.79|Uncommon|Gold
5037|Memoirs|Collected all collectable items for your room|12895|23 Jul 2018 3:28:39 PM|561|2684|20.9|Uncommon|Gold
5037|Craft|Completed the radio|12894|23 Jul 2018 3:28:30 PM|602|2684|22.43|Uncommon|Gold
5037|Investigate|Completed the puzzle|12893|23 Jul 2018 3:26:15 PM|590|2684|21.98|Uncommon|Gold
5037|Sis|Talked to Sis a total of 12 times|12892|23 Jul 2018 2:50:14 PM|786|2684|29.28|Uncommon|Bronze
5037|Dawn|Cleared Chapter 7|12891|23 Jul 2018 2:48:19 PM|848|2684|31.59|Uncommon|Gold
5037|Wild Spirit|Found the Tsuchinoko|12890|23 Jul 2018 2:04:14 PM|695|2684|25.89|Uncommon|Gold
5037|Dead of Night|Cleared Chapter 6|12889|23 Jul 2018 1:36:52 PM|868|2684|32.34|Uncommon|Silver
6050|Many Shades|Survived the Spectrum case.|12888|22 Jul 2018 4:43:28 PM|646|1471|43.92|Uncommon|Silver
6050|Your score is in your heart.|Correctly answered all trivia questions.|12887|22 Jul 2018 4:34:45 PM|513|1471|34.87|Uncommon|Gold
6050|My other job is property manager.|Explored the entirety of the Typhoon apartment complex.|12886|22 Jul 2018 4:21:51 PM|526|1471|35.76|Uncommon|Silver
6050|Living in the Past|Tried to travel into the past.|12885|22 Jul 2018 3:15:02 PM|550|1471|37.39|Uncommon|Silver
6050|Met Kamui|Survived the Decoyman case.|12884|22 Jul 2018 3:15:01 PM|739|1471|50.24|Common|Bronze
6050|All Green|Completed HIT & BLOW in 5 or fewer attempts.|12883|22 Jul 2018 2:36:53 PM|542|1471|36.85|Uncommon|Silver
5037|Late Night|Cleared Chapter 5|12882|21 Jul 2018 4:16:19 PM|895|2684|33.35|Uncommon|Silver
5037|Adventurer|Collected all usable items|12881|21 Jul 2018 4:16:12 PM|652|2684|24.29|Uncommon|Silver
5037|Monster Cat|Picked up the Big Bell|12880|20 Jul 2018 2:37:02 PM|620|2684|23.1|Uncommon|Silver
4389|Two Sides of the Same Coin|Win 10 times.|12879|19 Jul 2018 8:32:08 PM|1758|2971|13.39|Rare|Bronze
4389|Protect and Serve|Protect the BSAA without any of them getting hurt.|12878|19 Jul 2018 8:09:45 PM|2336|2971|17.79|Rare|Bronze
4389|Murder Spree|Defeat the BSAA as a creature without dying once.|12877|19 Jul 2018 7:39:04 PM|2519|2971|19.19|Rare|Silver
4389|Surrounded on All Sides|Send 2,000 enemies to your opponent's map.|12876|19 Jul 2018 7:19:09 PM|2009|5038|11.75|Rare|Gold
5037|Moonless Night|Cleared Chapter 4|12875|19 Jul 2018 2:52:34 PM|947|2684|35.28|Uncommon|Bronze
5037|Award|Picked up a trophy|12874|19 Jul 2018 2:39:21 PM|674|2684|25.11|Uncommon|Silver
5037|Hide and Seek|Hid a total of 50 times|12873|19 Jul 2018 2:10:48 PM|1017|2684|37.89|Uncommon|Bronze
5037|Midnight|Cleared Chapter 3|12872|19 Jul 2018 1:55:48 PM|1019|2684|37.97|Uncommon|Bronze
5037|Indomitable|Suffered a Game Over a total of 30 times|12871|19 Jul 2018 1:41:20 PM|1043|2684|38.86|Uncommon|Bronze
6050|It must be important...|Let a phone ring for a long time.|12870|19 Jul 2018 11:15:14 AM|597|1471|40.58|Uncommon|Silver
6050|Follows Orders|Completed the Forest exactly as ordered.|12869|19 Jul 2018 10:55:20 AM|631|1471|42.9|Uncommon|Bronze
6050|Lunatic|Survived the Lunatic case.|12868|19 Jul 2018 10:19:27 AM|992|1471|67.44|Common|Bronze
6050|Avid Reader|Collected the 2nd Comic Beam.|12867|19 Jul 2018 10:13:34 AM|916|1471|62.27|Common|Bronze
4389|You Are S.O.L.|Defeat your opponent 10 times with enemies you sent.|12866|18 Jul 2018 9:14:23 PM|2007|5038|11.74|Rare|Bronze
4389|Killer Combo|Achieve a 30-combo chain.|12865|18 Jul 2018 8:05:11 PM|4913|5038|28.74|Uncommon|Silver
4389|Kill or Be Killed|Win while in the dying state.|12864|18 Jul 2018 7:55:06 PM|2475|5038|14.48|Rare|Bronze
4389|Take the Stage|Defeat your opponent and achieve victory in 3 stages.|12863|18 Jul 2018 7:51:42 PM|2894|5038|16.93|Rare|Silver
4389|One Is Never Enough|As Ustanak, capture a total of 50 humans.|12862|18 Jul 2018 6:37:44 PM|1955|7276|9.52|Very Rare|Bronze
5037|Home|Stayed home for a total of 15 minutes|12861|18 Jul 2018 3:57:02 PM|923|2684|34.39|Uncommon|Bronze
4389|Staying Alive|Return to the game as a human character.|12860|18 Jul 2018 8:59:59 AM|3557|5884|19.25|Rare|Bronze
4389|Team Effort|Win without any members of your team being killed.|12859|18 Jul 2018 8:54:16 AM|4676|5884|25.31|Uncommon|Bronze
4389|Not without a Fight|Defeat Ustanak 20 times.|12858|17 Jul 2018 9:08:49 PM|2436|7276|11.86|Rare|Gold
4389|Invincible|Defeat Ustanak without anyone on your team being captured.|12857|17 Jul 2018 8:40:19 PM|6333|7276|30.82|Uncommon|Silver
4389|Held Captive|Defeat Ustanak with only one Agent remaining.|12856|17 Jul 2018 8:40:18 PM|4658|7276|22.67|Uncommon|Bronze
4389|Easy Pickings|Eliminate all players as Ustanak in less than a minute.|12855|17 Jul 2018 8:37:08 PM|5044|7276|24.55|Uncommon|Silver
4389|Last Man Standing--Again|Win five times in a row.|12854|17 Jul 2018 8:15:24 PM|3344|5884|18.1|Rare|Gold
4389|Kung Fu Fighting|Survive to the end only using physical attacks.|12853|17 Jul 2018 8:10:58 PM|2939|5884|15.91|Rare|Silver
5037|Cat|Fed a cat|12852|17 Jul 2018 6:09:38 PM|977|2684|36.4|Uncommon|Bronze
5037|Evening|Cleared Chapter 2|12851|17 Jul 2018 6:04:19 PM|1166|2684|43.44|Uncommon|Bronze
5037|Kick the Can|Kicked the can a total of 50 times|12850|17 Jul 2018 5:26:45 PM|784|2684|29.21|Uncommon|Bronze
5037|Pitch Dark|Played a total of 10 minutes without the flashlight on|12849|17 Jul 2018 2:07:51 PM|1102|2684|41.06|Uncommon|Silver
4389|RESIDENT EVIL 6 Platinum Trophy|Congratulations! You've overcome all your fears in RESIDENT EVIL 6!|12848|16 Jul 2018 8:54:01 PM|7447|58019|12.84|Rare|Platinum
4389|Covered in Brass|Earn 150 different medals.|12847|16 Jul 2018 8:54:01 PM|12001|58019|20.68|Uncommon|Silver
4389|B.O.W.s Are Ugly|Defeat 100 enemies that have come out of a chrysalid.|12846|16 Jul 2018 9:48:19 AM|12068|58019|20.8|Uncommon|Silver
4389|Flying Ace|Pilot the VTOL without getting a scratch on it.|12845|15 Jul 2018 10:09:17 PM|12799|58019|22.06|Uncommon|Bronze
4389|Sneaking Around|Get through the aircraft carrier's bridge area without being noticed.|12844|15 Jul 2018 9:54:57 PM|9048|58019|15.59|Rare|Bronze
4389|Bob and Weave|Counter an enemy's attack three times in row.|12843|15 Jul 2018 9:40:14 PM|16109|58019|27.77|Uncommon|Bronze
4389|Weapons Master|Use all the weapons in the game and kill ten enemies with each of them.|12842|15 Jul 2018 9:29:09 PM|8669|58019|14.94|Rare|Silver
4389|Hard Choice|Shoot the helicopter pilot with a Magnum at point-blank range.|12841|15 Jul 2018 8:44:44 PM|10479|58019|18.06|Rare|Bronze
4389|I Prefer Them Alive|Rescue two female survivors at the cathedral.|12840|15 Jul 2018 8:21:52 PM|17435|58019|30.05|Uncommon|Bronze
4389|Heirlooms|Collect all the serpent emblems.|12839|15 Jul 2018 8:12:05 PM|8631|58019|14.88|Rare|Silver
4389|Bring the Heat|Take down an enemy from 50 meters away with a headshot using the thermal scope.|12838|15 Jul 2018 7:57:19 PM|11813|58019|20.36|Uncommon|Bronze
4389|Mad Skillz|Max out all the skills that allow you to level up.|12837|15 Jul 2018 7:18:58 PM|8181|58019|14.1|Rare|Gold
4389|Green around the Ears|Complete the entire game on Amateur.|12836|15 Jul 2018 5:36:48 PM|18071|58019|31.15|Uncommon|Bronze
4389|Normal Is Good|Complete the entire game on Normal.|12835|15 Jul 2018 5:36:48 PM|14885|58019|25.66|Uncommon|Silver
4389|Back in My Day|Complete the entire game on Veteran.|12834|15 Jul 2018 5:36:41 PM|9719|58019|16.75|Rare|Silver
4389|Leave It to the Pro|Complete the entire game on Professional.|12833|15 Jul 2018 5:36:34 PM|8905|58019|15.35|Rare|Gold
4389|What's Next?|Complete Chapter 5 in Ada's campaign.|12832|15 Jul 2018 5:36:33 PM|20078|58019|34.61|Uncommon|Bronze
4389|Ada's Demise|Complete Chapter 4 in Ada's campaign.|12831|15 Jul 2018 3:05:08 PM|20250|58019|34.9|Uncommon|Bronze
4389|This Takes Me Back|Complete Chapter 3 in Ada's campaign.|12830|15 Jul 2018 2:37:27 PM|20618|58019|35.54|Uncommon|Bronze
4389|Counterintelligence|Complete Chapter 2 in Ada's campaign.|12829|15 Jul 2018 2:11:23 PM|21313|58019|36.73|Uncommon|Bronze
4389|I Spy|Complete Chapter 1 in Ada's campaign.|12828|15 Jul 2018 1:31:32 PM|22807|58019|39.31|Uncommon|Bronze
4389|See You Around|Complete Chapter 5 in Jake's campaign.|12827|15 Jul 2018 12:54:18 PM|23053|58019|39.73|Uncommon|Bronze
4389|Give a Little Push|Knock ten enemies off a high place.|12826|15 Jul 2018 12:35:22 PM|13145|58019|22.66|Uncommon|Bronze
4389|Rising Up|Earn a level-four title.|12825|14 Jul 2018 9:22:44 PM|21082|58019|36.34|Uncommon|Silver
4389|Still on the Run|Complete Chapter 4 in Jake's campaign.|12824|14 Jul 2018 9:19:48 PM|23643|58019|40.75|Uncommon|Bronze
4389|J'avo Genocide|Defeat 500 J'avo.|12823|14 Jul 2018 8:48:00 PM|24435|58019|42.12|Uncommon|Bronze
4389|Let's Blow This Joint|Complete Chapter 3 in Jake's campaign.|12822|14 Jul 2018 8:21:39 PM|24498|58019|42.22|Uncommon|Bronze
4389|A Revolting Development|Complete Chapter 2 in Jake's campaign.|12821|14 Jul 2018 7:39:33 PM|25448|58019|43.86|Uncommon|Bronze
4389|Finish What You Start|Perform a coup de grâce on ten enemies.|12820|14 Jul 2018 7:15:07 PM|29539|58019|50.91|Common|Bronze
4389|High Voltage|Defeat ten enemies with a stun rod charge attack.|12819|14 Jul 2018 7:03:56 PM|10590|58019|18.25|Rare|Bronze
4389|Money Talks|Complete Chapter 1 in Jake's campaign.|12818|14 Jul 2018 6:52:41 PM|27328|58019|47.1|Uncommon|Bronze
4389|Duty Calls|Complete Chapter 5 in Chris' campaign.|12817|14 Jul 2018 2:59:28 PM|24119|58019|41.57|Uncommon|Bronze
4389|There's Always Hope|Complete Chapter 4 in Chris' campaign.|12816|14 Jul 2018 2:04:05 PM|25078|58019|43.22|Uncommon|Bronze
4389|After Her!|Complete Chapter 3 in Chris' campaign.|12815|14 Jul 2018 1:08:00 PM|26238|58019|45.22|Uncommon|Bronze
4389|Tragedy in Europe|Complete Chapter 2 in Chris' campaign.|12814|13 Jul 2018 8:59:15 PM|28098|58019|48.43|Uncommon|Bronze
4389|Rescue the Hostages|Complete Chapter 1 in Chris' campaign.|12813|13 Jul 2018 7:35:54 PM|31262|58019|53.88|Common|Bronze
4389|They're ACTION Figures!|Collect 3 figures.|12812|13 Jul 2018 6:38:31 PM|14777|58019|25.47|Uncommon|Bronze
4389|The Trouble with Women|Complete Chapter 5 in Leon's campaign.|12811|13 Jul 2018 6:30:57 PM|30854|58019|53.18|Common|Bronze
4389|Silent Killer|Use a stealth attack to take down five enemies.|12810|13 Jul 2018 6:19:59 PM|34811|58019|60.0|Common|Bronze
4389|Stuntman|Defeat 20 enemies with the Hydra using a quick shot.|12809|13 Jul 2018 6:16:28 PM|11905|58019|20.52|Uncommon|Bronze
4389|Zombie Massacre|Defeat 500 zombies.|12808|13 Jul 2018 5:58:07 PM|32794|58019|56.52|Common|Bronze
2224|Starshine!|Finish 3 stars on every level|12807|13 Jul 2018 2:05:44 PM|524|3665|14.3|Rare|Gold
2224|Governor of the Lands|Get 3 stars in all levels in World 9|12806|13 Jul 2018 2:05:43 PM|541|541|38.42|Uncommon|Gold
2224|Cosmic Traveler|Get 3 stars in all levels in World 8|12805|13 Jul 2018 1:09:18 PM|535|3665|14.6|Rare|Bronze
2224|Cartful of Stars|Collect 250 stars from levels|12804|13 Jul 2018 7:41:37 AM|563|3665|15.36|Rare|Silver
2224|Master of the Valley|Get 3 stars in all levels in World 7|12803|13 Jul 2018 7:41:36 AM|537|3665|14.65|Rare|Bronze
4389|Big Trouble in China|Complete Chapter 4 in Leon's campaign.|12802|12 Jul 2018 7:30:36 PM|31888|58019|54.96|Common|Bronze
4389|Get on the Plane|Complete Chapter 3 in Leon's campaign.|12801|12 Jul 2018 6:23:33 PM|33280|58019|57.36|Common|Bronze
7607|Platinum|Unlock every Trophy.|12800|12 Jul 2018 5:01:15 PM|418|561|74.51|Common|Platinum
7607|Tough Choice|Made a choice. Was it enough to get rid of the Koshmaars once and for all?|12799|12 Jul 2018 5:01:15 PM|487|561|86.81|Common|Silver
7607|The Road Less...|Make a choice whether to fight or to deal with Koshmaar.|12798|12 Jul 2018 5:00:59 PM|488|561|86.99|Common|Bronze
7607|Last Fight|Win the last fight against the Koshmaar without failing.|12797|12 Jul 2018 5:00:52 PM|466|561|83.07|Common|Silver
7607|No More Minigames!|Finish the last minigame in the game without the skip.|12796|12 Jul 2018 5:00:52 PM|480|561|85.56|Common|Bronze
7607|The Ladder Code|Move the ladder back, forth, back and forth again!|12795|12 Jul 2018 4:45:48 PM|480|561|85.56|Common|Bronze
7607|True Hunter|Finish Game on Expert Difficulty.|12794|12 Jul 2018 4:36:10 PM|469|561|83.6|Common|Gold
7607|The Nightmare is Over|We saved the city, and Camilla. The Koshmaar is re-imprisoned. But so is Gabriel.|12793|12 Jul 2018 4:35:59 PM|497|561|88.59|Common|Gold
7607|Persistent|Finish all Hidden Object Puzzles without using the Hint button.|12792|12 Jul 2018 4:35:11 PM|487|561|86.81|Common|Gold
7607|What Skip Button?|Play all Minigames without using a Skip button.|12791|12 Jul 2018 4:33:35 PM|486|561|86.63|Common|Gold
7607|All of My Little Friends|Find all Collectibles.|12790|12 Jul 2018 4:32:15 PM|451|561|80.39|Common|Gold
7607|Cut Ties|Solomon is dead. He turned into a Maskwraith. Gabriel showed up, and we joined forces.|12789|12 Jul 2018 4:28:02 PM|499|561|88.95|Common|Silver
7607|Frozen Memories|Finish the Fifth Memory Mirror in less than 3 minutes.|12788|12 Jul 2018 4:25:17 PM|424|561|75.58|Common|Bronze
7607|Master of Magic|Win the final Rune Battle Minigame without an error.|12787|12 Jul 2018 4:19:51 PM|478|561|85.2|Common|Bronze
7607|Mother's Love|I have everything I need to face the Koshmaar.|12786|12 Jul 2018 4:15:00 PM|500|561|89.13|Common|Silver
7607|Into the Past|Finish the Fourth Memory Mirror in less than 3 minutes.|12785|12 Jul 2018 4:14:44 PM|456|561|81.28|Common|Bronze
7607|Doctor's Degree|Gabriel double-crossed me, but I know where to find him now.|12784|12 Jul 2018 3:46:41 PM|505|561|90.02|Common|Silver
7607|Bringing Her Back|Finish the Third Memory Mirror in less than 3 minutes.|12783|12 Jul 2018 3:38:58 PM|466|561|83.07|Common|Bronze
7607|Watertower Down|Solomon's hurt. I must find a cure for him.|12782|12 Jul 2018 3:26:04 PM|509|561|90.73|Common|Silver
7607|Shot in the Back|Finish the Second Memory Mirror in less than 3 minutes.|12781|12 Jul 2018 3:23:54 PM|485|561|86.45|Common|Bronze
7607|Cute and Scary|Find half of all Collectibles.|12780|12 Jul 2018 3:18:20 PM|507|561|90.37|Common|Silver
7607|City of Monsters|The Koshmaar abducted a city into his realm.|12779|12 Jul 2018 3:08:19 PM|515|561|91.8|Common|Silver
7607|Her Story|Finish the First Memory Mirror in less than 3 minutes.|12778|12 Jul 2018 2:46:38 PM|509|561|90.73|Common|Bronze
7607|A Bit Hardcore|Play 4 Minigames in a row without skipping.|12777|12 Jul 2018 2:41:46 PM|518|561|92.34|Common|Silver
7607|Flawless Victory|Win a Rune Battle Minigame against a Maskwraith without an error.|12776|12 Jul 2018 2:41:46 PM|512|561|91.27|Common|Bronze
7607|Devotion|Finish a single Hidden Object Puzzle without using the Hint button.|12775|12 Jul 2018 2:31:38 PM|526|561|93.76|Common|Bronze
7607|Strike Fast|Finish a Hidden Object Puzzle in less than 20 seconds.|12774|12 Jul 2018 2:31:37 PM|456|561|81.28|Common|Silver
7607|Triple Shot|Find 3 Hidden Objects within 3 seconds.|12773|12 Jul 2018 2:31:16 PM|524|561|93.4|Common|Bronze
7607|The Stolen Stone|An Incarceri Stone was stolen from the Order's Treasury.|12772|12 Jul 2018 2:28:20 PM|533|561|95.01|Common|Bronze
7607|What is That?|Find the first Collectible.|12771|12 Jul 2018 2:16:48 PM|542|561|96.61|Common|Bronze
2224|Champion of the Summit|Get 3 stars in all levels in World 6|12770|12 Jul 2018 8:05:11 AM|546|3665|14.9|Rare|Bronze
2224|Sackful of Stars|Collect 200 stars from levels|12769|12 Jul 2018 7:40:27 AM|605|3665|16.51|Rare|Silver
2224|Poet of the Fall|Get 3 stars in all levels in World 5|12768|11 Jul 2018 6:14:35 PM|571|3665|15.58|Rare|Bronze
2224|Commander of the Fields|Get 3 stars in all levels in World 4|12767|11 Jul 2018 3:44:16 PM|654|3665|17.84|Rare|Bronze
4389|Check Out My Dogs|Customize your dog tags.|12766|10 Jul 2018 9:34:30 PM|29111|58019|50.17|Common|Bronze
4389|Titular Achievement|Earn 10 different titles.|12765|10 Jul 2018 9:33:32 PM|30596|58019|52.73|Common|Bronze
4389|Buried Secrets|Complete Chapter 2 in Leon's campaign.|12764|10 Jul 2018 9:31:08 PM|35394|58019|61.0|Common|Bronze
4389|Down, Not Out|Defeat an enemy while dying, then recover without any help.|12763|10 Jul 2018 9:02:10 PM|28473|58019|49.08|Uncommon|Bronze
2224|Tenacious Climber|Get 3 stars in all levels in World 3|12762|10 Jul 2018 6:10:31 PM|834|3665|22.76|Uncommon|Bronze
2224|Pocketful of Stars|Collect 100 stars from levels|12761|10 Jul 2018 5:55:19 PM|1018|3665|27.78|Uncommon|Silver
2224|Defender of the Homeland|Get 3 stars in all levels in World 2|12760|10 Jul 2018 3:15:06 PM|1116|3665|30.45|Uncommon|Bronze
