7504|Show them who's boss|Reach 75,000 points in Classic Mode|12546|3 Jul 2018 11:19:56 AM|1382|1558|88.7|Common|Gold
7504|Getting better|Reach level 10 in Classic Mode|12545|3 Jul 2018 11:19:40 AM|1408|1558|90.37|Common|Gold
7504|Go get them|Reach 50,000 points in Classic Mode|12544|3 Jul 2018 11:19:34 AM|1406|1558|90.24|Common|Gold
7504|Leveling up|Reach level 5 in Classic Mode|12543|3 Jul 2018 11:05:37 AM|1471|1558|94.42|Common|Gold
7504|Little by little|Reach 25,000 points in Classic Mode|12542|3 Jul 2018 11:05:35 AM|1450|1558|93.07|Common|Gold
7504|Overpowered|Die for the first time|12541|3 Jul 2018 11:00:34 AM|1552|1558|99.61|Common|Silver
7504|Getting Started|Kill your first enemy|12540|3 Jul 2018 11:00:20 AM|1550|1558|99.49|Common|Silver
5402|The Orbital Eclipse|Cleared “The Orbital Eclipse”.|12539|2 Jul 2018 9:14:15 PM|3205|4044|79.25|Common|Silver
4295|"Back to work."|Completed Day 2|12538|2 Jul 2018 8:40:45 PM|24117|27778|86.82|Common|Silver
4295|Shutter Bug|Filled a disposable camera with photos.|12537|2 Jul 2018 8:20:01 PM|6345|10456|37.23|Uncommon|Bronze
4295|Love Turts|Adopted a turtle as a pet. The average lifespan of a box turtle is fifty years. It will outlive you.|12536|2 Jul 2018 8:11:32 PM|7086|10456|41.58|Uncommon|Bronze
4295|"Good first day."|Completed Day 1|12535|2 Jul 2018 8:00:38 PM|25998|27778|93.59|Common|Bronze
6963|Platinum Chalice|You unlocked all other trophies.|12534|2 Jul 2018 6:50:11 PM|616|942|65.39|Common|Platinum
6963|Thanks!|Was that our 15 minutes of fame?|12533|2 Jul 2018 6:50:11 PM|668|942|70.91|Common|Bronze
6963|Huzzah let's hope far away|Now what?|12532|2 Jul 2018 6:45:53 PM|668|942|70.91|Common|Bronze
6963|Not in the face!|Thank you, sir, may I have another?|12531|2 Jul 2018 6:42:09 PM|641|942|68.05|Common|Silver
6963|Behind the mirror|An alternative ending to another game|12530|2 Jul 2018 6:37:09 PM|641|942|68.05|Common|Silver
6963|Huzzah we'll work overtime|Swimming certificate earned|12529|2 Jul 2018 6:34:34 PM|670|942|71.13|Common|Bronze
6963|Flipper out|Hunt for the Red October|12528|2 Jul 2018 6:27:12 PM|664|942|70.49|Common|Silver
6963|Woooghieee|Did you see that?|12527|2 Jul 2018 6:15:01 PM|644|942|68.37|Common|Silver
6963|Pin-up Goal|I only read it for the articles|12526|2 Jul 2018 6:12:19 PM|623|942|66.14|Common|Gold
6963|Captain Planet|… and Fay wept quietly|12525|2 Jul 2018 6:11:17 PM|677|942|71.87|Common|Bronze
6963|Animal lover|No animals were harmed in the making of this game!|12524|2 Jul 2018 6:06:37 PM|652|942|69.21|Common|Gold
6963|A bond for life|Force your luck|12523|2 Jul 2018 5:58:44 PM|676|942|71.76|Common|Bronze
6963|Freestyler|Prove your street cred|12522|2 Jul 2018 5:53:49 PM|677|942|71.87|Common|Bronze
6963|Tease the dragon|I thought you couldn't die here?|12521|2 Jul 2018 5:51:49 PM|674|942|71.55|Common|Silver
6963|Huzzah put balls to the wall|After them!|12520|2 Jul 2018 5:47:19 PM|686|942|72.82|Common|Bronze
6963|Pre-paradox|Back to the future|12519|2 Jul 2018 5:38:37 PM|666|942|70.7|Common|Bronze
6963|Family drama|Darth Vader is Luke Skywalker's father!|12518|2 Jul 2018 5:30:16 PM|697|942|73.99|Common|Bronze
6963|Supercool|Make a fool of yourself|12517|2 Jul 2018 5:25:09 PM|644|942|68.37|Common|Gold
6963|Animal husbandry|Catch 'em all!|12516|2 Jul 2018 5:19:33 PM|665|942|70.59|Common|Silver
6963|Egg race|No egg on your face|12515|2 Jul 2018 4:58:45 PM|715|942|75.9|Common|Silver
6963|Shut up, Simon!|Training is for losers!|12514|2 Jul 2018 4:55:36 PM|706|942|74.95|Common|Silver
6963|What women want|Survive the interview|12513|2 Jul 2018 4:25:00 PM|691|942|73.35|Common|Silver
6963|Collecting agent|Collecting agent|12512|2 Jul 2018 4:20:11 PM|665|942|70.59|Common|Gold
6963|Garden work|Is it Easter already?|12511|2 Jul 2018 4:19:33 PM|732|942|77.71|Common|Silver
6963|Deponia Idol|The Droggeljug searches for the supersinger|12510|2 Jul 2018 4:09:36 PM|694|942|73.67|Common|Silver
6963|T-415411293|I'll be back!|12509|2 Jul 2018 4:07:22 PM|679|942|72.08|Common|Silver
6963|With love from Porta Fisco|Expert in platypus poetry|12508|2 Jul 2018 3:42:02 PM|714|942|75.8|Common|Silver
6963|All mine!|Omnomnom! Nomnomnomnomnomnom!|12507|2 Jul 2018 3:38:55 PM|743|942|78.87|Common|Bronze
6963|Bloody nose|Rake up another achievement!|12506|2 Jul 2018 3:28:40 PM|712|942|75.58|Common|Silver
6963|Endurance test|These foreign models are junk.|12505|2 Jul 2018 3:25:33 PM|720|942|76.43|Common|Silver
6963|Lollipop or love?|Set priorities|12504|2 Jul 2018 3:07:35 PM|806|942|85.56|Common|Bronze
6963|Cheater|I see what you did there...|12503|2 Jul 2018 2:54:41 PM|703|942|74.63|Common|Silver
6963|Huzzah with booze and so forth|Rube Goldberg can pack up and go home|12502|2 Jul 2018 2:41:30 PM|858|942|91.08|Common|Bronze
6963|Blow job|Actually, that would have been Toni's job...|12501|2 Jul 2018 2:36:48 PM|782|942|83.01|Common|Bronze
6963|Huzzah – once more from the top|I didn't do anything?!|12500|2 Jul 2018 2:27:03 PM|870|942|92.36|Common|Bronze
6826|Platinum|Unlock every Trophy.|12499|1 Jul 2018 10:06:10 PM|1302|1624|80.17|Common|Platinum
6826|The Rebel|Save your child from the hospital (additional content)|12498|1 Jul 2018 10:06:10 PM|1435|1624|88.36|Common|Gold
6826|Game, set, match|Finish all the games of Domino|12497|1 Jul 2018 9:40:33 PM|1309|1624|80.6|Common|Gold
6826|Equally matched|Finish half of all the games of Domino|12496|1 Jul 2018 9:07:33 PM|1332|1624|82.02|Common|Silver
6826|Speed reach|Finish a game of Domino in less than 1 minute|12495|1 Jul 2018 8:19:53 PM|1362|1624|83.87|Common|Gold
6826|Save the day|Complete the game|12494|1 Jul 2018 8:04:30 PM|1471|1624|90.58|Common|Gold
6826|Expert gamer|Complete the game (Expert Mode)|12493|1 Jul 2018 8:04:30 PM|1392|1624|85.71|Common|Gold
6826|DIY Master|Finish all hidden-object scenes without using any hints|12492|1 Jul 2018 8:03:06 PM|1394|1624|85.84|Common|Gold
6826|Never a skipper|Finish all the mini-games without using the 'SKIP' option|12491|1 Jul 2018 8:01:03 PM|1425|1624|87.75|Common|Gold
6826|Prison Break|Escape from the Laboratory|12490|1 Jul 2018 7:54:07 PM|1473|1624|90.7|Common|Silver
6826|Say cheese!|Scare the beast blocking your way|12489|1 Jul 2018 7:28:02 PM|1479|1624|91.07|Common|Silver
6826|The Florist|Collect the Flower from Greenhouse|12488|1 Jul 2018 7:20:39 PM|1481|1624|91.19|Common|Silver
6826|Nuttin' like a furry friend|Give a cute squirrel a nut|12487|1 Jul 2018 7:19:53 PM|1480|1624|91.13|Common|Silver
6826|Escape Artist|Free yourself from the Restraining Vines|12486|1 Jul 2018 6:40:03 PM|1500|1624|92.36|Common|Silver
6826|Pathfinder|Make your way through the maze in the Agricultural section|12485|1 Jul 2018 6:35:11 PM|1506|1624|92.73|Common|Silver
6826|Winners don't skip|Finish 3 mini-games in a row without using the Skip button|12484|1 Jul 2018 6:18:14 PM|1515|1624|93.29|Common|Silver
6826|Quick-eye|Finish any hidden-object scene in less than 1 minute|12483|1 Jul 2018 6:13:26 PM|1513|1624|93.17|Common|Bronze
6826|Lady DIY|Finish 3 hidden-object scenes in a row without using any hints|12482|1 Jul 2018 6:13:26 PM|1513|1624|93.17|Common|Silver
6826|3-in-3|Find 3 hidden-objects within 3 seconds|12481|1 Jul 2018 6:00:15 PM|1532|1624|94.33|Common|Bronze
6826|Puzzle Mastermind|Finish any mini-game in less than 1 minute|12480|1 Jul 2018 5:45:14 PM|1528|1624|94.09|Common|Bronze
6826|Marksman|Finish any hidden-object scene with less than 5 mistakes|12479|1 Jul 2018 5:38:15 PM|1516|1624|93.35|Common|Silver
