5574|秋の実り|林檎と野菜の収穫をした|16741|6 Jul 2018 11:42:55 PM|879|913|96.28|Common|Bronze
5574|深夜の怪奇スポット巡り|えりか・千鳥とシェイプシフターについて調べた|16740|6 Jul 2018 11:42:03 PM|878|913|96.17|Common|Bronze
4607|ベテラン撮影者|橘サクヤ編の「ストーリー」モードで、サクヤの「メインストーリー」全シチュエーションで撮影を行った|16739|6 Jul 2018 11:41:55 PM|281|313|89.78|Common|Silver
5574|自慢の友人たち|立花と蘇芳のお茶会に行った|16738|6 Jul 2018 11:40:51 PM|879|913|96.28|Common|Bronze
5574|出逢った時からの想い|TrueEndを見た|16737|6 Jul 2018 11:39:50 PM|880|913|96.39|Common|Gold
5574|“鐘楼のルーガルー”|chapter5の推理パートをクリア|16736|6 Jul 2018 11:39:01 PM|883|913|96.71|Common|Silver
5574|変わらぬ親友の姿|ネリネと鐘楼のルーガルー事件を調べた|16735|6 Jul 2018 11:38:12 PM|881|913|96.5|Common|Bronze
5574|彼女らの寝顔|沙沙貴姉妹とウェンディゴの捜索を行った|16734|6 Jul 2018 11:37:17 PM|879|913|96.28|Common|Bronze
4607|密着初撮影|橘サクヤ編の「ストーリー」モードの撮影シーンで、サクヤの「メインストーリー」中に初めて撮影を行った|16733|6 Jul 2018 11:31:08 PM|288|313|92.01|Common|Bronze
4479|名撮影者|「プレイヤーと二人で撮影」モードで、神機装備あり、神機装備なし両方のコウタに全ての指示を行い、
「ストーリー」モードで、コウタの「メインストーリー」全シチュエーションで撮影を行った|16732|6 Jul 2018 11:27:09 PM|279|317|88.01|Common|Gold
4479|勇ましい姿を演出|「プレイヤーと二人で撮影」モードの撮影シーンで、神機を装備したコウタに全ての指示を行った|16731|6 Jul 2018 11:27:04 PM|279|317|88.01|Common|Silver
4479|自然な姿を演出|「プレイヤーと二人で撮影」モードの撮影シーンで、神機を装備していないコウタに全ての指示を行った|16730|6 Jul 2018 11:24:44 PM|279|317|88.01|Common|Silver
4479|別の自分で|「プレイヤーと二人で撮影」モードの撮影シーンで、プレイヤーを切り替えて初めて撮影を行った|16729|6 Jul 2018 11:17:40 PM|280|317|88.33|Common|Bronze
4479|勇ましい姿で一緒に|「プレイヤーと二人で撮影」モードの撮影シーンで、神機を装備したコウタと初めて撮影を行った|16728|6 Jul 2018 11:17:34 PM|283|317|89.27|Common|Bronze
4479|コウタを撮影|「プレイヤーと二人で撮影」モードの撮影シーンで、コウタのみで初めて撮影を行った|16727|6 Jul 2018 11:16:02 PM|283|317|89.27|Common|Bronze
4479|ひとりで撮影|「プレイヤーと二人で撮影」モードの撮影シーンで、プレイヤーのみで初めて撮影を行った|16726|6 Jul 2018 11:15:45 PM|283|317|89.27|Common|Bronze
4479|自然な姿で一緒に|「プレイヤーと二人で撮影」モードの撮影シーンで、神機を装備していないコウタと初めて撮影を行った|16725|6 Jul 2018 11:15:15 PM|286|317|90.22|Common|Bronze
4479|密着完了|「ストーリー」モードの撮影シーンで、コウタの「メインストーリー」全シチュエーションを見た|16724|6 Jul 2018 11:14:31 PM|294|317|92.74|Common|Bronze
4479|ベテラン撮影者|「ストーリー」モードで、コウタの「メインストーリー」全シチュエーションで撮影を行った|16723|6 Jul 2018 11:13:33 PM|290|317|91.48|Common|Silver
5574|“森を彷徨うウェンディゴ”|chapter4の推理パートをクリア|16722|6 Jul 2018 11:12:06 PM|885|913|96.93|Common|Silver
5574|断るわけないじゃないですか|えりか・千鳥とウェンディゴ退治に行った|16721|6 Jul 2018 11:11:50 PM|879|913|96.28|Common|Bronze
5574|親友を気遣っての看病|ネリネの看病をした|16720|6 Jul 2018 11:11:07 PM|884|913|96.82|Common|Bronze
5574|“寄宿舎のシェイプシフター”|chapter2の推理パートをクリア|16719|6 Jul 2018 11:10:35 PM|890|913|97.48|Common|Silver
5574|秋の星空|ネリネとシェイプシフターについて調べた|16718|6 Jul 2018 11:10:10 PM|890|913|97.48|Common|Bronze
5574|焼き芋！|沙沙貴姉妹と焼き芋を食べた|16717|6 Jul 2018 11:09:35 PM|893|913|97.81|Common|Bronze
4479|密着初撮影|「ストーリー」モードの撮影シーンで、コウタの「メインストーリー」中に初めて撮影を行った|16716|6 Jul 2018 11:01:50 PM|294|317|92.74|Common|Bronze
4380|名撮影者|「プレイヤーと二人で撮影」モードで、ジャンボトウモロコシ持ち、ジャンボトウモロコシ無し両方のシオに全ての指示を行い、
「ストーリー」モードで、シオの「メインストーリー」全シチュエーションで撮影を行った|16715|6 Jul 2018 10:56:17 PM|295|352|83.81|Common|Gold
4380|自然な姿を演出|「プレイヤーと二人で撮影」モードの撮影シーンで、ジャンボトウモロコシを持っていないシオに全ての指示を行った|16714|6 Jul 2018 10:56:09 PM|296|352|84.09|Common|Silver
4380|勇ましい姿を演出|「プレイヤーと二人で撮影」モードの撮影シーンで、ジャンボトウモロコシを持ったシオに全ての指示を行った|16713|6 Jul 2018 10:47:56 PM|295|352|83.81|Common|Silver
4380|別の自分で|「プレイヤーと二人で撮影」モードの撮影シーンで、プレイヤーを切り替えて初めて撮影を行った|16712|6 Jul 2018 10:28:49 PM|298|352|84.66|Common|Bronze
4380|勇ましい姿で一緒に|「プレイヤーと二人で撮影」モードの撮影シーンで、ジャンボトウモロコシを持ったシオと初めて撮影を行った|16711|6 Jul 2018 10:28:43 PM|306|352|86.93|Common|Bronze
4380|シオを撮影|「プレイヤーと二人で撮影」モードの撮影シーンで、シオのみで初めて撮影を行った|16710|6 Jul 2018 10:26:06 PM|301|352|85.51|Common|Bronze
4380|ひとりで撮影|「プレイヤーと二人で撮影」モードの撮影シーンで、プレイヤーのみで初めて撮影を行った|16709|6 Jul 2018 10:24:37 PM|305|352|86.65|Common|Bronze
4380|自然な姿で一緒に|「プレイヤーと二人で撮影」モードの撮影シーンで、ジャンボトウモロコシを持っていないシオと初めて撮影を行った|16708|6 Jul 2018 10:23:16 PM|308|352|87.5|Common|Bronze
4380|密着完了|「ストーリー」モードの撮影シーンで、シオの「メインストーリー」全シチュエーションを見た|16707|6 Jul 2018 10:21:41 PM|322|352|91.48|Common|Bronze
4380|ベテラン撮影者|「ストーリー」モードで、シオの「メインストーリー」全シチュエーションで撮影を行った|16706|6 Jul 2018 10:20:23 PM|313|352|88.92|Common|Silver
4380|密着初撮影|「ストーリー」モードの撮影シーンで、シオの「メインストーリー」中に初めて撮影を行った|16705|6 Jul 2018 10:09:44 PM|327|352|92.9|Common|Bronze
5785|彼方の向こうに、何かが見える|全てのトロフィーを取得しました。|16704|6 Jul 2018 9:24:38 PM|836|930|89.89|Common|Platinum
5785|MOVIEコンプリート|全てのムービーをオープンしました。|16703|6 Jul 2018 9:24:38 PM|837|930|90.0|Common|Gold
5785|REPLAYコンプリート|全てのREPLAYをオープンしました。|16702|6 Jul 2018 9:24:33 PM|837|930|90.0|Common|Gold
5785|CGコンプリート|全てのCGをオープンしました。|16701|6 Jul 2018 9:24:27 PM|837|930|90.0|Common|Gold
5785|ミニゲームプレイ莉佳|莉佳でミニゲームをプレイしました|16700|6 Jul 2018 9:24:08 PM|866|930|93.12|Common|Bronze
5785|ミニゲームプレイ真白|真白でミニゲームをプレイしました|16699|6 Jul 2018 9:23:52 PM|867|930|93.23|Common|Bronze
5785|ミニゲームプレイみさき|みさきでミニゲームをプレイしました|16698|6 Jul 2018 9:23:39 PM|876|930|94.19|Common|Bronze
5785|ミニゲームプレイ明日香|明日香でミニゲームをプレイしました|16697|6 Jul 2018 9:23:14 PM|877|930|94.3|Common|Bronze
5785|彼方の向こうに|グランドエンディングを見ました。|16696|6 Jul 2018 9:22:33 PM|840|930|90.32|Common|Gold
5785|届けたい気持ち|みさきルートをクリアしました。|16695|6 Jul 2018 9:22:23 PM|852|930|91.61|Common|Silver
5785|あたし、FCをやめるから|みさきルート第七話をクリアしました。|16694|6 Jul 2018 9:21:48 PM|858|930|92.26|Common|Bronze
5785|変わらないもの|莉佳ルートをクリアしました。|16693|6 Jul 2018 9:21:19 PM|845|930|90.86|Common|Silver
5785|強がる優等生|莉佳ルート第七話をクリアしました。|16692|6 Jul 2018 9:20:52 PM|849|930|91.29|Common|Bronze
5785|ありがと、先輩|真白ルートをクリアしました。|16691|6 Jul 2018 9:19:58 PM|851|930|91.51|Common|Silver
5785|小さくても勇気|真白ルート第七話をクリアしました。|16690|6 Jul 2018 9:19:31 PM|851|930|91.51|Common|Bronze
5785|蒼の彼方へ|明日香ルートをクリアしました。|16689|6 Jul 2018 9:18:32 PM|849|930|91.29|Common|Silver
5785|空を飛ぶ夢|明日香ルート第七話をクリアしました。|16688|6 Jul 2018 9:18:09 PM|853|930|91.72|Common|Bronze
5785|決戦、そして|第六話をクリアしました。|16687|6 Jul 2018 9:17:50 PM|874|930|93.98|Common|Bronze
5785|目的不明＆理由不明|黒渕霞が登場しました。|16686|6 Jul 2018 9:17:28 PM|874|930|93.98|Common|Bronze
5785|謎のスカイウォーカー|覆面選手が登場しました。|16685|6 Jul 2018 9:17:21 PM|875|930|94.09|Common|Bronze
5785|嵐の前の|第五話をクリアしました。|16684|6 Jul 2018 9:17:19 PM|877|930|94.3|Common|Bronze
5785|あっち側の「妹」|虎魚有梨華が登場しました。|16683|6 Jul 2018 9:17:00 PM|881|930|94.73|Common|Bronze
5785|あっち側の「お姉さま」|我如古繭が登場しました。|16682|6 Jul 2018 9:16:59 PM|881|930|94.73|Common|Bronze
5785|わたしだって、戦いたい|第四話をクリアしました。|16681|6 Jul 2018 9:16:51 PM|880|930|94.62|Common|Bronze
5785|本物のお嬢様|イリーナ・アヴァロンが登場しました。|16680|6 Jul 2018 9:16:51 PM|884|930|95.05|Common|Bronze
5785|いつもおっとりニコニコ|有坂牡丹が登場しました。|16679|6 Jul 2018 9:16:42 PM|884|930|95.05|Common|Bronze
5785|謎に包まれたFC選手|乾沙希が登場しました。|16678|6 Jul 2018 9:16:42 PM|884|930|95.05|Common|Bronze
5785|自称お嬢様|佐藤院麗子が登場しました。|16677|6 Jul 2018 9:16:34 PM|897|930|96.45|Common|Bronze
5785|暴走気味放送部員|保坂実里が登場しました。|16676|6 Jul 2018 9:16:34 PM|884|930|95.05|Common|Bronze
5785|好敵手たち|第三話をクリアしました。|16675|6 Jul 2018 9:16:26 PM|884|930|95.05|Common|Bronze
5785|最強選手|真藤一成が登場しました。|16674|6 Jul 2018 9:16:25 PM|886|930|95.27|Common|Bronze
5785|あの子誰だっけ？|白瀬みなもが登場しました。|16673|6 Jul 2018 9:16:17 PM|892|930|95.91|Common|Bronze
5785|飄々とした店主|白瀬隼人が登場しました。|16672|6 Jul 2018 9:16:16 PM|892|930|95.91|Common|Bronze
5785|「勝てない」部長|青柳紫苑が登場しました。|16671|6 Jul 2018 9:16:08 PM|896|930|96.34|Common|Bronze
5785|久奈浜マネージャー|青柳窓果が登場しました。|16670|6 Jul 2018 9:16:08 PM|907|930|97.53|Common|Bronze
5785|空の上のサーカス|第二話をクリアしました。|16669|6 Jul 2018 9:16:03 PM|887|930|95.38|Common|Bronze
5785|久奈浜FC部顧問|各務葵が登場しました。|16668|6 Jul 2018 9:16:02 PM|911|930|97.96|Common|Bronze
5785|飛び方を、教えて下さい|第一話をクリアしました。|16667|6 Jul 2018 9:15:57 PM|895|930|96.24|Common|Bronze
5785|部活も勉強もしっかり優等生|市ノ瀬莉佳が登場しました。|16666|6 Jul 2018 9:15:51 PM|903|930|97.1|Common|Bronze
5785|先輩大好きゲーム好き小動物|有坂真白が登場しました。|16665|6 Jul 2018 9:15:43 PM|906|930|97.42|Common|Bronze
5785|完全フリーダム浮遊女子|鳶沢みさきが登場しました。|16664|6 Jul 2018 9:15:41 PM|909|930|97.74|Common|Bronze
5785|天然ストレート飛行少女|倉科明日香が登場しました。|16663|6 Jul 2018 9:15:38 PM|916|930|98.49|Common|Bronze
7709|sweet pool|全てのトロフィーを獲得した|16662|6 Jul 2018 8:43:21 PM|102|104|98.08|Common|Platinum
7709|SONGコンプリート|SONGを全てオープンした|16661|6 Jul 2018 8:43:21 PM|102|104|98.08|Common|Gold
7709|RECOLLECTIONコンプリート|RECOLLECTIONを全てオープンした|16660|6 Jul 2018 8:43:17 PM|102|104|98.08|Common|Gold
7709|CGコンプリート|CGを全てオープンした|16659|6 Jul 2018 8:43:11 PM|102|104|98.08|Common|Gold
7709|CONGRATULATIONS|フルコンプイラストを見た|16658|6 Jul 2018 8:42:59 PM|102|104|98.08|Common|Gold
7709|Miracles may|全てのエンディングを見た|16657|6 Jul 2018 8:42:45 PM|102|104|98.08|Common|Gold
7709|I'm in blue|I'm in blue (Japanese Ver.) が解放した|16656|6 Jul 2018 8:42:42 PM|102|104|98.08|Common|Gold
7709|善弥 END|善弥のエンディングを見た|16655|6 Jul 2018 8:41:44 PM|102|104|98.08|Common|Gold
7709|睦 END|睦のエンディングを見た|16654|6 Jul 2018 8:40:48 PM|103|104|99.04|Common|Gold
7709|哲雄 END2|哲雄 END2を見た|16653|6 Jul 2018 8:39:56 PM|103|104|99.04|Common|Gold
7709|哲雄 END3|哲雄 END3を見た|16652|6 Jul 2018 8:37:37 PM|103|104|99.04|Common|Gold
7709|哲雄 END1|哲雄 END1を見た|16651|6 Jul 2018 8:36:42 PM|102|104|98.08|Common|Gold
6411|コンプリート|全てのトロフィーを獲得|16650|6 Jul 2018 5:39:06 PM|810|821|98.66|Common|Platinum
6411|ボイスコレクター|ボイスコレクションでプレイリストを作成した|16649|6 Jul 2018 5:39:06 PM|812|821|98.9|Common|Gold
6411|壁紙コンプリート|壁紙集をコンプリート|16648|6 Jul 2018 5:38:50 PM|812|821|98.9|Common|Gold
6411|BGMコンプリート|BGM鑑賞をコンプリート|16647|6 Jul 2018 5:38:48 PM|813|821|99.03|Common|Gold
6411|ある日のグリザイア島|「おまけ」エピソードを最後まで読んだ|16646|6 Jul 2018 5:38:27 PM|813|821|99.03|Common|Gold
6411|「グリザイアの旋律」CG100%達成|「グリザイアの旋律」のCGギャラリー100%達成|16645|6 Jul 2018 5:38:18 PM|811|821|98.78|Common|Gold
6411|「グリザイアの残光」CG100%達成|「グリザイアの残光」のCGギャラリー100%達成|16644|6 Jul 2018 5:38:17 PM|813|821|99.03|Common|Gold
6411|「グリザイアの有閑」CG100%達成|「グリザイアの有閑」のCGギャラリー100%達成|16643|6 Jul 2018 5:38:15 PM|813|821|99.03|Common|Gold
6411|サイドエピソード・コンプリート|サイドエピソード３作を最後まで読んだ|16642|6 Jul 2018 5:38:06 PM|813|821|99.03|Common|Gold
6411|グリザイアの旋律|「グリザイアの旋律」を最後まで読んだ|16641|6 Jul 2018 5:38:05 PM|814|821|99.15|Common|Gold
6411|グリザイアの残光|「グリザイアの残光」を最後まで読んだ|16640|6 Jul 2018 5:37:08 PM|814|821|99.15|Common|Gold
6411|グリザイアの有閑|「グリザイアの有閑」を最後まで読んだ|16639|6 Jul 2018 5:36:02 PM|816|821|99.39|Common|Gold
7437|ラストメモリーズ Complete|全てのトロフィーを獲得した。|16638|6 Jul 2018 5:27:09 PM|245|307|79.8|Common|Platinum
7437|警告劇場|警告劇場を全て見た。|16637|6 Jul 2018 5:27:09 PM|249|307|81.11|Common|Silver
7436|ラストメモリーズ Complete|全てのトロフィーを獲得した。|16636|6 Jul 2018 5:27:06 PM|130|158|82.28|Common|Platinum
7436|警告劇場|警告劇場を全て見た。|16635|6 Jul 2018 5:27:06 PM|131|158|82.91|Common|Silver
7436|Visual Gallery|Albumコンプリート！|16634|6 Jul 2018 5:23:17 PM|130|158|82.28|Common|Gold
7436|過去と現在と未来|全てのエンディングを見た。|16633|6 Jul 2018 5:23:00 PM|131|158|82.91|Common|Gold
7436|Memories Off|ライトサイド・アナザーエンドを見た。|16632|6 Jul 2018 5:22:59 PM|132|158|83.54|Common|Silver
7436|Sound Gallery|Musicコンプリート！|16631|6 Jul 2018 5:22:49 PM|131|158|82.91|Common|Gold
7437|Visual Gallery|Albumコンプリート！|16630|6 Jul 2018 5:21:22 PM|245|307|79.8|Common|Gold
7437|Memories Off|ライトサイド・アナザーエンドを見た。|16629|6 Jul 2018 5:21:02 PM|251|307|81.76|Common|Silver
7437|過去と現在と未来|全てのエンディングを見た。|16628|6 Jul 2018 5:21:02 PM|247|307|80.46|Common|Gold
7437|Sound Gallery|Musicコンプリート！|16627|6 Jul 2018 5:20:49 PM|249|307|81.11|Common|Gold
7436|もう１度、約束を|ヘヴィサイド・TwinバッドBエンドを見た。|16626|6 Jul 2018 5:09:18 PM|132|158|83.54|Common|Silver
7437|もう１度、約束を|ヘヴィサイド・TwinバッドBエンドを見た。|16625|6 Jul 2018 5:08:40 PM|253|307|82.41|Common|Silver
7436|涙の色は|ヘヴィサイド・TwinバッドAエンドを見た。|16624|6 Jul 2018 5:08:10 PM|132|158|83.54|Common|Silver
7437|涙の色は|ヘヴィサイド・TwinバッドAエンドを見た。|16623|6 Jul 2018 5:07:49 PM|254|307|82.74|Common|Silver
7436|愛奏のカタストロフ|ヘヴィサイド・惨劇エンドを見た。|16622|6 Jul 2018 5:06:27 PM|132|158|83.54|Common|Silver
7437|愛奏のカタストロフ|ヘヴィサイド・惨劇エンドを見た。|16621|6 Jul 2018 5:06:22 PM|248|307|80.78|Common|Silver
7437|語らぬ雨|ヘヴィサイド・悲劇エンドを見た。|16620|6 Jul 2018 5:04:06 PM|248|307|80.78|Common|Silver
7436|語らぬ雨|ヘヴィサイド・悲劇エンドを見た。|16619|6 Jul 2018 5:04:02 PM|132|158|83.54|Common|Silver
7436|まだ見ぬ、未来へ|ヘヴィサイド・春エンドを見た。|16618|6 Jul 2018 5:02:17 PM|131|158|82.91|Common|Gold
7437|まだ見ぬ、未来へ|ヘヴィサイド・春エンドを見た。|16617|6 Jul 2018 5:01:03 PM|251|307|81.76|Common|Gold
7436|そして、明日へ|ヘヴィサイド・冬エンドを見た。|16616|6 Jul 2018 4:56:56 PM|131|158|82.91|Common|Gold
7437|そして、明日へ|ヘヴィサイド・冬エンドを見た。|16615|6 Jul 2018 4:55:04 PM|252|307|82.08|Common|Gold
7436|Innocent Fille|無垢なる少女。|16614|6 Jul 2018 4:54:10 PM|131|158|82.91|Common|Bronze
7436|全ての始まり|久世のボイスデータを聴いた。|16613|6 Jul 2018 4:53:52 PM|131|158|82.91|Common|Bronze
7437|Innocent Fille|無垢なる少女。|16612|6 Jul 2018 4:52:13 PM|252|307|82.08|Common|Bronze
7437|全ての始まり|久世のボイスデータを聴いた。|16611|6 Jul 2018 4:51:58 PM|252|307|82.08|Common|Bronze
7436|其れは雪片。咎めの如く。|ヘヴィサイド・真相ルートを開始した。|16610|6 Jul 2018 4:47:53 PM|131|158|82.91|Common|Bronze
7437|其れは雪片。咎めの如く。|ヘヴィサイド・真相ルートを開始した。|16609|6 Jul 2018 4:47:29 PM|252|307|82.08|Common|Bronze
7437|ふたり共に|ヘヴィサイド・Twinダブルエンドを見た。|16608|6 Jul 2018 12:40:43 PM|252|307|82.08|Common|Silver
7436|ふたり共に|ヘヴィサイド・Twinダブルエンドを見た。|16607|6 Jul 2018 12:40:42 PM|132|158|83.54|Common|Silver
7436|居場所|ライトサイド・アナザールートを解放した。|16606|6 Jul 2018 12:38:37 PM|132|158|83.54|Common|Bronze
7436|想いの力|ヘヴィサイド・ノエル裏ルートを解放した。|16605|6 Jul 2018 12:38:36 PM|132|158|83.54|Common|Bronze
7437|居場所|ライトサイド・アナザールートを解放した。|16604|6 Jul 2018 12:38:33 PM|253|307|82.41|Common|Bronze
7436|大好き|ヘヴィサイド・Twinグッドエンドを見た。|16603|6 Jul 2018 12:38:33 PM|132|158|83.54|Common|Silver
7437|想いの力|ヘヴィサイド・ノエル裏ルートを解放した。|16602|6 Jul 2018 12:38:31 PM|255|307|83.06|Common|Bronze
7437|大好き|ヘヴィサイド・Twinグッドエンドを見た。|16601|6 Jul 2018 12:38:05 PM|254|307|82.74|Common|Silver
7436|自傷するレジリエンス|ヘヴィサイド・Twinルートを開始した。|16600|6 Jul 2018 12:13:35 PM|132|158|83.54|Common|Bronze
7437|自傷するレジリエンス|ヘヴィサイド・Twinルートを開始した。|16599|6 Jul 2018 12:13:20 PM|256|307|83.39|Common|Bronze
7436|過去への一歩|ヘヴィサイド・Twinルートを開始した。|16598|6 Jul 2018 11:59:03 AM|135|158|85.44|Common|Bronze
7437|過去への一歩|ヘヴィサイド・Twinルートを開始した。|16597|6 Jul 2018 11:58:18 AM|259|307|84.36|Common|Bronze
7436|Je suis venu|ライトサイド・ベストエンドを見た。|16596|6 Jul 2018 11:43:11 AM|133|158|84.18|Common|Silver
7437|Je suis venu|ライトサイド・ベストエンドを見た。|16595|6 Jul 2018 11:42:35 AM|260|307|84.69|Common|Silver
7436|後悔|ライトサイド・Ｗエンドを見た。|16594|6 Jul 2018 11:17:25 AM|135|158|85.44|Common|Silver
7437|後悔|ライトサイド・Ｗエンドを見た。|16593|6 Jul 2018 11:15:57 AM|255|307|83.06|Common|Silver
7436|贖罪|ライトサイド・Ｍエンドを見た。|16592|6 Jul 2018 11:11:13 AM|136|158|86.08|Common|Silver
7437|贖罪|ライトサイド・Ｍエンドを見た。|16591|6 Jul 2018 11:09:44 AM|255|307|83.06|Common|Silver
7436|契、そして|ライトサイド・Ｓグッドエンドを見た。|16590|6 Jul 2018 11:06:34 AM|137|158|86.71|Common|Silver
7437|契、そして|ライトサイド・Ｓグッドエンドを見た。|16589|6 Jul 2018 11:04:57 AM|257|307|83.71|Common|Silver
7437|オルタナティヴ|ヘヴィサイド・ルートを解放した。|16588|6 Jul 2018 10:53:38 AM|268|307|87.3|Common|Bronze
7436|オルタナティヴ|ヘヴィサイド・ルートを解放した。|16587|6 Jul 2018 10:53:32 AM|138|158|87.34|Common|Bronze
7436|Bonne fin|ライトサイド・グッドエンドを見た。|16585|6 Jul 2018 10:53:29 AM|136|158|86.08|Common|Bronze
7437|Bonne fin|ライトサイド・グッドエンドを見た。|16586|6 Jul 2018 10:53:29 AM|264|307|85.99|Common|Bronze
7436|保健室の魔女|ライトサイド・保健室イベントを全て見た。|16584|6 Jul 2018 10:36:58 AM|136|158|86.08|Common|Silver
7437|保健室の魔女|ライトサイド・保健室イベントを全て見た。|16583|6 Jul 2018 10:36:42 AM|258|307|84.04|Common|Silver
7436|明日への一歩|ライトサイド・ルートを開始した。|16582|6 Jul 2018 10:28:30 AM|141|158|89.24|Common|Bronze
7436|新たな一歩|コモン・ルートを終了した。|16581|6 Jul 2018 10:28:13 AM|142|158|89.87|Common|Bronze
7437|明日への一歩|ライトサイド・ルートを開始した。|16580|6 Jul 2018 10:27:49 AM|277|307|90.23|Common|Bronze
7437|新たな一歩|コモン・ルートを終了した。|16579|6 Jul 2018 10:27:37 AM|278|307|90.55|Common|Bronze
6456|Energy Cycle Platinum|Good job! Completed all tasks!|16578|5 Jul 2018 2:52:53 PM|2326|2389|97.36|Common|Platinum
6456|Infinity Layer #50|Passed through layer #50 in Infinite Play mode|16577|5 Jul 2018 2:52:53 PM|2340|2389|97.95|Common|Gold
6456|Infinity Layer #40|Passed through layer #40 in Infinite Play mode|16576|5 Jul 2018 2:51:46 PM|2340|2389|97.95|Common|Gold
6456|Infinity Layer #30|Passed through layer #30 in Infinite Play mode|16575|5 Jul 2018 2:51:41 PM|2340|2389|97.95|Common|Silver
6456|Infinity Layer #20|Passed through layer #20 in Infinite Play mode|16574|5 Jul 2018 2:51:35 PM|2344|2389|98.12|Common|Silver
6456|Infinity Layer #10|Passed through layer #10 in Infinite Play mode|16573|5 Jul 2018 2:51:30 PM|2347|2389|98.24|Common|Bronze
6456|Time Attack Layer #30|Passed through layer #30 in Time Attack mode|16572|5 Jul 2018 2:51:16 PM|2340|2389|97.95|Common|Gold
6456|Time Attack Layer #20|Passed through layer #20 in Time Attack mode|16571|5 Jul 2018 2:51:09 PM|2340|2389|97.95|Common|Gold
6456|Time Attack Layer #10|Passed through layer #10 in Time Attack mode|16570|5 Jul 2018 2:51:04 PM|2346|2389|98.2|Common|Silver
6456|Game Completed|Energy Cycle is complete|16569|5 Jul 2018 2:50:50 PM|2333|2389|97.66|Common|Gold
6456|Level 27 Completed|Part of the cycle is complete|16568|5 Jul 2018 2:50:30 PM|2338|2389|97.87|Common|Gold
6456|Level 24 Completed|Part of the cycle is complete|16567|5 Jul 2018 2:49:25 PM|2340|2389|97.95|Common|Gold
6456|Level 21 Completed|Part of the cycle is complete|16566|5 Jul 2018 2:48:18 PM|2340|2389|97.95|Common|Gold
6456|Level 18 Completed|Part of the cycle is complete|16565|5 Jul 2018 2:47:16 PM|2342|2389|98.03|Common|Silver
6456|Level 15 Completed|Part of the cycle is complete|16564|5 Jul 2018 2:46:07 PM|2342|2389|98.03|Common|Silver
6456|Level 12 Completed|Part of the cycle is complete|16563|5 Jul 2018 2:44:10 PM|2343|2389|98.07|Common|Silver
6456|Level 9 Completed|Part of the cycle is complete|16562|5 Jul 2018 2:43:23 PM|2349|2389|98.33|Common|Bronze
6456|Level 6 Completed|Part of the cycle is complete|16561|5 Jul 2018 2:42:38 PM|2356|2389|98.62|Common|Bronze
6456|Level 3 Completed|Part of the cycle is complete|16560|5 Jul 2018 2:41:57 PM|2373|2389|99.33|Common|Bronze
6737|Platinum Midnight|Become a master collector|16559|5 Jul 2018 2:39:51 PM|2685|3324|80.78|Common|Platinum
6737|So close|Die with 35 fragments|16558|5 Jul 2018 2:39:51 PM|2755|3324|82.88|Common|Gold
6737|That IS bad luck|Die with 36 fragments|16557|5 Jul 2018 2:35:21 PM|2773|3324|83.42|Common|Gold
6737|At least you tried|Die with only 1 fragment|16556|5 Jul 2018 2:30:54 PM|3289|3324|98.95|Common|Gold
