6708|猿飛咲助と任務|猿飛咲助の勇士隊絵巻を全て見た|19182|24 Jul 2018 7:45:53 PM|195|220|88.64|Common|Bronze
6708|猿飛咲助の卒業|猿飛咲助の卒業絵巻を全て見た|19181|24 Jul 2018 7:42:52 PM|196|220|89.09|Common|Bronze
6667|―革命の輪舞曲―|全てのトロフィーを取得しました|19180|24 Jul 2018 2:26:19 PM|276|285|96.84|Common|Platinum
6667|Special Storyコンプリート|各キャラクターのSpecial Storyを全て見ました|19179|24 Jul 2018 2:26:19 PM|276|285|96.84|Common|Gold
6667|プロフィールコンプリート|プロフィールのおまけをすべて取得しました|19178|24 Jul 2018 2:25:33 PM|277|285|97.19|Common|Gold
6667|回想コンプリート|全てのシーン回想を取得しました|19177|24 Jul 2018 2:25:29 PM|277|285|97.19|Common|Gold
6667|BGM鑑賞コンプリート|全てのBGMを取得しました|19176|24 Jul 2018 2:25:25 PM|276|285|96.84|Common|Gold
6667|CGコンプリート|全てのCGを取得しました|19175|24 Jul 2018 2:25:19 PM|277|285|97.19|Common|Gold
6667|奏嗣エンドコンプリート|奏嗣のエンディングを全て見ました|19174|24 Jul 2018 2:25:04 PM|277|285|97.19|Common|Silver
6667|エンディングコンプリート|エンディングを全て見ました|19173|24 Jul 2018 2:25:01 PM|277|285|97.19|Common|Gold
6667|奏嗣・ノーマルエンドクリア|……愛しているよ。これまでも、これからも、永遠に|19172|24 Jul 2018 2:24:54 PM|277|285|97.19|Common|Bronze
6667|後日談コンプリート|各キャラクターの後日談を全て見ました|19171|24 Jul 2018 2:24:13 PM|277|285|97.19|Common|Gold
6667|奏嗣・ハッピーエンドクリア|『……みんな、いつまでもいつまでもしあわせにくらしました』|19170|24 Jul 2018 2:23:59 PM|277|285|97.19|Common|Bronze
6667|景光エンドコンプリート|景光のエンディングを全て見ました|19169|24 Jul 2018 2:22:06 PM|277|285|97.19|Common|Silver
6667|景光・ノーマルエンドクリア|奏嗣が愛した国は、もうどこにも存在しない|19168|24 Jul 2018 2:21:58 PM|277|285|97.19|Common|Bronze
6667|景光・ハッピーエンドクリア|あの日の約束に誓って君を守ってみせる。だから、ずっと僕の隣にいてほしい|19167|24 Jul 2018 2:21:04 PM|277|285|97.19|Common|Bronze
6667|皇一朗エンドコンプリート|皇一朗のエンディングを全て見ました|19166|24 Jul 2018 2:19:03 PM|278|285|97.54|Common|Silver
6667|皇一朗・ノーマルエンドクリア|『俺の役目は、終わった』|19165|24 Jul 2018 2:18:56 PM|278|285|97.54|Common|Bronze
6667|皇一朗・ハッピーエンドクリア|これからも、俺がお前を守る|19164|24 Jul 2018 2:17:54 PM|278|285|97.54|Common|Bronze
6667|螢エンドコンプリート|螢のエンディングを全て見ました|19163|24 Jul 2018 2:15:38 PM|278|285|97.54|Common|Silver
6667|螢・ノーマルエンドクリア|『水月を誰かに贈るのは、特別な意味を持つんだ』|19162|24 Jul 2018 2:15:26 PM|278|285|97.54|Common|Bronze
6667|螢・ハッピーエンドクリア|……もう、絶対に離れない。覚悟しておけよ？|19161|24 Jul 2018 2:14:37 PM|278|285|97.54|Common|Bronze
6667|桐己エンドコンプリート|桐己のエンディングを全て見ました|19160|24 Jul 2018 2:12:27 PM|278|285|97.54|Common|Silver
6667|桐己・ノーマルエンドクリア|もし、また出会えたら……今度こそ、オレは、あんたのことを|19159|24 Jul 2018 2:12:19 PM|278|285|97.54|Common|Bronze
6667|桐己・ハッピーエンドクリア|あんたのこと絶対、幸せにするから|19158|24 Jul 2018 2:09:52 PM|279|285|97.89|Common|Bronze
6667|プロローグクリア|プロローグを見ました|19157|24 Jul 2018 2:07:45 PM|282|285|98.95|Common|Silver
5932|ファタモルガーナの館|全てのトロフィーを獲得した|19156|24 Jul 2018 12:33:00 PM|341|410|83.17|Common|Platinum
5932|追想の刻|Musicを全てオープンした|19155|24 Jul 2018 12:33:00 PM|343|410|83.66|Common|Gold
5932|館の記憶|ＣＧを全てオープンした|19154|24 Jul 2018 12:32:55 PM|345|410|84.15|Common|Gold
5932|滅びゆく物語に|Short storyを全て読破した|19153|24 Jul 2018 12:32:50 PM|346|410|84.39|Common|Gold
5932|それぞれの道へ|グランドエンディングを見た|19152|24 Jul 2018 12:30:35 PM|352|410|85.85|Common|Gold
5932|魂の世界|Fragmentを見た|19151|24 Jul 2018 12:26:13 PM|350|410|85.37|Common|Gold
5932|Ａｆｔｅｒ Ｈａｐｐｙ Ｅｎｄ|Ａｆｔｅｒ Ｈａｐｐｙ Ｅｎｄを見た|19150|24 Jul 2018 12:25:28 PM|349|410|85.12|Common|Gold
5932|アセントデリ|アセントデリを見た|19149|24 Jul 2018 12:25:14 PM|349|410|85.12|Common|Gold
5932|そして零に至る|A Requiem for Innocenceを見た|19148|24 Jul 2018 12:25:03 PM|348|410|84.88|Common|Gold
5932|魔女の終わりなき日常|プロローグを見た|19147|24 Jul 2018 12:22:09 PM|347|410|84.63|Common|Gold
5932|「あなた」の歩んだ道筋|本編のエンディングを全て見た|19146|24 Jul 2018 12:21:52 PM|358|410|87.32|Common|Gold
5932|この世界に光を|真相ルートをクリアした|19145|24 Jul 2018 12:21:12 PM|364|410|88.78|Common|Silver
5932|呪われた館への道標|はじまり|19144|24 Jul 2018 11:59:13 AM|394|410|96.1|Common|Silver
6968|～ヒミツのナイトクラブ～|全てのトロフィーを取得しました|19143|24 Jul 2018 11:52:16 AM|236|242|97.52|Common|Platinum
6968|Special Storyコンプリート|各キャラクターのSpecial Storyを全て見ました|19142|24 Jul 2018 11:52:16 AM|236|242|97.52|Common|Gold
6968|プロフィールコンプリート|プロフィールのおまけをすべて取得しました|19141|24 Jul 2018 11:50:51 AM|237|242|97.93|Common|Gold
6968|回想コンプリート|全てのシーン回想を取得しました|19140|24 Jul 2018 11:50:48 AM|236|242|97.52|Common|Gold
6968|BGM鑑賞コンプリート|全てのBGMを取得しました|19139|24 Jul 2018 11:50:44 AM|236|242|97.52|Common|Gold
6968|CGコンプリート|全てのCGを取得しました|19138|24 Jul 2018 11:50:41 AM|236|242|97.52|Common|Gold
6968|優夜エンドコンプリート|優夜のエンディングを全て見ました|19137|24 Jul 2018 11:50:35 AM|236|242|97.52|Common|Silver
6968|エンディングコンプリート|エンディングを全て見ました|19136|24 Jul 2018 11:50:32 AM|236|242|97.52|Common|Gold
6968|優夜・ノーマルエンドクリア|──わたしも好きです。そう言って先輩を抱きしめ返したかった。|19135|24 Jul 2018 11:50:24 AM|236|242|97.52|Common|Bronze
6968|後日談コンプリート|各キャラクターの後日談を全て見ました|19134|24 Jul 2018 11:50:05 AM|237|242|97.93|Common|Gold
6968|優夜・ハッピーエンドクリア|「実は、昔から夢があってさ……オレ、一番大切な人と、幸せな家族を作りたいんだ。その夢、一緒に叶えてもらえませんか？」|19133|24 Jul 2018 11:49:52 AM|237|242|97.93|Common|Bronze
6968|蓮司エンドコンプリート|蓮司のエンディングを全て見ました|19132|24 Jul 2018 11:48:06 AM|236|242|97.52|Common|Silver
6968|蓮司・ノーマルエンドクリア|（何度繰り返し言葉にしても、この想いが届く事はないんだ）|19131|24 Jul 2018 11:47:55 AM|236|242|97.52|Common|Bronze
6968|蓮司・ハッピーエンドクリア|「そんな君だから、俺は君のことを好きになったんだろうな」|19130|24 Jul 2018 11:47:09 AM|237|242|97.93|Common|Bronze
6968|航エンドコンプリート|航のエンディングを全て見ました|19129|24 Jul 2018 11:45:43 AM|237|242|97.93|Common|Silver
6968|航・ハッピーエンドクリア|「絶対に離れたくない。悲しい顔をさせたくない。もう他の事が考えられないくらい……大好きなんだ──」|19128|24 Jul 2018 11:45:27 AM|238|242|98.35|Common|Bronze
6968|航・ノーマルエンドクリア|遠くの方から小さく、航くんの声が聞こえた気がした。|19127|24 Jul 2018 11:44:49 AM|237|242|97.93|Common|Bronze
6968|朔エンドコンプリート|朔のエンディングを全て見ました|19126|24 Jul 2018 11:43:25 AM|237|242|97.93|Common|Silver
6968|朔・ノーマルエンドクリア|いつか、彼にお帰りなさいを言える日までわたしは待ち続ける。どれだけかかるか分からないけれど、彼との約束を果たす為に。|19125|24 Jul 2018 11:43:14 AM|237|242|97.93|Common|Bronze
6968|朔・ハッピーエンドクリア|「色々な事はあったけれど……俺の進んで来た道は、“ほんとうの幸福に近づく一足ずつ”になってきていたんですね」|19124|24 Jul 2018 11:42:25 AM|238|242|98.35|Common|Bronze
6968|冬舞エンドコンプリート|冬舞のエンディングを全て見ました|19123|24 Jul 2018 11:40:02 AM|237|242|97.93|Common|Silver
6968|冬舞・ノーマルエンドクリア|学園を去った彼は、今もどこかで舞台に立つ準備をしているに違いない。わたしはそう信じ、いつまでも待っていようと思う。|19122|24 Jul 2018 11:39:51 AM|237|242|97.93|Common|Bronze
6968|冬舞・ハッピーエンドクリア|「これからも一緒に行こう。何があっても僕は諦めないから、君に見ていてもらいたい」|19121|24 Jul 2018 11:39:07 AM|238|242|98.35|Common|Bronze
6968|朝陽エンドコンプリート|朝陽のエンディングを全て見ました|19120|24 Jul 2018 11:36:40 AM|236|242|97.52|Common|Silver
6968|朝陽・ノーマルエンドクリア|もっと朝陽くんの気持ちを支えてあげられていたら、何かが変わっていたのかもしれない。|19119|24 Jul 2018 11:36:30 AM|236|242|97.52|Common|Bronze
6968|朝陽・ハッピーエンドクリア|「オレは君と未来を約束したい」|19118|24 Jul 2018 11:34:15 AM|237|242|97.93|Common|Bronze
6968|プロローグクリア|プロローグを見ました|19117|24 Jul 2018 11:30:44 AM|241|242|99.59|Common|Silver
5949|Contributor to the Encyclopaedia Asposia|Unlock all trophies to officially earn the prestigious title "Contributor to the Encyclopaedia Asposia". With this title you'll be able to contribute to the next edition of said encyclopedia as you proofed your deep knowledge of the asposian world and its inhabitants.|19116|24 Jul 2018 1:38:08 AM|692|809|85.54|Common|Platinum
5949|Casual-Gamer|Until now, you’ve been using the help system quite often. You’re a casual-gamer for sure! But hey, the main point is, you’re having fun! And you get one point for being casual. Congrats!|19115|24 Jul 2018 1:38:08 AM|706|809|87.27|Common|Bronze
5949|Mr Wise-Guy|Complete the game without taking hints from the help system. In other words: don’t press L2.|19114|24 Jul 2018 1:34:18 AM|699|809|86.4|Common|Gold
5949|Blabbermouth|Talk to every possible character in Asposia.|19113|24 Jul 2018 1:34:11 AM|696|809|86.03|Common|Gold
5949|Chapter 5 - Asposia's Last Hope|Complete the fifth chapter!|19112|24 Jul 2018 1:34:10 AM|702|809|86.77|Common|Gold
5949|Just a scratch|You just shot a healing-laser in the back of Asposia’s greatest despot. A really disputable achievement. Nevertheless: 20 points, just for you!|19111|24 Jul 2018 1:30:46 AM|698|809|86.28|Common|Silver
5949|Chapter 4 - The Secret of the Basylians|Complete the fourth chapter!|19110|24 Jul 2018 1:21:14 AM|702|809|86.77|Common|Gold
5949|Hedgehog- Anesthesia|You tried to put Fonk to sleep using K.O.-drops. That’s understandable, for he’s the nightmare of your youth.|19109|24 Jul 2018 1:11:50 AM|700|809|86.53|Common|Silver
5949|Chief of BBQ|Congratulations! You made sure Dr. Reminepo was getting so many electric shocks that his brain’s probably toast now.|19108|24 Jul 2018 1:10:22 AM|697|809|86.16|Common|Silver
5949|Chapter 3 - The Abandoned Dynasty|Complete the third chapter!|19107|24 Jul 2018 1:02:33 AM|707|809|87.39|Common|Gold
5949|The Royal Toilet|Hand over brown guest passes to Steve!|19106|24 Jul 2018 12:49:17 AM|702|809|86.77|Common|Silver
5949|Casanova Casonostri|Gift flowers to Gorfelina!|19105|24 Jul 2018 12:43:48 AM|708|809|87.52|Common|Silver
5949|Chapter 2 - The Secret Place in the Root Forest|Complete the second chapter!|19104|24 Jul 2018 12:36:19 AM|714|809|88.26|Common|Gold
5949|Suicide|It’s not the best idea to return an old, trigger-happy wind monk’s glasses, who, even though he’s blind, is able to aim surprisingly good at you.|19103|24 Jul 2018 12:22:18 AM|714|809|88.26|Common|Silver
5949|Master of Stirring|Stir the swamp!|19102|24 Jul 2018 12:20:08 AM|714|809|88.26|Common|Bronze
5949|Gorf-Scratcher|Scratch the Gorf’s head!|19101|24 Jul 2018 12:19:44 AM|721|809|89.12|Common|Bronze
5949|Windfall|A fruit from the tree fell down on the ground. Great work.|19100|24 Jul 2018 12:16:12 AM|718|809|88.75|Common|Bronze
5949|Brainteaser|You smashed a fruit from the tree with your funnel helmet!|19099|24 Jul 2018 12:14:08 AM|722|809|89.25|Common|Bronze
5949|Chapter 1 - The quest for the Silver Fosfos|Complete the first chapter!|19098|24 Jul 2018 12:07:50 AM|730|809|90.23|Common|Gold
5949|Trial and Error|You solved the Mechatre-Puzzle just by trying out things randomly… or by ingenious intuition!|19097|24 Jul 2018 12:02:18 AM|722|809|89.25|Common|Bronze
7058|白銀の奇跡|全てのトロフィーを獲得した|19096|23 Jul 2018 11:36:42 PM|206|233|88.41|Common|Platinum
7058|Congratulations!!|フルコンプ画像を見た|19095|23 Jul 2018 11:36:42 PM|208|233|89.27|Common|Gold
7058|皆とずっと一緒に|トライアングルデートの画像を全てオープンした|19094|23 Jul 2018 11:35:50 PM|215|233|92.27|Common|Gold
5949|King of Sins|You thoroughly talked to Ottilie about sins. Your pure soul is a just a tiny bit more corrupted now.|19093|23 Jul 2018 11:29:16 PM|737|809|91.1|Common|Silver
5949|Fresh Breath|Eat a mint!|19092|23 Jul 2018 11:24:11 PM|732|809|90.48|Common|Bronze
5949|Pigeon-Tunnel|You put the pigeon through your special windsock-pigeon-tunnel. Although you couldn’t catch it this way… nice try!|19091|23 Jul 2018 11:12:03 PM|743|809|91.84|Common|Bronze
7058|それぞれの結末|全てのエンディングムービーを見た|19090|23 Jul 2018 10:52:23 PM|208|233|89.27|Common|Gold
7058|世界を彩る音色たち|BGMをコンプリート|19089|23 Jul 2018 10:52:14 PM|207|233|88.84|Common|Gold
7058|とある日々の思い出|カンタレラルートの画像を全てオープンした|19088|23 Jul 2018 10:52:05 PM|213|233|91.42|Common|Silver
7058|ショルメとの思い出|ショルメの画像を全てオープンした|19087|23 Jul 2018 10:52:03 PM|212|233|90.99|Common|Silver
7058|フィーニスとの思い出|フィーニスの画像を全てオープンした|19086|23 Jul 2018 10:52:02 PM|214|233|91.85|Common|Silver
7058|サンとの思い出|サンのクリスマスルートの画像を全てオープンした|19085|23 Jul 2018 10:52:01 PM|218|233|93.56|Common|Silver
7058|インピーとの思い出|インピーのクリスマスルートの画像を全てオープンした|19084|23 Jul 2018 10:52:00 PM|216|233|92.7|Common|Silver
7058|フランとの思い出|フランのクリスマスルートの画像を全てオープンした|19083|23 Jul 2018 10:51:59 PM|216|233|92.7|Common|Silver
7058|ヴァンとの思い出|ヴァンのクリスマスルートの画像を全てオープンした|19082|23 Jul 2018 10:51:58 PM|217|233|93.13|Common|Silver
7058|ルパンとの思い出|ルパンのクリスマスルートの画像を全てオープンした|19081|23 Jul 2018 10:51:57 PM|217|233|93.13|Common|Silver
7058|ものすごく物知りなお嬢様|用語集をコンプリート|19080|23 Jul 2018 10:51:06 PM|206|233|88.41|Common|Gold
5949|Schnapps-Dealer|Find some alcohol in the garbage and try to palm it off on the garbage dealer.|19079|23 Jul 2018 10:40:30 PM|746|809|92.21|Common|Silver
7058|祝福の未来のその先を――|スペシャルアフターを解放した|19078|23 Jul 2018 10:36:46 PM|210|233|90.13|Common|Gold
7058|君を迎えに|ショルメのアフタールートをクリアした|19077|23 Jul 2018 10:36:23 PM|213|233|91.42|Common|Bronze
7058|名探偵の選択|ショルメアフタールートの一枚目のＣＧを解放した|19076|23 Jul 2018 10:33:10 PM|216|233|92.7|Common|Bronze
7058|白き歌姫と動く城|カンタレラルートをクリアした|19075|23 Jul 2018 10:25:12 PM|215|233|92.27|Common|Bronze
7058|白き歌姫|カンタレラルートの一枚目のＣＧを解放した|19074|23 Jul 2018 10:15:31 PM|219|233|93.99|Common|Bronze
7058|命の答え|フィーニスのアフタールートをクリアした|19073|23 Jul 2018 10:14:56 PM|214|233|91.85|Common|Bronze
7058|弟として|フィーニスアフタールートの一枚目のＣＧを解放した|19072|23 Jul 2018 10:10:33 PM|214|233|91.85|Common|Bronze
7058|幾千年の恋|サンのクリスマスルートをクリアした|19071|23 Jul 2018 10:08:37 PM|218|233|93.56|Common|Bronze
7058|If Christmas -side Saint-|サンのクリスマスルートの一枚目のＣＧを解放した|19070|23 Jul 2018 10:01:12 PM|218|233|93.56|Common|Bronze
7058|好きということ|インピーのクリスマスルートをクリアした|19069|23 Jul 2018 9:59:18 PM|217|233|93.13|Common|Bronze
7058|If Christmas -side Impey-|インピーのクリスマスルートの一枚目のＣＧを解放した|19068|23 Jul 2018 9:57:11 PM|218|233|93.56|Common|Bronze
7058|続く時を共に|フランのクリスマスルートをクリアした|19067|23 Jul 2018 9:55:37 PM|216|233|92.7|Common|Bronze
7058|If Christmas -side Fran-|フランのクリスマスルートの一枚目のＣＧを解放した|19066|23 Jul 2018 9:52:17 PM|216|233|92.7|Common|Bronze
7058|心許せる人と|ヴァンのクリスマスルートをクリアした|19065|23 Jul 2018 9:43:17 PM|217|233|93.13|Common|Bronze
7058|If Christmas -side Van-|ヴァンのクリスマスルートの一枚目のＣＧを解放した|19064|23 Jul 2018 9:39:37 PM|217|233|93.13|Common|Bronze
7058|泥棒紳士の隣には|ルパンのクリスマスルートをクリアした|19063|23 Jul 2018 9:39:16 PM|218|233|93.56|Common|Bronze
7058|If Christmas -side Lupin-|ルパンのクリスマスルートの一枚目のＣＧを解放した|19062|23 Jul 2018 9:35:22 PM|218|233|93.56|Common|Bronze
6599|猛獣たちが愛するお姫様|全てのトロフィーを獲得した|19061|23 Jul 2018 8:42:27 PM|319|339|94.1|Common|Platinum
6599|お姫様の思い出アルバム|フルコンプ画像をオープンした|19060|23 Jul 2018 8:42:27 PM|319|339|94.1|Common|Gold
6599|みんなの思い出|その他の画像を全てオープンした|19059|23 Jul 2018 8:42:26 PM|319|339|94.1|Common|Silver
6599|ライマーとの思い出|ライマーの画像を全てオープンした|19058|23 Jul 2018 8:42:25 PM|322|339|94.99|Common|Silver
6599|ヘンリクとの思い出|ヘンリクの画像を全てオープンした|19057|23 Jul 2018 8:42:24 PM|322|339|94.99|Common|Silver
6599|ユゼフとの思い出|ユゼフの画像を全てオープンした|19056|23 Jul 2018 8:42:23 PM|321|339|94.69|Common|Silver
6599|ミアーシュとの思い出|ミアーシュの画像を全てオープンした|19055|23 Jul 2018 8:42:22 PM|321|339|94.69|Common|Silver
6599|ルドヴィクとの思い出|ルドヴィクの画像を全てオープンした|19054|23 Jul 2018 8:42:21 PM|322|339|94.99|Common|Silver
6599|リシャルトとの思い出|リシャルトの画像を全てオープンした|19053|23 Jul 2018 8:42:20 PM|322|339|94.99|Common|Silver
6599|モフモフのスペシャリスト|全員を上手にモフモフした|19052|23 Jul 2018 8:42:16 PM|320|339|94.4|Common|Gold
6599|最愛のあなたとモフモフタイム～リシャルト編～|リシャルトを上手にモフモフした|19051|23 Jul 2018 8:42:15 PM|322|339|94.99|Common|Silver
6599|最愛のあなたとモフモフタイム～ルドヴィク編～|ルドヴィクを上手にモフモフした|19050|23 Jul 2018 8:41:08 PM|323|339|95.28|Common|Silver
6599|最愛のあなたとモフモフタイム～ライマー編～|ライマーを上手にモフモフした|19049|23 Jul 2018 8:40:06 PM|322|339|94.99|Common|Silver
6599|最愛のあなたとモフモフタイム～ヘンリク編～|ヘンリクを上手にモフモフした|19048|23 Jul 2018 8:38:57 PM|322|339|94.99|Common|Silver
6599|最愛のあなたとモフモフタイム～ユゼフ編～|ユゼフを上手にモフモフした|19047|23 Jul 2018 8:37:55 PM|321|339|94.69|Common|Silver
6599|最愛のあなたとモフモフタイム～ミアーシュ編～|ミアーシュを上手にモフモフした|19046|23 Jul 2018 8:36:55 PM|321|339|94.69|Common|Silver
6599|あなたといる幸せな未来|全てのSSSを鑑賞した|19045|23 Jul 2018 8:33:03 PM|321|339|94.69|Common|Gold
6599|ミアーシュの歌問題|ミアーシュのSSSを鑑賞した|19044|23 Jul 2018 8:33:02 PM|322|339|94.99|Common|Bronze
6599|お姫様の宝物コレクション|本棚を全て埋めた|19043|23 Jul 2018 8:32:22 PM|321|339|94.69|Common|Gold
7570|Sorcerer|Complete Ice, Fire, Water, Earth, Air, Chaos and Ultra|19042|23 Jul 2018 8:29:33 PM|640|707|90.52|Common|Platinum
7570|Water elemental mastery|Reach the exit|19041|23 Jul 2018 8:29:33 PM|642|707|90.81|Common|Gold
7570|Water|50 percent complete|19040|23 Jul 2018 8:28:19 PM|651|707|92.08|Common|Silver
7570|Chaos mastery|Reach the exit|19039|23 Jul 2018 8:26:11 PM|648|707|91.65|Common|Gold
7570|Chaos|50 percent complete|19038|23 Jul 2018 8:21:13 PM|653|707|92.36|Common|Gold
6599|ライマーと過ごす日常|ライマーのSSSを鑑賞した|19037|23 Jul 2018 8:16:51 PM|323|339|95.28|Common|Bronze
6599|ヘンリクと白鳥の呪い|ヘンリクのSSSを鑑賞した|19036|23 Jul 2018 8:15:46 PM|324|339|95.58|Common|Bronze
7570|Ultra mastery|Reach the exit|19035|23 Jul 2018 8:15:00 PM|643|707|90.95|Common|Gold
6599|ユゼフと新しい家族|ユゼフのSSSを鑑賞した|19034|23 Jul 2018 8:13:53 PM|322|339|94.99|Common|Bronze
6599|ルドヴィクと犬たちの日課|ルドヴィクのSSSを鑑賞した|19033|23 Jul 2018 8:12:54 PM|324|339|95.58|Common|Bronze
7570|Ultra|50 percent complete|19032|23 Jul 2018 8:11:50 PM|649|707|91.8|Common|Silver
6599|リシャルトのお仕事事情|リシャルトのSSSを鑑賞した|19031|23 Jul 2018 8:11:35 PM|325|339|95.87|Common|Bronze
6599|めでたし、めでたし|全ストーリーをクリア|19030|23 Jul 2018 8:10:01 PM|321|339|94.69|Common|Gold
6599|「必ず幸せにすると誓います」|ライマーAFTER STORYをクリア|19029|23 Jul 2018 8:10:00 PM|325|339|95.87|Common|Bronze
7570|Air elemental mastery|Reach the exit|19028|23 Jul 2018 8:07:32 PM|648|707|91.65|Common|Gold
6599|「お前の笑顔がいちばんの幸せだ」|ヘンリクAFTER STORYをクリア|19027|23 Jul 2018 8:02:31 PM|325|339|95.87|Common|Bronze
6599|「幸せにできるように頑張るよ」|ユゼフAFTER STORYをクリア|19026|23 Jul 2018 7:55:40 PM|325|339|95.87|Common|Bronze
7570|Air|50 percent complete|19025|23 Jul 2018 7:54:28 PM|653|707|92.36|Common|Gold
6599|「君を守りたい、一生をかけて」|ミアーシュAFTER STORYをクリア|19024|23 Jul 2018 7:48:37 PM|323|339|95.28|Common|Bronze
7570|Earth elemental mastery|Reach the exit|19023|23 Jul 2018 7:48:34 PM|650|707|91.94|Common|Gold
7570|Earth|50 percent complete|19022|23 Jul 2018 7:44:58 PM|658|707|93.07|Common|Silver
6599|「お前を支える力になる」|ルドヴィクAFTER STORYをクリア|19021|23 Jul 2018 7:43:16 PM|328|339|96.76|Common|Bronze
6599|「人生をかけてお前を守るよ」|リシャルトAFTER STORYをクリア|19020|23 Jul 2018 7:36:04 PM|327|339|96.46|Common|Bronze
7570|Fire elemental mastery|Reach the exit|19019|23 Jul 2018 7:33:38 PM|665|707|94.06|Common|Gold
7570|Fire|50 percent complete|19018|23 Jul 2018 7:32:26 PM|671|707|94.91|Common|Silver
7570|Ice mastery|Reach the exit|19017|23 Jul 2018 7:27:58 PM|673|707|95.19|Common|Gold
7570|Ice|50 percent complete|19016|23 Jul 2018 7:26:43 PM|678|707|95.9|Common|Bronze
6599|「これがタルメの望み」|IF STORY 大団円をクリア|19015|23 Jul 2018 7:25:49 PM|327|339|96.46|Common|Bronze
7570|Death|Persevere|19014|23 Jul 2018 7:24:35 PM|707|707|100.0|Common|Bronze
6599|「俺にこんな感情が生まれるとはな」|IF STORY タルメをクリア|19013|23 Jul 2018 7:22:16 PM|329|339|97.05|Common|Bronze
5460|数乱digit|全てのトロフィーを獲得|19012|23 Jul 2018 4:01:26 PM|532|565|94.16|Common|Platinum
5460|画廊コンプリート|画廊を全て取得した|19011|23 Jul 2018 4:01:26 PM|533|565|94.34|Common|Gold
5460|その他イベントCGコンプリート|その他のイベントCGを全て取得した|19010|23 Jul 2018 4:01:26 PM|533|565|94.34|Common|Silver
5460|巡イベントCGコンプリート|玖折巡のイベントCGを全て取得した|19009|23 Jul 2018 3:56:55 PM|533|565|94.34|Common|Silver
5460|崇樹イベントCGコンプリート|陸平崇樹のイベントCGを全て取得した|19008|23 Jul 2018 3:56:54 PM|533|565|94.34|Common|Silver
5460|景太郎イベントCGコンプリート|漆原景太郎のイベントCGを全て取得した|19007|23 Jul 2018 3:56:53 PM|533|565|94.34|Common|Silver
5460|有比イベントCGコンプリート|肆形有比のイベントCGを全て取得した|19006|23 Jul 2018 3:56:52 PM|533|565|94.34|Common|Silver
5460|央助イベントCGコンプリート|壱園央助のイベントCGを全て取得した|19005|23 Jul 2018 3:56:51 PM|533|565|94.34|Common|Silver
5460|光イベントCGコンプリート|弐藤光のイベントCGを全て取得した|19004|23 Jul 2018 3:56:50 PM|533|565|94.34|Common|Silver
