6987|Kersplash!|Destroy Equipment at Dig|25848|5 Jul 2018 3:27:23 PM|7294|10035|72.69|Common|Bronze
6987|Strip Mine, Not Yours|Blow up Strip Mine in Eco Wells|25847|5 Jul 2018 3:27:23 PM|7249|10035|72.24|Common|Bronze
6987|Cha-ching|Collect Money for Krew|25846|5 Jul 2018 3:27:20 PM|7770|10035|77.43|Common|Bronze
6987|Scout's Honor|Catch Scouts in Haven Forest|25845|5 Jul 2018 3:27:20 PM|7442|10035|74.16|Common|Bronze
6987|Over Easy|Destroy Eggs at Drill Platform|25844|5 Jul 2018 3:27:14 PM|7800|10035|77.73|Common|Silver
6987|Lost and Found|Find Pumping Station Patrol|25843|5 Jul 2018 3:27:14 PM|7784|10035|77.57|Common|Silver
6987|Just the Artifacts Ma'am|Find 3 Artifacts in Mountain Temple|25842|5 Jul 2018 3:27:14 PM|7602|10035|75.75|Common|Bronze
6987|More Power to You|Turn on 5 Power Switches|25841|5 Jul 2018 3:27:14 PM|7626|10035|75.99|Common|Bronze
6987|Skip the Stairs|Ride Elevator up to Palace|25840|5 Jul 2018 3:27:14 PM|7595|10035|75.69|Common|Bronze
6987|Don't Let Him Get Away|Defeat Baron at Palace|25839|5 Jul 2018 3:27:14 PM|7581|10035|75.55|Common|Silver
6987|Stripped Down|Rescue Vin at Strip Mine|25838|5 Jul 2018 3:27:13 PM|7938|10035|79.1|Common|Bronze
6987|Signature Moves|Protect Sig at Pumping Station|25837|5 Jul 2018 3:27:10 PM|8337|10035|83.08|Common|Bronze
6987|Turrets Syndrome|Destroy Turrets in Sewers|25836|5 Jul 2018 3:27:10 PM|8208|10035|81.79|Common|Bronze
6987|Poor Kid|Protect Kor and Kid|25835|5 Jul 2018 3:27:04 PM|9499|10035|94.66|Common|Bronze
6987|Dead and Gone|Retrieve Banner from Dead Town|25834|5 Jul 2018 3:27:04 PM|9249|10035|92.17|Common|Bronze
6987|Kaboom!|Blow up Ammo at Fortress|25833|5 Jul 2018 3:27:04 PM|8748|10035|87.17|Common|Bronze
6083|"黄昏時の境界線"第２話をクリア|"黄昏時の境界線"第２話をクリアしました。|25832|5 Jul 2018 3:04:56 PM|335|353|94.9|Common|Bronze
6083|"黄昏時の境界線"第１話をクリア|"黄昏時の境界線"第１話をクリアしました。|25831|5 Jul 2018 2:43:00 PM|340|353|96.32|Common|Bronze
7435|Hooah|In it for life.|25830|5 Jul 2018 2:27:37 PM|12967|13157|98.56|Common|Platinum
7435|Private|Everybody starts somewhere.|25829|5 Jul 2018 2:27:37 PM|12992|13157|98.75|Common|Gold
7435|Private 2nd Class|Second comes first.|25828|5 Jul 2018 2:27:37 PM|12990|13157|98.73|Common|Gold
7435|Private 1st Class|First at bat.|25827|5 Jul 2018 2:27:37 PM|12983|13157|98.68|Common|Gold
7435|Specialist|Well isn't that special.|25826|5 Jul 2018 2:27:37 PM|12980|13157|98.65|Common|Gold
7435|Corporal|Corporal diem.|25825|5 Jul 2018 2:27:37 PM|12979|13157|98.65|Common|Gold
7435|Sergeant|Don't call me sarge.|25824|5 Jul 2018 2:27:37 PM|12977|13157|98.63|Common|Gold
7435|Staff Sergeant|Staffing up.|25823|5 Jul 2018 2:27:37 PM|12973|13157|98.6|Common|Gold
7435|Sergeant First Class|Call me sarge.|25822|5 Jul 2018 2:27:37 PM|12970|13157|98.58|Common|Gold
7435|Master Sergeant|Call me master.|25821|5 Jul 2018 2:27:37 PM|12969|13157|98.57|Common|Gold
7435|Sergeant Major|I majored in sargeantology.|25820|5 Jul 2018 2:27:37 PM|12967|13157|98.56|Common|Gold
7435|Boot Camp|Settle in, buttercup.|25819|5 Jul 2018 2:27:31 PM|12997|13157|98.78|Common|Silver
7435|Deployed|See the world, they said.|25818|5 Jul 2018 2:27:31 PM|12995|13157|98.77|Common|Gold
7435|Drafted|We are soldiers now.|25817|5 Jul 2018 2:27:24 PM|13000|13157|98.81|Common|Silver
5781|幸福の花束|全てのトロフィーを取得しました|25816|5 Jul 2018 3:00:15 AM|287|297|96.63|Common|Platinum
5781|おはよう|ミニゲームでアラームを解除しました|25815|5 Jul 2018 3:00:15 AM|288|297|96.97|Common|Bronze
5781|エンディングコンプリート|エンディングを全て見ました|25814|5 Jul 2018 2:58:43 AM|287|297|96.63|Common|Gold
5781|シーン回想コンプリート|全てのシーン回想を取得しました|25813|5 Jul 2018 2:58:37 AM|287|297|96.63|Common|Gold
5781|CGコンプリート|全てのCGを取得しました|25812|5 Jul 2018 2:58:28 AM|287|297|96.63|Common|Gold
5781|アデルエンドコンプリート|アデルのエンディングを全て見ました|25811|5 Jul 2018 2:58:22 AM|287|297|96.63|Common|Silver
5781|夢見る人形～アデルの独白～|「夢見る人形～アデルの独白～」を見ました|25810|5 Jul 2018 2:58:21 AM|291|297|97.98|Common|Bronze
5781|ルイスエンドコンプリート|ルイスのエンディングを全て見ました|25809|5 Jul 2018 2:57:14 AM|288|297|96.97|Common|Silver
5781|夢見る人形～ルイスの独白～|「夢見る人形～ルイスの独白～」を見ました|25808|5 Jul 2018 2:57:13 AM|290|297|97.64|Common|Bronze
5781|カインエンドコンプリート|カインのエンディングを全て見ました|25807|5 Jul 2018 2:55:24 AM|289|297|97.31|Common|Silver
5781|復讐の業火、全ての破滅|「復讐の業火、全ての破滅」を見ました|25806|5 Jul 2018 2:55:23 AM|290|297|97.64|Common|Bronze
5781|私たちの幸福、みんなの幸福|「私たちの幸福、みんなの幸福」を見ました|25805|5 Jul 2018 2:54:54 AM|290|297|97.64|Common|Bronze
5781|未来への船出|「未来への船出」を見ました|25804|5 Jul 2018 2:53:15 AM|289|297|97.31|Common|Bronze
5781|フィルエンドコンプリート|フィルのエンディングを全て見ました|25803|5 Jul 2018 2:50:40 AM|288|297|96.97|Common|Silver
5781|嫌いなところまで愛してる|「嫌いなところまで愛してる」を見ました|25802|5 Jul 2018 2:50:39 AM|288|297|96.97|Common|Bronze
5781|好きだから、さよならを……|「好きだから、さよならを……」を見ました|25801|5 Jul 2018 2:50:23 AM|288|297|96.97|Common|Bronze
5781|ただいま|「ただいま」を見ました|25800|5 Jul 2018 2:49:22 AM|288|297|96.97|Common|Bronze
5781|騎士として、あなたを守る|「騎士として、あなたを守る」を見ました|25799|5 Jul 2018 2:49:16 AM|288|297|96.97|Common|Bronze
5781|恋が始まった場所で……|「恋が始まった場所で……」を見ました|25798|5 Jul 2018 2:47:57 AM|288|297|96.97|Common|Bronze
5781|これからはあなたの騎士として|「これからはあなたの騎士として」を見ました|25797|5 Jul 2018 2:47:49 AM|288|297|96.97|Common|Bronze
5781|ノアエンドコンプリート|ノアのエンディングを全て見ました|25796|5 Jul 2018 2:39:27 AM|289|297|97.31|Common|Silver
5781|分かち合う痛み、舐め合う傷|「分かち合う痛み、舐め合う傷」を見ました|25795|5 Jul 2018 2:39:25 AM|289|297|97.31|Common|Bronze
5781|ひとつの終わりと、新たな始まり|「ひとつの終わりと、新たな始まり」を見ました|25794|5 Jul 2018 2:38:15 AM|289|297|97.31|Common|Bronze
5781|約束を叶える日|「約束を叶える日」を見ました|25793|5 Jul 2018 2:38:04 AM|289|297|97.31|Common|Bronze
5781|共に沈みゆく、歪んだ幸福|「共に沈みゆく、歪んだ幸福」を見ました|25792|5 Jul 2018 2:34:09 AM|289|297|97.31|Common|Bronze
5781|祝福の声、幸福の連鎖|「祝福の声、幸福の連鎖」を見ました|25791|5 Jul 2018 2:32:06 AM|290|297|97.64|Common|Bronze
5781|永遠に、あなたのもの|「永遠に、あなたのもの」を見ました|25790|5 Jul 2018 2:31:51 AM|290|297|97.64|Common|Bronze
5781|ザックエンドコンプリート|ザックのエンディングを全て見ました|25789|5 Jul 2018 2:23:12 AM|289|297|97.31|Common|Silver
5781|交差した想い|「交差した想い」を見ました|25788|5 Jul 2018 2:23:11 AM|290|297|97.64|Common|Bronze
5781|蜜檻|「蜜檻」を見ました|25787|5 Jul 2018 2:21:51 AM|290|297|97.64|Common|Bronze
5781|快楽の時間の始まり|「快楽の時間の始まり」を見ました|25786|5 Jul 2018 2:21:41 AM|290|297|97.64|Common|Bronze
5781|もう一度出会うために|「もう一度出会うために」を見ました|25785|5 Jul 2018 2:19:31 AM|288|297|96.97|Common|Bronze
5781|彼の愛に背を向ける|「彼の愛に背を向ける」を見ました|25784|5 Jul 2018 2:19:24 AM|289|297|97.31|Common|Bronze
5781|幸せのおすそわけ？|「幸せのおすそわけ？」を見ました|25783|5 Jul 2018 2:18:13 AM|289|297|97.31|Common|Bronze
5781|離した理由|「離した理由」を見ました|25782|5 Jul 2018 2:14:09 AM|290|297|97.64|Common|Bronze
5781|幸せな提案|「幸せな提案」を見ました|25781|5 Jul 2018 2:12:39 AM|290|297|97.64|Common|Bronze
5781|愛の溢れる新婚生活|「愛の溢れる新婚生活」を見ました|25780|5 Jul 2018 2:12:32 AM|290|297|97.64|Common|Bronze
5781|狂愛傀儡|「狂愛傀儡」を見ました|25779|5 Jul 2018 2:06:56 AM|291|297|97.98|Common|Bronze
5781|ありがとう、さようなら|「ありがとう、さようなら」を見ました|25778|5 Jul 2018 2:02:53 AM|291|297|97.98|Common|Bronze
5781|誓う愛、見守る影|「誓う愛、見守る影」を見ました|25777|5 Jul 2018 2:01:39 AM|291|297|97.98|Common|Bronze
5781|一緒にお風呂|「一緒にお風呂」を見ました|25776|5 Jul 2018 2:01:29 AM|291|297|97.98|Common|Bronze
5781|おとぎ話は、おとぎ話のまま――|「おとぎ話は、おとぎ話のまま――」を見ました|25775|5 Jul 2018 1:56:00 AM|291|297|97.98|Common|Bronze
5781|私たちが描く未来|「私たちが描く未来」を見ました|25774|5 Jul 2018 1:53:45 AM|291|297|97.98|Common|Bronze
5781|ここから紡がれていく二人の物語|「ここから紡がれていく二人の物語」を見ました|25773|5 Jul 2018 1:53:32 AM|292|297|98.32|Common|Bronze
6637|Eye of the Storm|Collect all other trophies.|25772|5 Jul 2018 1:19:49 AM|3215|3398|94.61|Common|Platinum
6637|The End|Fin.|25771|5 Jul 2018 1:19:49 AM|3231|3398|95.09|Common|Gold
6637|Energy Room|Have a rest. Now carry on.|25770|5 Jul 2018 1:12:30 AM|3232|3398|95.11|Common|Gold
5993|KYOHSO|全てのトロフィーを獲得した|25769|5 Jul 2018 1:07:12 AM|281|293|95.9|Common|Platinum
5993|All photo complete|CGを全て開いた|25768|5 Jul 2018 1:07:12 AM|281|293|95.9|Common|Gold
5993|All scene complete|回想を全て開いた|25767|5 Jul 2018 1:07:07 AM|281|293|95.9|Common|Gold
5993|stay-at-home dates|篠宗アンコールスペシャルシナリオをクリアした|25766|5 Jul 2018 1:04:35 AM|281|293|95.9|Common|Gold
5993|独り占めDAY|優アンコールスペシャルシナリオをクリアした|25765|5 Jul 2018 1:00:40 AM|283|293|96.59|Common|Gold
5993|TOKIHARU VS NYANKICHI|時明アンコールスペシャルシナリオをクリアした|25764|5 Jul 2018 12:57:22 AM|283|293|96.59|Common|Gold
5993|raddolcendo|依都アンコールスペシャルシナリオをクリアした|25763|5 Jul 2018 12:48:55 AM|282|293|96.25|Common|Gold
5993|HAPPY|篠宗アンコールエンディング１をクリアした|25762|5 Jul 2018 12:44:07 AM|282|293|96.25|Common|Silver
5993|pottering|篠宗アンコールエンディング２をクリアした|25761|5 Jul 2018 12:43:58 AM|282|293|96.25|Common|Bronze
5993|beiβen|優アンコールエンディング１をクリアした|25760|5 Jul 2018 12:39:28 AM|283|293|96.59|Common|Silver
5993|Mahlzeit!|優アンコールエンディング２をクリアした|25759|5 Jul 2018 12:39:09 AM|284|293|96.93|Common|Bronze
5993|Je vous suis attaché|時明アンコールエンディング１をクリアした|25758|5 Jul 2018 12:32:34 AM|283|293|96.59|Common|Silver
5993|Le beau cerisier|時明アンコールエンディング２をクリアした|25757|5 Jul 2018 12:32:22 AM|283|293|96.59|Common|Bronze
5993|CHIRP|依都アンコールエンディング１をクリアした|25756|5 Jul 2018 12:27:00 AM|282|293|96.25|Common|Silver
5993|Love ya!|依都アンコールエンディング２をクリアした|25755|5 Jul 2018 12:26:48 AM|282|293|96.25|Common|Bronze
5993|White sheets|篠宗エンディング３をクリアした|25754|4 Jul 2018 11:54:52 PM|282|293|96.25|Common|Bronze
6637|Lava Forever|Heatwave.|25753|4 Jul 2018 11:54:02 PM|3242|3398|95.41|Common|Silver
5993|BABY|篠宗エンディング２をクリアした|25752|4 Jul 2018 11:50:29 PM|283|293|96.59|Common|Bronze
5993|heartwarming|篠宗エンディング１をクリアした|25751|4 Jul 2018 11:49:50 PM|283|293|96.59|Common|Silver
6637|Secret Pipe|Oldest trick in the book.|25750|4 Jul 2018 11:39:24 PM|3228|3398|95.0|Common|Gold
5993|good experience|共通バッドエンドをクリアした|25749|4 Jul 2018 11:35:46 PM|282|293|96.25|Common|Bronze
6637|End of the Tunnel|Explore the dead end.|25748|4 Jul 2018 11:34:20 PM|3259|3398|95.91|Common|Gold
5993|Tschüss|優エンディング３をクリアした|25747|4 Jul 2018 11:33:19 PM|284|293|96.93|Common|Bronze
5993|der Schatz|優エンディング２をクリアした|25746|4 Jul 2018 11:32:46 PM|284|293|96.93|Common|Bronze
5993|MC|優エンディング１をクリアした|25745|4 Jul 2018 11:31:55 PM|286|293|97.61|Common|Silver
6637|Laser Survivor|Making light of the situation.|25744|4 Jul 2018 11:27:10 PM|3257|3398|95.85|Common|Silver
6637|Running into Walls|Sometimes, a hidden passage opens up.|25743|4 Jul 2018 11:22:58 PM|3241|3398|95.38|Common|Gold
5993|Amore mio|時明エンディング３をクリアした|25742|4 Jul 2018 11:14:14 PM|283|293|96.59|Common|Bronze
5993|sweet temptation|時明エンディング２をクリアした|25741|4 Jul 2018 11:13:17 PM|284|293|96.93|Common|Bronze
6637|Death From Above|Should’ve kept an eye out.|25740|4 Jul 2018 11:12:58 PM|3267|3398|96.14|Common|Silver
5993|YOU|時明エンディング１をクリアした|25739|4 Jul 2018 11:12:15 PM|284|293|96.93|Common|Silver
6637|Bottom of the Pool|Darkest depths.|25738|4 Jul 2018 11:06:01 PM|3256|3398|95.82|Common|Gold
6637|Jump for Fun|Raindrops keep fallin’ on my head.|25737|4 Jul 2018 10:59:40 PM|3291|3398|96.85|Common|Gold
5993|VOCALIST|依都エンディング３をクリアした|25736|4 Jul 2018 10:54:57 PM|281|293|95.9|Common|Bronze
5993|One Hundred Times|依都エンディング２をクリアした|25735|4 Jul 2018 10:51:52 PM|283|293|96.59|Common|Bronze
5993|Be mine|依都エンディング１をクリアした|25734|4 Jul 2018 10:50:20 PM|283|293|96.59|Common|Silver
6637|Shock Therapy|It’ll learn.|25733|4 Jul 2018 10:43:38 PM|3313|3398|97.5|Common|Gold
6637|Spiderbot|Spider-bot, spider-bot…|25732|4 Jul 2018 10:37:35 PM|3278|3398|96.47|Common|Gold
6637|Boogie Time|Just dance.|25731|4 Jul 2018 10:34:14 PM|3347|3398|98.5|Common|Silver
6637|Wreckage|No way back.|25730|4 Jul 2018 10:33:31 PM|3291|3398|96.85|Common|Silver
7203|ハロー・レディ！|全てのトロフィーを取得しました|25729|4 Jul 2018 8:26:30 PM|216|225|96.0|Common|Platinum
7203|「ハロー・レディ！ - Superior Dynamis -」Re Playコンプリート|「ハロー・レディ！ - Superior Dynamis -」のRe Playをコンプリートしました。|25728|4 Jul 2018 8:26:30 PM|217|225|96.44|Common|Silver
7203|「ハロー・レディ！ - New Division -」Re Playコンプリート|「ハロー・レディ！ - New Division -」のRe Playをコンプリートしました。|25727|4 Jul 2018 8:26:27 PM|218|225|96.89|Common|Silver
7203|「ハロー・レディ！」Re Playコンプリート|「ハロー・レディ！」本編のRe Playをコンプリートしました。|25726|4 Jul 2018 8:26:23 PM|218|225|96.89|Common|Silver
7203|Re Playコンプリート|全てのRe Playを取得しました|25725|4 Jul 2018 8:26:20 PM|217|225|96.44|Common|Gold
7203|「ハロー・レディ！ - Superior Dynamis -」CGコンプリート|「ハロー・レディ！ - Superior Dynamis -」のCGをコンプリートしました。|25724|4 Jul 2018 8:26:15 PM|217|225|96.44|Common|Silver
7203|ＢＧＭコンプリート|全てのBGMを取得しました|25723|4 Jul 2018 8:26:13 PM|217|225|96.44|Common|Gold
7203|「ハロー・レディ！ - New Division -」ＣＧコンプリート|「ハロー・レディ！ - New Division -」のCGをコンプリートしました。|25722|4 Jul 2018 8:26:12 PM|218|225|96.89|Common|Silver
7203|「ハロー・レディ！」ＣＧコンプリート|「ハロー・レディ！」本編の
CGをコンプリートしました。|25721|4 Jul 2018 8:26:08 PM|218|225|96.89|Common|Silver
7203|ＣＧコンプリート|全てのCGを取得しました|25720|4 Jul 2018 8:26:05 PM|217|225|96.44|Common|Gold
7203|御門瑠璃エピソードクリア|かくして、成田真理の復讐は終わる。|25719|4 Jul 2018 8:25:18 PM|217|225|96.44|Common|Silver
7203|「ハロー・レディ！ - Superior Dynamis -」クリア|「ハロー・レディ！ - Superior Dynamis -」を
クリアしました。|25718|4 Jul 2018 8:25:15 PM|217|225|96.44|Common|Gold
7203|兜山美鳥ルートクリア|いつか、約束が果たされたならば、
その時は、もう一度始めてみよう。|25717|4 Jul 2018 8:17:18 PM|218|225|96.89|Common|Silver
7203|「ハロー・レディ！ - Superior Dynamis -」解放|これは、世界を救う復讐劇|25716|4 Jul 2018 8:17:14 PM|218|225|96.89|Common|Silver
7203|「ハロー・レディ！ - New Division -」クリア|「ハロー・レディ！ - New Division -」をクリアしました。|25715|4 Jul 2018 8:17:11 PM|218|225|96.89|Common|Gold
7203|菱吾森ルートクリア|――――――そして、旅は続く。|25714|4 Jul 2018 8:10:24 PM|218|225|96.89|Common|Silver
7203|音無朔ルートクリア|――――――そして私は、輝けるものと出逢った。|25713|4 Jul 2018 7:55:48 PM|218|225|96.89|Common|Silver
7203|「ハロー・レディ！ - New Division -」解放|それは、黄金色の［新たな一篇 -New Division-］|25712|4 Jul 2018 7:55:45 PM|218|225|96.89|Common|Silver
7203|「ハロー・レディ！」クリア|「ハロー・レディ！」本編をクリアしました。|25711|4 Jul 2018 7:55:42 PM|218|225|96.89|Common|Gold
7203|鷹崎エルルートクリア|これは、とある男と女の、誕生の物語である。|25710|4 Jul 2018 7:42:29 PM|218|225|96.89|Common|Silver
7203|桂木空子ルートクリア|これは、とある男と女の、再生の物語である。|25709|4 Jul 2018 7:12:24 PM|218|225|96.89|Common|Silver
7203|ペルーシェマンショー・海賊版|はじめてペルーシェマンショーを見ました。|25708|4 Jul 2018 7:01:04 PM|220|225|97.78|Common|Bronze
7203|赤人珠緒ルートクリア|これは、とある男と女の、旅立ちの物語である。|25707|4 Jul 2018 6:57:06 PM|219|225|97.33|Common|Silver
5561|Plantinium|You have been awarded the platinum trophy.|25706|4 Jul 2018 6:53:52 PM|3824|3952|96.76|Common|Platinum
5561|Memento Nubla|You have completed every drawing of the Museum.|25705|4 Jul 2018 6:53:52 PM|3825|3952|96.79|Common|Gold
5561|The End|Congratulations! You have completed Nubla Part One.|25704|4 Jul 2018 6:52:02 PM|3846|3952|97.32|Common|Gold
7203|共通ルートクリア|そして、新たな舞台の幕は上がる。|25703|4 Jul 2018 6:48:54 PM|221|225|98.22|Common|Bronze
5561|Love letter|François Clouet. The Love Letter. 1570.|25702|4 Jul 2018 6:48:50 PM|3844|3952|97.27|Common|Bronze
5561|The alpine hill|You are taking your first steps in a new world.|25701|4 Jul 2018 6:48:44 PM|3847|3952|97.34|Common|Gold
5561|The ascent|You have entered the Rotating House.|25700|4 Jul 2018 6:47:52 PM|3847|3952|97.34|Common|Gold
5561|Blue horse|Franz Marc. The Dream. 1912.|25699|4 Jul 2018 6:45:08 PM|3846|3952|97.32|Common|Bronze
5561|Nubla|You have reached the place where Nubla awaits.|25698|4 Jul 2018 6:44:40 PM|3851|3952|97.44|Common|Gold
6943|神頼みしすぎて俺の未来がヤバい。|全てのトロフィーを取得した|25697|4 Jul 2018 6:33:37 PM|277|283|97.88|Common|Platinum
6943|ははは、いえいえ、これくらいお安い御用で|全てのイベントＣＧを見た|25696|4 Jul 2018 6:33:37 PM|277|283|97.88|Common|Gold
6943|まったくもって、羨ましいっ！　あと、おめでとう！|全てのルートをクリアした|25695|4 Jul 2018 6:33:11 PM|277|283|97.88|Common|Gold
6943|本当、そういうところ昔から変わらないんだから|「神林真央」ルートをクリアした|25694|4 Jul 2018 6:33:10 PM|278|283|98.23|Common|Gold
5561|Forgotten valise|Edward Hopper. Hotel Room. 1931.|25693|4 Jul 2018 6:31:58 PM|3844|3952|97.27|Common|Bronze
5561|Abandoned Glove|Henri de Toulouse-Lautrec. Yvette Guilbert. 1893.|25692|4 Jul 2018 6:30:53 PM|3853|3952|97.49|Common|Bronze
5561|The Blue City|You have discovered what the Blue City hides.|25691|4 Jul 2018 6:30:16 PM|3857|3952|97.6|Common|Gold
5561|Tree|René Magritte. La Clef des champs. 1936.|25690|4 Jul 2018 6:28:10 PM|3842|3952|97.22|Common|Bronze
5561|Stories told|Domenico Ghirlandaio. Portrait of Giovanna Tornabuoni 1489-1490.|25689|4 Jul 2018 6:25:07 PM|3868|3952|97.87|Common|Bronze
5561|Summer Cloud|Emil Nolde. Summer Clouds. 1913.|25688|4 Jul 2018 6:24:41 PM|3853|3952|97.49|Common|Bronze
5561|Moon|Max Ernst. Solitary and Conjugal Trees. 1940.|25687|4 Jul 2018 6:24:13 PM|3851|3952|97.44|Common|Bronze
5561|The Woods of Vanished Faces|You have walked through the trees that whisper stories.|25686|4 Jul 2018 6:23:43 PM|3877|3952|98.1|Common|Gold
6943|真央お姉さんとお話してたんじゃないんですか？|「神林真央」ルートに入った|25685|4 Jul 2018 6:23:37 PM|279|283|98.59|Common|Silver
6943|なんで、真央に縁カウントが見えるんだ……！？|「神林真央」の縁カウントが見えた|25684|4 Jul 2018 6:23:15 PM|279|283|98.59|Common|Bronze
5561|A lady's hat|Hans Baldung Grien. Portrait of a Woman. 1530.|25683|4 Jul 2018 6:13:15 PM|3890|3952|98.43|Common|Bronze
5561|Nine of spades|Balthus. The Card Game. 1948-1950.|25682|4 Jul 2018 6:10:00 PM|3907|3952|98.86|Common|Bronze
5561|Bring us the light|You have brought back the light to the world of Nubla.|25681|4 Jul 2018 6:09:18 PM|3909|3952|98.91|Common|Gold
6943|それならば、十分に叶っています|「坂白花夜」ルートをクリアした|25680|4 Jul 2018 6:06:43 PM|279|283|98.59|Common|Gold
5561|Whispers in the dark|You have taken your first step into this strange Museum.|25679|4 Jul 2018 6:05:50 PM|3929|3952|99.42|Common|Gold
6943|いや、まあ、ないとは言えませんけど|「坂白花夜」ルートに入った|25678|4 Jul 2018 5:58:56 PM|279|283|98.59|Common|Silver
6943|見えるっ！？　見えてるっ！？|「坂白花夜」の縁カウントが見えた|25677|4 Jul 2018 5:58:40 PM|279|283|98.59|Common|Bronze
6943|あたしのこと、ずっと離さないでくださいね|「麗」ルートをクリアした|25676|4 Jul 2018 5:56:51 PM|278|283|98.23|Common|Gold
6300|Plantinium|You have been awarded the platinum trophy.|25675|4 Jul 2018 5:54:32 PM|1533|1565|97.96|Common|Platinum
6300|Memento Nubla|You have completed every drawing of the Museum.|25674|4 Jul 2018 5:54:32 PM|1535|1565|98.08|Common|Gold
6300|The End|Congratulations! You have completed Nubla Part One.|25673|4 Jul 2018 5:52:32 PM|1538|1565|98.27|Common|Gold
6300|Love letter|François Clouet. The Love Letter. 1570.|25672|4 Jul 2018 5:49:35 PM|1539|1565|98.34|Common|Bronze
6300|The alpine hill|You are taking your first steps in a new world.|25671|4 Jul 2018 5:49:29 PM|1540|1565|98.4|Common|Gold
6300|The ascent|You have entered the Rotating House.|25670|4 Jul 2018 5:48:47 PM|1540|1565|98.4|Common|Gold
6300|Blue horse|Franz Marc. The Dream. 1912.|25669|4 Jul 2018 5:42:12 PM|1539|1565|98.34|Common|Bronze
6300|Nubla|You have reached the place where Nubla awaits.|25668|4 Jul 2018 5:41:57 PM|1540|1565|98.4|Common|Gold
6943|あたしに縁カウントが見えるって！|「麗」ルートに入った|25667|4 Jul 2018 5:39:32 PM|279|283|98.59|Common|Silver
6943|はっきりと、カウントが表示される|「麗」の縁カウントが見えた|25666|4 Jul 2018 5:39:09 PM|279|283|98.59|Common|Bronze
6943|私はとても幸せさ|「周防由香里」ルートをクリアした|25665|4 Jul 2018 5:36:21 PM|279|283|98.59|Common|Gold
6300|Forgotten valise|Edward Hopper. Hotel Room. 1931.|25664|4 Jul 2018 5:26:38 PM|1541|1565|98.47|Common|Bronze
6300|Abandoned Glove|Henri de Toulouse-Lautrec. Yvette Guilbert. 1893.|25663|4 Jul 2018 5:25:21 PM|1540|1565|98.4|Common|Bronze
6300|The Blue City|You have discovered what the Blue City hides.|25662|4 Jul 2018 5:23:35 PM|1542|1565|98.53|Common|Gold
6943|ほほう、由香里ちゃんですか|「周防由香里」ルートに入った|25661|4 Jul 2018 5:19:08 PM|279|283|98.59|Common|Silver
6300|Tree|René Magritte. La Clef des champs. 1936.|25660|4 Jul 2018 5:18:25 PM|1540|1565|98.4|Common|Bronze
6943|世界で一番幸せなのは……わたしですから|「赤城鈴奈」ルートをクリアした|25659|4 Jul 2018 5:17:51 PM|278|283|98.23|Common|Gold
6300|Stories told|Domenico Ghirlandaio. Portrait of Giovanna Tornabuoni 1489-1490.|25658|4 Jul 2018 5:14:55 PM|1542|1565|98.53|Common|Bronze
6300|Summer Cloud|Emil Nolde. Summer Clouds. 1913.|25657|4 Jul 2018 5:14:31 PM|1538|1565|98.27|Common|Bronze
6300|Moon|Max Ernst. Solitary and Conjugal Trees. 1940.|25656|4 Jul 2018 5:13:35 PM|1541|1565|98.47|Common|Bronze
6300|The Woods of Vanished Faces|You have walked through the trees that whisper stories.|25655|4 Jul 2018 5:13:01 PM|1544|1565|98.66|Common|Gold
6300|A lady's hat|Hans Baldung Grien. Portrait of a Woman. 1530.|25654|4 Jul 2018 5:09:13 PM|1548|1565|98.91|Common|Bronze
6300|Nine of spades|Balthus. The Card Game. 1948-1950.|25653|4 Jul 2018 5:01:09 PM|1553|1565|99.23|Common|Bronze
6300|Bring us the light|You have brought back the light to the world of Nubla.|25652|4 Jul 2018 5:00:13 PM|1555|1565|99.36|Common|Gold
6943|ほほう、鈴奈さんですか|「赤城鈴奈」ルートに入った|25651|4 Jul 2018 4:59:39 PM|278|283|98.23|Common|Silver
6943|私がこの世界で一番好きな、その文字のために|「南雲七海」ルートをクリアした|25650|4 Jul 2018 4:58:42 PM|278|283|98.23|Common|Gold
