6518|CONGRATULATIONS！|フルコンプリートイラストを見た|28130|22 Jul 2018 2:47:28 AM|215|222|96.85|Common|Gold
6518|SHORT STORY　COMPLETE|全キャラのショートストーリーを見た|28129|22 Jul 2018 2:47:27 AM|215|222|96.85|Common|Silver
6518|EPISODE　COMPLETE|全キャラのオマケエピソードを見た|28128|22 Jul 2018 2:46:01 AM|215|222|96.85|Common|Gold
6518|双子との戯れ|伊勢兄弟のエンディングを見た|28127|22 Jul 2018 2:43:43 AM|215|222|96.85|Common|Silver
6518|薫との戯れ|伊勢薫のエンディングを見た|28126|22 Jul 2018 2:41:20 AM|215|222|96.85|Common|Silver
6518|馨との戯れ|伊勢馨のエンディングを見た|28125|22 Jul 2018 2:40:49 AM|215|222|96.85|Common|Silver
6518|月夜の道|館林のエンディングを見た|28124|22 Jul 2018 2:39:01 AM|215|222|96.85|Common|Silver
6518|清打|館林のエンディングを見た|28123|22 Jul 2018 2:36:31 AM|215|222|96.85|Common|Silver
6518|時代の行く末|時雨のエンディングを見た|28122|22 Jul 2018 2:33:44 AM|216|222|97.3|Common|Silver
6518|淡墨桜の下で|時雨のエンディングを見た|28121|22 Jul 2018 2:32:28 AM|216|222|97.3|Common|Silver
6518|死が二人を別つまで|千家のエンディングを見た|28120|22 Jul 2018 2:30:06 AM|216|222|97.3|Common|Silver
6518|黄泉の道行|千家のエンディングを見た|28119|22 Jul 2018 2:27:22 AM|216|222|97.3|Common|Silver
6518|雨のち晴れ|ミサキのエンディングを見た|28118|22 Jul 2018 2:20:22 AM|215|222|96.85|Common|Silver
6518|約束|ミサキのエンディングを見た|28117|22 Jul 2018 2:19:58 AM|215|222|96.85|Common|Silver
6518|道中二人|ミサキのエンディングを見た|28116|22 Jul 2018 2:19:31 AM|215|222|96.85|Common|Silver
6778|SQUAREBOY VS BULLIES|DEFEAT ALL THE BULLIES|28115|22 Jul 2018 1:52:20 AM|1272|1451|87.66|Common|Platinum
6778|BULLYING IS UNCOOL|FINISH THE GAME|28114|22 Jul 2018 1:52:20 AM|1274|1451|87.8|Common|Gold
6778|BIGGER THEY ARE, HARDER THEY FALL|DEFEAT BIG BOSS BULLY|28113|22 Jul 2018 1:52:08 AM|1274|1451|87.8|Common|Gold
6778|A BLACK ROBE ALONE MAKETH NOT THE NINJA|DEFEAT NINJA BULLY ON THE SHIP DECK|28112|22 Jul 2018 1:20:25 AM|1328|1451|91.52|Common|Gold
6778|GOTCHA SLIPPERY NINJA|THROW A CRATE ON THE NINJA BULLY ON THE SHIP DECK|28111|22 Jul 2018 1:20:10 AM|1324|1451|91.25|Common|Gold
6778|STAND UP FOR EVERYONE|DEFEAT 300 BULLIES|28110|22 Jul 2018 1:11:25 AM|1348|1451|92.9|Common|Gold
6778|EARLY DELIVERY|HIT AN ENEMY WITH A CRATE|28109|22 Jul 2018 12:53:18 AM|1341|1451|92.42|Common|Silver
6778|WEAPONS MASTER|HIT ENEMIES BEHIND AND IN FRONT OF YOU WITH A SINGLE SWING OF A WEAPON|28108|22 Jul 2018 12:37:20 AM|1365|1451|94.07|Common|Gold
6778|HOMERUN|HIT AN ENEMY WITH A BASEBALL BAT|28107|22 Jul 2018 12:37:17 AM|1376|1451|94.83|Common|Silver
6778|UNLEASHED|HIT AN ENEMY WITH A CHAIN|28106|22 Jul 2018 12:37:12 AM|1376|1451|94.83|Common|Silver
6778|BANDANAS ARE SILLY|DEFEAT BANDANA BULLY ON THE HIDEOUT ROOFTOP|28105|22 Jul 2018 12:37:10 AM|1374|1451|94.69|Common|Gold
6778|STAND UP FOR YOUR FRIENDS|DEFEAT 100 BULLIES|28104|22 Jul 2018 12:35:01 AM|1394|1451|96.07|Common|Silver
6778|TAKING OUT THE TRASH|HIT AN ENEMY WITH A TRASH CAN|28103|22 Jul 2018 12:34:52 AM|1386|1451|95.52|Common|Silver
6778|BOXING CHAMP|HIT AN ENEMY WITH A BOX|28102|22 Jul 2018 12:31:48 AM|1393|1451|96.0|Common|Silver
6778|TIRE OR TYRE?|HIT AN ENEMY WITH A TIRE|28101|22 Jul 2018 12:27:38 AM|1419|1451|97.79|Common|Silver
6778|STAND UP FOR YOURSELF|DEFEAT 10 BULLIES|28100|22 Jul 2018 12:24:01 AM|1441|1451|99.31|Common|Bronze
6778|EYES AT THE BACK|HIT AN ENEMY WITH A BACK PUNCH|28099|22 Jul 2018 12:22:54 AM|1439|1451|99.17|Common|Silver
6778|KNOWLEDGE IS KEY|OPEN THE MOVES LIST IN THE PAUSED MENU|28098|22 Jul 2018 12:22:20 AM|1430|1451|98.55|Common|Bronze
6778|TRAINING|DESTROY ALL THE DUMMIES IN THE DOJO|28097|22 Jul 2018 12:22:12 AM|1442|1451|99.38|Common|Bronze
6778|STRIKER|HIT AN ENEMY WITH A STRIKE COMBO|28096|22 Jul 2018 12:22:10 AM|1443|1451|99.45|Common|Bronze
6778|HAYEAHH|THROW AN ENEMY|28095|22 Jul 2018 12:22:05 AM|1427|1451|98.35|Common|Bronze
6778|GOTCHA|GRAB AN ENEMY|28094|22 Jul 2018 12:21:57 AM|1444|1451|99.52|Common|Bronze
6778|UPPERCUT HERO|HIT AN ENEMY WITH A JUMP PUNCH|28093|22 Jul 2018 12:21:35 AM|1445|1451|99.59|Common|Bronze
6778|WHAT A KICK|HIT AN ENEMY WITH A JUMP KICK|28092|22 Jul 2018 12:21:31 AM|1444|1451|99.52|Common|Bronze
6778|A CLEAN SWEEP|HIT AN ENEMY WITH A SPIN KICK|28091|22 Jul 2018 12:21:27 AM|1419|1451|97.79|Common|Silver
6778|LIKE A TORNADO|HIT AN ENEMY WITH A SPIN PUNCH|28090|22 Jul 2018 12:21:19 AM|1420|1451|97.86|Common|Bronze
6778|SO FAST|HIT AN ENEMY WITH A DASH ATTACK|28089|22 Jul 2018 12:21:17 AM|1428|1451|98.41|Common|Bronze
6354|一个罪人的重生|获得所有的奖杯|28088|21 Jul 2018 4:27:40 AM|249|255|97.65|Common|Platinum
6354|让你也尝尝同样的滋味|通过第六章|28087|21 Jul 2018 4:27:40 AM|249|255|97.65|Common|Gold
6354|现在你了解一切了吗？|获得所有的信息碎片|28086|21 Jul 2018 4:26:23 AM|249|255|97.65|Common|Gold
6354|马修，你都干了些什么？|利用人偶触发床上的机关|28085|21 Jul 2018 4:25:20 AM|249|255|97.65|Common|Silver
6354|记住我说的，想起你做的|查看过所有的电视|28084|21 Jul 2018 4:24:32 AM|249|255|97.65|Common|Gold
6354|是时候面对你的过错了|通过第五章|28083|21 Jul 2018 4:15:05 AM|249|255|97.65|Common|Gold
6354|也许我该给你一个奖杯？|在第五章里，将破碎的奖杯复原|28082|21 Jul 2018 4:12:04 AM|249|255|97.65|Common|Silver
6354|马修，不愧是警官|破解所有的密码类谜题|28081|21 Jul 2018 4:10:16 AM|249|255|97.65|Common|Gold
6354|我会永远记住这一天|通过第四章|28080|21 Jul 2018 4:06:23 AM|249|255|97.65|Common|Gold
6354|很好，你打开了它。|在第四章里，打开厨房的保险箱|28079|21 Jul 2018 4:01:13 AM|249|255|97.65|Common|Silver
6354|因为这不是马修的错|通过第三章|28078|21 Jul 2018 3:58:46 AM|249|255|97.65|Common|Gold
6354|别客气，随便吃|在第三章里，打开酒吧的冰箱|28077|21 Jul 2018 3:53:48 AM|249|255|97.65|Common|Silver
6354|但你从未帮助她|通过第二章|28076|21 Jul 2018 3:51:32 AM|249|255|97.65|Common|Gold
6354|喜欢我的小小谜题吗?|在第二章里，打开前台处所有的储物柜|28075|21 Jul 2018 3:48:39 AM|249|255|97.65|Common|Silver
6354|我一直在你周围|在电视里分别看到男性与女性|28074|21 Jul 2018 3:43:55 AM|249|255|97.65|Common|Bronze
6354|我想和你玩个游戏|通过第一章|28073|21 Jul 2018 3:37:33 AM|250|255|98.04|Common|Gold
6354|母亲最爱的旋律|在第一章里，使用钢琴弹奏出正确的旋律|28072|21 Jul 2018 3:32:20 AM|250|255|98.04|Common|Silver
6354|马修，你很聪明|第一次成功组合道具|28071|21 Jul 2018 3:31:23 AM|250|255|98.04|Common|Bronze
6354|这是特意为你准备的|第一次获得信息碎片|28070|21 Jul 2018 3:30:24 AM|250|255|98.04|Common|Bronze
6354|欢迎来到港湾镇|开始游戏|28069|21 Jul 2018 3:27:59 AM|252|255|98.82|Common|Bronze
3075|DRAMAtical Murder|全てのトロフィーを獲得した|28068|21 Jul 2018 3:14:16 AM|891|991|89.91|Common|Platinum
3075|SONGコンプリート|SONGを全てオープンした|28067|21 Jul 2018 3:14:16 AM|893|991|90.11|Common|Silver
3075|CGコンプリート|CGを全てオープンした|28066|21 Jul 2018 3:14:13 AM|893|991|90.11|Common|Gold
3075|ArtifactCGコンプリート|ArtifactのCGを全てオープンした|28065|21 Jul 2018 3:14:10 AM|893|991|90.11|Common|Silver
3075|OthersCGコンプリート|OthersのCGを全てオープンした|28064|21 Jul 2018 3:14:07 AM|893|991|90.11|Common|Silver
3075|蓮CGコンプリート|蓮のCGを全てオープンした|28063|21 Jul 2018 3:14:03 AM|893|991|90.11|Common|Silver
3075|RECOLLECTIONコンプリート|RECOLLECTIONを全てオープンした|28062|21 Jul 2018 3:14:02 AM|893|991|90.11|Common|Silver
3075|クリアCGコンプリート|クリアのCGを全てオープンした|28061|21 Jul 2018 3:14:00 AM|894|991|90.21|Common|Silver
3075|ミンクCGコンプリート|ミンクのCGを全てオープンした|28060|21 Jul 2018 3:13:57 AM|899|991|90.72|Common|Silver
3075|ノイズCGコンプリート|ノイズのCGを全てオープンした|28059|21 Jul 2018 3:13:54 AM|899|991|90.72|Common|Silver
3075|紅雀CGコンプリート|紅雀のCGを全てオープンした|28058|21 Jul 2018 3:13:51 AM|899|991|90.72|Common|Silver
3075|蒼葉CGコンプリート|蒼葉のCGを全てオープンした|28057|21 Jul 2018 3:13:48 AM|895|991|90.31|Common|Silver
3075|新たな可能性|モルヒネルートを攻略した|28056|21 Jul 2018 3:13:16 AM|894|991|90.21|Common|Silver
3075|ENDコンプリート|全てのエンディングを見た|28055|21 Jul 2018 3:13:13 AM|893|991|90.11|Common|Gold
3075|GOODENDコンプリート|全てのグッドエンディングを見た|28054|21 Jul 2018 3:13:10 AM|895|991|90.31|Common|Gold
3075|CONGRATULATIONS|フルコンプイラストを見た|28053|21 Jul 2018 3:13:04 AM|893|991|90.11|Common|Gold
3075|BADENDコンプリート|全てのバッドエンディングを見た|28052|21 Jul 2018 3:10:10 AM|893|991|90.11|Common|Gold
3075|最後のプレゼント|蓮ルートを攻略した|28051|21 Jul 2018 2:51:46 AM|893|991|90.11|Common|Silver
3075|故郷の風|ミンクルートを攻略した|28050|21 Jul 2018 2:29:03 AM|902|991|91.02|Common|Silver
3075|クラゲの歌|クリアルートを攻略した|28049|21 Jul 2018 2:16:28 AM|904|991|91.22|Common|Silver
3075|けじめ|ノイズルートを攻略した|28048|21 Jul 2018 2:09:47 AM|899|991|90.72|Common|Silver
3075|幼馴染|紅雀ルートを攻略した|28047|21 Jul 2018 1:48:35 AM|906|991|91.42|Common|Silver
3075|The first happiness|初めてグッドエンディングを見た|28046|21 Jul 2018 1:48:32 AM|919|991|92.73|Common|Silver
6641|コンプリート|全てのトロフィーを獲得|28045|21 Jul 2018 12:18:11 AM|447|487|91.79|Common|Platinum
6641|サウンドコンプリート|サウンド鑑賞をコンプリート|28044|21 Jul 2018 12:18:11 AM|447|487|91.79|Common|Gold
6641|CGコンプリート|CG鑑賞をコンプリート|28043|21 Jul 2018 12:18:07 AM|447|487|91.79|Common|Gold
6641|「幸せ」|瀬川夏希アフター編クリア|28042|21 Jul 2018 12:17:34 AM|452|487|92.81|Common|Gold
6641|星織ユメミライ|全ヒロインのアフター編をクリア|28041|21 Jul 2018 12:17:34 AM|447|487|91.79|Common|Gold
6641|想いの力|瀬川夏希スクール編クリア|28040|21 Jul 2018 12:14:57 AM|452|487|92.81|Common|Silver
6641|別々の道|雪村透子スクール編透子転校エンドを見た|28039|21 Jul 2018 12:07:54 AM|450|487|92.4|Common|Bronze
6641|しあわせの場所|雪村透子アフター編クリア|28038|21 Jul 2018 12:06:15 AM|452|487|92.81|Common|Gold
6641|もう１人じゃない|雪村透子スクール編クリア|28037|21 Jul 2018 12:04:06 AM|452|487|92.81|Common|Silver
7233|Platinum Midnight|Unlock all the trophies.|28036|20 Jul 2018 11:54:03 PM|1198|1244|96.3|Common|Platinum
7233|Expert|Complete 40 levels.|28035|20 Jul 2018 11:54:03 PM|1202|1244|96.62|Common|Gold
7233|Stunned|Die by a laser.|28034|20 Jul 2018 11:49:52 PM|1206|1244|96.95|Common|Gold
6641|流れ星の約束|篠崎真里花アフター編クリア|28033|20 Jul 2018 11:41:31 PM|454|487|93.22|Common|Gold
6641|確かな願い|篠崎真里花スクール編クリア|28032|20 Jul 2018 11:38:23 PM|456|487|93.63|Common|Silver
7233|Stabbed|Die by a spike.|28031|20 Jul 2018 11:32:52 PM|1232|1244|99.04|Common|Gold
7233|Professional|Complete 20 levels.|28030|20 Jul 2018 11:32:39 PM|1215|1244|97.67|Common|Gold
7233|Not squared anymore|Die by a saw.|28029|20 Jul 2018 11:31:20 PM|1228|1244|98.71|Common|Gold
7233|Improving|Complete 10 levels.|28028|20 Jul 2018 11:24:54 PM|1233|1244|99.12|Common|Gold
7233|Engineer|Pull a lever.|28027|20 Jul 2018 11:22:50 PM|1236|1244|99.36|Common|Gold
7233|Starter|Complete 5 levels.|28026|20 Jul 2018 11:22:16 PM|1237|1244|99.44|Common|Gold
6641|私の世界|鳴沢律佳アフター編クリア|28025|20 Jul 2018 11:21:08 PM|455|487|93.43|Common|Gold
7233|Not overworking|Get 3 stars in one level.|28024|20 Jul 2018 11:20:38 PM|1239|1244|99.6|Common|Gold
7233|You made it|Complete level 4 making Midnight's friend smile.|28023|20 Jul 2018 11:20:36 PM|1225|1244|98.47|Common|Gold
7233|Making friends|Bump into one of Midnight's friends.|28022|20 Jul 2018 11:20:34 PM|1238|1244|99.52|Common|Silver
7233|Went to explore|Die by getting out of a level.|28021|20 Jul 2018 11:19:24 PM|1239|1244|99.6|Common|Gold
7233|Go into the light|Complete level 1.|28020|20 Jul 2018 11:18:57 PM|1242|1244|99.84|Common|Silver
6641|２人のミライへ|鳴沢律佳スクール編クリア|28019|20 Jul 2018 11:18:28 PM|455|487|93.43|Common|Silver
6772|SQUAREBOY VS BULLIES|DEFEAT ALL THE BULLIES|28018|20 Jul 2018 11:09:23 PM|788|914|86.21|Common|Platinum
6772|BULLYING IS UNCOOL|FINISH THE GAME|28017|20 Jul 2018 11:09:23 PM|790|914|86.43|Common|Gold
6772|BIGGER THEY ARE, HARDER THEY FALL|DEFEAT BIG BOSS BULLY|28016|20 Jul 2018 11:09:08 PM|790|914|86.43|Common|Gold
6641|魚たちの祝福|沖原美砂アフター編クリア|28015|20 Jul 2018 11:01:33 PM|450|487|92.4|Common|Gold
6641|さーかなやー！|沖原美砂スクール編クリア|28014|20 Jul 2018 10:59:15 PM|452|487|92.81|Common|Silver
6641|星に願いを|逢坂そらアフター編クリア|28013|20 Jul 2018 10:50:26 PM|454|487|93.22|Common|Gold
6641|Star Link|逢坂そらスクール編クリア|28012|20 Jul 2018 10:47:19 PM|455|487|93.43|Common|Silver
6772|A BLACK ROBE ALONE MAKETH NOT THE NINJA|DEFEAT NINJA BULLY ON THE SHIP DECK|28011|20 Jul 2018 12:25:43 PM|816|914|89.28|Common|Gold
6772|GOTCHA SLIPPERY NINJA|THROW A CRATE ON THE NINJA BULLY ON THE SHIP DECK|28010|20 Jul 2018 12:25:26 PM|812|914|88.84|Common|Gold
6772|STAND UP FOR EVERYONE|DEFEAT 300 BULLIES|28009|20 Jul 2018 12:18:47 PM|827|914|90.48|Common|Gold
6772|EARLY DELIVERY|HIT AN ENEMY WITH A CRATE|28008|20 Jul 2018 12:10:25 PM|820|914|89.72|Common|Silver
6772|WEAPONS MASTER|HIT ENEMIES BEHIND AND IN FRONT OF YOU WITH A SINGLE SWING OF A WEAPON|28007|20 Jul 2018 4:24:51 AM|838|914|91.68|Common|Gold
6772|BANDANAS ARE SILLY|DEFEAT BANDANA BULLY ON THE HIDEOUT ROOFTOP|28006|20 Jul 2018 4:11:13 AM|857|914|93.76|Common|Gold
6772|UNLEASHED|HIT AN ENEMY WITH A CHAIN|28005|20 Jul 2018 4:11:08 AM|857|914|93.76|Common|Silver
6772|HOMERUN|HIT AN ENEMY WITH A BASEBALL BAT|28004|20 Jul 2018 4:10:59 AM|854|914|93.44|Common|Silver
6772|TAKING OUT THE TRASH|HIT AN ENEMY WITH A TRASH CAN|28003|20 Jul 2018 4:08:38 AM|863|914|94.42|Common|Silver
6772|STAND UP FOR YOUR FRIENDS|DEFEAT 100 BULLIES|28002|20 Jul 2018 4:05:33 AM|869|914|95.08|Common|Silver
6772|BOXING CHAMP|HIT AN ENEMY WITH A BOX|28001|20 Jul 2018 4:01:27 AM|873|914|95.51|Common|Silver
7173|Heartbeat|Unlock every trophy|28000|20 Jul 2018 3:47:00 AM|727|2732|26.61|Uncommon|Platinum
7173|Thanks For Playing|Complete all C-Sides|27999|20 Jul 2018 3:47:00 AM|755|2732|27.64|Uncommon|Gold
6772|TIRE OR TYRE?|HIT AN ENEMY WITH A TIRE|27998|20 Jul 2018 3:43:46 AM|889|914|97.26|Common|Silver
6772|STAND UP FOR YOURSELF|DEFEAT 10 BULLIES|27997|20 Jul 2018 3:39:39 AM|904|914|98.91|Common|Bronze
6772|EYES AT THE BACK|HIT AN ENEMY WITH A BACK PUNCH|27996|20 Jul 2018 3:38:53 AM|902|914|98.69|Common|Silver
6772|TRAINING|DESTROY ALL THE DUMMIES IN THE DOJO|27995|20 Jul 2018 3:36:38 AM|907|914|99.23|Common|Bronze
6772|WHAT A KICK|HIT AN ENEMY WITH A JUMP KICK|27994|20 Jul 2018 3:36:36 AM|908|914|99.34|Common|Bronze
6772|UPPERCUT HERO|HIT AN ENEMY WITH A JUMP PUNCH|27993|20 Jul 2018 3:36:33 AM|907|914|99.23|Common|Bronze
6772|KNOWLEDGE IS KEY|OPEN THE MOVES LIST IN THE PAUSED MENU|27992|20 Jul 2018 3:35:13 AM|897|914|98.14|Common|Bronze
6772|LIKE A TORNADO|HIT AN ENEMY WITH A SPIN PUNCH|27991|20 Jul 2018 3:33:50 AM|890|914|97.37|Common|Bronze
6772|A CLEAN SWEEP|HIT AN ENEMY WITH A SPIN KICK|27990|20 Jul 2018 3:33:45 AM|887|914|97.05|Common|Silver
6772|SO FAST|HIT AN ENEMY WITH A DASH ATTACK|27989|20 Jul 2018 3:33:38 AM|898|914|98.25|Common|Bronze
6772|STRIKER|HIT AN ENEMY WITH A STRIKE COMBO|27988|20 Jul 2018 3:33:34 AM|908|914|99.34|Common|Bronze
6772|HAYEAHH|THROW AN ENEMY|27987|20 Jul 2018 3:33:03 AM|892|914|97.59|Common|Bronze
6772|GOTCHA|GRAB AN ENEMY|27986|20 Jul 2018 3:33:01 AM|908|914|99.34|Common|Bronze
5672|The Crown Jewels|Complete Her Majesty's SPIFFING: The Empire Staggers Back|27985|20 Jul 2018 3:14:47 AM|4101|4460|91.95|Common|Platinum
5672|That's all we could afford|Complete Her Majesty's SPIFFING: The Empire Staggers Back|27984|20 Jul 2018 3:14:47 AM|4170|4460|93.5|Common|Gold
5672|Bubbles!|Place washing liquid inside washing machine before it's activated|27983|20 Jul 2018 3:11:02 AM|4123|4460|92.44|Common|Gold
5672|Cheese sir, I want some more|Acquire a second block of cheese|27982|20 Jul 2018 3:08:22 AM|4136|4460|92.74|Common|Bronze
5672|Nailed It|Fail to catch a frog even when they are asleep|27981|20 Jul 2018 3:03:30 AM|4155|4460|93.16|Common|Bronze
5672|Lullabies to paralyze|Soothe a group of frogs to sleep|27980|20 Jul 2018 3:01:55 AM|4186|4460|93.86|Common|Silver
5672|Master of Unlocking Trophies|Save game progress using the typewriter|27979|20 Jul 2018 2:59:38 AM|4217|4460|94.55|Common|Gold
5672|Cringer|Summon the Power of Greyskull to distract Antoine and Pierre|27978|20 Jul 2018 2:53:00 AM|4201|4460|94.19|Common|Bronze
5672|Damn you all!|Maybe it was earth all along?|27977|20 Jul 2018 2:51:24 AM|4163|4460|93.34|Common|Silver
5672|+1 Geology|Examine all the rocks on the planet surface|27976|20 Jul 2018 2:50:15 AM|4150|4460|93.05|Common|Gold
5672|Premium Engineering|Locate the French camp while driving the Beagle Two Too|27975|20 Jul 2018 2:46:06 AM|4147|4460|92.98|Common|Silver
5672|She's behind you!|Find a replacement motor, when asked|27974|20 Jul 2018 2:44:11 AM|4159|4460|93.25|Common|Silver
5672|While simultaneously no earned|Observe Schrödinger's cat both alive and dead|27973|20 Jul 2018 2:39:30 AM|4158|4460|93.23|Common|Bronze
5672|Cardio, bruh|Break a sweat when using the treadmill|27972|20 Jul 2018 2:35:06 AM|4156|4460|93.18|Common|Silver
5672|What a thrill|Use the ladder like a boss|27971|20 Jul 2018 2:33:27 AM|4233|4460|94.91|Common|Bronze
5672|I can't believe you've done this!|Wake up Sub Lieutenant Jones|27970|20 Jul 2018 2:26:38 AM|4244|4460|95.16|Common|Bronze
5672|One can never be too careful|Ensure no one can erase the driver|27969|20 Jul 2018 2:25:19 AM|4154|4460|93.14|Common|Gold
5672|Leg breaker|Crush a table top football player|27968|20 Jul 2018 2:20:39 AM|4278|4460|95.92|Common|Bronze
5672|Call Autoglass!|Crash into ejected fuel cell when at the controls of the HMSS Imperialise|27967|20 Jul 2018 2:16:30 AM|4150|4460|93.05|Common|Gold
5672|Sharing is caring|Give Sub Lieutenant Jones English's tea|27966|20 Jul 2018 2:13:02 AM|4205|4460|94.28|Common|Silver
5672|Inconceivable|Attempt to mix washing up liquid and tea|27965|20 Jul 2018 2:10:25 AM|4184|4460|93.81|Common|Bronze
5672|Bring me my detonators!|Talk to G.E.R.T.E.A. about British villains|27964|20 Jul 2018 2:06:51 AM|4226|4460|94.75|Common|Silver
5672|The Gravity Simulation Switch|Examine the Gravity Simulation Switch|27963|20 Jul 2018 2:03:48 AM|4306|4460|96.55|Common|Bronze
5672|Don't show me this tip again|Locate the paperclip|27962|20 Jul 2018 2:03:03 AM|4302|4460|96.46|Common|Silver
5672|One Small Step...|Commence your mission on board the HMSS Imperialise!|27961|20 Jul 2018 2:01:55 AM|4406|4460|98.79|Common|Bronze
5672|Every Breath You Take|Look intently at Sub Lieutenant Jones|27960|20 Jul 2018 2:01:46 AM|4228|4460|94.8|Common|Silver
3585|エターナル・ハッピネス|全てのトロフィーを集めた。|27959|20 Jul 2018 1:54:16 AM|715|747|95.72|Common|Platinum
3585|小笠原諒　SH後おまけクリア|小笠原諒　SH後おまけクリアした。|27958|20 Jul 2018 1:54:16 AM|718|747|96.12|Common|Gold
3585|如月公平　SH後おまけクリア|如月公平　SH後おまけクリアした。|27957|20 Jul 2018 1:52:38 AM|717|747|95.98|Common|Gold
3585|回想コンプリート|全ての回想を開いた。|27956|20 Jul 2018 1:51:54 AM|715|747|95.72|Common|Silver
3585|イベントスチルフルオープン|イベントスチルを全部オープンした。|27955|20 Jul 2018 1:51:42 AM|715|747|95.72|Common|Silver
3585|藤守賢史　SH後おまけクリア|藤守賢史　SH後おまけクリアした。|27954|20 Jul 2018 1:34:29 AM|720|747|96.39|Common|Gold
3585|明智誠臣　SH後おまけクリア|明智誠臣　SH後おまけクリアした。|27953|20 Jul 2018 1:33:41 AM|720|747|96.39|Common|Gold
3585|ジョン・スミス　SH後おまけクリア|ジョン・スミス　SH後おまけクリアした。|27952|20 Jul 2018 1:33:00 AM|716|747|95.85|Common|Gold
3585|穂積泪　SH後おまけクリア|穂積泪　SH後おまけクリアした。|27951|20 Jul 2018 1:30:44 AM|717|747|95.98|Common|Gold
3585|小野瀬葵　SH後おまけクリア|小野瀬葵　SH後おまけクリアした。|27950|20 Jul 2018 1:27:40 AM|718|747|96.12|Common|Gold
3585|ジョン・スミス　ハッピ－エンドクリア|ジョン・スミス　ハッピ－エンドクリアした。|27949|20 Jul 2018 1:15:04 AM|716|747|95.85|Common|Bronze
3585|ジョン・スミス　Ｓハッピ－エンドクリア|ジョン・スミス　Ｓハッピ－エンドクリアした。|27948|20 Jul 2018 1:10:13 AM|720|747|96.39|Common|Silver
3585|穂積泪　ハッピ－エンドクリア|穂積泪　ハッピ－エンドクリアした。|27947|20 Jul 2018 12:52:03 AM|717|747|95.98|Common|Bronze
3585|穂積泪　Ｓハッピ－エンドクリア|穂積泪　Ｓハッピ－エンドクリアした。|27946|20 Jul 2018 12:47:21 AM|722|747|96.65|Common|Silver
3585|小野瀬葵　ハッピ－エンドクリア|小野瀬葵　ハッピ－エンドクリアした。|27945|20 Jul 2018 12:34:48 AM|718|747|96.12|Common|Bronze
3585|小野瀬葵　Ｓハッピ－エンドクリア|小野瀬葵　Ｓハッピ－エンドクリアした。|27944|20 Jul 2018 12:29:49 AM|725|747|97.05|Common|Silver
3585|小笠原諒　ハッピ－エンドクリア|小笠原諒　ハッピ－エンドクリアした。|27943|20 Jul 2018 12:10:37 AM|718|747|96.12|Common|Bronze
3585|小笠原諒　Ｓハッピ－エンドクリア|小笠原諒　Ｓハッピ－エンドクリアした。|27942|20 Jul 2018 12:06:36 AM|728|747|97.46|Common|Silver
3585|如月公平　ハッピ－エンドクリア|如月公平　ハッピ－エンドクリアした。|27941|19 Jul 2018 11:54:47 PM|719|747|96.25|Common|Bronze
3585|如月公平　Ｓハッピ－エンドクリア|如月公平　Ｓハッピ－エンドクリアした。|27940|19 Jul 2018 11:51:17 PM|728|747|97.46|Common|Silver
3585|藤守賢史　ハッピ－エンドクリア|藤守賢史　ハッピ－エンドクリアした。|27939|19 Jul 2018 11:39:05 PM|721|747|96.52|Common|Bronze
3585|藤守賢史　Ｓハッピ－エンドクリア|藤守賢史　Ｓハッピ－エンドクリアした。|27938|19 Jul 2018 11:35:28 PM|729|747|97.59|Common|Silver
7232|Platinum Midnight|Unlock all the trophies.|27937|19 Jul 2018 11:22:39 PM|3233|3311|97.64|Common|Platinum
7232|You made it|Complete level 4 making Midnight's friend smile.|27936|19 Jul 2018 11:22:39 PM|3267|3311|98.67|Common|Gold
7232|Expert|Complete 40 levels.|27935|19 Jul 2018 11:21:50 PM|3236|3311|97.73|Common|Gold
7232|Stunned|Die by a laser.|27934|19 Jul 2018 11:16:39 PM|3244|3311|97.98|Common|Gold
3585|明智誠臣　ハッピ－エンドクリア|明智誠臣　ハッピ－エンドクリアした。|27933|19 Jul 2018 11:10:46 PM|722|747|96.65|Common|Bronze
3585|明智誠臣　Ｓハッピ－エンドクリア|明智誠臣　Ｓハッピ－エンドクリアした。|27932|19 Jul 2018 11:05:40 PM|731|747|97.86|Common|Silver
7232|Not squared anymore|Die by a saw.|27931|19 Jul 2018 11:04:09 PM|3274|3311|98.88|Common|Gold
7232|Professional|Complete 20 levels.|27930|19 Jul 2018 11:02:29 PM|3254|3311|98.28|Common|Gold
7232|Improving|Complete 10 levels.|27929|19 Jul 2018 10:57:25 PM|3278|3311|99.0|Common|Gold
7232|Stabbed|Die by a spike.|27928|19 Jul 2018 10:55:27 PM|3280|3311|99.06|Common|Gold
7232|Engineer|Pull a lever.|27927|19 Jul 2018 10:55:04 PM|3287|3311|99.28|Common|Gold
7232|Starter|Complete 5 levels.|27926|19 Jul 2018 10:54:22 PM|3289|3311|99.34|Common|Gold
7232|Went to explore|Die by getting out of a level.|27925|19 Jul 2018 10:54:11 PM|3295|3311|99.52|Common|Gold
7232|Not overworking|Get 3 stars in one level.|27924|19 Jul 2018 10:54:00 PM|3299|3311|99.64|Common|Gold
7232|Making friends|Bump into one of Midnight's friends.|27923|19 Jul 2018 10:53:31 PM|3292|3311|99.43|Common|Silver
7232|Go into the light|Complete level 1.|27922|19 Jul 2018 10:52:20 PM|3305|3311|99.82|Common|Silver
6047|THE ALIEN|Who's who?|27921|19 Jul 2018 10:36:50 PM|590|646|91.33|Common|Platinum
6047|DR. MCCOY|I'm a nightwatchman, not a doctor!|27920|19 Jul 2018 10:36:50 PM|592|646|91.64|Common|Gold
6047|STAY PUFT|Don't cross the streams!|27919|19 Jul 2018 10:33:36 PM|591|646|91.49|Common|Bronze
6047|ZAMPONE|The real crowbar!|27918|19 Jul 2018 10:12:01 PM|592|646|91.64|Common|Bronze
6047|SUBMARINE|All submarines should be yellow...|27917|19 Jul 2018 9:29:45 PM|598|646|92.57|Common|Silver
6047|ESCARGOT|They go down slowly...|27916|19 Jul 2018 9:15:09 PM|600|646|92.88|Common|Silver
6047|BRAVE|Or stupid?|27915|19 Jul 2018 9:11:56 PM|605|646|93.65|Common|Bronze
6047|GREEN THUMB|Damn! I'm a watchman, not a gardener!|27914|19 Jul 2018 9:08:40 PM|599|646|92.72|Common|Silver
6047|BOOMBOX|So 80's...|27913|19 Jul 2018 9:00:33 PM|605|646|93.65|Common|Silver
6047|FANCY A COLA?|To cola! The cause of... and solution to... all of life's problems!|27912|19 Jul 2018 8:59:49 PM|600|646|92.88|Common|Gold
