7944|France Tourist|Reveal any photo of France|8079|30 Jul 2018 11:36:12 AM|23|36|63.89|Common|Bronze
6247|Boo-yah, Grandma! Boo-yah!|Earn 30 Relics (gold or better).|8078|29 Jul 2018 5:50:37 PM|18202|145190|12.54|Rare|Gold
7944|Japan Sightseer|Complete the album page for Japan|8077|29 Jul 2018 1:28:25 PM|18|36|50.0|Uncommon|Silver
7944|Fast Exposure|Solve a puzzle in under 5 minutes using only the Smart Cursor|8076|26 Jul 2018 6:46:13 PM|18|36|50.0|Uncommon|Gold
7944|Just Follow Your Nose|Solve a puzzle without using Show Next Move|8075|26 Jul 2018 6:40:43 PM|27|36|75.0|Common|Gold
7944|Retrace Your Steps|Restart any puzzle|8074|26 Jul 2018 6:26:30 PM|26|36|72.22|Common|Silver
7609|Theme Master|Finish the game by choosing 10 different background themes.|8073|25 Jul 2018 5:05:39 PM|477|700|68.14|Common|Silver
7609|Win streak|Finish the game third times in a row.|8072|25 Jul 2018 4:54:39 PM|479|700|68.43|Common|Silver
7609|Select Theme|Finish the game by choosing 5 different background themes.|8071|25 Jul 2018 4:54:39 PM|502|700|71.71|Common|Bronze
5050|Lord of War|Complete second episode without using any tips|8070|25 Jul 2018 4:41:55 PM|712|991|71.85|Common|Silver
5050|The Evil Genius|Complete the game without using tips|8069|25 Jul 2018 4:41:55 PM|701|991|70.74|Common|Gold
5050|Space Superstar|Complete the Space War group|8068|25 Jul 2018 4:38:07 PM|725|991|73.16|Common|Bronze
5050|Sweet Little Toys|Complete the Weapons and Military groups|8067|25 Jul 2018 4:32:50 PM|725|991|73.16|Common|Bronze
5050|Science!|Complete the Science group|8066|25 Jul 2018 4:24:01 PM|729|991|73.56|Common|Bronze
5050|Vivisector|Complete the Monsters group|8065|25 Jul 2018 4:20:24 PM|735|991|74.17|Common|Bronze
5050|Walking in God's Shoes|Complete the Nature, Animals, and Plants groups|8064|25 Jul 2018 4:20:06 PM|731|991|73.76|Common|Bronze
5050|Great Distortion|Complete first episode without using tips|8063|25 Jul 2018 4:13:31 PM|721|991|72.75|Common|Silver
5050|Unholy Chain|Create 50 elements in a row|8062|25 Jul 2018 4:12:37 PM|713|991|71.95|Common|Silver
5050|Accidental Well-doer|Complete the Good group|8061|25 Jul 2018 4:06:09 PM|751|991|75.78|Common|Bronze
5050|Devil's Dozen|Create 13 different elements|8060|25 Jul 2018 4:05:39 PM|905|991|91.32|Common|Bronze
5050|Forbidden Fruit|Complete intro|8059|25 Jul 2018 4:04:16 PM|965|991|97.38|Common|Bronze
5050|Combo!|Create two new elements in a row|8058|25 Jul 2018 4:04:10 PM|965|991|97.38|Common|Bronze
7944|The Scenic Route|Solve a puzzle without using the Smart Cursor once|8057|25 Jul 2018 11:12:44 AM|25|36|69.44|Common|Gold
7944|Phrase Book|Read the tutorial in every in-game language|8056|25 Jul 2018 3:35:46 AM|24|36|66.67|Common|Silver
7944|Japan Tourist|Reveal any photo of Japan|8055|25 Jul 2018 2:39:29 AM|32|36|88.89|Common|Bronze
7944|Comfort Stop|Resume a partially completed puzzle|8054|25 Jul 2018 2:27:05 AM|28|36|77.78|Common|Silver
7944|Venture Forth!|Complete the tutorial|8053|24 Jul 2018 7:09:01 PM|35|36|97.22|Common|Bronze
2647|Ice To See You|Defeat 'Frost Grubber'|8052|23 Jul 2018 9:37:30 PM|29402|157064|18.72|Rare|Bronze
2647|Cave Cleaner Veteran|Kill over 500 enemies|8051|23 Jul 2018 9:16:28 PM|31245|157064|19.89|Rare|Silver
4537|Night Night|Kill a boss with "Lights Out."|8050|23 Jul 2018 7:33:41 PM|2881|9756|29.53|Uncommon|Bronze
4537|Endless Voyager|Collect 4 Keycards.|8049|23 Jul 2018 5:46:16 PM|3929|9756|40.27|Uncommon|Silver
4537|Diamond Casket|Bank 20,000 gold.|8048|23 Jul 2018 5:38:41 PM|4456|9756|45.67|Uncommon|Silver
4537|Macho|Deal 5000 damage in one shot.|8047|23 Jul 2018 5:14:23 PM|6439|9756|66.0|Common|Silver
4537|The Lone Survivor|Survive 40 minutes.|8046|23 Jul 2018 5:05:37 PM|5989|9756|61.39|Common|Bronze
4537|Better Luck Next Time|Fail a shrine 3 times in a row.|8045|23 Jul 2018 2:10:31 PM|6612|9756|67.77|Common|Bronze
6158|Showdown Completion|Complete all Puzzle Showdown 4K Trophies|8044|23 Jul 2018 4:55:06 AM|4323|5271|82.01|Common|Platinum
6158|Puzzle Champion|Complete 50 Puzzles|8043|23 Jul 2018 4:55:06 AM|4385|5271|83.19|Common|Gold
6158|Relaxation Station|Complete a puzzle with scoring disabled|8042|23 Jul 2018 4:17:16 AM|5113|5271|97.0|Common|Bronze
6158|Line of Five|Complete a Line Bonus of 5 pieces or more|8041|23 Jul 2018 4:15:24 AM|4589|5271|87.06|Common|Gold
6158|Another's Treasure|Complete an Another's Treasure Bonus twice in one Showdown|8040|23 Jul 2018 4:13:32 AM|4455|5271|84.52|Common|Gold
6158|Showdown Champion|10 Competitive Wins|8039|23 Jul 2018 4:09:39 AM|4475|5271|84.9|Common|Gold
6158|Showdown Underdog|Come back from a 1000 point deficit in showdown|8038|23 Jul 2018 3:58:21 AM|4483|5271|85.05|Common|Gold
6158|Showdown Winner|1 Competitive Win|8037|23 Jul 2018 3:54:07 AM|4645|5271|88.12|Common|Gold
6158|Triple Jig|Complete 3rd Puzzle|8036|23 Jul 2018 3:54:06 AM|4956|5271|94.02|Common|Silver
6158|First Showdown|Compete against another player|8035|23 Jul 2018 3:49:58 AM|4658|5271|88.37|Common|Silver
6158|Puzzle Connoisseur|Complete a 510-piece Puzzle|8034|23 Jul 2018 3:39:43 AM|4652|5271|88.26|Common|Gold
6158|Do a Jig|Complete 1st Puzzle|8033|23 Jul 2018 3:39:37 AM|5180|5271|98.27|Common|Bronze
6158|Puzzle Master|Complete a 510-piece Puzzle in under 2 hours|8032|23 Jul 2018 3:39:37 AM|4555|5271|86.42|Common|Gold
6158|Ithsmus Be Difficult|Complete an Isthmus Bonus of 15 or more pieces|8031|23 Jul 2018 2:35:20 AM|4871|5271|92.41|Common|Gold
6158|Triple Speed Streak|Complete 3 Speed Streak Bonuses in a row|8030|23 Jul 2018 2:13:38 AM|4901|5271|92.98|Common|Silver
6158|Accuracy Streak|Complete 5 Accuracy Bonuses in a row|8029|23 Jul 2018 2:13:13 AM|4925|5271|93.44|Common|Silver
6158|Showdown Boon|Complete two 30-point or higher Bonus Points in one Showdown|8028|23 Jul 2018 2:12:34 AM|4941|5271|93.74|Common|Silver
6247|Bringing Down the House|Earn 42 Gems.|8027|23 Jul 2018 12:06:44 AM|20995|145190|14.46|Rare|Gold
6247|Giving 102%!|Earn the Gems in the bonus levels.|8026|23 Jul 2018 12:06:44 AM|22111|145190|15.23|Rare|Silver
6247|Getting Carried Away|Discovered the Secret Exit in Dino Might!|8025|23 Jul 2018 12:04:38 AM|23584|145190|16.24|Rare|Silver
6247|UFO Xing|Discovered the Secret Exit in Road Crash.|8024|22 Jul 2018 11:47:48 PM|32673|145190|22.5|Uncommon|Silver
6247|Is There a Problem, Granny?!|Earn 10 Relics (gold or better).|8023|22 Jul 2018 8:11:16 PM|24768|145190|17.06|Rare|Silver
4537|Lizard Bait|Defeat 20 lemurians in one playthrough.|8022|22 Jul 2018 3:37:20 AM|8665|9756|88.82|Common|Bronze
6053|Full Throttle|Unlock all trophies|8021|21 Jul 2018 5:02:33 AM|5081|6986|72.73|Common|Platinum
6053|Burn-In Rubber|Save your screen from burn-in with 3D animated vehicles|8020|21 Jul 2018 5:02:33 AM|5820|6986|83.31|Common|Bronze
6053|Angels with Dirty Faces|Keep talking to Todd|8019|21 Jul 2018 4:59:51 AM|5311|6986|76.02|Common|Bronze
6053|Thank No Cats|Watch the bunnies overtake the credits|8018|21 Jul 2018 4:31:42 AM|5415|6986|77.51|Common|Bronze
6053|Can't Beat a Corley|Send up a gorge-ous death for Ripburger|8017|21 Jul 2018 4:15:11 AM|5685|6986|81.38|Common|Gold
6053|Burger Well Done|Defeat Ripburger without dying|8016|21 Jul 2018 4:15:10 AM|5169|6986|73.99|Common|Gold
6053|LOOMing Seagull|Kill the LOOM Seagull|8015|21 Jul 2018 4:14:12 AM|5385|6986|77.08|Common|Bronze
6053|Now Boarding|Get Ripburger into the plane|8014|21 Jul 2018 4:12:03 AM|5694|6986|81.51|Common|Silver
6053|Rabbit Ragu|Dice a rabbit in the engine fan|8013|21 Jul 2018 4:10:16 AM|5417|6986|77.54|Common|Silver
6053|Burger Melt|Melt Ripburger's vision of the future|8012|21 Jul 2018 4:03:58 AM|5708|6986|81.71|Common|Bronze
6053|Wisecrack|Kick the crack to open the secret passage|8011|21 Jul 2018 4:01:07 AM|5718|6986|81.85|Common|Bronze
6053|What A Pain Threshold!|Make the Boom Boom Bros go boom|8010|21 Jul 2018 3:58:03 AM|5724|6986|81.94|Common|Silver
6053|Taut a Lesson|Talk your way out of getting quartered|8009|21 Jul 2018 3:46:07 AM|5748|6986|82.28|Common|Bronze
6053|Hare Trigger|Sacrifice bunnies to get through the minefield|8008|21 Jul 2018 3:41:16 AM|5748|6986|82.28|Common|Silver
6053|Invasion of the Bunny Snatcher|Snatch the bunny|8007|21 Jul 2018 3:37:38 AM|5772|6986|82.62|Common|Bronze
6053|Pull a Fast One|Get the battery from the minefield|8006|21 Jul 2018 3:36:18 AM|5774|6986|82.65|Common|Bronze
6053|Pure Evel|Launch over Poyahoga Gorge|8005|21 Jul 2018 3:31:43 AM|5836|6986|83.54|Common|Silver
6053|The Spirit of Ricky Myran|Escape with Ricky's ramp|8004|21 Jul 2018 3:30:30 AM|5858|6986|83.85|Common|Bronze
6053|Gogglor|Use the Cavefish goggles to locate their lair|8003|20 Jul 2018 8:02:31 PM|5885|6986|84.24|Common|Bronze
6053|A Fistful of Fertilizer|Get the chainsaw with the fertilizer|8002|20 Jul 2018 7:19:49 PM|5775|6986|82.67|Common|Silver
6053|Torque Talk|Consume Father Torque's wisdom|8001|20 Jul 2018 7:17:12 PM|5979|6986|85.59|Common|Silver
6053|Fertilized|Use the fertilizer to spin out Nestor and Bolus|8000|20 Jul 2018 7:11:54 PM|5941|6986|85.04|Common|Bronze
6053|Hosed|Get a hose to fix your bike|7999|20 Jul 2018 7:05:53 PM|6081|6986|87.05|Common|Bronze
6053|Hard Tale|Look at the pic of Maureen and Malcom fixing hard tail|7998|20 Jul 2018 7:05:21 PM|5360|6986|76.72|Common|Silver
6053|I Can Do That|Play a game of five finger fillet|7997|20 Jul 2018 6:59:37 PM|5405|6986|77.37|Common|Silver
6053|News to Me|Watch the entire news broadcast|7996|20 Jul 2018 6:58:23 PM|5349|6986|76.57|Common|Bronze
6053|A New Hope|Grab the Fake ID from Miranda|7995|20 Jul 2018 6:56:37 PM|6123|6986|87.65|Common|Bronze
6053|Unnatural Causes|Listen to Malcolm's last words|7994|20 Jul 2018 6:47:29 PM|6169|6986|88.31|Common|Silver
6053|Right in the Junk|Recover the forks from the junkyard|7993|20 Jul 2018 6:29:32 PM|6228|6986|89.15|Common|Bronze
6053|OK, I'll Put My Lips on That|Siphon gas from Floyd|7992|20 Jul 2018 6:23:15 PM|6272|6986|89.78|Common|Bronze
6053|Annoyed Floyd|Hide from Floyd|7991|20 Jul 2018 6:22:26 PM|6301|6986|90.19|Common|Bronze
6053|Not So Tough After All|Pick the lock to the tower|7990|20 Jul 2018 6:18:46 PM|6368|6986|91.15|Common|Silver
6053|Carry the Torch|Retrieve Mo's welding torch|7989|20 Jul 2018 6:17:46 PM|6341|6986|90.77|Common|Bronze
6053|Trailer Trashed|Kick in the trailer door|7988|20 Jul 2018 6:16:35 PM|6435|6986|92.11|Common|Bronze
6053|Minking Memories|Check out the photo of Uncle Pete|7987|20 Jul 2018 6:08:22 PM|6470|6986|92.61|Common|Silver
6053|Know Mo|Finish all of Mo's initial dialog|7986|20 Jul 2018 4:50:20 PM|6145|6986|87.96|Common|Silver
6053|A-Number One Polecat Honcho|Take out the first Rottwheeler|7985|20 Jul 2018 4:44:38 PM|6600|6986|94.47|Common|Bronze
6053|Ring Pull|Get your keys from the bartender|7984|20 Jul 2018 4:39:33 PM|6636|6986|94.99|Common|Silver
6053|Not Puttin' My Lips on That|Keep Your Lips Off of 10 Objects|7983|20 Jul 2018 4:38:35 PM|6032|6986|86.34|Common|Silver
6053|One Final Offer...|Accept Ripburger's Final Offer|7982|20 Jul 2018 4:31:40 PM|6695|6986|95.83|Common|Bronze
2647|Suit Up|Collect your first suit|7981|19 Jul 2018 7:54:49 PM|46045|157064|29.32|Uncommon|Bronze
2647|My Precious|Collect all the hidden treasure within an Episode|7980|19 Jul 2018 7:45:02 PM|27555|157064|17.54|Rare|Silver
6352|Energy Balance Platinum|Good job! You have restored the full balance!|7979|19 Jul 2018 4:36:14 PM|369|538|68.59|Common|Platinum
6352|Square Level 4 Completed|We live as ripples of energy in the vast ocean of energy.|7978|19 Jul 2018 4:36:14 PM|369|538|68.59|Common|Gold
6352|Square Level 3 Completed|Today is today, only today... Tomorrow it will only be yesterday.|7977|18 Jul 2018 7:03:24 PM|369|538|68.59|Common|Gold
6352|Square Level 2 Completed|Energy is liberated matter, matter is energy waiting to happen.|7976|18 Jul 2018 6:58:46 PM|371|538|68.96|Common|Silver
6352|Square Level 1 Completed|I wonder how a battery feels when it pours electricity into a non-conductor?|7975|18 Jul 2018 6:55:14 PM|371|538|68.96|Common|Silver
6352|Hardcore Level 4 Completed|With great power comes great dissipation.|7974|18 Jul 2018 6:52:06 PM|371|538|68.96|Common|Gold
6352|Hardcore Level 3 Completed|We all have the ability to heal ourselves.|7973|18 Jul 2018 5:07:28 PM|373|538|69.33|Common|Gold
6352|Hardcore Level 2 Completed|The greatest weariness comes from work not done.|7972|18 Jul 2018 4:58:54 PM|379|538|70.45|Common|Silver
6352|Hardcore Level 1 Completed|Solitude is where I place my chaos to rest and awaken my inner peace.|7971|18 Jul 2018 4:50:20 PM|392|538|72.86|Common|Silver
6352|Level 12 Completed|Renew energy, revive strength.|7970|18 Jul 2018 3:35:53 PM|393|538|73.05|Common|Gold
2647|Come With Me If You Want To Live|Rescue all the scientists within an Episode|7969|18 Jul 2018 2:53:10 PM|27851|157064|17.73|Rare|Silver
2647|No Stone Unturned|Find all of the secret areas within an Episode|7968|18 Jul 2018 2:53:09 PM|35718|157064|22.74|Uncommon|Silver
2647|Why Did It Have To Be Spiders?|Defeat 'Giant Spitter'|7967|18 Jul 2018 2:52:57 PM|50682|157064|32.27|Uncommon|Bronze
2647|Sharp Shooter|Build a combo of 32 or over|7966|18 Jul 2018 10:49:45 AM|55831|157064|35.55|Uncommon|Bronze
1552|Hohokum Remix: Synth Loops|Complete the mix with a splash of analog electronics.|7965|17 Jul 2018 2:48:14 PM|16955|16976|55.54|Common|Silver
1552|Hohokum Remix: Guitar Loops|Sculpt these ethereal guitar and bass melodies.|7964|17 Jul 2018 2:48:09 PM|16946|16976|55.51|Common|Silver
1552|Hohokum Remix: Drum Loops|Rearrange the drum loops to make something fresh!|7963|17 Jul 2018 2:48:03 PM|16943|16976|55.5|Common|Silver
1552|Hohokum Remix: Drum Kit|Can you use these dreamy drums to make a beat?|7962|17 Jul 2018 2:47:58 PM|16949|16976|55.52|Common|Silver
1552|Hohokum Remix: Bass|Build your own bassline from this pulse.|7961|17 Jul 2018 2:47:52 PM|16961|16976|55.56|Common|Silver
1552|Beat School: Set Phasers to 'Funk'|When the mothership is under attack, fight back with a funky loop.|7960|17 Jul 2018 2:47:46 PM|16581|16595|54.93|Common|Silver
1552|Beat School: Mission to Planet Drums|3, 2, 1... funk off!|7959|17 Jul 2018 2:47:40 PM|16584|16595|54.94|Common|Silver
1552|Beat School: Something Smells Funky in Here!|Time to do the funky laundry!|7958|17 Jul 2018 2:47:34 PM|16580|16595|54.93|Common|Silver
1552|Beat School: Interstellar Funkonauts|May the funk be with you.|7957|17 Jul 2018 2:47:29 PM|16583|16595|54.94|Common|Silver
1552|Beat School: 3001 A Bass Odyssey|Take this bassline for a spin around the galaxy!|7956|17 Jul 2018 2:47:21 PM|16586|16595|54.95|Common|Silver
1552|Beat School: Machine Language|Twist synthetic singing around to make your own vocal line!|7955|17 Jul 2018 2:47:16 PM|19470|19490|59.52|Common|Silver
1552|Beat School: Text to Speech|How could we resist? Shout out Sound Shapes with this unique beat.|7954|17 Jul 2018 2:47:09 PM|19476|19490|59.54|Common|Silver
1552|Beat School: Word to Your Motherboard|Dance, funk, rock and house. You will master all the robotic styles.|7953|17 Jul 2018 2:47:03 PM|19467|19490|59.51|Common|Silver
1552|Beat School: Artificial Ah Yeah!|Robot feels good!|7952|17 Jul 2018 2:46:58 PM|19471|19490|59.52|Common|Silver
1552|Beat School: Does Not Compute|Start with the basics, countdown like a robot!|7951|17 Jul 2018 2:46:52 PM|19474|19490|59.53|Common|Silver
1552|Beat School: Loop Jugglin'|Ultimate hip hop loop builder - word to your moms!|7950|17 Jul 2018 2:46:46 PM|19520|19547|59.59|Common|Silver
1552|Beat School: The Drummer Gets Wicked|Cut and paste drums to make your own breakbeat!|7949|17 Jul 2018 2:46:40 PM|19518|19547|59.58|Common|Silver
1552|Beat School: On the One's and Two's|Checka-checka-check out the scratch routine!|7948|17 Jul 2018 2:46:34 PM|19524|19547|59.6|Common|Silver
1552|Beat School: The Five Elements|Who got the jazz? Add some horns to your beat!|7947|17 Jul 2018 2:46:28 PM|19530|19547|59.62|Common|Silver
1552|Beat School: A Funky Introduction|Get started with this simple bass loop!|7946|17 Jul 2018 2:46:22 PM|19538|19547|59.64|Common|Silver
1552|Beat School: All You Need is Wub|Complete the Beat School level.|7945|17 Jul 2018 2:46:17 PM|21163|21246|61.96|Common|Silver
1552|Beat School: Half-Time Drum Loops|Complete the Beat School level.|7944|17 Jul 2018 2:46:10 PM|21166|21246|61.97|Common|Silver
1552|Beat School: Filthy Bass Monster|Complete the Beat School level.|7943|17 Jul 2018 2:46:04 PM|21181|21246|62.02|Common|Silver
1552|Beat School: Synth Grime|Complete the Beat School level.|7942|17 Jul 2018 2:45:58 PM|21196|21246|62.06|Common|Silver
1552|Beat School: Dubstep Drum Practice|Complete the Beat School level.|7941|17 Jul 2018 2:45:51 PM|21200|21246|62.07|Common|Silver
1552|Beat School: Brass Knuckles|Put up yer dukes, and make a funky horn loop!|7940|17 Jul 2018 2:45:44 PM|17854|17869|57.0|Common|Silver
1552|Beat School: Jazz Hands|Swing to the beat of the cool jazzy brass riff!|7939|17 Jul 2018 2:45:39 PM|17856|17869|57.01|Common|Silver
1552|Beat School: Triumph Horns|A few notes with a huge result!|7938|17 Jul 2018 2:45:33 PM|17859|17869|57.02|Common|Silver
1552|Beat School: Battle of the Saxes|Practice your sax skills by creating this cool phrase.|7937|17 Jul 2018 2:45:26 PM|17858|17869|57.01|Common|Silver
1552|Beat School: Blow Your Own Horn|Learn the brass basics by constructing this simple trumpet loop.|7936|17 Jul 2018 2:45:21 PM|17864|17869|57.03|Common|Silver
1552|Beat School: Hollywood Cop|Complete the Beat School level.|7935|17 Jul 2018 2:45:15 PM|21096|21158|61.9|Common|Silver
1552|Beat School: Fast Times|Complete the Beat School level.|7934|17 Jul 2018 2:45:08 PM|21118|21158|61.96|Common|Silver
1552|Beat School: Driving the Autobahn|Complete the Beat School level.|7933|17 Jul 2018 2:45:02 PM|21122|21158|61.97|Common|Silver
1552|Beat School: Shoulder Pads|Complete the Beat School level.|7932|17 Jul 2018 2:44:56 PM|21136|21158|62.01|Common|Silver
1552|Beat School: Big Hair Beat|Complete the Beat School level.|7931|17 Jul 2018 2:44:51 PM|21147|21158|62.05|Common|Silver
1552|Beat School: Axe Grinder|Complete the Beat School level.|7930|17 Jul 2018 2:44:45 PM|21004|21110|61.7|Common|Silver
1552|Beat School: Pedal to the Metal|Complete the Beat School level.|7929|17 Jul 2018 2:44:39 PM|21019|21110|61.74|Common|Silver
1552|Beat School: Badd Syntax|Complete the Beat School level.|7928|17 Jul 2018 2:44:34 PM|21018|21110|61.74|Common|Silver
1552|Beat School: Synth Madness 2|Complete the Beat School level.|7927|17 Jul 2018 2:44:28 PM|21036|21110|61.79|Common|Silver
1552|Beat School: Synth Madness 1|Complete the Beat School level.|7926|17 Jul 2018 2:44:22 PM|21093|21110|61.96|Common|Silver
1552|Beat School: Insert Coin|Complete the Beat School level.|7925|17 Jul 2018 2:44:16 PM|22159|22282|63.35|Common|Silver
1552|Beat School: Underworld|Complete the Beat School level.|7924|17 Jul 2018 2:44:11 PM|22155|22282|63.34|Common|Silver
1552|Beat School: Bass Boss|Complete the Beat School level.|7923|17 Jul 2018 2:44:05 PM|22179|22282|63.41|Common|Silver
1552|Beat School: Danger! Danger!|Complete the Beat School level.|7922|17 Jul 2018 2:43:59 PM|22174|22282|63.4|Common|Silver
1552|Beat School: 8-Bit Melody|Complete the Beat School level.|7921|17 Jul 2018 2:43:53 PM|22257|22282|63.63|Common|Silver
1552|Beat School: In The Club|Complete the Beat School level.|7920|17 Jul 2018 2:43:47 PM|21899|22005|63.0|Common|Silver
1552|Beat School: Robot Invasion|Complete the Beat School level.|7919|17 Jul 2018 2:43:41 PM|21927|22005|63.08|Common|Silver
1552|Beat School: Lazy Day Beat|Complete the Beat School level.|7918|17 Jul 2018 2:43:36 PM|21930|22005|63.09|Common|Silver
1552|Beat School: Groovology 101|Complete the Beat School level.|7917|17 Jul 2018 2:43:29 PM|21938|22005|63.12|Common|Silver
1552|Beat School: Basic Rock Beat|Complete the Beat School level.|7916|17 Jul 2018 2:43:23 PM|21978|22005|63.23|Common|Silver
1552|Beat School: Harmony Helper|Complete the Beat School level.|7915|17 Jul 2018 2:43:17 PM|22084|22243|63.2|Common|Silver
1552|Beat School: Piano? PiaYES!|Complete the Beat School level.|7914|17 Jul 2018 2:43:12 PM|22114|22243|63.28|Common|Silver
1552|Beat School: Kalimba Magic|Complete the Beat School level.|7913|17 Jul 2018 2:43:06 PM|22132|22243|63.33|Common|Silver
1552|Beat School: Guitar Serenity 2|Complete the Beat School level.|7912|17 Jul 2018 2:43:00 PM|22163|22243|63.42|Common|Silver
1552|Beat School: Guitar Serenity 1|Complete the Beat School level.|7911|17 Jul 2018 2:42:52 PM|22236|22243|63.63|Common|Silver
229|Explorer|Use all Modes at least once in a session.|7910|17 Jul 2018 2:26:40 PM|47478|53108|89.4|Common|Gold
229|Detune|Upload some music to your system, play that music while playing with detuned, and maximize one of the distortive sound effects.|7909|17 Jul 2018 2:25:19 PM|46516|53108|87.59|Common|Silver
229|Elephant Dance|Dance with four elephants around the chair.|7908|17 Jul 2018 2:24:00 PM|46925|53108|88.36|Common|Silver
229|Jarig|Look at Rob dancing.|7907|17 Jul 2018 2:22:52 PM|44750|53108|84.26|Common|Silver
229|Combo|Issue any two button combo.|7906|17 Jul 2018 2:22:15 PM|52398|53108|98.66|Common|Silver
229|RTM|Read the… Help Screen.|7905|17 Jul 2018 2:21:57 PM|50412|53108|94.92|Common|Bronze
229|Crank|Use the right stick to crank up an effect.|7904|17 Jul 2018 2:21:43 PM|52811|53108|99.44|Common|Bronze
229|Pump|Use the pump controls to pump up and release completely an effect.|7903|17 Jul 2018 2:21:29 PM|51067|53108|96.16|Common|Bronze
229|Zoom|Use the camera controls to zoom in or out.|7902|17 Jul 2018 2:20:46 PM|52513|53108|98.88|Common|Bronze
229|Demo|Watch the demo mode to the end.|7901|17 Jul 2018 2:20:00 PM|47229|53108|88.93|Common|Silver
2647|Cave Cleaner|Kill over 100 enemies|7900|17 Jul 2018 11:11:08 AM|68998|157064|43.93|Uncommon|Bronze
2647|It's Only A Flesh Wound|Cool your ship down after being set on fire, then stay alive for 5 seconds|7899|17 Jul 2018 11:01:41 AM|81761|157064|52.06|Common|Bronze
2647|A Chamber Of Secrets|Find your first secret area|7898|17 Jul 2018 10:33:38 AM|129462|157064|82.43|Common|Bronze
6352|Level 11 Completed|Wind is renewable. Turbines are not.|7897|16 Jul 2018 6:15:04 PM|399|538|74.16|Common|Gold
6352|Level 10 Completed|She was full of some strange energy that morning.|7896|16 Jul 2018 5:28:17 PM|402|538|74.72|Common|Gold
6352|Level 9 Completed|Good energy has served me well.|7895|16 Jul 2018 5:16:16 PM|404|538|75.09|Common|Gold
6352|Level 8 Completed|The difference between one man and another is not mere ability... it is energy.|7894|16 Jul 2018 3:43:51 PM|405|538|75.28|Common|Silver
2251|Hohokum Remix: Synth Loops|Complete the mix with a splash of analog electronics.|7893|14 Jul 2018 2:24:19 AM|10214|10246|51.56|Common|Silver
2251|Hohokum Remix: Bass|Build your own bassline from this pulse.|7892|14 Jul 2018 2:24:18 AM|10229|10246|51.64|Common|Silver
2251|Hohokum Remix: Drum Kit|Can you use these dreamy drums to make a beat?|7891|14 Jul 2018 2:24:18 AM|10205|10246|51.52|Common|Silver
2251|Hohokum Remix: Drum Loops|Rearrange the drum loops to make something fresh!|7890|14 Jul 2018 2:24:18 AM|10199|10246|51.49|Common|Silver
2251|Hohokum Remix: Guitar Loops|Sculpt these ethereal guitar and bass melodies.|7889|14 Jul 2018 2:24:18 AM|10207|10246|51.53|Common|Silver
2251|Beat School: Mission to Planet Drums|3, 2, 1... funk off!|7888|14 Jul 2018 2:24:12 AM|10035|10062|51.12|Common|Silver
2251|Beat School: Set Phasers to 'Funk'|When the mothership is under attack, fight back with a funky loop.|7887|14 Jul 2018 2:24:12 AM|10033|10062|51.11|Common|Silver
2251|Beat School: Interstellar Funkonauts|May the funk be with you.|7886|14 Jul 2018 2:24:11 AM|10034|10062|51.12|Common|Silver
2251|Beat School: Something Smells Funky in Here!|Time to do the funky laundry!|7885|14 Jul 2018 2:24:11 AM|10035|10062|51.12|Common|Silver
2251|Beat School: Does Not Compute|Start with the basics, countdown like a robot!|7884|14 Jul 2018 2:24:05 AM|11607|11621|55.02|Common|Silver
2251|Beat School: Artificial Ah Yeah!|Robot feels good!|7883|14 Jul 2018 2:24:05 AM|11600|11621|54.99|Common|Silver
2251|Beat School: Word to Your Motherboard|Dance, funk, rock and house. You will master all the robotic styles.|7882|14 Jul 2018 2:24:05 AM|11597|11621|54.97|Common|Silver
2251|Beat School: Text to Speech|How could we resist? Shout out Sound Shapes with this unique beat.|7881|14 Jul 2018 2:24:05 AM|11603|11621|55.0|Common|Silver
2251|Beat School: Machine Language|Twist synthetic singing around to make your own vocal line!|7880|14 Jul 2018 2:24:05 AM|11592|11621|54.95|Common|Silver
2251|Beat School: 3001 A Bass Odyssey|Take this bassline for a spin around the galaxy!|7879|14 Jul 2018 2:24:05 AM|10052|10062|51.21|Common|Silver
2251|Beat School: Filthy Bass Monster|Complete the Beat School level.|7878|14 Jul 2018 2:23:58 AM|12150|12203|56.21|Common|Silver
2251|Beat School: Half-Time Drum Loops|Complete the Beat School level.|7877|14 Jul 2018 2:23:58 AM|12136|12203|56.14|Common|Silver
2251|Beat School: All You Need is Wub|Complete the Beat School level.|7876|14 Jul 2018 2:23:58 AM|12138|12203|56.15|Common|Silver
2251|Beat School: A Funky Introduction|Get started with this simple bass loop!|7875|14 Jul 2018 2:23:58 AM|11684|11694|55.21|Common|Silver
2251|Beat School: The Five Elements|Who got the jazz? Add some horns to your beat!|7874|14 Jul 2018 2:23:58 AM|11673|11694|55.16|Common|Silver
2251|Beat School: On the One's and Two's|Checka-checka-check out the scratch routine!|7873|14 Jul 2018 2:23:58 AM|11663|11694|55.11|Common|Silver
2251|Beat School: The Drummer Gets Wicked|Cut and paste drums to make your own breakbeat!|7872|14 Jul 2018 2:23:58 AM|11648|11694|55.04|Common|Silver
2251|Beat School: Loop Jugglin'|Ultimate hip hop loop builder - word to your moms!|7871|14 Jul 2018 2:23:58 AM|11651|11694|55.06|Common|Silver
2251|Beat School: Dubstep Drum Practice|Complete the Beat School level.|7870|14 Jul 2018 2:23:57 AM|12173|12203|56.31|Common|Silver
