3318|RAW Strength|Take optional photo #7 in Episode 3: Chaos Theory|8073|29 Jul 2018 7:17:55 PM|7887|16847|46.82|Uncommon|Bronze
3318|Pinholed|Take optional photo #6 in Episode 3: Chaos Theory|8072|29 Jul 2018 7:15:49 PM|9196|16847|54.59|Common|Bronze
3318|Parallax View|Take optional photo #1 in Episode 3: Chaos Theory|8071|29 Jul 2018 7:03:44 PM|7739|16847|45.94|Uncommon|Bronze
3318|Bokeh|Take optional photo #5 in Episode 3: Chaos Theory|8070|29 Jul 2018 4:20:13 PM|7939|16847|47.12|Uncommon|Bronze
3318|Histogrammar|Take optional photo #4 in Episode 3: Chaos Theory|8069|29 Jul 2018 4:12:20 PM|9355|16847|55.53|Common|Bronze
3318|The Reflex|Take optional photo #3 in Episode 3: Chaos Theory|8068|29 Jul 2018 4:11:45 PM|9438|16847|56.02|Common|Bronze
3318|Lenscrafted|Take optional photo #2 in Episode 3: Chaos Theory|8067|29 Jul 2018 3:59:57 PM|8088|16847|48.01|Uncommon|Bronze
6144|Fall fresco|Use the Autumn fragment to reveal this fresco.|8066|28 Jul 2018 2:53:56 PM|2154|2709|79.51|Common|Silver
6144|Winter fresco|Use the Winter fragment to reveal this fresco.|8065|28 Jul 2018 2:35:40 PM|2427|2709|89.59|Common|Silver
6144|An awakening|What's on the surface?|8064|28 Jul 2018 2:21:57 PM|2622|2709|96.79|Common|Silver
3318|Out of Time|Finish Episode 2: Out of Time|8063|28 Jul 2018 11:48:55 AM|10489|16847|62.26|Common|Bronze
3318|Lab Master|Take all optional photos in Episode 2: Out of Time|8062|28 Jul 2018 11:29:13 AM|7934|16847|47.09|Uncommon|Bronze
3318|Resolution Revolution|Take optional photo #10 in Episode 2: Out of Time|8061|28 Jul 2018 11:28:57 AM|9920|16847|58.88|Common|Bronze
3318|Meter Made|Take optional photo #9 in Episode 2: Out of Time|8060|28 Jul 2018 11:25:44 AM|8954|16847|53.15|Common|Bronze
3318|Colorized|Take optional photo #8 in Episode 2: Out of Time|8059|28 Jul 2018 11:01:53 AM|9082|16847|53.91|Common|Bronze
3318|Dynamic Range|Take optional photo #7 in Episode 2: Out of Time|8058|28 Jul 2018 10:51:16 AM|10420|16847|61.85|Common|Bronze
3318|Pixelated|Take optional photo #6 in Episode 2: Out of Time|8057|24 Jul 2018 1:36:21 PM|8594|16847|51.01|Common|Bronze
3318|Compressed|Take optional photo #5 in Episode 2: Out of Time|8056|24 Jul 2018 1:18:55 PM|9718|16847|57.68|Common|Bronze
3318|Image Stabilizer|Take optional photo #4 in Episode 2: Out of Time|8055|24 Jul 2018 1:18:17 PM|8953|16847|53.14|Common|Bronze
3318|Processor|Take optional photo #3 in Episode 2: Out of Time|8054|24 Jul 2018 1:17:48 PM|8449|16847|50.15|Common|Bronze
3318|Full Exposure|Take optional photo #2 in Episode 2: Out of Time|8053|24 Jul 2018 12:28:36 PM|9129|16847|54.19|Common|Bronze
3318|Field Of View|Take optional photo #1 in Episode 2: Out of Time|8052|24 Jul 2018 11:50:17 AM|10251|16847|60.85|Common|Bronze
6490|Ye've Done It|“This day, you reach the end of a story,” she continues, “and the last of its paths.”|8051|23 Jul 2018 9:56:55 PM|2671|3192|83.68|Common|Platinum
6490|Foiled by the Tree|The jaws snap shut over the shattered tree, launching the men out into the deepening darkness.|8050|23 Jul 2018 9:56:55 PM|2702|3192|84.65|Common|Silver
6490|Poor Beastie|With a piercing screech, the creature disappears back into the depths.|8049|23 Jul 2018 9:48:26 PM|2706|3192|84.77|Common|Silver
6490|QUITE GOOD AT THROWING|“Great idea!” cuts in Steady Beard. “How about a demonstration?”|8048|23 Jul 2018 9:46:44 PM|2719|3192|85.18|Common|Silver
6490|She's a Goner|Clinging to wooden barrels, they watch their beloved ship sink into the depths.|8047|23 Jul 2018 9:38:36 PM|2722|3192|85.28|Common|Silver
6490|Womenfolk in the Water|Finding the dark water empty, the men quickly regret their course of action.|8046|23 Jul 2018 9:18:04 PM|2767|3192|86.69|Common|Silver
6490|QUITE GOOD AT FLOWERS|“Quick, while we’ve a chance!” whispers Hasty Beard, leading the way to the boat.|8045|23 Jul 2018 9:16:25 PM|2796|3192|87.59|Common|Silver
6490|The Path of Waiting|“Time flows quickly in contemplation of the Great One’s splendor.”|8044|23 Jul 2018 9:12:54 PM|2834|3192|88.78|Common|Bronze
6490|Nice Day|Surfacing, they find themselves men once more, who, for the moment, splash about like happy children under the moonlit sky.|8043|23 Jul 2018 8:58:22 PM|2684|3192|84.09|Common|Gold
6490|In Need of Assistance|Heedless of the warning, the burly seals spread out as they swim, until the spell around them weakens and they become human once more.|8042|23 Jul 2018 8:45:29 PM|2753|3192|86.25|Common|Silver
6490|Vengeance Satisfied|The creature drags the struggling men deeper beneath the waves, finally tossing them aside in disgust.|8041|23 Jul 2018 8:43:50 PM|2760|3192|86.47|Common|Silver
6490|Begone!|The men push off, paddling the raft beyond the island and into the night.|8040|23 Jul 2018 8:37:20 PM|2694|3192|84.4|Common|Gold
6490|Thus is Thy Fate Sealed|With a rumble, the island sinks slowly into the sea, carrying all hands with it.|8039|23 Jul 2018 8:28:57 PM|2716|3192|85.09|Common|Gold
6490|A Bargain to Make|“Right, then. Let’s be off!” commands Brave Beard, striking a leaderly pose.|8038|23 Jul 2018 8:27:33 PM|2723|3192|85.31|Common|Gold
6490|Fountain of the Faithless|“Give me water, and I’ll teach it to carry me!”|8037|23 Jul 2018 8:25:29 PM|2812|3192|88.1|Common|Bronze
6490|Into the Deepening Darkness|The men paddle furiously, but the widening vortex is inescapable.|8036|23 Jul 2018 8:17:53 PM|2738|3192|85.78|Common|Silver
6490|Out of the Deepening Darkness|Collapsing, the maelstrom tosses the men in their barrels toward the surface.|8035|23 Jul 2018 6:22:15 PM|2783|3192|87.19|Common|Silver
6490|The Long Way|“Really very sorry for scuttling your promotion and all that,” offers Steady Beard.|8034|23 Jul 2018 6:20:58 PM|2823|3192|88.44|Common|Silver
6490|Well Met…|“Er, hullo,” stammers Brave Beard.|8033|23 Jul 2018 6:14:39 PM|2829|3192|88.63|Common|Gold
6490|The Back Door|Following the glow of moonlight, the men step out eagerly into the night.|8032|23 Jul 2018 6:12:16 PM|2738|3192|85.78|Common|Silver
6490|…Bearded Travelers|The absurdity of underwater speech only adds to the wonder apparent on his face.|8031|23 Jul 2018 6:00:58 PM|2873|3192|90.01|Common|Gold
6490|Getting Your Beards Wet|The orbs lead on, out through the cavern’s deep tunnels and beyond the island.|8030|23 Jul 2018 5:58:56 PM|2748|3192|86.09|Common|Silver
6490|Complimentary Trip to the Afterlife|“Shouldn’t you be a bit more chipper, having won and all?” prods Steady Beard.|8029|23 Jul 2018 5:56:34 PM|2777|3192|87.0|Common|Silver
6490|Wooden Trousers|“Aye, they’ll float,” nods Steady Beard.|8028|23 Jul 2018 5:54:30 PM|2872|3192|89.97|Common|Bronze
6490|Great Barnacled One|It’s dark inside the whale, but the men appear to be intact.|8027|23 Jul 2018 5:52:44 PM|2992|3192|93.73|Common|Bronze
4129|Home|Complete the main game, epilogue, and all extras.|8026|23 Jul 2018 5:27:45 PM|1121|1585|70.73|Common|Gold
4129|70 out of 100|Looked through Kelly's photography final.|8025|23 Jul 2018 5:23:51 PM|1211|1585|76.4|Common|Bronze
4129|Until Next Time|Completed the epilogue.|8024|23 Jul 2018 5:20:58 PM|1302|1585|82.15|Common|Gold
4129|By Benji|Read through all of Ben's stories.|8023|23 Jul 2018 4:51:54 PM|1207|1585|76.15|Common|Bronze
4129|Wrong Bus|Got on the wrong bus.|8022|23 Jul 2018 4:47:16 PM|1219|1585|76.91|Common|Silver
4129|Canon|How it really happened: never called Mom.|8021|23 Jul 2018 4:35:30 PM|1201|1585|75.77|Common|Bronze
4129|We'll All Sit Down and Have a Talk|Completed the main story.|8020|23 Jul 2018 4:32:01 PM|1457|1585|91.92|Common|Silver
2576|World's Best Dad|Beat the game.|8019|23 Jul 2018 3:50:17 PM|8523|15685|54.34|Common|Bronze
2576|Independent Woman|Scarlet plugs the cafeteria fountain spouts without your help.|8018|23 Jul 2018 3:48:40 PM|2651|15685|16.9|Rare|Bronze
2576|Stay True to Yourself|Sneak to the cafeteria without the use of a disguise.|8017|23 Jul 2018 3:43:11 PM|2503|15685|15.96|Rare|Bronze
2576|Poor Workplace Etiquette|Go the extra mile in ruining the break room (and Joe's reputation).|8016|23 Jul 2018 3:40:06 PM|2631|15685|16.77|Rare|Bronze
2576|Au Naturel|Nothing left to hide.|8015|23 Jul 2018 3:26:31 PM|9292|15685|59.24|Common|Bronze
2576|Oh Captain, My Captain|Visit with several of your crewmen while dressed as the captain.|8014|23 Jul 2018 3:17:33 PM|2584|15685|16.47|Rare|Bronze
2576|Band of Blubbers|Rescue five of your brethren from an awful fate.|8013|23 Jul 2018 3:10:33 PM|3077|15685|19.62|Rare|Bronze
2576|Stairs with Attitude|Climb the escalators in less than 30 seconds.|8012|23 Jul 2018 3:07:08 PM|4773|15685|30.43|Uncommon|Bronze
2576|Secrets of the Deep|Reveal the pride of the aquarium's jellyfish collection.|8011|23 Jul 2018 3:04:43 PM|4382|15685|27.94|Uncommon|Bronze
2576|Dancing in the Dark|Complete the Deep Sea dance challenge without missing a step.|8010|23 Jul 2018 3:02:52 PM|3403|15685|21.7|Uncommon|Bronze
2576|Head Otter|Wear the sea otter head.|8009|23 Jul 2018 2:48:28 PM|3221|15685|20.54|Uncommon|Bronze
2576|Dunk Tank|Come on and slam and welcome to the Amazon.|8008|23 Jul 2018 2:41:11 PM|2826|15685|18.02|Rare|Bronze
2576|No Cutsies|We have rules for a reason.|8007|23 Jul 2018 2:28:02 PM|8237|15685|52.52|Common|Bronze
2576|Trim Your Moustache|Get sucked into the riding mower.|8006|23 Jul 2018 2:20:00 PM|3394|15685|21.64|Uncommon|Bronze
2576|The Secret Gardener|Orange no-thumbs are the new green thumbs.|8005|23 Jul 2018 2:14:36 PM|2847|15685|18.15|Rare|Bronze
2576|Trickshot-gun wedding|Throw the ring onto Scarlet's finger from a distance.|8004|23 Jul 2018 2:06:12 PM|4336|15685|27.64|Uncommon|Bronze
2576|Person-al Shopper|Help all of the shoppers fill their carts.|8003|23 Jul 2018 1:53:51 PM|3332|15685|21.24|Uncommon|Bronze
2576|Secret Shopper|Get the Sports Johnson cereal before the lady puts it in her cart.|8002|23 Jul 2018 1:52:33 PM|3549|15685|22.63|Uncommon|Bronze
2576|Smokey the Dad|Only you can prevent kitchen fires.|8001|23 Jul 2018 1:42:45 PM|3677|15685|23.44|Uncommon|Bronze
2576|The Best Man|Get married with the best man on the altar.|8000|23 Jul 2018 1:38:51 PM|3798|15685|24.21|Uncommon|Bronze
3318|Chrysalis|Finish Episode 1: Chrysalis|7999|22 Jul 2018 3:58:53 PM|13369|16847|79.36|Common|Bronze
3318|Visionary|Take all optional photos in Episode 1: Chrysalis|7998|22 Jul 2018 3:45:37 PM|9119|16847|54.13|Common|Bronze
3318|Light Leak|Take optional photo #10 in Episode 1: Chrysalis|7997|22 Jul 2018 3:45:27 PM|10776|16847|63.96|Common|Bronze
3318|Maximum Aperture|Take optional photo #9 in Episode 1: Chrysalis|7996|22 Jul 2018 3:44:55 PM|9935|16847|58.97|Common|Bronze
3318|Focal Pointed|Take optional photo #8 in Episode 1: Chrysalis|7995|22 Jul 2018 3:18:32 PM|10284|16847|61.04|Common|Bronze
3318|Zoomed In|Take optional photo #7 in Episode 1: Chrysalis|7994|22 Jul 2018 3:15:45 PM|10203|16847|60.56|Common|Bronze
3318|Focused|Take optional photo #6 in Episode 1: Chrysalis|7993|22 Jul 2018 3:12:40 PM|10771|16847|63.93|Common|Bronze
3318|Red Eye|Take optional photo #5 in Episode 1: Chrysalis|7992|22 Jul 2018 3:09:54 PM|12874|16847|76.42|Common|Bronze
3318|Close-Ups|Take optional photo #4 in Episode 1: Chrysalis|7991|22 Jul 2018 3:01:38 PM|10035|16847|59.57|Common|Bronze
3318|Telephotogenic|Take optional photo #3 in Episode 1: Chrysalis|7990|22 Jul 2018 2:57:08 PM|11154|16847|66.21|Common|Bronze
3318|Wide Angles|Take optional photo #2 in Episode 1: Chrysalis|7989|22 Jul 2018 2:55:26 PM|10220|16847|60.66|Common|Bronze
3318|Macro Eyes|Take optional photo #1 in Episode 1: Chrysalis|7988|22 Jul 2018 2:39:06 PM|14146|16847|83.97|Common|Bronze
3891|The End|They’re not us!|7987|22 Jul 2018 12:22:31 PM|6448|14285|45.14|Uncommon|Silver
3891|Your Expressway to the Stars|Reached the Omega Space Gun|7986|22 Jul 2018 12:03:19 PM|6475|14285|45.33|Uncommon|Silver
3891|Endangered Species|Met the last person left alive|7985|22 Jul 2018 11:45:57 AM|6479|14285|45.36|Uncommon|Silver
3891|A New You|Changed body at Omicron|7984|22 Jul 2018 11:00:29 AM|6683|14285|46.78|Uncommon|Silver
3891|Killed the Dream I Dreamed|Escaped Theta|7983|22 Jul 2018 10:07:50 AM|6913|14285|48.39|Uncommon|Silver
3891|Plan B|Failed at acquiring the DUNBAT|7982|22 Jul 2018 9:24:47 AM|7484|14285|52.39|Common|Silver
3891|The DUNBAT|Discovered Theta|7981|22 Jul 2018 8:32:59 AM|7981|14285|55.87|Common|Silver
3891|Stranded|Crash-landed on peak Delta|7980|22 Jul 2018 7:58:58 AM|8490|14285|59.43|Common|Silver
7364|Find all events|Awarded when you find all 15 events on Big Surf Island|7979|21 Jul 2018 4:03:25 PM|3821|5768|46.62|Uncommon|Bronze
7364|Shutdown the Carson Inferno Van|Awarded when you "Shutdown" the Carson Inferno Van.|7978|21 Jul 2018 4:02:54 PM|5447|11647|46.77|Uncommon|Bronze
3891|Chasing Catherine|Discovered Lambda|7977|21 Jul 2018 11:25:21 AM|9765|14285|68.36|Common|Silver
3891|Answering the Call|Talked to Catherine Chun|7976|21 Jul 2018 10:50:19 AM|11928|14285|83.5|Common|Bronze
6579|Heartbreaker|Collect 20 health pickups|7975|15 Jul 2018 7:52:00 PM|404|591|68.36|Common|Bronze
6579|The Lucky Lizard|Survive 3 burns from the lava in a single game|7974|15 Jul 2018 5:15:50 PM|443|591|74.96|Common|Silver
6579|King Of The Swingers|Achieve a score of 30,000|7973|15 Jul 2018 5:12:55 PM|388|591|65.65|Common|Gold
6579|Licky: Le Professionnel|Achieve a score of 15,000|7972|15 Jul 2018 5:11:43 PM|414|591|70.05|Common|Silver
6579|Amphibian|Release 10 floods|7971|15 Jul 2018 5:10:45 PM|425|591|71.91|Common|Bronze
6579|Getting Into The Swing Of Things|Achieve a score of 5000 in a single combo|7970|15 Jul 2018 5:10:09 PM|417|591|70.56|Common|Silver
6579|DIY|Grapple to 60 platforms using the manual aim|7969|15 Jul 2018 5:04:37 PM|449|591|75.97|Common|Bronze
6579|He Lives... Again|Die 10 times|7968|15 Jul 2018 5:00:55 PM|519|591|87.82|Common|Bronze
6579|Adrenaline Junkie|Gain 15 boosts from geysers|7967|15 Jul 2018 4:59:41 PM|460|591|77.83|Common|Bronze
6579|Just Getting Started|Achieve a score of 5,000|7966|15 Jul 2018 4:57:13 PM|482|591|81.56|Common|Bronze
6579|Licky Lizard: Destroyer Of Worlds|Destroy 80 platforms or boulders|7965|15 Jul 2018 4:55:07 PM|474|591|80.2|Common|Bronze
6579|I'll Take Ten!|Get x10 multiplier|7964|15 Jul 2018 4:53:43 PM|519|591|87.82|Common|Bronze
6579|Learned Lizard|Complete the tutorial|7963|15 Jul 2018 4:49:08 PM|540|591|91.37|Common|Bronze
7160|Platinum Midnight|Unlock all the trophies.|7962|15 Jul 2018 4:12:49 PM|2283|2337|97.69|Common|Platinum
7160|Expert|Complete 40 levels.|7961|15 Jul 2018 4:12:49 PM|2288|2337|97.9|Common|Gold
7160|Stunned|Die by a laser.|7960|15 Jul 2018 3:59:42 PM|2289|2337|97.95|Common|Gold
7160|Professional|Complete 20 levels.|7959|15 Jul 2018 3:44:45 PM|2304|2337|98.59|Common|Gold
4370|Farewell|Completed Episode 3|7958|15 Jul 2018 3:35:26 PM|2521|2973|84.8|Common|Bronze
4370|Hell Hath No Fury|Completed Chapter 6 of Episode 3|7957|15 Jul 2018 3:29:40 PM|2522|2973|84.83|Common|Bronze
4370|A Storm is Brewing|Completed Chapter 5 of Episode 3|7956|15 Jul 2018 3:16:12 PM|2531|2973|85.13|Common|Bronze
4370|Dark Sacrifice|Completed Chapter 4 of Episode 3|7955|15 Jul 2018 3:10:20 PM|2532|2973|85.17|Common|Bronze
4370|Charred Memory|Completed Chapter 3 of Episode 3|7954|15 Jul 2018 2:45:20 PM|2532|2973|85.17|Common|Bronze
4370|Unexpected Guests|Completed Chapter 2 of Episode 3|7953|15 Jul 2018 12:21:17 PM|2541|2973|85.47|Common|Bronze
4370|Fun on the Shore|Completed Chapter 1 of Episode 3|7952|15 Jul 2018 12:17:15 PM|2542|2973|85.5|Common|Bronze
4370|Bad Signal|Completed Episode 2|7951|15 Jul 2018 12:08:10 PM|2585|2973|86.95|Common|Bronze
4370|Quiet Time|Completed Chapter 6 of Episode 2|7950|15 Jul 2018 11:57:45 AM|2586|2973|86.98|Common|Bronze
4370|Party Crashers|Completed Chapter 5 of Episode 2|7949|15 Jul 2018 11:47:11 AM|2593|2973|87.22|Common|Bronze
4370|Distant Memories|Completed Chapter 4 of Episode 2|7948|15 Jul 2018 11:40:00 AM|2597|2973|87.35|Common|Bronze
4370|Emergency Room|Completed Chapter 3 of Episode 2|7947|15 Jul 2018 11:26:50 AM|2605|2973|87.62|Common|Bronze
4370|Herd Mentality|Completed Chapter 2 of Episode 2|7946|15 Jul 2018 11:22:35 AM|2607|2973|87.69|Common|Bronze
4370|Burning Bridges|Completed Chapter 1 of Episode 2|7945|15 Jul 2018 11:15:30 AM|2614|2973|87.92|Common|Bronze
4370|Landfall|You completed Episode 1|7944|15 Jul 2018 10:53:50 AM|2731|2973|91.86|Common|Bronze
4370|Lies|Completed Chapter 6 of Episode 1|7943|15 Jul 2018 10:46:25 AM|2734|2973|91.96|Common|Bronze
7160|Not squared anymore|Die by a saw.|7942|15 Jul 2018 1:26:32 AM|2314|2337|99.02|Common|Gold
7160|Improving|Complete 10 levels.|7941|15 Jul 2018 1:23:54 AM|2316|2337|99.1|Common|Gold
7160|Stabbed|Die by a spike.|7940|15 Jul 2018 1:21:57 AM|2321|2337|99.32|Common|Gold
7160|Engineer|Pull a lever.|7939|15 Jul 2018 1:21:39 AM|2325|2337|99.49|Common|Gold
7160|Starter|Complete 5 levels.|7938|15 Jul 2018 1:20:55 AM|2326|2337|99.53|Common|Gold
7160|You made it|Complete level 4 making Midnight's friend smile.|7937|15 Jul 2018 1:20:20 AM|2309|2337|98.8|Common|Gold
7160|Making friends|Bump into one of Midnight's friends.|7936|15 Jul 2018 1:20:18 AM|2327|2337|99.57|Common|Silver
7160|Went to explore|Die by getting out of a level.|7935|15 Jul 2018 1:20:13 AM|2327|2337|99.57|Common|Gold
7160|Not overworking|Get 3 stars in one level.|7934|15 Jul 2018 1:17:37 AM|2330|2337|99.7|Common|Gold
7160|Go into the light|Complete level 1.|7933|15 Jul 2018 1:17:34 AM|2331|2337|99.74|Common|Silver
5672|The Crown Jewels|Complete Her Majesty's SPIFFING: The Empire Staggers Back|7932|15 Jul 2018 12:54:27 AM|4101|4460|91.95|Common|Platinum
5672|That's all we could afford|Complete Her Majesty's SPIFFING: The Empire Staggers Back|7931|15 Jul 2018 12:54:27 AM|4170|4460|93.5|Common|Gold
5672|Bubbles!|Place washing liquid inside washing machine before it's activated|7930|15 Jul 2018 12:50:44 AM|4123|4460|92.44|Common|Gold
5672|Cheese sir, I want some more|Acquire a second block of cheese|7929|15 Jul 2018 12:47:56 AM|4136|4460|92.74|Common|Bronze
5672|Nailed It|Fail to catch a frog even when they are asleep|7928|15 Jul 2018 12:44:15 AM|4155|4460|93.16|Common|Bronze
5672|Lullabies to paralyze|Soothe a group of frogs to sleep|7927|15 Jul 2018 12:43:19 AM|4186|4460|93.86|Common|Silver
5672|Master of Unlocking Trophies|Save game progress using the typewriter|7926|15 Jul 2018 12:41:43 AM|4217|4460|94.55|Common|Gold
5672|Cringer|Summon the Power of Greyskull to distract Antoine and Pierre|7925|15 Jul 2018 12:36:24 AM|4201|4460|94.19|Common|Bronze
5672|Damn you all!|Maybe it was earth all along?|7924|15 Jul 2018 12:34:54 AM|4163|4460|93.34|Common|Silver
5672|+1 Geology|Examine all the rocks on the planet surface|7923|15 Jul 2018 12:34:33 AM|4150|4460|93.05|Common|Gold
5672|Premium Engineering|Locate the French camp while driving the Beagle Two Too|7922|15 Jul 2018 12:30:47 AM|4147|4460|92.98|Common|Silver
5672|She's behind you!|Find a replacement motor, when asked|7921|15 Jul 2018 12:23:12 AM|4159|4460|93.25|Common|Silver
5672|While simultaneously no earned|Observe Schrödinger's cat both alive and dead|7920|15 Jul 2018 12:18:56 AM|4158|4460|93.23|Common|Bronze
5672|Cardio, bruh|Break a sweat when using the treadmill|7919|15 Jul 2018 12:15:45 AM|4156|4460|93.18|Common|Silver
5672|What a thrill|Use the ladder like a boss|7918|15 Jul 2018 12:14:25 AM|4233|4460|94.91|Common|Bronze
5672|I can't believe you've done this!|Wake up Sub Lieutenant Jones|7917|15 Jul 2018 12:11:45 AM|4244|4460|95.16|Common|Bronze
5672|One can never be too careful|Ensure no one can erase the driver|7916|15 Jul 2018 12:10:47 AM|4154|4460|93.14|Common|Gold
5672|Leg breaker|Crush a table top football player|7915|15 Jul 2018 12:07:06 AM|4278|4460|95.92|Common|Bronze
5672|Call Autoglass!|Crash into ejected fuel cell when at the controls of the HMSS Imperialise|7914|15 Jul 2018 12:03:52 AM|4150|4460|93.05|Common|Gold
5672|Sharing is caring|Give Sub Lieutenant Jones English's tea|7913|15 Jul 2018 12:01:24 AM|4205|4460|94.28|Common|Silver
5672|Inconceivable|Attempt to mix washing up liquid and tea|7912|14 Jul 2018 11:59:14 PM|4184|4460|93.81|Common|Bronze
5672|Bring me my detonators!|Talk to G.E.R.T.E.A. about British villains|7911|14 Jul 2018 11:57:21 PM|4226|4460|94.75|Common|Silver
5672|The Gravity Simulation Switch|Examine the Gravity Simulation Switch|7910|14 Jul 2018 11:55:00 PM|4306|4460|96.55|Common|Bronze
5672|Don't show me this tip again|Locate the paperclip|7909|14 Jul 2018 11:54:19 PM|4302|4460|96.46|Common|Silver
5672|One Small Step...|Commence your mission on board the HMSS Imperialise!|7908|14 Jul 2018 11:53:14 PM|4406|4460|98.79|Common|Bronze
5672|Every Breath You Take|Look intently at Sub Lieutenant Jones|7907|14 Jul 2018 11:53:06 PM|4228|4460|94.8|Common|Silver
7364|Visit the Quarry|Awarded for visiting the Quarry in White Mountain.|7906|14 Jul 2018 9:49:11 PM|7736|11647|66.42|Common|Bronze
7364|24 hours in Paradise on a bike|Awarded for spending a full 24 hour day and night cycle riding a bike.|7905|14 Jul 2018 9:39:36 PM|3138|5571|38.96|Uncommon|Bronze
7364|Ride 50 Miles Offline on a bike|Awarded when you reach a total bike distance ridden of 50 miles.|7904|14 Jul 2018 9:35:42 PM|3551|5571|44.08|Uncommon|Bronze
7364|Ride 10 miles on a bike in an 8 player lobby|Awarded for riding 10 miles on a bike in an 8 player online game.|7903|14 Jul 2018 9:34:48 PM|2130|5571|26.44|Uncommon|Bronze
7364|8 Players meet in the Wildcats' Baseball Stadium|Awarded for meeting up with 7 other players inside the Wildcats' Baseball Stadium in an online game.|7902|14 Jul 2018 9:32:38 PM|4861|11647|41.74|Uncommon|Bronze
4370|Community|Completed Chapter 5 of Episode 1|7901|13 Jul 2018 10:53:20 PM|2743|2973|92.26|Common|Bronze
4370|Stolen Goods|Completed Chapter 4 of Episode 1|7900|13 Jul 2018 10:46:42 PM|2748|2973|92.43|Common|Bronze
4370|Dead in the Water|Completed Chapter 3 of Episode 1|7899|13 Jul 2018 10:34:35 PM|2765|2973|93.0|Common|Bronze
4370|Companionship|Completed Chapter 2 of Episode 1|7898|13 Jul 2018 10:28:36 PM|2781|2973|93.54|Common|Bronze
7364|Complete your first Island Tour|Awarded when you successfully complete your first Island tour|7897|13 Jul 2018 9:58:29 PM|3330|5768|40.63|Uncommon|Bronze
7364|4.5 seconds of Crash TV Air Time|Successfully land the Island Mega jump from the Crash TV Ski Jump and get at least 4.5 seconds of Air Time|7896|13 Jul 2018 9:43:41 PM|3668|5768|44.75|Uncommon|Bronze
7364|Drive through 20 Island Smash gates|Awarded when you drive through your 20th set of Orange Island Smash Gates|7895|13 Jul 2018 9:31:36 PM|5264|5768|64.22|Common|Bronze
7364|Earn your 'A' Class License|Awarded when you receive your 'A' Class License|7894|12 Jul 2018 10:02:50 PM|5938|11647|50.98|Common|Silver
7364|Smash 60 Burnout Billboards|Awarded when you smash through your 60th pristine Burnout Billboard|7893|12 Jul 2018 9:37:31 PM|5736|11647|49.25|Uncommon|Gold
4370|Remember Me|Completed Chapter 1 of Episode 1|7892|11 Jul 2018 7:07:21 PM|2823|2973|94.95|Common|Bronze
7364|Earn your 'B' Class License|Awarded when you receive your 'B' Class License|7891|9 Jul 2018 6:18:50 PM|7653|11647|65.71|Common|Silver
7364|Complete all 10 Island freeburn Challenges|Awarded when you successfully complete all 10 Island Freeburn Challenges. These can be completed by 2 -8 players|7890|8 Jul 2018 11:46:44 PM|1963|5768|23.95|Uncommon|Bronze
7364|Smash 15 Island billboards|Awarded when you smash through your 15th pristine Island billboard|7889|8 Jul 2018 11:45:41 PM|4189|5768|51.11|Common|Bronze
7364|Complete a 750yd drift inside the Inspiral Car Park|Awarded when you complete a continuous 750yd drift inside the Inspiral car Park|7888|8 Jul 2018 11:45:07 PM|3108|5768|37.92|Uncommon|Bronze
7364|Land 5 Island Mega Jumps|Awarded when you successfully land your 5th Island Mega Jump|7887|8 Jul 2018 11:36:39 PM|4797|5768|58.53|Common|Bronze
7364|Jump through Deese's Donut|Successfully land the Island Mega Jump through Deese's Donut|7886|8 Jul 2018 11:25:24 PM|3780|5768|46.12|Uncommon|Bronze
7364|Complete any Bike Day Road Rule|Awarded when you set your 1st bike Day Road Rule.|7885|8 Jul 2018 11:20:26 PM|5285|5571|65.61|Common|Bronze
7364|Complete 5 Bike Challenges|Awarded when you complete your 5th Freeburn Challenge on a bike.|7884|8 Jul 2018 11:17:28 PM|2245|5571|27.87|Uncommon|Bronze
7364|Complete a Bike Timed Challenge using the Toy Bike|Awarded when you complete any Timed Challenge using the Toy Bike|7883|8 Jul 2018 11:07:10 PM|2001|4370|28.05|Uncommon|Bronze
7364|Complete any Bike Night Road Rule|Awarded when you set your 1st bike Night Road Rule.|7882|8 Jul 2018 11:02:29 PM|3890|5571|48.29|Uncommon|Bronze
7364|Set 10 Time Road Rules|Awarded when you set your 10th Time Road Rule.|7881|8 Jul 2018 10:50:23 PM|5866|11647|50.36|Common|Bronze
7364|Survive a Marked Man in the Extreme Hot Rod|Awarded for winning any Offline Marked Man driving the Extreme Hot Rod|7880|8 Jul 2018 10:49:12 PM|3167|3398|50.34|Common|Bronze
7364|Score a Burnout Chain of x4|Awarded for achieving your first Boost Chain of x4.|7879|8 Jul 2018 10:43:10 PM|7100|11647|60.96|Common|Silver
7364|Score a Boost Chain of x3 in the GT Nighthawk|Awarded for achieving a Boost Chain of x3 driving the GT Nighthawk|7878|8 Jul 2018 10:43:02 PM|4670|5516|58.26|Common|Bronze
7364|Score a Burnout Chain of x2|Awarded for achieving your first Boost Chain of x2.|7877|8 Jul 2018 10:42:54 PM|8495|11647|72.94|Common|Bronze
7364|Set a Showtime Road Rule on any road|Awarded for beating any of the original Showtime Road Rule scores|7876|8 Jul 2018 11:13:49 AM|6619|11647|56.83|Common|Bronze
7364|Score a x5 Multiplier in Showtime|Awarded for reaching a x5 Multiplier in Showtime|7875|8 Jul 2018 11:12:08 AM|6307|11647|54.15|Common|Silver
7364|Score a x3 Multiplier in Showtime|Awarded for reaching a x3 Multiplier in Showtime|7874|8 Jul 2018 11:11:55 AM|6667|11647|57.24|Common|Bronze
