7364|Sound the horn on a Silver Lake Super Jump in the Cavalry Bootlegger|Awarded for sounding the horn and successfully landing a Super Jump in Silver Lake driving the Cavalry Bootlegger|7873|8 Jul 2018 11:04:50 AM|2760|5516|34.43|Uncommon|Bronze
7364|Win a Stunt Run in the P12 88 Special|Awarded for winning any Offline Stunt Run driving the P12 88 Special|7872|8 Jul 2018 10:55:13 AM|3884|5516|48.46|Uncommon|Bronze
7364|Score over 50,000 in a Stunt Run|Awarded for scoring over 50,000 in any Offline Stunt Run.|7871|8 Jul 2018 10:38:36 AM|8833|11647|75.84|Common|Silver
7364|Beat the target score in Stunt Run|Awarded for winning any Offline Stunt Run.|7870|8 Jul 2018 10:38:35 AM|9683|11647|83.14|Common|Bronze
7364|Earn your 'C' Class License|Awarded when you receive your 'C' Class License|7869|8 Jul 2018 10:30:05 AM|9355|11647|80.32|Common|Silver
7364|Win a Race in a Toy Car|Awarded for winning any Offline Race driving any of the Toy Cars|7868|8 Jul 2018 10:27:57 AM|3978|4370|55.76|Common|Bronze
7364|Every player succeeds in every Party Game|Awarded upon completing a Party in which every player successfully completes every Game of every Round.|7867|8 Jul 2018 1:10:19 AM|2420|2797|42.4|Uncommon|Bronze
7364|Complete a Small Party|Awarded when 2-4 players have completed a Party.|7866|8 Jul 2018 1:10:19 AM|2653|2797|46.48|Uncommon|Bronze
7364|Every player succeeds in a Party Round|Awarded when every player successfully completes a Party Round.|7865|8 Jul 2018 1:10:17 AM|2714|2797|47.55|Uncommon|Bronze
7364|Complete your 1st Party Round|Awarded when you complete the 1st Round of your 1st Party.|7864|8 Jul 2018 1:10:17 AM|2797|2797|49.0|Uncommon|Bronze
7364|Complete a Timed Challenge using all 3 Boost types in the Hawker Mech|Awarded when you complete any Timed Challenge driving the Hawker Mech having used all 3 boost types|7863|8 Jul 2018 1:04:13 AM|2061|3398|32.76|Uncommon|Bronze
7364|Light up the Manhattan Spirit during an Online Challenge|Awarded for using the flashing lights of the Manhattan Spirit during an Online Freeburn Challenge or Timed Challenge|7862|8 Jul 2018 12:59:18 AM|2608|5516|32.54|Uncommon|Bronze
7364|Win a game on the Robbers team|Awarded for being on the winning Robbers team in an Online Cops and Robbers game.|7861|8 Jul 2018 12:54:25 AM|2053|2952|35.01|Uncommon|Bronze
7364|Win a game driving the Watson R-Turbo Roadster|Awarded for being on the winning team of an Online Cops and Robbers game driving the Watson R-Turbo Roadster.|7860|8 Jul 2018 12:51:23 AM|1805|2952|30.78|Uncommon|Bronze
7364|Win a best of five rounds game|Awarded for being on the winning team of a best of five round game of Online Cops and Robbers.|7859|8 Jul 2018 12:51:22 AM|1756|2952|29.95|Uncommon|Bronze
7364|Win a game on the Cops team|Awarded for being on the winning Cops team in an Online Cops and Robbers game.|7858|8 Jul 2018 12:51:21 AM|2169|2952|36.99|Uncommon|Bronze
7364|Bank the Gold|Awarded for successfully delivering the Gold to your team base in an Online Cops and Robbers game.|7857|8 Jul 2018 12:47:24 AM|2312|2952|39.43|Uncommon|Bronze
7364|Pick up dropped Gold|Awarded for successfully picking up the Gold once it has been dropped in an Online Cops and Robbers game.|7856|8 Jul 2018 12:42:56 AM|2298|2952|39.19|Uncommon|Bronze
7364|Takedown the Gold carrier|Awarded for successfully performing a Takedown on the player carrying the Gold in an Online Cops and Robbers game.|7855|8 Jul 2018 12:42:28 AM|2695|2952|45.96|Uncommon|Bronze
7364|Be the first to reach the Gold|Awarded for being the first player in an Online Cops and Robbers game to pick up the gold.|7854|8 Jul 2018 12:42:10 AM|2430|2952|41.44|Uncommon|Bronze
7364|Complete 10 Timed Challenges|Awarded when you complete your 10th Timed Challenge.|7853|8 Jul 2018 12:37:27 AM|1896|4880|25.15|Uncommon|Bronze
7364|Drive through 200 sets of Yellow Smash Gates|Awarded when you drive through your 200th set of Yellow Smash Gates|7852|8 Jul 2018 12:32:13 AM|7247|11647|62.22|Common|Silver
7364|Barrel Roll a Toy Car in the Airfield|Awarded for successfully landing a Barrel Roll in the Airfield driving any of the Toy Cars|7851|8 Jul 2018 12:08:02 AM|3211|4370|45.01|Uncommon|Bronze
7364|Land a Barrel Roll jump|Awarded for successfully landing a Barrel Roll jump.|7850|7 Jul 2018 11:53:29 PM|9420|11647|80.88|Common|Bronze
7364|Smash 30 Burnout Billboards|Awarded when you smash through your 30th pristine Burnout Billboard|7849|7 Jul 2018 11:50:49 PM|7724|11647|66.32|Common|Silver
7364|Visit the Airfield|Awarded for visiting the Airfield in Silver Lake.|7848|7 Jul 2018 11:38:51 PM|6744|11647|57.9|Common|Bronze
7364|Complete your first Timed Challenge|Awarded when you complete your 1st Timed Challenge.|7847|7 Jul 2018 11:28:36 PM|3711|4880|49.22|Uncommon|Bronze
7364|Complete 10 Freeburn Challenges|Awarded when you complete your 10th Freeburn Challenge.|7846|7 Jul 2018 11:24:47 PM|4990|11647|42.84|Uncommon|Silver
7364|Complete a Freeburn Challenge|Awarded when you complete your 1st Freeburn Challenge.|7845|7 Jul 2018 11:14:37 PM|5758|11647|49.44|Uncommon|Bronze
7364|Jump over another Player's Car|Awarded for jumping over another player's car in an online game.|7844|7 Jul 2018 11:14:22 PM|6059|11647|52.02|Common|Bronze
7364|Be on the Blue team for Online Road Rage|Awarded for taking part in an Online Road Rage as a Runner on the Blue Team.|7843|7 Jul 2018 11:12:17 PM|2665|4880|35.35|Uncommon|Bronze
7364|Be on the Red team for Online Road Rage|Awarded for taking part in an Online Road Rage as a Chaser on the Red Team.|7842|7 Jul 2018 11:11:59 PM|2633|4880|34.92|Uncommon|Bronze
7364|Take part in an Online Marked Man|Awarded for taking part in an Online Marked Man.|7841|7 Jul 2018 11:11:35 PM|3342|4880|44.33|Uncommon|Bronze
7364|Take part in an Online Stunt Run|Awarded for taking part in an Online Stunt Run.|7840|7 Jul 2018 11:11:08 PM|3152|4880|41.81|Uncommon|Bronze
7364|Visit a Paint shop to change your vehicle color|Awarded for driving through any Paint Shop to change your vehicle color.|7839|7 Jul 2018 11:08:11 PM|9167|11647|78.71|Common|Bronze
7364|Perform a 180 degree Flatspin|Awarded for performing a "Flatspin" of at least 180 degrees.|7838|6 Jul 2018 11:23:30 PM|7481|11647|64.23|Common|Bronze
7364|Jump Dead Man's Edge|Awarded when you first jump over Dead Man's Edge in White Mountain.|7837|6 Jul 2018 11:23:15 PM|9075|11647|77.92|Common|Bronze
7364|Successfully land 10 Super Jumps|Awarded when you successfully land your 10th Super Jump.|7836|6 Jul 2018 11:23:14 PM|8937|11647|76.73|Common|Bronze
7364|Drive through a Repair Shop during a Road Rage|Awarded for driving through an Auto Repair during any Offline Road Rage.|7835|6 Jul 2018 11:17:25 PM|7666|11647|65.82|Common|Bronze
7364|Perform 3 Takedowns|Awarded for performing your third Takedowns.|7834|6 Jul 2018 11:16:51 PM|11019|11647|94.61|Common|Bronze
7364|Visit a Gas Station during a Race|Awarded for driving through a Gas Station during any Offline Race.|7833|6 Jul 2018 11:12:32 PM|8275|11647|71.05|Common|Bronze
7364|Power Park your car|Awarded for successfully "Power Parking" your car between two other vehicles.|7832|6 Jul 2018 11:11:42 PM|6173|11647|53.0|Common|Silver
7364|Set a Time Road Rule on any Road|Awarded for beating any of the original Time Road Rule scores|7831|6 Jul 2018 10:48:32 PM|9181|11647|78.83|Common|Bronze
7364|Drive through 50 sets of Yellow Smash Gates|Awarded when you drive through your 50th set of Yellow Smash Gates|7830|6 Jul 2018 10:40:31 PM|10043|11647|86.23|Common|Bronze
7364|Shutdown the Nakamura SI-7|Awarded when you Shutdown the Nakamura SI-7|7829|6 Jul 2018 10:37:25 PM|10274|11647|88.21|Common|Bronze
7364|Survive a Marked Man|Awarded for winning any Offline Marked Man.|7828|6 Jul 2018 10:35:54 PM|9940|11647|85.34|Common|Bronze
7364|Drive through 10 sets of Yellow Smash Gates|Awarded when you drive through your 10th set of Yellow Smash Gates|7827|6 Jul 2018 10:27:47 PM|11044|11647|94.82|Common|Bronze
7364|Earn your 'D' Class License|Awarded when you receive your 'D' Class License|7826|6 Jul 2018 10:26:21 PM|10882|11647|93.43|Common|Silver
7364|Smash 3 Burnout Billboards|Awarded when you smash through your 3rd pristine Burnout Billboard|7825|6 Jul 2018 10:24:51 PM|10935|11647|93.89|Common|Bronze
7364|Win a race|Awarded for winning any Offline Race|7824|6 Jul 2018 10:21:35 PM|10694|11647|91.82|Common|Bronze
7364|Successfully land your first Super Jump|Awarded when you successfully land your 1st Super Jump.|7823|6 Jul 2018 10:21:10 PM|11135|11647|95.6|Common|Bronze
7364|Repair your car|Awarded for driving through any Auto Repair|7822|6 Jul 2018 10:17:56 PM|11474|11647|98.51|Common|Bronze
7364|Drive on the wrong side of the road for 547 yards|Awarded for driving a distance of 547 yards in Oncoming Traffic in one go.|7821|6 Jul 2018 10:17:13 PM|11194|11647|96.11|Common|Bronze
6647|Winter|The two most joyous times of the year are Christmas morning and the end of school.|7820|3 Jul 2018 9:26:20 PM|976|979|99.69|Common|Gold
6647|Autumn|Autumn is a second spring when every leaf is a flower.|7819|3 Jul 2018 9:24:28 PM|977|979|99.8|Common|Gold
6647|Summer|Health is the thing that makes you feel that now is the best time of the year.|7818|3 Jul 2018 9:23:04 PM|977|979|99.8|Common|Gold
6647|Spring|Every year on your birthday, you get a chance to start new.|7817|3 Jul 2018 9:21:32 PM|977|979|99.8|Common|Silver
4172|Untold Stories|Get to the end of the short episode "The Day the Night Slept (After After)".|7816|1 Jul 2018 2:04:33 AM|1527|2044|74.71|Common|Bronze
4172|The King Said|Read all of the King's picture book.|7815|1 Jul 2018 2:03:45 AM|1497|2044|73.24|Common|Silver
4172|Radio Star|Watch all of the Radio episodes.|7814|1 Jul 2018 2:02:38 AM|1549|2044|75.78|Common|Silver
4172|Radio Chick|Watch one of the Radio episodes.|7813|1 Jul 2018 1:58:51 AM|1642|2044|80.33|Common|Bronze
4172|Come to Kyoto|Get to the end of the short episode "Preliminary Inspection".|7812|1 Jul 2018 1:57:50 AM|1515|2044|74.12|Common|Bronze
4172|Black in the Dark|Get to the end of the short episode "Albert's Secret".|7811|1 Jul 2018 1:56:57 AM|1515|2044|74.12|Common|Bronze
4172|Thank You, Mom!|Get to the end of the short episode "Midnight Attack of the Nightmare".|7810|1 Jul 2018 1:55:24 AM|1535|2044|75.1|Common|Bronze
4172|Immature Adult Bird|Get to the end of the short episode "Legumentine's Chronicles".|7809|1 Jul 2018 1:54:57 AM|1552|2044|75.93|Common|Bronze
4172|Happy New Year!|Get to the end of the short episode "Pigeon Shrine Visit".|7808|1 Jul 2018 1:54:10 AM|1495|2044|73.14|Common|Bronze
4172|Live Long with Your Own Sins|Get to the end of the fourth episode.|7807|1 Jul 2018 1:46:30 AM|1529|2044|74.8|Common|Gold
4172|Happy Kingdoms|Get to the end of the third episode.|7806|1 Jul 2018 1:27:14 AM|1559|2044|76.27|Common|Silver
4172|Golden Madness|Get to the end of the second episode.|7805|1 Jul 2018 1:20:10 AM|1580|2044|77.3|Common|Bronze
4172|Merry Christmas!|Get to the end of the first episode.|7804|1 Jul 2018 1:15:11 AM|1688|2044|82.58|Common|Bronze
5548|Shocking Discovery!|Collect all the items (Batteries) on Lockdown|7803|1 Jul 2018 12:44:27 AM|4022|75348|3.46|Ultra Rare|Bronze
5548|Powered by Steam|Collect all the items (Steam Cells) on Airship|7802|1 Jul 2018 12:32:11 AM|4303|75348|3.71|Ultra Rare|Bronze
6987|Done Done Done|For excellent and dedicated field work in the field of battle for completion|7801|1 Jul 2018 12:18:21 AM|5838|10035|58.18|Common|Platinum
6987|Pedal to the Metal|Destroy Metal Kor at Nest|7800|1 Jul 2018 12:18:21 AM|6690|10035|66.67|Common|Gold
6987|Head Master|Collect 510 Metal Head Skull Gems|7799|1 Jul 2018 12:14:38 AM|6483|10035|64.6|Common|Gold
6987|Head Over Heels|Collect 50 Metal Head Skull Gems|7798|1 Jul 2018 12:14:37 AM|7928|10035|79.0|Common|Bronze
6987|Head Cheese|Collect 250 Metal Head Skull Gems|7797|1 Jul 2018 12:14:37 AM|7433|10035|74.07|Common|Silver
6987|The Collectivist|Collect 125 Precursor Orbs|7796|1 Jul 2018 12:14:36 AM|6074|10035|60.53|Common|Silver
6987|The Collectationator!|Collect 286 Precursor Orbs|7795|1 Jul 2018 12:14:36 AM|5878|10035|58.57|Common|Gold
6987|The Collector|Collect 25 Precursor Orbs|7794|1 Jul 2018 12:14:35 AM|7432|10035|74.06|Common|Bronze
6987|Heavy Distortion|Attack the Metal Head Nest|7793|1 Jul 2018 12:14:20 AM|6738|10035|67.14|Common|Bronze
6987|Who Knew Krew Blew?|Beat Krew in Weapons Lab|7792|1 Jul 2018 12:14:19 AM|6766|10035|67.42|Common|Silver
6987|Finders Keepers|Find Sig in Underport|7791|1 Jul 2018 12:14:19 AM|6754|10035|67.3|Common|Bronze
6987|Speed Speedily|Win Class 1 Race in Stadium|7790|1 Jul 2018 12:14:18 AM|6780|10035|67.56|Common|Gold
6987|I Heart Heart|Get Heart of Mar in Weapons Lab|7789|1 Jul 2018 12:14:18 AM|6766|10035|67.42|Common|Bronze
6987|Bot Bot Boom Boom|Protect Hideout from Bomb Bots|7788|1 Jul 2018 12:14:11 AM|6886|10035|68.62|Common|Bronze
6987|Timber!|Destroy Drill Platform Tower|7787|1 Jul 2018 12:14:11 AM|6791|10035|67.67|Common|Bronze
6987|Speed Quicker|Win Class 2 Race at Stadium|7786|1 Jul 2018 12:14:10 AM|6901|10035|68.77|Common|Silver
6987|What's That Smell?|Escort Men Through Sewers|7785|1 Jul 2018 12:14:10 AM|6888|10035|68.64|Common|Bronze
6987|We're All Friends Here|Rescue Friends at Fortress|7784|1 Jul 2018 12:14:09 AM|6941|10035|69.17|Common|Bronze
6987|Grin and Baron It|Defeat Baron in Mar's Tomb|7783|1 Jul 2018 12:14:03 AM|6972|10035|69.48|Common|Silver
6987|No Man is a Canyon|Use Items in No Man's Canyon|7782|1 Jul 2018 12:14:02 AM|7004|10035|69.8|Common|Bronze
6987|Testosterone|Pass the Tests of Manhood|7781|1 Jul 2018 12:14:02 AM|6981|10035|69.57|Common|Silver
6987|Speeding Slowly|Win Class 3 Race at Stadium|7780|1 Jul 2018 12:14:01 AM|7176|10035|71.51|Common|Bronze
6987|Doggin' the Hellcats|Destroy 5 Hellcat Cruisers|7779|1 Jul 2018 12:14:01 AM|7054|10035|70.29|Common|Bronze
6987|Clap Hands|Get Seal Piece at Dig|7778|1 Jul 2018 12:14:00 AM|7119|10035|70.94|Common|Silver
6987|Sunken Ship|Destroy Ship at Drill Platform|7777|1 Jul 2018 12:13:59 AM|7190|10035|71.65|Common|Bronze
6987|Kersplash!|Destroy Equipment at Dig|7776|1 Jul 2018 12:13:58 AM|7294|10035|72.69|Common|Bronze
6987|Strip Mine, Not Yours|Blow up Strip Mine in Eco Wells|7775|1 Jul 2018 12:13:58 AM|7249|10035|72.24|Common|Bronze
6987|Scout's Honor|Catch Scouts in Haven Forest|7774|1 Jul 2018 12:13:56 AM|7442|10035|74.16|Common|Bronze
6987|Cha-ching|Collect Money for Krew|7773|1 Jul 2018 12:13:54 AM|7770|10035|77.43|Common|Bronze
6987|Don't Let Him Get Away|Defeat Baron at Palace|7772|1 Jul 2018 12:13:53 AM|7581|10035|75.55|Common|Silver
6987|Skip the Stairs|Ride Elevator up to Palace|7771|1 Jul 2018 12:13:52 AM|7595|10035|75.69|Common|Bronze
6987|Over Easy|Destroy Eggs at Drill Platform|7770|1 Jul 2018 12:13:51 AM|7800|10035|77.73|Common|Silver
6987|More Power to You|Turn on 5 Power Switches|7769|1 Jul 2018 12:13:51 AM|7626|10035|75.99|Common|Bronze
6987|Just the Artifacts Ma'am|Find 3 Artifacts in Mountain Temple|7768|1 Jul 2018 12:13:50 AM|7602|10035|75.75|Common|Bronze
6987|Lost and Found|Find Pumping Station Patrol|7767|1 Jul 2018 12:13:49 AM|7784|10035|77.57|Common|Silver
6987|Stripped Down|Rescue Vin at Strip Mine|7766|1 Jul 2018 12:13:46 AM|7938|10035|79.1|Common|Bronze
6987|Turrets Syndrome|Destroy Turrets in Sewers|7765|1 Jul 2018 12:13:44 AM|8208|10035|81.79|Common|Bronze
6987|Kaboom!|Blow up Ammo at Fortress|7764|1 Jul 2018 12:13:43 AM|8748|10035|87.17|Common|Bronze
6987|Signature Moves|Protect Sig at Pumping Station|7763|1 Jul 2018 12:13:43 AM|8337|10035|83.08|Common|Bronze
6987|Dead and Gone|Retrieve Banner from Dead Town|7762|1 Jul 2018 12:13:42 AM|9249|10035|92.17|Common|Bronze
6987|Poor Kid|Protect Kor and Kid|7761|1 Jul 2018 12:13:41 AM|9499|10035|94.66|Common|Bronze
7435|Hooah|In it for life.|7760|1 Jul 2018 12:03:15 AM|12967|13157|98.56|Common|Platinum
7435|Sergeant Major|I majored in sargeantology.|7759|1 Jul 2018 12:03:15 AM|12967|13157|98.56|Common|Gold
7435|Master Sergeant|Call me master.|7758|1 Jul 2018 12:03:14 AM|12969|13157|98.57|Common|Gold
7435|Sergeant First Class|Call me sarge.|7757|1 Jul 2018 12:03:13 AM|12970|13157|98.58|Common|Gold
7435|Staff Sergeant|Staffing up.|7756|1 Jul 2018 12:03:12 AM|12973|13157|98.6|Common|Gold
7435|Sergeant|Don't call me sarge.|7755|1 Jul 2018 12:03:11 AM|12977|13157|98.63|Common|Gold
7435|Corporal|Corporal diem.|7754|1 Jul 2018 12:03:10 AM|12979|13157|98.65|Common|Gold
7435|Specialist|Well isn't that special.|7753|1 Jul 2018 12:03:09 AM|12980|13157|98.65|Common|Gold
7435|Private 1st Class|First at bat.|7752|1 Jul 2018 12:03:08 AM|12983|13157|98.68|Common|Gold
7435|Private|Everybody starts somewhere.|7751|1 Jul 2018 12:03:07 AM|12992|13157|98.75|Common|Gold
7435|Private 2nd Class|Second comes first.|7750|1 Jul 2018 12:03:07 AM|12990|13157|98.73|Common|Gold
7435|Deployed|See the world, they said.|7749|1 Jul 2018 12:03:06 AM|12995|13157|98.77|Common|Gold
7435|Boot Camp|Settle in, buttercup.|7748|1 Jul 2018 12:03:04 AM|12997|13157|98.78|Common|Silver
7435|Drafted|We are soldiers now.|7747|1 Jul 2018 12:03:03 AM|13000|13157|98.81|Common|Silver
