5949|Fresh Breath|Eat a mint!|10314|11 Jul 2018 4:55:40 AM|732|809|90.48|Common|Bronze
5949|Pigeon-Tunnel|You put the pigeon through your special windsock-pigeon-tunnel. Although you couldn’t catch it this way… nice try!|10313|11 Jul 2018 4:39:51 AM|743|809|91.84|Common|Bronze
6619|Platinum Robot|Unlock all other trophies|10312|10 Jul 2018 9:33:38 PM|430|582|73.88|Common|Platinum
6619|Gruyère robot|Die on the spikes over 25 times|10311|10 Jul 2018 9:33:38 PM|453|582|77.84|Common|Bronze
6619|Finished!|Finish all the levels|10310|10 Jul 2018 9:12:49 PM|433|582|74.4|Common|Gold
6619|Battery hunter|Collect all batteries across all levels|10309|10 Jul 2018 9:12:47 PM|433|582|74.4|Common|Silver
6619|Always together|Finish all the levels with both robots alive|10308|10 Jul 2018 9:12:45 PM|431|582|74.05|Common|Gold
6619|Call it even|Finish all the even levels with both robots alive|10307|10 Jul 2018 9:12:43 PM|431|582|74.05|Common|Gold
6619|Under pressure|Both robots die smashed together|10306|10 Jul 2018 9:04:40 PM|491|582|84.36|Common|Silver
6619|This is odd|Finish all the odd levels with both robots alive|10305|10 Jul 2018 8:59:19 PM|432|582|74.23|Common|Gold
6619|Two and two makes 22|Finish level 22 with both robots alive|10304|10 Jul 2018 7:28:47 PM|439|582|75.43|Common|Gold
5949|Schnapps-Dealer|Find some alcohol in the garbage and try to palm it off on the garbage dealer.|10303|10 Jul 2018 4:04:47 AM|746|809|92.21|Common|Silver
6844|Slasher|Collect all trophies to unlock the platinum trophy.|10302|10 Jul 2018 1:49:14 AM|783|1256|62.34|Common|Platinum
6844|Blow Out|Unlock the gorepack called Puffed Up.|10301|10 Jul 2018 1:49:14 AM|827|1256|65.84|Common|Silver
6844|Day of the Dead|Unlock the gorepack called Cinco de Slayo.|10300|10 Jul 2018 1:48:57 AM|846|1256|67.36|Common|Silver
6844|Final Destination|Get a score of 25 in Faces of Killed 3.|10299|10 Jul 2018 1:48:39 AM|862|1256|68.63|Common|Silver
6619|I am the one who knocks|Run against a closed door|10298|9 Jul 2018 11:57:35 PM|461|582|79.21|Common|Bronze
6619|The floor is lava|Perform 10 consecutive wall jumps|10297|9 Jul 2018 8:28:25 PM|495|582|85.05|Common|Gold
6619|Acid addict|Die 5 times inside an acid pool|10296|9 Jul 2018 8:19:41 PM|488|582|83.85|Common|Bronze
6619|Two on two|Finish level 2 with both robots alive|10295|9 Jul 2018 7:51:33 PM|553|582|95.02|Common|Silver
6619|Frogger|Jump 75 times in one level, using the same robot|10294|9 Jul 2018 7:49:37 PM|499|582|85.74|Common|Gold
6619|Lifeguard|Share energy when your twin is about to die|10293|9 Jul 2018 7:44:45 PM|530|582|91.07|Common|Silver
6619|See ya in another life, brotha|Finish a level using only 1 robot, not switching control even once|10292|9 Jul 2018 7:43:03 PM|541|582|92.96|Common|Silver
6619|No rush|Press the red button at the last minute, just before your twin gets crushed|10291|9 Jul 2018 7:40:08 PM|532|582|91.41|Common|Gold
6619|So generous|Give all your energy to your twin|10290|9 Jul 2018 7:36:00 PM|551|582|94.67|Common|Gold
6619|Better together|Reach the exit with both robots|10289|9 Jul 2018 7:34:07 PM|570|582|97.94|Common|Bronze
6619|Blue tiles|Step on all of them in one level|10288|9 Jul 2018 7:33:50 PM|555|582|95.36|Common|Silver
6053|Full Throttle|Unlock all trophies|10287|9 Jul 2018 6:58:19 PM|5081|6986|72.73|Common|Platinum
6053|Thank No Cats|Watch the bunnies overtake the credits|10286|9 Jul 2018 6:58:19 PM|5415|6986|77.51|Common|Bronze
6053|Can't Beat a Corley|Send up a gorge-ous death for Ripburger|10285|9 Jul 2018 6:36:44 PM|5685|6986|81.38|Common|Gold
6053|Burger Well Done|Defeat Ripburger without dying|10284|9 Jul 2018 6:36:43 PM|5169|6986|73.99|Common|Gold
6053|LOOMing Seagull|Kill the LOOM Seagull|10283|9 Jul 2018 6:36:08 PM|5385|6986|77.08|Common|Bronze
6053|Now Boarding|Get Ripburger into the plane|10282|9 Jul 2018 6:33:44 PM|5694|6986|81.51|Common|Silver
6053|Rabbit Ragu|Dice a rabbit in the engine fan|10281|9 Jul 2018 6:31:38 PM|5417|6986|77.54|Common|Silver
6053|Burger Melt|Melt Ripburger's vision of the future|10280|9 Jul 2018 6:25:02 PM|5708|6986|81.71|Common|Bronze
6053|Wisecrack|Kick the crack to open the secret passage|10279|9 Jul 2018 6:20:51 PM|5718|6986|81.85|Common|Bronze
6053|What A Pain Threshold!|Make the Boom Boom Bros go boom|10278|9 Jul 2018 6:18:09 PM|5724|6986|81.94|Common|Silver
6053|Taut a Lesson|Talk your way out of getting quartered|10277|9 Jul 2018 5:49:32 PM|5748|6986|82.28|Common|Bronze
6053|Hare Trigger|Sacrifice bunnies to get through the minefield|10276|9 Jul 2018 5:48:04 PM|5748|6986|82.28|Common|Silver
6053|Burn-In Rubber|Save your screen from burn-in with 3D animated vehicles|10275|9 Jul 2018 5:44:00 PM|5820|6986|83.31|Common|Bronze
6053|Invasion of the Bunny Snatcher|Snatch the bunny|10274|9 Jul 2018 5:19:40 PM|5772|6986|82.62|Common|Bronze
6053|Pull a Fast One|Get the battery from the minefield|10273|9 Jul 2018 5:08:04 PM|5774|6986|82.65|Common|Bronze
6053|Pure Evel|Launch over Poyahoga Gorge|10272|9 Jul 2018 5:00:13 PM|5836|6986|83.54|Common|Silver
6053|The Spirit of Ricky Myran|Escape with Ricky's ramp|10271|9 Jul 2018 4:59:10 PM|5858|6986|83.85|Common|Bronze
6053|Gogglor|Use the Cavefish goggles to locate their lair|10270|9 Jul 2018 3:49:34 PM|5885|6986|84.24|Common|Bronze
6053|A Fistful of Fertilizer|Get the chainsaw with the fertilizer|10269|9 Jul 2018 3:34:54 PM|5775|6986|82.67|Common|Silver
6053|Torque Talk|Consume Father Torque's wisdom|10268|9 Jul 2018 3:27:26 PM|5979|6986|85.59|Common|Silver
6053|Fertilized|Use the fertilizer to spin out Nestor and Bolus|10267|9 Jul 2018 3:21:20 PM|5941|6986|85.04|Common|Bronze
6053|Hosed|Get a hose to fix your bike|10266|9 Jul 2018 3:15:23 PM|6081|6986|87.05|Common|Bronze
6053|Hard Tale|Look at the pic of Maureen and Malcom fixing hard tail|10265|9 Jul 2018 3:14:36 PM|5360|6986|76.72|Common|Silver
6053|I Can Do That|Play a game of five finger fillet|10264|9 Jul 2018 3:10:16 PM|5405|6986|77.37|Common|Silver
6053|News to Me|Watch the entire news broadcast|10263|9 Jul 2018 3:09:01 PM|5349|6986|76.57|Common|Bronze
6053|A New Hope|Grab the Fake ID from Miranda|10262|9 Jul 2018 3:04:50 PM|6123|6986|87.65|Common|Bronze
6053|Unnatural Causes|Listen to Malcolm's last words|10261|9 Jul 2018 2:57:44 PM|6169|6986|88.31|Common|Silver
6053|Right in the Junk|Recover the forks from the junkyard|10260|9 Jul 2018 2:50:52 PM|6228|6986|89.15|Common|Bronze
6053|OK, I'll Put My Lips on That|Siphon gas from Floyd|10259|9 Jul 2018 2:28:06 PM|6272|6986|89.78|Common|Bronze
6053|Annoyed Floyd|Hide from Floyd|10258|9 Jul 2018 2:26:56 PM|6301|6986|90.19|Common|Bronze
6053|Not So Tough After All|Pick the lock to the tower|10257|9 Jul 2018 2:22:43 PM|6368|6986|91.15|Common|Silver
6053|Carry the Torch|Retrieve Mo's welding torch|10256|9 Jul 2018 2:11:33 PM|6341|6986|90.77|Common|Bronze
6053|Trailer Trashed|Kick in the trailer door|10255|9 Jul 2018 2:09:58 PM|6435|6986|92.11|Common|Bronze
6053|Angels with Dirty Faces|Keep talking to Todd|10254|9 Jul 2018 2:09:46 PM|5311|6986|76.02|Common|Bronze
6053|Minking Memories|Check out the photo of Uncle Pete|10253|9 Jul 2018 2:03:54 PM|6470|6986|92.61|Common|Silver
6053|Know Mo|Finish all of Mo's initial dialog|10252|9 Jul 2018 2:03:21 PM|6145|6986|87.96|Common|Silver
6053|A-Number One Polecat Honcho|Take out the first Rottwheeler|10251|9 Jul 2018 1:57:55 PM|6600|6986|94.47|Common|Bronze
6053|Ring Pull|Get your keys from the bartender|10250|9 Jul 2018 1:55:51 PM|6636|6986|94.99|Common|Silver
6053|Not Puttin' My Lips on That|Keep Your Lips Off of 10 Objects|10249|9 Jul 2018 1:54:52 PM|6032|6986|86.34|Common|Silver
6053|One Final Offer...|Accept Ripburger's Final Offer|10248|9 Jul 2018 1:23:32 PM|6695|6986|95.83|Common|Bronze
6844|Slay It Again, Sam|Unlock the gorepack called C-flat Face.|10247|9 Jul 2018 5:37:20 AM|858|1256|68.31|Common|Bronze
6844|Cannonball? Run!|Unlock the gorepack called Ball'd Faced Lier.|10246|9 Jul 2018 5:29:27 AM|862|1256|68.63|Common|Silver
6844|Gory-gami|Unlock the gorepack called Origami'd.|10245|9 Jul 2018 5:21:31 AM|882|1256|70.22|Common|Bronze
6844|Number of the Best|Kill 666 victims across all Slayaway Camp movies.|10244|9 Jul 2018 5:21:07 AM|810|1256|64.49|Common|Gold
6844|Blend It Like Beckham|Unlock the gorepack called Juiced.|10243|9 Jul 2018 5:18:50 AM|869|1256|69.19|Common|Bronze
6844|The Bees|Unlock the gorepack called Not the Bees.|10242|9 Jul 2018 4:39:53 AM|904|1256|71.97|Common|Bronze
6844|Nailed It!|Unlock the gorepack called Pincusioned.|10241|9 Jul 2018 4:39:28 AM|876|1256|69.75|Common|Bronze
6844|Lawnmower Man|Unlock the gorepack called Party's Over.|10240|9 Jul 2018 4:39:11 AM|826|1256|65.76|Common|Silver
6844|Sheer Terror|Unlock the gorepack called Pruned.|10239|9 Jul 2018 4:38:45 AM|883|1256|70.3|Common|Silver
6844|Hellraiser|Unlock the gorepack called Demonized.|10238|9 Jul 2018 4:38:25 AM|853|1256|67.91|Common|Silver
6844|Firestarter|Unlock the gorepack called Charbroiled.|10237|9 Jul 2018 4:38:01 AM|826|1256|65.76|Common|Bronze
6844|Milton's Revenge|Unlock the gorepack called Face Stapled.|10236|9 Jul 2018 4:37:39 AM|836|1256|66.56|Common|Silver
6844|The Texas Pitchfork Massacre|Unlock the gorepack called Spronged.|10235|9 Jul 2018 4:37:10 AM|874|1256|69.59|Common|Bronze
6844|Little Shop of Horrors|Unlock 13 Gore Packs.|10234|9 Jul 2018 4:36:47 AM|943|1256|75.08|Common|Gold
6844|My Bloody Valentine|Unlock the gorepack called Broken Heart.|10233|9 Jul 2018 4:36:43 AM|892|1256|71.02|Common|Bronze
6844|See No Evil|Unlock the gorepack called Double Blind.|10232|9 Jul 2018 4:36:26 AM|894|1256|71.18|Common|Bronze
6844|The Silencer|Unlock the gorepack called Grenade!.|10231|9 Jul 2018 4:34:53 AM|879|1256|69.98|Common|Bronze
6844|Pupper Master|Unlock 13 Killers using the Mystery Box.|10230|9 Jul 2018 3:11:56 AM|883|1256|70.3|Common|Silver
6844|Creepshow|Unlock 5 Killers using the Mystery Box.|10229|9 Jul 2018 3:03:07 AM|919|1256|73.17|Common|Bronze
6844|I Am Legend|Get a score of 20 in Faces of Killed 3.|10228|9 Jul 2018 1:56:50 AM|928|1256|73.89|Common|Bronze
6844|The Grudge|Get a score of 10 in Faces of Killed 3.|10227|9 Jul 2018 1:40:34 AM|974|1256|77.55|Common|Bronze
6844|The Purge|Get a score of 13 in Faces of Killed 3.|10226|9 Jul 2018 1:40:34 AM|965|1256|76.83|Common|Bronze
6844|Grindhouse|Get a score of 5 in Faces of Killed 3.|10225|9 Jul 2018 1:39:30 AM|977|1256|77.79|Common|Bronze
6844|Galaxy of Terror|Complete Slayaway Camp X "Space Camp".|10224|9 Jul 2018 1:29:07 AM|877|1256|69.82|Common|Silver
6844|Frankenweenie|Complete Slayaway Camp 8 "Manhattan Manslaughter".|10223|8 Jul 2018 3:46:12 PM|888|1256|70.7|Common|Bronze
6844|Graveyard Shift|Complete Slayaway Camp 7 "Office Hours".|10222|8 Jul 2018 3:33:32 PM|907|1256|72.21|Common|Bronze
6844|Shocker|Kill a victim by scaring them into an electric fence.|10221|8 Jul 2018 3:15:31 PM|925|1256|73.65|Common|Bronze
6844|Flatliners|Complete Slayaway Camp 6 "Fatality Ward".|10220|8 Jul 2018 3:14:11 PM|930|1256|74.04|Common|Bronze
6844|Child's Play|Unlock one new psycho killer using the Mystery Box.|10219|8 Jul 2018 5:57:55 AM|1031|1256|82.09|Common|Bronze
6844|Prince of Darkness|Kill a victim when the lights are off.|10218|8 Jul 2018 5:48:35 AM|953|1256|75.88|Common|Bronze
6844|Deep Rising|Complete Slayaway Camp 5 "Bloodbath Beach".|10217|8 Jul 2018 5:45:56 AM|957|1256|76.19|Common|Bronze
6844|Killer of the Elite|Kill a swat cop.|10216|8 Jul 2018 5:44:54 AM|959|1256|76.35|Common|Bronze
6844|Psycho Cop|Kill 30 dumb cops across all Slayaway Camp movies.|10215|8 Jul 2018 5:29:37 AM|967|1256|76.99|Common|Bronze
6844|The Faculty|Complete Slayaway Camp 4 "Slash'em High".|10214|8 Jul 2018 4:59:59 AM|978|1256|77.87|Common|Bronze
6844|Carnival of Souls|Complete Slayaway Camp 3D "The Abusement Park".|10213|8 Jul 2018 4:28:33 AM|1010|1256|80.41|Common|Bronze
6844|House of 100 Corpses|Kill 100 victims across all Slayaway Camp movies.|10212|8 Jul 2018 4:20:48 AM|1043|1256|83.04|Common|Bronze
6844|Faster, Pussycat!|Get through a level with a cat without killing it.|10211|8 Jul 2018 4:19:42 AM|1020|1256|81.21|Common|Bronze
6844|Rest in Pieces|Kill a victim with a Landmine.|10210|8 Jul 2018 3:49:55 AM|1123|1256|89.41|Common|Bronze
6844|The Mummy|Complete Slayaway Camp 2.5 "Another Return to Slayaway Camp".|10209|8 Jul 2018 3:49:10 AM|1116|1256|88.85|Common|Bronze
6844|The Hunger|Kill a victim by knocking over a fridge onto them.|10208|8 Jul 2018 3:40:02 AM|1161|1256|92.44|Common|Bronze
6844|Part II|Complete Slayaway Camp 2 "Return to Slayaway Camp".|10207|8 Jul 2018 3:34:02 AM|1197|1256|95.3|Common|Bronze
6844|The Deep|Kill a victim by scarin them into water.|10206|8 Jul 2018 3:24:07 AM|1217|1256|96.89|Common|Bronze
6844|Maniac Cop|Kill a dumb cop.|10205|8 Jul 2018 3:23:39 AM|1219|1256|97.05|Common|Bronze
6844|Needful Things|Unlock 1 Gore Pack.|10204|8 Jul 2018 3:20:49 AM|1231|1256|98.01|Common|Bronze
6844|Cabin in the Woods|Complete Slayaway Camp.|10203|8 Jul 2018 3:11:23 AM|1231|1256|98.01|Common|Bronze
6844|Six Feet Under|Kill a victim by scaring them into a hole.|10202|8 Jul 2018 3:11:14 AM|1230|1256|97.93|Common|Bronze
6844|Fire Walk With Me|Kill a victim by scaring them into a fire.|10201|8 Jul 2018 3:09:31 AM|1239|1256|98.65|Common|Bronze
6840|Pilgrim|Explore the Land of Gods.|10200|7 Jul 2018 4:14:34 PM|867|1087|79.76|Common|Platinum
6840|Equilibrium|Complete the game.|10199|7 Jul 2018 4:14:34 PM|894|1087|82.24|Common|Gold
6840|Mausoleum of Ice|Complete the The Monastery.|10198|7 Jul 2018 4:02:28 PM|901|1087|82.89|Common|Gold
6840|Baa from the past|Find the Ancient Llamba.|10197|7 Jul 2018 2:03:59 PM|888|1087|81.69|Common|Silver
6840|Cartographer|Discover all areas of the map.|10196|7 Jul 2018 2:00:51 PM|917|1087|84.36|Common|Gold
6840|Knowledge for Power|Complete the The Archives.|10195|7 Jul 2018 1:54:16 PM|901|1087|82.89|Common|Gold
6840|Attuned to the spirits|Speak to all of the spirit animals.|10194|7 Jul 2018 1:33:54 PM|886|1087|81.51|Common|Gold
6840|In the belly of the beast|Find the bones of an old beast.|10193|7 Jul 2018 1:29:59 PM|905|1087|83.26|Common|Silver
6840|Gaze into the abyss|Find the dwellings of the rift cult.|10192|7 Jul 2018 1:22:46 PM|904|1087|83.16|Common|Silver
6840|Memorial|Find the ancient battlefield.|10191|7 Jul 2018 1:20:28 PM|896|1087|82.43|Common|Silver
6840|Tails of Stone|Find the statue of the fox.|10190|7 Jul 2018 1:17:30 PM|898|1087|82.61|Common|Silver
6840|Condor condo|Find the giant birdshrine.|10189|7 Jul 2018 1:16:42 PM|899|1087|82.7|Common|Silver
6840|Written in stone|Find the chiseled stone map.|10188|7 Jul 2018 1:15:07 PM|895|1087|82.34|Common|Silver
6840|Wings of Stone|Find the statue of the crane.|10187|7 Jul 2018 1:12:55 PM|909|1087|83.62|Common|Silver
6840|Hide and Seek|Find Erin when she's gone.|10186|7 Jul 2018 1:10:44 PM|874|1087|80.4|Common|Silver
6840|People's Haven|Complete the Eventide Sanctuary.|10185|7 Jul 2018 12:49:24 PM|934|1087|85.92|Common|Gold
6840|Ripples on the surface|Step into the well.|10184|7 Jul 2018 4:11:42 AM|915|1087|84.18|Common|Silver
6840|An uninvited guest|Find the Crab Island.|10183|7 Jul 2018 4:06:26 AM|929|1087|85.46|Common|Silver
6840|Mama?|Get some Lambaby love.|10182|7 Jul 2018 4:03:07 AM|975|1087|89.7|Common|Silver
6840|Antlers of Stone|Find the statue of the deer.|10181|7 Jul 2018 3:59:52 AM|936|1087|86.11|Common|Silver
6840|Light at the end of the tunnel|Escape the collapsing cave.|10180|7 Jul 2018 3:43:16 AM|1046|1087|96.23|Common|Silver
7233|Platinum Midnight|Unlock all the trophies.|10179|6 Jul 2018 10:50:14 PM|1198|1244|96.3|Common|Platinum
7233|Expert|Complete 40 levels.|10178|6 Jul 2018 10:50:14 PM|1202|1244|96.62|Common|Gold
7233|Stunned|Die by a laser.|10177|6 Jul 2018 9:45:32 PM|1206|1244|96.95|Common|Gold
7233|Professional|Complete 20 levels.|10176|6 Jul 2018 9:20:01 PM|1215|1244|97.67|Common|Gold
7233|Not squared anymore|Die by a saw.|10175|6 Jul 2018 9:08:23 PM|1228|1244|98.71|Common|Gold
5253|Mullach an Eilein|Trigger all directors' commentary|10174|6 Jul 2018 8:39:11 PM|2224|6195|35.9|Uncommon|Silver
7233|Improving|Complete 10 levels.|10173|6 Jul 2018 6:53:42 PM|1233|1244|99.12|Common|Gold
7233|Stabbed|Die by a spike.|10172|6 Jul 2018 6:48:06 PM|1232|1244|99.04|Common|Gold
7233|Engineer|Pull a lever.|10171|6 Jul 2018 6:47:08 PM|1236|1244|99.36|Common|Gold
7233|Starter|Complete 5 levels.|10170|6 Jul 2018 6:45:34 PM|1237|1244|99.44|Common|Gold
7233|Went to explore|Die by getting out of a level.|10169|6 Jul 2018 6:45:24 PM|1239|1244|99.6|Common|Gold
7233|You made it|Complete level 4 making Midnight's friend smile.|10168|6 Jul 2018 6:44:56 PM|1225|1244|98.47|Common|Gold
7233|Making friends|Bump into one of Midnight's friends.|10167|6 Jul 2018 6:44:42 PM|1238|1244|99.52|Common|Silver
7233|Not overworking|Get 3 stars in one level.|10166|6 Jul 2018 6:38:35 PM|1239|1244|99.6|Common|Gold
7233|Go into the light|Complete level 1.|10165|6 Jul 2018 6:38:07 PM|1242|1244|99.84|Common|Silver
7361|Metropolis: Lux Obscura Platinum|Good job! Completed all tasks!|10164|6 Jul 2018 6:31:39 PM|147|194|75.77|Common|Platinum
7361|She saved you a bullet|Find Goldie.|10163|6 Jul 2018 6:31:39 PM|153|194|78.87|Common|Gold
7361|Goldie|Almost met with Goldie.|10162|6 Jul 2018 6:17:31 PM|158|194|81.44|Common|Gold
7361|Hell for the company|Bliss is not that stupid.|10161|6 Jul 2018 5:08:02 PM|152|194|78.35|Common|Bronze
7361|Bikers|There's a guys on two wheels.|10160|6 Jul 2018 4:55:38 PM|158|194|81.44|Common|Gold
7361|Bite the bullet|Win a fight after collecting 10 police tokens.|10159|6 Jul 2018 4:54:20 PM|154|194|79.38|Common|Gold
7361|Warehouse|Visited warehouse.|10158|6 Jul 2018 4:47:27 PM|172|194|88.66|Common|Gold
7361|Sound of da Police|Met with the police.|10157|6 Jul 2018 4:20:54 PM|168|194|86.6|Common|Gold
7361|At the club again|New troubles at the club.|10156|6 Jul 2018 4:12:05 PM|168|194|86.6|Common|Silver
7361|Words are loaded pistols|Get one of main endings without a gun.|10155|6 Jul 2018 2:20:36 PM|153|194|78.87|Common|Silver
7361|The choices we make|Help Candice and Leana to get off the hook.|10154|6 Jul 2018 2:20:35 PM|156|194|80.41|Common|Silver
7361|Farm|Visited farm.|10153|6 Jul 2018 1:42:40 PM|160|194|82.47|Common|Silver
5253|Paul|Finish Chapter 'The Beacon'|10152|6 Jul 2018 5:28:18 AM|4532|6195|73.16|Common|Gold
5253|Seanchaidh|Trigger all voice over points|10151|6 Jul 2018 5:24:34 AM|2804|6195|45.26|Uncommon|Silver
5253|Tuir|Uncover 4 urns|10150|6 Jul 2018 5:15:00 AM|2460|6195|39.71|Uncommon|Bronze
5253|Esther|Finish Chapter 'The Caves'|10149|6 Jul 2018 5:06:29 AM|4628|6195|74.71|Common|Silver
5253|Man of the Rocks|Walk 5000 steps|10148|6 Jul 2018 4:56:33 AM|3841|6195|62.0|Common|Bronze
5253|Jakobson|Finish Chapter 'The Buoy'|10147|6 Jul 2018 4:53:12 AM|4762|6195|76.87|Common|Silver
5253|Donnelley|Finish Chapter 'The Lighthouse'|10146|6 Jul 2018 4:25:31 AM|5316|6195|85.81|Common|Silver
5253|Seonaidh|Drown Once|10145|6 Jul 2018 4:17:22 AM|4853|6195|78.34|Common|Bronze
5253|Stac an Armin|Die from falling off a cliff once|10144|6 Jul 2018 4:09:12 AM|4274|6195|68.99|Common|Bronze
7361|Candy|Met with Candy.|10143|6 Jul 2018 3:16:06 AM|160|194|82.47|Common|Silver
7361|Like Chuck|100 damage points in a single turn.|10142|6 Jul 2018 2:35:13 AM|159|194|81.96|Common|Gold
7361|Tough guy|50 damage points in a single turn.|10141|6 Jul 2018 2:35:12 AM|164|194|84.54|Common|Silver
7361|Trap|Caught in a trap.|10140|5 Jul 2018 7:30:54 PM|170|194|87.63|Common|Silver
7361|That same dealer|Got a new task.|10139|5 Jul 2018 7:30:06 PM|172|194|88.66|Common|Silver
7361|Bar|No good night at the bar.|10138|5 Jul 2018 7:22:01 PM|170|194|87.63|Common|Silver
7361|Tork|I have been a personal driver.|10137|5 Jul 2018 6:51:32 PM|174|194|89.69|Common|Bronze
7361|Angry policemen|The police turned into anger.|10136|5 Jul 2018 6:17:49 PM|163|194|84.02|Common|Silver
7361|Drugstore|Visited drugstore.|10135|5 Jul 2018 6:13:40 PM|174|194|89.69|Common|Bronze
7361|Bridge|Meeting on the bridge.|10134|5 Jul 2018 6:00:39 PM|180|194|92.78|Common|Bronze
7361|You're dead|Died for the first time.|10133|5 Jul 2018 5:34:19 PM|179|194|92.27|Common|Bronze
7361|Club|At the door of the club.|10132|5 Jul 2018 5:27:49 PM|182|194|93.81|Common|Bronze
7359|Peacemaker|Reconciled the Sun with the Moon|10131|5 Jul 2018 1:50:04 PM|86|94|91.49|Common|Silver
7359|Stubborn|Refused to give a man boats three times in a row|10130|5 Jul 2018 1:48:16 PM|76|94|80.85|Common|Silver
7359|Curious|All the ends of all the branches reached|10129|5 Jul 2018 1:43:34 PM|77|94|81.91|Common|Silver
7359|Survivor|Visited a bear three times|10128|5 Jul 2018 1:40:55 PM|78|94|82.98|Common|Gold
7359|A cunning plan|Caused a quarrel between The Sun and The Moon|10127|5 Jul 2018 1:28:20 PM|88|94|93.62|Common|Bronze
7359|Explorer|Found all exits of the labyrinth|10126|5 Jul 2018 1:18:53 PM|84|94|89.36|Common|Silver
7359|Sleeper|Saw all dreams|10125|5 Jul 2018 1:18:14 PM|78|94|82.98|Common|Silver
7359|Persistent|Press the same button four times in a row|10124|5 Jul 2018 1:11:43 PM|81|94|86.17|Common|Silver
6637|Eye of the Storm|Collect all other trophies.|10123|5 Jul 2018 3:54:30 AM|3215|3398|94.61|Common|Platinum
6637|The End|Fin.|10122|5 Jul 2018 3:54:30 AM|3231|3398|95.09|Common|Gold
6637|Energy Room|Have a rest. Now carry on.|10121|5 Jul 2018 3:43:46 AM|3232|3398|95.11|Common|Gold
6637|Lava Forever|Heatwave.|10120|5 Jul 2018 2:11:18 AM|3242|3398|95.41|Common|Silver
6637|Secret Pipe|Oldest trick in the book.|10119|5 Jul 2018 1:59:52 AM|3228|3398|95.0|Common|Gold
6637|End of the Tunnel|Explore the dead end.|10118|5 Jul 2018 1:57:07 AM|3259|3398|95.91|Common|Gold
6637|Laser Survivor|Making light of the situation.|10117|5 Jul 2018 1:52:34 AM|3257|3398|95.85|Common|Silver
6637|Running into Walls|Sometimes, a hidden passage opens up.|10116|5 Jul 2018 1:49:14 AM|3241|3398|95.38|Common|Gold
6637|Death From Above|Should’ve kept an eye out.|10115|5 Jul 2018 1:39:07 AM|3267|3398|96.14|Common|Silver
6637|Bottom of the Pool|Darkest depths.|10114|5 Jul 2018 1:31:33 AM|3256|3398|95.82|Common|Gold
6637|Jump for Fun|Raindrops keep fallin’ on my head.|10113|4 Jul 2018 4:49:05 AM|3291|3398|96.85|Common|Gold
6637|Shock Therapy|It’ll learn.|10112|4 Jul 2018 4:17:23 AM|3313|3398|97.5|Common|Gold
6637|Spiderbot|Spider-bot, spider-bot…|10111|4 Jul 2018 4:06:24 AM|3278|3398|96.47|Common|Gold
6637|Boogie Time|Just dance.|10110|4 Jul 2018 3:59:39 AM|3347|3398|98.5|Common|Silver
6637|Wreckage|No way back.|10109|4 Jul 2018 3:59:17 AM|3291|3398|96.85|Common|Silver
6660|Platinum Midnight|Become a master collector|10108|4 Jul 2018 3:43:30 AM|1657|2067|80.16|Common|Platinum
6660|The fastest one|Get 36 fragments in less than 6 Min|10107|4 Jul 2018 3:43:30 AM|1662|2067|80.41|Common|Gold
7073|Platinum Midnight|Become a master collector|10106|4 Jul 2018 1:45:42 AM|4621|5508|83.9|Common|Platinum
7073|So close|Die with 35 fragments|10105|4 Jul 2018 1:45:42 AM|4746|5508|86.17|Common|Gold
7073|That IS bad luck|Die with 36 fragments|10104|4 Jul 2018 1:31:55 AM|4822|5508|87.55|Common|Gold
6011|Platinum Trophy|A full Trophy cabinet|10103|4 Jul 2018 1:22:14 AM|1464|1715|85.36|Common|Platinum
6011|Masquerade|Collect your mask from Finn|10102|4 Jul 2018 1:22:14 AM|1564|1715|91.2|Common|Gold
6011|Not a happy bunny|Find these weathered toys|10101|3 Jul 2018 10:20:39 PM|1477|1715|86.12|Common|Bronze
6011|Poster Club|Inspect all the film posters in the game|10100|3 Jul 2018 10:19:51 PM|1481|1715|86.36|Common|Gold
6011|Dark Destroyer|Acquire your Umbrakinesis Powers|10099|3 Jul 2018 10:18:45 PM|1583|1715|92.3|Common|Gold
6011|A moment captured|Inspect this instant memory maker|10098|3 Jul 2018 10:16:07 PM|1580|1715|92.13|Common|Bronze
6011|Big Cheater|Look for Finn as quickly as you can|10097|3 Jul 2018 10:13:26 PM|1495|1715|87.17|Common|Gold
6011|Who's the daddy?|An ego waiting to be found|10096|3 Jul 2018 10:07:47 PM|1583|1715|92.3|Common|Silver
6011|Alas, Poor Isaac!|Uncover Isaac's past secrets|10095|3 Jul 2018 10:07:05 PM|1570|1715|91.55|Common|Gold
6011|Pure Folly|Find this fanciful hideout|10094|3 Jul 2018 10:02:40 PM|1578|1715|92.01|Common|Bronze
6011|Catharsis|Set Finn's emotions free|10093|3 Jul 2018 9:59:13 PM|1491|1715|86.94|Common|Silver
6011|Redemption|Redeem your mistakes|10092|3 Jul 2018 9:52:49 PM|1546|1715|90.15|Common|Silver
6011|Fire Starter|Acquire your Pyrokinesis Powers|10091|3 Jul 2018 9:49:27 PM|1594|1715|92.94|Common|Gold
6011|Doodle dandy|Find this moment of teenage fancy|10090|3 Jul 2018 9:41:25 PM|1585|1715|92.42|Common|Bronze
6011|Life Giver|Acquire your Life Powers|10089|3 Jul 2018 9:29:26 PM|1609|1715|93.82|Common|Gold
6011|You spin me right round|Inspect this moment in space|10088|3 Jul 2018 9:12:15 PM|1589|1715|92.65|Common|Bronze
6011|Good kitty|Inspect your purrrfect pet|10087|3 Jul 2018 9:11:03 PM|1580|1715|92.13|Common|Bronze
6011|Prize draw|Inspect this shared success|10086|3 Jul 2018 9:10:36 PM|1572|1715|91.66|Common|Bronze
6011|Green Fingered|Find Grandad's refuge|10085|3 Jul 2018 8:37:01 PM|1623|1715|94.64|Common|Silver
6011|Guitar man|Inspect this once loved instrument|10084|3 Jul 2018 8:34:58 PM|1607|1715|93.7|Common|Bronze
6011|Pull the other one|Inspect this emergency feature|10083|3 Jul 2018 8:27:58 PM|1524|1715|88.86|Common|Silver
6011|Simon Says: Good to Go|Complete your first adventure|10082|3 Jul 2018 8:17:45 PM|1675|1715|97.67|Common|Bronze
6011|Simon Says: Don't lose|Can you beat this nostalgic game?|10081|3 Jul 2018 8:17:43 PM|1529|1715|89.15|Common|Gold
7073|Stuned|Die by a laser|10080|3 Jul 2018 5:25:06 AM|5477|5508|99.44|Common|Gold
7073|The fastest one|Get 36 fragments in less than 6 Min|10079|3 Jul 2018 5:21:26 AM|4636|5508|84.17|Common|Gold
7073|Super fast|Get 36 fragments in less than 10 Min|10078|3 Jul 2018 5:21:26 AM|4791|5508|86.98|Common|Gold
7073|The greatest gift|Get 36 fragments|10077|3 Jul 2018 5:21:25 AM|4805|5508|87.24|Common|Gold
7073|Only the half left|Get 18 fragments|10076|3 Jul 2018 5:17:57 AM|5270|5508|95.68|Common|Gold
