3568|No more darkness|Paint the whole world with color.|7421|29 Jul 2018 9:56:28 PM|9913|36231|27.36|Uncommon|Bronze
3568|All safe!|Release all Tokis from their cages.|7420|29 Jul 2018 9:52:43 PM|9911|36231|27.36|Uncommon|Silver
3568|Starry sky|Earn an incredible amount of stars. (50%)|7419|29 Jul 2018 9:23:18 PM|10361|36231|28.6|Uncommon|Gold
3568|Hiking adventure|Defeat the Mountain Boss.|7418|29 Jul 2018 8:49:44 PM|11096|36231|30.63|Uncommon|Silver
5222|Into the Limelight|Unlock lime colour|7417|28 Jul 2018 11:36:09 PM|12285|33671|36.49|Uncommon|Bronze
5222|Pigment of Your Imagination|Make 5000 obstacles disappear|7416|28 Jul 2018 11:08:25 PM|19681|33671|58.45|Common|Silver
5222|A Yellow Streak|Unlock yellow colour|7415|28 Jul 2018 10:57:04 PM|13195|33671|39.19|Uncommon|Bronze
5222|In a Blue Moon|Unlock blue colour|7414|28 Jul 2018 10:34:10 PM|13841|33671|41.11|Uncommon|Bronze
5222|Caught Red Handed|Unlock red colour|7413|28 Jul 2018 10:04:20 PM|14908|33671|44.28|Uncommon|Bronze
5222|Back to the Fuchsia|Unlock pink colour|7412|28 Jul 2018 9:24:28 PM|20149|33671|59.84|Common|Bronze
5222|Like Clockwork|Unlock orange colour|7411|28 Jul 2018 8:55:18 PM|26257|33671|77.98|Common|Bronze
5222|Shrinking Violet|Unlock purple colour|7410|28 Jul 2018 8:50:46 PM|28745|33671|85.37|Common|Bronze
5222|Showing True Colours|Change colour for the first time|7409|28 Jul 2018 8:43:40 PM|30625|33671|90.95|Common|Bronze
5222|Aquacadabra|Unlock aqua colour|7408|28 Jul 2018 8:41:02 PM|31179|33671|92.6|Common|Bronze
6417|Winter|The two most joyous times of the year are Christmas morning and the end of school.|7407|28 Jul 2018 6:53:59 PM|737|742|99.33|Common|Gold
6417|Autumn|Autumn is a second spring when every leaf is a flower.|7406|28 Jul 2018 6:52:07 PM|737|742|99.33|Common|Gold
6417|Summer|Health is the thing that makes you feel that now is the best time of the year.|7405|28 Jul 2018 6:50:42 PM|739|742|99.6|Common|Gold
6417|Spring|Every year on your birthday, you get a chance to start new.|7404|28 Jul 2018 6:49:08 PM|740|742|99.73|Common|Silver
3568|No orbs for you!|Complete a level without grabbing a single orb.|7403|28 Jul 2018 3:17:27 PM|11275|36231|31.12|Uncommon|Bronze
3568|EZPZ|Clear Mountain level 6 without grabbing any orbs.|7402|28 Jul 2018 3:17:25 PM|9398|36231|25.94|Uncommon|Gold
3568|None left|Destroy every single goblin in Mountain level 3.|7401|28 Jul 2018 2:54:58 PM|10375|36231|28.64|Uncommon|Bronze
3568|Check every door|Open all gates in Mountain level 2.|7400|28 Jul 2018 2:50:46 PM|11130|36231|30.72|Uncommon|Bronze
3568|Color Guardian jelly time!|Stay 5 minutes on a level using Jellies wihout dying.|7399|28 Jul 2018 2:24:06 PM|10851|36231|29.95|Uncommon|Bronze
3568|Rod-zenegger|Get to the choppa!!! Don't miss any of the choppers on Windmill Level 6.|7398|28 Jul 2018 2:13:38 PM|12674|36231|34.98|Uncommon|Bronze
3568|Goblin's aren't so bad|Encounter the Old Goblin.|7397|28 Jul 2018 12:13:10 AM|11955|36231|33.0|Uncommon|Bronze
3568|Light at the end|Defeat Krogma on Crystal cave.|7396|28 Jul 2018 12:11:37 AM|11963|36231|33.02|Uncommon|Bronze
3568|Starsky and Hutch|Earn a big pile of stars. (30%)|7395|27 Jul 2018 11:54:43 PM|12163|36231|33.57|Uncommon|Silver
3568|Rail master|Clear Crystal Cave level 6 without crashing any obstacles on the color rails.|7394|27 Jul 2018 11:42:22 PM|12239|36231|33.78|Uncommon|Bronze
3568|Tilting at windmills|Defeat the Windmill Boss.|7393|27 Jul 2018 2:07:11 AM|13512|36231|37.29|Uncommon|Bronze
3568|Aiming for the stars|Earn a bunch of stars. (20%)|7392|27 Jul 2018 1:53:53 AM|14046|36231|38.77|Uncommon|Bronze
6619|Platinum Robot|Unlock all other trophies|7391|27 Jul 2018 12:03:28 AM|430|582|73.88|Common|Platinum
6619|Gruyère robot|Die on the spikes over 25 times|7390|27 Jul 2018 12:03:28 AM|453|582|77.84|Common|Bronze
6619|Always together|Finish all the levels with both robots alive|7389|26 Jul 2018 11:56:11 PM|431|582|74.05|Common|Gold
6619|Call it even|Finish all the even levels with both robots alive|7388|26 Jul 2018 11:56:09 PM|431|582|74.05|Common|Gold
6619|Battery hunter|Collect all batteries across all levels|7387|26 Jul 2018 11:36:32 PM|433|582|74.4|Common|Silver
6619|This is odd|Finish all the odd levels with both robots alive|7386|26 Jul 2018 11:35:34 PM|432|582|74.23|Common|Gold
6619|Finished!|Finish all the levels|7385|26 Jul 2018 5:52:23 PM|433|582|74.4|Common|Gold
6619|Two and two makes 22|Finish level 22 with both robots alive|7384|26 Jul 2018 7:38:52 AM|439|582|75.43|Common|Gold
3568|Flying high|Use windchopper for the first time.|7383|25 Jul 2018 6:23:58 PM|15696|36231|43.32|Uncommon|Bronze
3568|Castle Seeker|Find all of the Castle's hidden Tokis.|7382|25 Jul 2018 8:55:56 AM|12077|36231|33.33|Uncommon|Silver
3568|No fear|Clear a level without passing through checkpoints.|7381|25 Jul 2018 8:37:58 AM|13991|36231|38.62|Uncommon|Bronze
3568|Really? REALLY?!?!|Almost perfect a level and miss by one orb.|7380|25 Jul 2018 7:39:33 AM|14570|36231|40.21|Uncommon|Bronze
3568|We're not worthy!|Clear a level with no stars.|7379|25 Jul 2018 7:28:37 AM|17897|36231|49.4|Uncommon|Bronze
3568|Cama cama chameleon|Clear a level collecting only multicolor orbs.|7378|25 Jul 2018 7:28:35 AM|13933|36231|38.46|Uncommon|Bronze
3568|Well done!|Get 3 stars on any level.|7377|25 Jul 2018 7:25:26 AM|22181|36231|61.22|Common|Bronze
3568|Put a ring on it!|Get diamond stars on any level.|7376|25 Jul 2018 7:25:24 AM|14687|36231|40.54|Uncommon|Bronze
3568|Party Like It’s 2015|Change colors 215 times on a level.|7375|25 Jul 2018 7:23:44 AM|16670|36231|46.01|Uncommon|Bronze
3568|Sorry, no princess in our castle|Defeat the Castle Boss.|7374|25 Jul 2018 7:19:28 AM|18538|36231|51.17|Common|Bronze
3568|Colorama|Grab 2000 color orbs.|7373|25 Jul 2018 7:12:27 AM|18510|36231|51.09|Common|Bronze
3568|I was in the pool!|Fall into the water 3 times in a row|7372|24 Jul 2018 5:36:49 PM|19957|36231|55.08|Common|Bronze
3568|Color overcharge|Complete 5 bonus color sequences.|7371|24 Jul 2018 2:47:07 PM|22114|36231|61.04|Common|Bronze
3568|Lollilollilollilollipop|Collect 100 big color orbs.|7370|24 Jul 2018 2:42:29 PM|22719|36231|62.71|Common|Bronze
3568|Diamond glitter!|Grab 500 orbs the perfect way.|7369|24 Jul 2018 2:35:01 PM|20757|36231|57.29|Common|Bronze
6619|I am the one who knocks|Run against a closed door|7368|23 Jul 2018 1:17:29 PM|461|582|79.21|Common|Bronze
6619|Acid addict|Die 5 times inside an acid pool|7367|23 Jul 2018 1:06:03 PM|488|582|83.85|Common|Bronze
7020|SQUAREBOY VS BULLIES|DEFEAT ALL THE BULLIES|7366|23 Jul 2018 3:13:42 AM|1689|1899|88.94|Common|Platinum
7020|BULLYING IS UNCOOL|FINISH THE GAME|7365|23 Jul 2018 3:13:42 AM|1691|1899|89.05|Common|Gold
7020|BIGGER THEY ARE, HARDER THEY FALL|DEFEAT BIG BOSS BULLY|7364|23 Jul 2018 3:13:31 AM|1691|1899|89.05|Common|Gold
6619|Under pressure|Both robots die smashed together|7363|23 Jul 2018 2:19:04 AM|491|582|84.36|Common|Silver
6619|Frogger|Jump 75 times in one level, using the same robot|7362|23 Jul 2018 2:13:43 AM|499|582|85.74|Common|Gold
6619|So generous|Give all your energy to your twin|7361|23 Jul 2018 1:25:17 AM|551|582|94.67|Common|Gold
6619|The floor is lava|Perform 10 consecutive wall jumps|7360|23 Jul 2018 1:22:18 AM|495|582|85.05|Common|Gold
6619|No rush|Press the red button at the last minute, just before your twin gets crushed|7359|23 Jul 2018 1:18:11 AM|532|582|91.41|Common|Gold
7020|A BLACK ROBE ALONE MAKETH NOT THE NINJA|DEFEAT NINJA BULLY ON THE SHIP DECK|7358|22 Jul 2018 10:45:43 PM|1744|1899|91.84|Common|Gold
7020|GOTCHA SLIPPERY NINJA|THROW A CRATE ON THE NINJA BULLY ON THE SHIP DECK|7357|22 Jul 2018 10:45:30 PM|1736|1899|91.42|Common|Gold
7020|STAND UP FOR EVERYONE|DEFEAT 300 BULLIES|7356|22 Jul 2018 10:26:39 PM|1759|1899|92.63|Common|Gold
7020|EARLY DELIVERY|HIT AN ENEMY WITH A CRATE|7355|22 Jul 2018 10:11:47 PM|1751|1899|92.21|Common|Silver
6619|See ya in another life, brotha|Finish a level using only 1 robot, not switching control even once|7354|22 Jul 2018 2:49:07 PM|541|582|92.96|Common|Silver
7020|BANDANAS ARE SILLY|DEFEAT BANDANA BULLY ON THE HIDEOUT ROOFTOP|7353|22 Jul 2018 7:37:13 AM|1797|1899|94.63|Common|Gold
7020|UNLEASHED|HIT AN ENEMY WITH A CHAIN|7352|22 Jul 2018 7:37:07 AM|1799|1899|94.73|Common|Silver
7020|WEAPONS MASTER|HIT ENEMIES BEHIND AND IN FRONT OF YOU WITH A SINGLE SWING OF A WEAPON|7351|22 Jul 2018 7:37:00 AM|1783|1899|93.89|Common|Gold
7020|HOMERUN|HIT AN ENEMY WITH A BASEBALL BAT|7350|22 Jul 2018 7:36:54 AM|1798|1899|94.68|Common|Silver
7020|STAND UP FOR YOUR FRIENDS|DEFEAT 100 BULLIES|7349|22 Jul 2018 7:34:31 AM|1817|1899|95.68|Common|Silver
7020|TAKING OUT THE TRASH|HIT AN ENEMY WITH A TRASH CAN|7348|22 Jul 2018 7:34:03 AM|1807|1899|95.16|Common|Silver
7020|BOXING CHAMP|HIT AN ENEMY WITH A BOX|7347|22 Jul 2018 7:30:45 AM|1821|1899|95.89|Common|Silver
7020|TIRE OR TYRE?|HIT AN ENEMY WITH A TIRE|7346|22 Jul 2018 7:21:57 AM|1843|1899|97.05|Common|Silver
7020|HAYEAHH|THROW AN ENEMY|7345|22 Jul 2018 7:20:54 AM|1874|1899|98.68|Common|Bronze
7020|UPPERCUT HERO|HIT AN ENEMY WITH A JUMP PUNCH|7344|22 Jul 2018 7:20:48 AM|1886|1899|99.32|Common|Bronze
7020|STAND UP FOR YOURSELF|DEFEAT 10 BULLIES|7343|22 Jul 2018 7:16:08 AM|1880|1899|99.0|Common|Bronze
7020|STRIKER|HIT AN ENEMY WITH A STRIKE COMBO|7342|22 Jul 2018 7:16:06 AM|1883|1899|99.16|Common|Bronze
7020|TRAINING|DESTROY ALL THE DUMMIES IN THE DOJO|7341|22 Jul 2018 7:14:35 AM|1885|1899|99.26|Common|Bronze
7020|EYES AT THE BACK|HIT AN ENEMY WITH A BACK PUNCH|7340|22 Jul 2018 7:14:21 AM|1883|1899|99.16|Common|Silver
7020|WHAT A KICK|HIT AN ENEMY WITH A JUMP KICK|7339|22 Jul 2018 7:14:08 AM|1886|1899|99.32|Common|Bronze
7020|KNOWLEDGE IS KEY|OPEN THE MOVES LIST IN THE PAUSED MENU|7338|22 Jul 2018 7:13:31 AM|1866|1899|98.26|Common|Bronze
7020|LIKE A TORNADO|HIT AN ENEMY WITH A SPIN PUNCH|7337|22 Jul 2018 7:13:17 AM|1848|1899|97.31|Common|Bronze
7020|A CLEAN SWEEP|HIT AN ENEMY WITH A SPIN KICK|7336|22 Jul 2018 7:13:15 AM|1840|1899|96.89|Common|Silver
7020|SO FAST|HIT AN ENEMY WITH A DASH ATTACK|7335|22 Jul 2018 7:13:04 AM|1863|1899|98.1|Common|Bronze
7020|GOTCHA|GRAB AN ENEMY|7334|22 Jul 2018 7:12:59 AM|1887|1899|99.37|Common|Bronze
6619|Lifeguard|Share energy when your twin is about to die|7333|21 Jul 2018 9:32:55 PM|530|582|91.07|Common|Silver
6619|Two on two|Finish level 2 with both robots alive|7332|21 Jul 2018 9:11:55 PM|553|582|95.02|Common|Silver
6619|Better together|Reach the exit with both robots|7331|21 Jul 2018 9:09:18 PM|570|582|97.94|Common|Bronze
6619|Blue tiles|Step on all of them in one level|7330|21 Jul 2018 9:08:52 PM|555|582|95.36|Common|Silver
7115|Energy Invasion Platinum|Good job! Completed all tasks!|7329|21 Jul 2018 3:29:17 AM|699|808|86.51|Common|Platinum
7115|Infinity|Passed level 30 in Endless mode|7328|21 Jul 2018 3:29:17 AM|702|808|86.88|Common|Gold
7115|Eternal|Passed level 25 in Endless mode|7327|21 Jul 2018 3:20:02 AM|704|808|87.13|Common|Gold
7115|Patience|Passed level 20 in Endless mode|7326|21 Jul 2018 3:10:58 AM|704|808|87.13|Common|Gold
7115|Diversity|Passed level 15 in Endless mode|7325|21 Jul 2018 2:59:03 AM|704|808|87.13|Common|Gold
7115|Tranquility|Passed level 10 in Endless mode|7324|21 Jul 2018 2:50:34 AM|704|808|87.13|Common|Silver
7115|Origin|Passed level 5 in Endless mode|7323|21 Jul 2018 2:44:08 AM|708|808|87.62|Common|Bronze
7115|Persistence|Linear mode complete!|7322|21 Jul 2018 2:36:30 AM|708|808|87.62|Common|Gold
7115|Strip|Passed level 20 in Linear mode|7321|21 Jul 2018 2:27:39 AM|709|808|87.75|Common|Gold
7115|Direction|Passed level 15 in Linear mode|7320|21 Jul 2018 2:19:32 AM|710|808|87.87|Common|Silver
7115|Linearity|Passed level 10 in Linear mode|7319|21 Jul 2018 2:11:59 AM|715|808|88.49|Common|Silver
7115|Parallelism|Passed level 5 in Linear mode|7318|21 Jul 2018 2:05:45 AM|719|808|88.99|Common|Bronze
7115|Salvation|Invasion complete!|7317|21 Jul 2018 1:59:15 AM|716|808|88.61|Common|Gold
7115|Defense|Passed level 20 in Invasion mode|7316|21 Jul 2018 1:44:57 AM|719|808|88.99|Common|Gold
7115|Maneuver|Passed level 15 in Invasion mode|7315|21 Jul 2018 1:33:22 AM|727|808|89.98|Common|Silver
7115|Intruders|Passed level 10 in Invasion mode|7314|21 Jul 2018 1:08:06 AM|739|808|91.46|Common|Silver
7115|Interception|Passed level 5 in Invasion mode|7313|21 Jul 2018 12:59:47 AM|759|808|93.94|Common|Silver
7115|Health pack|Got a special health pack bonus|7312|21 Jul 2018 12:59:04 AM|777|808|96.16|Common|Silver
7115|Good start|Invasion started|7311|21 Jul 2018 12:56:01 AM|788|808|97.52|Common|Bronze
6660|Platinum Midnight|Become a master collector|7310|20 Jul 2018 9:34:19 PM|1657|2067|80.16|Common|Platinum
6660|That IS bad luck|Die with 36 fragments|7309|20 Jul 2018 9:34:19 PM|1714|2067|82.92|Common|Gold
6660|So close|Die with 35 fragments|7308|20 Jul 2018 9:22:15 PM|1704|2067|82.44|Common|Gold
7233|Platinum Midnight|Unlock all the trophies.|7307|20 Jul 2018 8:01:47 PM|1198|1244|96.3|Common|Platinum
7233|Expert|Complete 40 levels.|7306|20 Jul 2018 8:01:47 PM|1202|1244|96.62|Common|Gold
7233|Stunned|Die by a laser.|7305|20 Jul 2018 7:51:24 PM|1206|1244|96.95|Common|Gold
7233|Professional|Complete 20 levels.|7304|20 Jul 2018 7:35:34 PM|1215|1244|97.67|Common|Gold
7233|Stabbed|Die by a spike.|7303|20 Jul 2018 7:19:04 PM|1232|1244|99.04|Common|Gold
7233|Not squared anymore|Die by a saw.|7302|20 Jul 2018 7:18:20 PM|1228|1244|98.71|Common|Gold
7233|Improving|Complete 10 levels.|7301|20 Jul 2018 7:17:37 PM|1233|1244|99.12|Common|Gold
7233|Went to explore|Die by getting out of a level.|7300|20 Jul 2018 7:14:07 PM|1239|1244|99.6|Common|Gold
7233|Engineer|Pull a lever.|7299|20 Jul 2018 7:10:54 PM|1236|1244|99.36|Common|Gold
7233|Starter|Complete 5 levels.|7298|20 Jul 2018 7:10:30 PM|1237|1244|99.44|Common|Gold
7233|You made it|Complete level 4 making Midnight's friend smile.|7297|20 Jul 2018 7:09:56 PM|1225|1244|98.47|Common|Gold
7233|Making friends|Bump into one of Midnight's friends.|7296|20 Jul 2018 7:09:54 PM|1238|1244|99.52|Common|Silver
7233|Not overworking|Get 3 stars in one level.|7295|20 Jul 2018 7:07:37 PM|1239|1244|99.6|Common|Gold
7233|Go into the light|Complete level 1.|7294|20 Jul 2018 7:07:35 PM|1242|1244|99.84|Common|Silver
7561|Expert Smarty Pants|Solve a 20x20 puzzle without using an X|7293|20 Jul 2018 6:38:36 PM|152|199|76.38|Common|Gold
7561|Expert Speed Demon|Solve a 20x20 puzzle in under 10 minutes|7292|20 Jul 2018 6:38:34 PM|149|199|74.87|Common|Silver
7561|Expert Puzzler|Solve a 20x20 puzzle|7291|20 Jul 2018 6:38:33 PM|159|199|79.9|Common|Bronze
7561|Talented Smarty Pants|Solve a 20x15 puzzle without using an X|7290|20 Jul 2018 6:29:42 PM|155|199|77.89|Common|Gold
7561|Talented Speed Demon|Solve a 20x15 puzzle in under 5 minutes|7289|20 Jul 2018 6:29:40 PM|150|199|75.38|Common|Silver
7561|Talented Puzzler|Solve a 20x15 puzzle|7288|20 Jul 2018 6:29:38 PM|158|199|79.4|Common|Bronze
7561|Adept Smarty Pants|Solve a 15x15 puzzle without using an X|7287|20 Jul 2018 6:22:16 PM|168|199|84.42|Common|Gold
7561|Adept Speed Demon|Solve a 15x15 puzzle in under 3 minutes|7286|20 Jul 2018 6:22:14 PM|160|199|80.4|Common|Silver
7561|Adept Puzzler|Solve a 15x15 puzzle|7285|20 Jul 2018 6:22:13 PM|171|199|85.93|Common|Bronze
7561|Casual Smarty Pants|Solve a 10x10 puzzle without using an X|7284|20 Jul 2018 6:17:03 PM|181|199|90.95|Common|Gold
7561|Casual Speed Demon|Solve a 10x10 puzzle in under 1 minute|7283|20 Jul 2018 6:17:01 PM|175|199|87.94|Common|Silver
7561|Casual Puzzler|Solve a 10x10 puzzle|7282|20 Jul 2018 6:17:00 PM|186|199|93.47|Common|Bronze
7561|Tiny Speed Demon|Solve a 5x5 puzzle in under 15 seconds|7281|20 Jul 2018 6:14:04 PM|183|199|91.96|Common|Silver
7561|Tiny Puzzler|Solve a 5x5 puzzle|7280|20 Jul 2018 6:07:39 PM|197|199|98.99|Common|Bronze
6772|SQUAREBOY VS BULLIES|DEFEAT ALL THE BULLIES|7279|20 Jul 2018 4:54:51 PM|788|914|86.21|Common|Platinum
6772|BULLYING IS UNCOOL|FINISH THE GAME|7278|20 Jul 2018 4:54:51 PM|790|914|86.43|Common|Gold
6772|BIGGER THEY ARE, HARDER THEY FALL|DEFEAT BIG BOSS BULLY|7277|20 Jul 2018 4:54:02 PM|790|914|86.43|Common|Gold
6772|A BLACK ROBE ALONE MAKETH NOT THE NINJA|DEFEAT NINJA BULLY ON THE SHIP DECK|7276|20 Jul 2018 4:15:44 PM|816|914|89.28|Common|Gold
6772|GOTCHA SLIPPERY NINJA|THROW A CRATE ON THE NINJA BULLY ON THE SHIP DECK|7275|20 Jul 2018 4:15:23 PM|812|914|88.84|Common|Gold
6772|STAND UP FOR EVERYONE|DEFEAT 300 BULLIES|7274|20 Jul 2018 4:07:10 PM|827|914|90.48|Common|Gold
6772|EARLY DELIVERY|HIT AN ENEMY WITH A CRATE|7273|20 Jul 2018 3:56:31 PM|820|914|89.72|Common|Silver
6772|HAYEAHH|THROW AN ENEMY|7272|20 Jul 2018 1:00:47 AM|892|914|97.59|Common|Bronze
6772|UNLEASHED|HIT AN ENEMY WITH A CHAIN|7271|20 Jul 2018 12:46:12 AM|857|914|93.76|Common|Silver
6772|BANDANAS ARE SILLY|DEFEAT BANDANA BULLY ON THE HIDEOUT ROOFTOP|7270|20 Jul 2018 12:46:11 AM|857|914|93.76|Common|Gold
6772|WEAPONS MASTER|HIT ENEMIES BEHIND AND IN FRONT OF YOU WITH A SINGLE SWING OF A WEAPON|7269|20 Jul 2018 12:46:00 AM|838|914|91.68|Common|Gold
6772|HOMERUN|HIT AN ENEMY WITH A BASEBALL BAT|7268|20 Jul 2018 12:45:53 AM|854|914|93.44|Common|Silver
6772|STAND UP FOR YOUR FRIENDS|DEFEAT 100 BULLIES|7267|20 Jul 2018 12:42:17 AM|869|914|95.08|Common|Silver
6772|TAKING OUT THE TRASH|HIT AN ENEMY WITH A TRASH CAN|7266|20 Jul 2018 12:42:07 AM|863|914|94.42|Common|Silver
6772|BOXING CHAMP|HIT AN ENEMY WITH A BOX|7265|20 Jul 2018 12:37:16 AM|873|914|95.51|Common|Silver
6772|TIRE OR TYRE?|HIT AN ENEMY WITH A TIRE|7264|20 Jul 2018 12:05:39 AM|889|914|97.26|Common|Silver
6772|WHAT A KICK|HIT AN ENEMY WITH A JUMP KICK|7263|20 Jul 2018 12:00:46 AM|908|914|99.34|Common|Bronze
6772|LIKE A TORNADO|HIT AN ENEMY WITH A SPIN PUNCH|7262|19 Jul 2018 11:59:59 PM|890|914|97.37|Common|Bronze
6772|A CLEAN SWEEP|HIT AN ENEMY WITH A SPIN KICK|7261|19 Jul 2018 10:42:16 PM|887|914|97.05|Common|Silver
6772|KNOWLEDGE IS KEY|OPEN THE MOVES LIST IN THE PAUSED MENU|7260|19 Jul 2018 10:41:46 PM|897|914|98.14|Common|Bronze
6772|STAND UP FOR YOURSELF|DEFEAT 10 BULLIES|7259|19 Jul 2018 10:41:31 PM|904|914|98.91|Common|Bronze
6772|STRIKER|HIT AN ENEMY WITH A STRIKE COMBO|7258|19 Jul 2018 10:40:18 PM|908|914|99.34|Common|Bronze
6772|TRAINING|DESTROY ALL THE DUMMIES IN THE DOJO|7257|19 Jul 2018 10:39:47 PM|907|914|99.23|Common|Bronze
6772|SO FAST|HIT AN ENEMY WITH A DASH ATTACK|7256|19 Jul 2018 10:39:44 PM|898|914|98.25|Common|Bronze
6772|EYES AT THE BACK|HIT AN ENEMY WITH A BACK PUNCH|7255|19 Jul 2018 10:39:38 PM|902|914|98.69|Common|Silver
6772|GOTCHA|GRAB AN ENEMY|7254|19 Jul 2018 10:38:51 PM|908|914|99.34|Common|Bronze
6772|UPPERCUT HERO|HIT AN ENEMY WITH A JUMP PUNCH|7253|19 Jul 2018 10:38:50 PM|907|914|99.23|Common|Bronze
6334|Energy Cycle Platinum|Good job! Completed all tasks!|7252|19 Jul 2018 8:10:23 PM|1651|1705|96.83|Common|Platinum
6334|Game Completed|Energy Cycle is complete|7251|19 Jul 2018 8:10:23 PM|1654|1705|97.01|Common|Gold
6334|Level 27 Completed|Part of the cycle is complete|7250|19 Jul 2018 8:09:32 PM|1658|1705|97.24|Common|Gold
6334|Level 24 Completed|Part of the cycle is complete|7249|19 Jul 2018 8:06:18 PM|1658|1705|97.24|Common|Gold
6334|Level 21 Completed|Part of the cycle is complete|7248|19 Jul 2018 8:03:54 PM|1658|1705|97.24|Common|Gold
6334|Level 18 Completed|Part of the cycle is complete|7247|19 Jul 2018 8:01:45 PM|1661|1705|97.42|Common|Silver
6334|Level 15 Completed|Part of the cycle is complete|7246|19 Jul 2018 7:59:34 PM|1661|1705|97.42|Common|Silver
6334|Level 12 Completed|Part of the cycle is complete|7245|19 Jul 2018 7:55:09 PM|1662|1705|97.48|Common|Silver
6334|Level 9 Completed|Part of the cycle is complete|7244|19 Jul 2018 7:53:04 PM|1671|1705|98.01|Common|Bronze
6334|Level 6 Completed|Part of the cycle is complete|7243|19 Jul 2018 7:51:17 PM|1674|1705|98.18|Common|Bronze
6334|Level 3 Completed|Part of the cycle is complete|7242|19 Jul 2018 7:49:48 PM|1685|1705|98.83|Common|Bronze
6334|Infinity Layer #50|Passed through layer #50 in Infinite Play mode|7241|19 Jul 2018 7:16:14 PM|1667|1705|97.77|Common|Gold
6334|Infinity Layer #40|Passed through layer #40 in Infinite Play mode|7240|19 Jul 2018 7:16:08 PM|1667|1705|97.77|Common|Gold
6334|Infinity Layer #30|Passed through layer #30 in Infinite Play mode|7239|19 Jul 2018 7:16:03 PM|1667|1705|97.77|Common|Silver
6334|Infinity Layer #20|Passed through layer #20 in Infinite Play mode|7238|19 Jul 2018 7:15:58 PM|1672|1705|98.06|Common|Silver
6334|Infinity Layer #10|Passed through layer #10 in Infinite Play mode|7237|19 Jul 2018 7:15:53 PM|1674|1705|98.18|Common|Bronze
6660|Super fast|Get 36 fragments in less than 10 Min|7236|19 Jul 2018 5:52:24 PM|1718|2067|83.12|Common|Gold
6660|The fastest one|Get 36 fragments in less than 6 Min|7235|19 Jul 2018 5:52:22 PM|1662|2067|80.41|Common|Gold
6660|The greatest gift|Get 36 fragments|7234|19 Jul 2018 5:52:20 PM|1720|2067|83.21|Common|Gold
6660|Stunned|Die by a laser|7233|19 Jul 2018 3:24:22 PM|2047|2067|99.03|Common|Gold
6660|Squared unicorn|Die by a spike|7232|19 Jul 2018 3:24:14 PM|2040|2067|98.69|Common|Gold
6660|At least you tried|Die with only 1 fragment|7231|19 Jul 2018 3:23:42 PM|2042|2067|98.79|Common|Gold
6660|Only the half left|Get 18 fragments|7230|19 Jul 2018 3:21:46 PM|1920|2067|92.89|Common|Gold
6660|Cut in half|Die by a saw|7229|19 Jul 2018 3:18:36 PM|2053|2067|99.32|Common|Gold
6660|Baby steps|Get 1 fragment|7228|19 Jul 2018 3:17:50 PM|2054|2067|99.37|Common|Gold
6352|Level 3 Completed|If you have sixty seconds worth of distance... run!|7227|19 Jul 2018 3:16:57 PM|482|538|89.59|Common|Bronze
6352|Level 2 Completed|It takes as much energy to wish as it does to plan.|7226|19 Jul 2018 3:14:02 PM|509|538|94.61|Common|Bronze
6352|Level 1 Completed|The energy of the mind is the essence of life.|7225|19 Jul 2018 3:12:52 PM|524|538|97.4|Common|Bronze
6334|Time Attack Layer #30|Passed through layer #30 in Time Attack mode|7224|19 Jul 2018 12:21:14 PM|1666|1705|97.71|Common|Gold
6334|Time Attack Layer #20|Passed through layer #20 in Time Attack mode|7223|19 Jul 2018 12:21:09 PM|1666|1705|97.71|Common|Gold
6334|Time Attack Layer #10|Passed through layer #10 in Time Attack mode|7222|19 Jul 2018 12:21:04 PM|1672|1705|98.06|Common|Silver
7125|Big Adventurer|Obtain all trophies|7221|19 Jul 2018 12:17:32 PM|3751|3830|97.94|Common|Platinum
7125|Stage 3 Completed|Complete Stage 3|7220|19 Jul 2018 12:17:32 PM|3753|3830|97.99|Common|Gold
7125|Level 12 Completed|Complete Level 12|7219|19 Jul 2018 12:17:26 PM|3753|3830|97.99|Common|Gold
7125|Triple the Defense|Raise your Defensive Shield to 3x|7218|19 Jul 2018 12:16:55 PM|3751|3830|97.94|Common|Bronze
7125|Level 11 Completed|Complete Level 11|7217|19 Jul 2018 12:15:41 PM|3755|3830|98.04|Common|Gold
7125|Level 10 Completed|Complete Level 10|7216|19 Jul 2018 12:13:30 PM|3755|3830|98.04|Common|Gold
7125|Level 9 Completed|Complete Level 9|7215|19 Jul 2018 12:11:45 PM|3761|3830|98.2|Common|Gold
7125|Stage 2 Completed|Complete Stage 2|7214|19 Jul 2018 8:57:23 AM|3763|3830|98.25|Common|Gold
7125|Level 8 Completed|Complete Level 8|7213|19 Jul 2018 8:57:17 AM|3764|3830|98.28|Common|Silver
7125|Level 7 Completed|Complete Level 7|7212|19 Jul 2018 8:54:51 AM|3767|3830|98.36|Common|Silver
7125|Level 6 Completed|Complete Level 6|7211|19 Jul 2018 8:49:56 AM|3800|3830|99.22|Common|Silver
7125|Level 5 Completed|Complete Level 5|7210|19 Jul 2018 8:31:45 AM|3810|3830|99.48|Common|Silver
7125|Double the Defense|Raise your Defensive Shield to 2x|7209|19 Jul 2018 8:31:12 AM|3812|3830|99.53|Common|Bronze
7125|Shield Up|Collect your first Defensive Shield|7208|19 Jul 2018 8:30:26 AM|3812|3830|99.53|Common|Bronze
7125|Stage 1 Completed|Complete Stage 1|7207|19 Jul 2018 8:29:58 AM|3815|3830|99.61|Common|Gold
7125|Level 4 Completed|Complete Level 4|7206|19 Jul 2018 8:29:47 AM|3817|3830|99.66|Common|Silver
7125|Triple the Power|Raise your Attack power to 3x|7205|19 Jul 2018 8:29:29 AM|3817|3830|99.66|Common|Bronze
7125|Level 3 Completed|Complete Level 3|7204|19 Jul 2018 8:28:12 AM|3816|3830|99.63|Common|Silver
7125|Double the Power|Raise your Attack power to 2x|7203|19 Jul 2018 8:27:14 AM|3817|3830|99.66|Common|Bronze
7125|Attack Power Up|Collect your first Attack Power Up|7202|19 Jul 2018 8:26:39 AM|3817|3830|99.66|Common|Bronze
7125|Level 2 Completed|Complete Level 2|7201|19 Jul 2018 8:25:46 AM|3819|3830|99.71|Common|Silver
7125|Level 1 Completed|Complete Level 1|7200|19 Jul 2018 8:24:11 AM|3826|3830|99.9|Common|Silver
4248|Born To Spell|Spell 3000 words|7199|19 Jul 2018 7:38:56 AM|4878|35601|13.7|Rare|Gold
1793|Pretty|315 seconds to play|7198|19 Jul 2018 7:20:34 AM|6197|6348|97.62|Common|Gold
1793|Lovely|225 seconds to play|7197|19 Jul 2018 7:18:37 AM|6230|6348|98.14|Common|Gold
1793|Cute|135 seconds to play|7196|19 Jul 2018 7:17:07 AM|6284|6348|98.99|Common|Gold
1793|Charming|45 seconds to play|7195|19 Jul 2018 7:15:37 AM|6328|6348|99.68|Common|Silver
1793|Kawaii|15 seconds to play|7194|19 Jul 2018 7:15:07 AM|6341|6348|99.89|Common|Bronze
7854|Platinum Destronaut|Get all the trophies|7193|18 Jul 2018 9:18:46 PM|732|745|98.26|Common|Platinum
7854|Challenge me|Complete 12 challenges|7192|18 Jul 2018 9:18:46 PM|733|745|98.39|Common|Gold
7854|Excellent|Reach to 100K points in Classic Mode|7191|18 Jul 2018 9:13:27 PM|736|745|98.79|Common|Gold
7854|Working hard|Reach to 50K points in Classic Mode|7190|18 Jul 2018 9:13:25 PM|739|745|99.19|Common|Gold
7854|Well done|Reach to 25K points in Classic Mode|7189|18 Jul 2018 9:13:24 PM|742|745|99.6|Common|Gold
7854|Countdown|Reach 10K in Time Attack Mode|7188|18 Jul 2018 9:11:23 PM|738|745|99.06|Common|Gold
7854|Saving the galaxy|Reach 1K in Hardcore Mode|7187|18 Jul 2018 9:09:29 PM|737|745|98.93|Common|Gold
7854|Mastering challenges|Complete 6 challenges|7186|18 Jul 2018 9:02:42 PM|737|745|98.93|Common|Gold
7854|I like challenges|Complete 3 challenges|7185|18 Jul 2018 9:00:18 PM|741|745|99.46|Common|Gold
7854|The whole crew was lost|Die once|7184|18 Jul 2018 8:59:11 PM|744|745|99.87|Common|Silver
