718|Faery warrior|Eliminate the first boss.|5092|29 Jul 2018 7:01:32 PM|5728|7768|73.74|Common|Bronze
1571|CS:GO Platinum Trophy|Collected all other CS:GO trophies|5091|29 Jul 2018 3:20:18 AM|9939|39191|25.36|Uncommon|Platinum
1571|Dead Shepherd|Kill an enemy who is leading the hostages without injuring the hostages|5090|29 Jul 2018 3:20:17 AM|20686|39191|52.78|Common|Gold
1571|The Cleaner|In Classic mode, kill five enemies in a single round|5089|29 Jul 2018 3:10:17 AM|21254|39191|54.23|Common|Gold
1571|Blast Will and Testament|Win a round by picking up the bomb from a fallen comrade and successfully planting it|5088|29 Jul 2018 3:03:05 AM|15083|39191|38.49|Uncommon|Silver
1571|Blind Fury|Kill an enemy while you are blinded from a flashbang|5087|29 Jul 2018 2:43:55 AM|20558|39191|52.46|Common|Silver
1571|The Unstoppable Force|Kill four enemies within a single round|5086|29 Jul 2018 2:43:16 AM|29943|39191|76.4|Common|Silver
1571|Make the Cut|Win a knife fight|5085|29 Jul 2018 2:41:56 AM|17563|39191|44.81|Uncommon|Bronze
1571|Denied!|Kill a player who is on gold knife level in Arms Race Mode|5084|29 Jul 2018 2:14:38 AM|19862|39191|50.68|Common|Gold
1571|Eye to Eye|Kill a zoomed-in enemy sniper with a sniper rifle of your own|5083|29 Jul 2018 2:10:24 AM|24583|39191|62.73|Common|Bronze
1571|Bunny Hunt|Kill an airborne enemy|5082|29 Jul 2018 2:06:24 AM|17996|39191|45.92|Uncommon|Silver
1571|Rampage!|Win an Arms Race match without dying|5081|28 Jul 2018 10:26:50 PM|11541|39191|29.45|Uncommon|Gold
1571|Insurgent|Kill an enemy who is dominating you|5080|28 Jul 2018 10:25:53 PM|25024|39191|63.85|Common|Gold
1571|Shot With Their Pants Down|Kill an enemy while they are reloading|5079|28 Jul 2018 10:22:55 PM|35309|39191|90.09|Common|Bronze
1571|Still Alive|Survive more than 30 seconds with less than ten health in Arms Race or Demolition mode|5078|28 Jul 2018 10:08:08 PM|19491|39191|49.73|Uncommon|Gold
1571|Overkill|Kill an enemy whom you are already dominating|5077|28 Jul 2018 9:50:10 PM|27015|39191|68.93|Common|Gold
1571|Born Ready|Kill an enemy with the first bullet after your respawn protection ends in Arms Race mode|5076|28 Jul 2018 9:49:53 PM|25665|39191|65.49|Common|Silver
1571|Repeat Offender|Dominate an enemy|5075|28 Jul 2018 9:49:28 PM|28724|39191|73.29|Common|Gold
1571|Magic Bullet|Kill an enemy with the last bullet in your magazine (excluding sniper rifles and Zeus x27)|5074|28 Jul 2018 9:48:40 PM|32849|39191|83.82|Common|Silver
1571|FIRST!|Be the first player to get a kill in an Arms Race or Demolition match|5073|28 Jul 2018 9:46:59 PM|23842|39191|60.84|Common|Gold
2200|Platinum|Awarded when all other trophies have been unlocked.|5072|27 Jul 2018 2:44:17 AM|314|1170|26.84|Uncommon|Platinum
2200|I Got This, Newton|Use Newton less than 15 times in the dark room|5071|27 Jul 2018 2:44:16 AM|374|1170|31.97|Uncommon|Gold
2200|The Outsider|Visit all deadlocks in The Deep|5070|27 Jul 2018 2:12:19 AM|391|1170|33.42|Uncommon|Silver
2200|Chosen of Cthulhu|Pass Act III without dying|5069|27 Jul 2018 1:56:22 AM|315|1170|26.92|Uncommon|Gold
2200|Servitor of the Outer Gods|For completing the game|5068|26 Jul 2018 10:51:39 PM|377|1170|32.22|Uncommon|Gold
1823|Platinum Trophy|For collecting all trophies|5067|25 Jul 2018 1:40:10 AM|3501|7271|48.15|Uncommon|Platinum
1823|Radio Silence|Find and destroy 100% of special objects.|5066|25 Jul 2018 1:40:09 AM|3506|7271|48.22|Uncommon|Gold
1823|Ordering Disruptions!|Find and destroy 75% of special objects.|5065|25 Jul 2018 1:21:00 AM|3537|7271|48.65|Uncommon|Bronze
1823|Demolition Addict|Destroy 1000 total destructible objects.|5064|25 Jul 2018 12:15:37 AM|3671|7271|50.49|Common|Silver
1823|Waste|Fire 25,000 rounds of ammunition.|5063|25 Jul 2018 12:06:49 AM|3700|7271|50.89|Common|Gold
1823|All Cleared|Complete all missions on Veteran Mode.|5062|25 Jul 2018 12:03:46 AM|3661|7271|50.35|Common|Gold
2200|Gates of Shub-Niggurath|Survive the From Beyond level by closing all 3 gates|5061|23 Jul 2018 10:53:09 PM|395|1170|33.76|Uncommon|Gold
1823|Radio Breaker|Find and destroy 50% of special objects.|5060|22 Jul 2018 6:04:20 PM|3603|7271|49.55|Uncommon|Bronze
1823|Collateral Damage|Destroy 500 total destructible objects.|5059|22 Jul 2018 6:02:10 PM|3876|7271|53.31|Common|Silver
1823|Headhunter|Perform 150 total headshots.|5058|22 Jul 2018 5:36:17 PM|3726|7271|51.24|Common|Gold
1823|Trigger Happy|Finish any mission with 5% or less accuracy.|5057|22 Jul 2018 5:13:39 PM|3694|7271|50.8|Common|Silver
1823|Half Cleared|Complete all missions on Rookie Mode.|5056|22 Jul 2018 5:01:30 PM|4179|7271|57.47|Common|Silver
1823|World Peace|Complete the 12th mission.|5055|22 Jul 2018 5:01:24 PM|4162|7271|57.24|Common|Bronze
1823|Marksman|Perform 100 total headshots.|5054|22 Jul 2018 4:59:51 PM|3833|7271|52.72|Common|Silver
1823|John R.|Score 1,000 total kills.|5053|22 Jul 2018 4:51:01 PM|4173|7271|57.39|Common|Gold
2200|Path of the Slayer|For killing the first monster|5052|22 Jul 2018 3:44:33 PM|416|1170|35.56|Uncommon|Silver
2200|Into the Abyss|For completing Act II|5051|22 Jul 2018 3:34:55 PM|420|1170|35.9|Uncommon|Gold
2200|Party Crasher|Break the glass in the Reboot|5050|22 Jul 2018 3:33:59 PM|420|1170|35.9|Uncommon|Silver
1823|Package Secured|Complete the 10th mission.|5049|21 Jul 2018 8:48:55 PM|4199|7271|57.75|Common|Bronze
1823|Apache Hero|Complete the 8th mission.|5048|21 Jul 2018 8:18:35 PM|4304|7271|59.19|Common|Bronze
1823|Fragile World|Destroy 200 total destructible objects.|5047|21 Jul 2018 8:11:15 PM|4369|7271|60.09|Common|Bronze
1823|Base Defender|Complete the 7th mission.|5046|21 Jul 2018 8:07:44 PM|4379|7271|60.23|Common|Bronze
1823|War Hero|Score 500 total kills.|5045|21 Jul 2018 7:42:25 PM|4470|7271|61.48|Common|Silver
1823|Hawk Eye|Complete the 5th mission.|5044|21 Jul 2018 7:33:57 PM|4542|7271|62.47|Common|Bronze
1823|Eagle Eye|Score 50 long range kills in total.|5043|21 Jul 2018 7:30:20 PM|4542|7271|62.47|Common|Bronze
1823|Chain Gamma|Chain together 10 consecutive kills.|5042|21 Jul 2018 7:30:12 PM|3689|7271|50.74|Common|Silver
1823|Chain Beta|Chain together 7 consecutive kills.|5041|21 Jul 2018 7:30:04 PM|4058|7271|55.81|Common|Bronze
1823|Chain Alpha|Chain together 5 consecutive kills.|5040|21 Jul 2018 7:29:55 PM|4696|7271|64.59|Common|Bronze
1823|Sharpshooter|Score 15 long range kills in total.|5039|21 Jul 2018 7:28:43 PM|4568|7271|62.82|Common|Bronze
1823|Good Aim|Perform 50 total headshots.|5038|21 Jul 2018 7:22:26 PM|4209|7271|57.89|Common|Bronze
1823|Top Secret|Complete the 3rd mission.|5037|21 Jul 2018 4:54:33 PM|4697|7271|64.6|Common|Bronze
1823|Ranger|Score 250 total kills.|5036|21 Jul 2018 4:51:54 PM|4722|7271|64.94|Common|Bronze
1823|Big Flood|Complete the 2nd mission.|5035|21 Jul 2018 4:02:59 PM|4970|7271|68.35|Common|Bronze
1823|Slaughter|Perform 6 splash damage kills simultaneously.|5034|21 Jul 2018 3:57:03 PM|4713|7271|64.82|Common|Silver
1823|Crowd Crusher|Perform 5 splash damage kills simultaneously.|5033|21 Jul 2018 3:56:57 PM|5020|7271|69.04|Common|Bronze
1823|Multi-kill|Perform 4 splash damage kills simultaneously.|5032|21 Jul 2018 3:56:49 PM|5296|7271|72.84|Common|Bronze
1198|Platinum Trophy|For collecting all trophies|5031|21 Jul 2018 3:00:09 AM|4722|10749|43.93|Uncommon|Platinum
1198|Golden Bullet|For 25 000 fired bullets|5030|21 Jul 2018 3:00:08 AM|4955|10749|46.1|Uncommon|Gold
1198|Silver Bullet|For 20 000 fired bullets|5029|21 Jul 2018 2:31:07 AM|5062|10749|47.09|Uncommon|Silver
1198|Veteran|For finishing all levels on veteran difficulty|5028|21 Jul 2018 2:28:15 AM|4783|10749|44.5|Uncommon|Bronze
1198|Bronze Bullet|For 15 000 fired bullets|5027|21 Jul 2018 1:42:07 AM|5280|10749|49.12|Uncommon|Bronze
1198|Headhunter|For 300 headshots in total|5026|21 Jul 2018 1:37:22 AM|4856|10749|45.18|Uncommon|Gold
1198|John R.|For 3000 kills in total|5025|21 Jul 2018 1:23:48 AM|4966|10749|46.2|Uncommon|Gold
1198|Demolition Addict|500 destructible objects destroyed in total|5024|21 Jul 2018 12:42:30 AM|5211|10749|48.48|Uncommon|Gold
1198|Rookie|For finishing all levels on rookie difficulty|5023|21 Jul 2018 12:20:11 AM|5403|10749|50.27|Common|Bronze
1198|The Crusher|For completing operation 11 and 12|5022|21 Jul 2018 12:20:06 AM|5325|10749|49.54|Uncommon|Bronze
1198|Close Call|For finishing any mission with only one Health bar left|5021|20 Jul 2018 11:57:39 PM|5809|10749|54.04|Common|Silver
1198|Survivor|For completing operation 9 and 10|5020|20 Jul 2018 11:57:33 PM|5756|10749|53.55|Common|Bronze
1198|Ruthless|For completing operation 7 and 8|5019|20 Jul 2018 11:29:39 PM|5872|10749|54.63|Common|Bronze
1198|Demolition Man|250 destructible objects destroyed in total|5018|20 Jul 2018 11:23:15 PM|5969|10749|55.53|Common|Silver
1198|Without a Scratch|For finishing any mission without being hit (except shooting ranges and “Hawk Eyes - The Escort”)|5017|20 Jul 2018 11:19:14 PM|5267|10749|49.0|Uncommon|Gold
1198|Last Minute Hero|For completing operation 5 and 6|5016|20 Jul 2018 10:25:30 PM|6002|10749|55.84|Common|Bronze
1198|Exterminator|For 1000 kills in total|5015|20 Jul 2018 10:22:26 PM|6032|10749|56.12|Common|Silver
1198|Sharpshooter|For 100 headshots in total|5014|20 Jul 2018 10:14:54 PM|5446|10749|50.67|Common|Silver
1198|Trigger Happy|For finishing any mission with accuracy 5% or lower|5013|20 Jul 2018 2:40:41 AM|5306|10749|49.36|Uncommon|Bronze
1198|No One Left Behind|For completing operation 3 and 4|5012|20 Jul 2018 2:39:13 AM|6433|10749|59.85|Common|Bronze
1198|Marksman|For 50 headshots in total|5011|20 Jul 2018 2:33:14 AM|6174|10749|57.44|Common|Bronze
1198|Marine|For 500 kills in total|5010|20 Jul 2018 1:55:47 AM|6627|10749|61.65|Common|Bronze
1198|Demolition Enthusiast|100 destructible objects destroyed in total|5009|20 Jul 2018 1:53:10 AM|6547|10749|60.91|Common|Bronze
1198|Chain C|For chain of 10 kills|5008|20 Jul 2018 1:52:47 AM|5114|10749|47.58|Uncommon|Gold
1198|Chain B|For chain of 7 kills|5007|20 Jul 2018 1:52:39 AM|6168|10749|57.38|Common|Silver
1198|Chain A|For chain of 5 kills|5006|20 Jul 2018 1:47:25 AM|7124|10749|66.28|Common|Bronze
1198|The Defender|For completing operation 1 and 2|5005|20 Jul 2018 1:42:42 AM|7643|10749|71.1|Common|Bronze
1198|Pinpoint Accurate|For finishing any mission with accuracy 50% or higher|5004|20 Jul 2018 1:33:49 AM|6909|10749|64.28|Common|Silver
673|O.C.M (Obsessive Compulsive Monster)|Totally destroy every building in a level.|5003|18 Jul 2018 10:19:26 PM|1108|14186|7.81|Very Rare|Bronze
673|Megabucks Monster Club|Cause over $850,000 worth of property damage within a single mission.|5002|18 Jul 2018 10:10:59 PM|1084|14186|7.64|Very Rare|Bronze
673|Inspector Monster|View every monster part in the Monster Lab.|5001|18 Jul 2018 10:05:41 PM|1421|14186|10.02|Rare|Bronze
673|Domination|Complete all missions in every level with all awards.|5000|18 Jul 2018 10:03:03 PM|1496|14186|10.55|Rare|Gold
673|Mwuhahahahaaa|Complete all missions in every level.|4999|18 Jul 2018 2:13:19 AM|2192|14186|15.45|Rare|Silver
673|Disposable Heroes|Lose 10 monsters in the course of play.|4998|16 Jul 2018 9:43:33 PM|5536|14186|39.02|Uncommon|Bronze
673|Demolition Master|Destroy 100 buildings.|4997|15 Jul 2018 8:21:35 PM|3083|14186|21.73|Uncommon|Silver
673|Monster Modelling School|Build and use 6 different monsters in the game.|4996|15 Jul 2018 5:17:11 PM|5115|14186|36.06|Uncommon|Silver
673|Twinkle toes|Complete a race level and cause less than $50,000 worth of damage.|4995|15 Jul 2018 5:05:45 PM|1442|14186|10.16|Rare|Bronze
673|Monster Games|Run over 1000m, throw an object over 50m in a single throw, and jump over 50m in a single jump. All in one level.|4994|15 Jul 2018 3:59:01 PM|9254|14186|65.23|Common|Bronze
673|Creature Feature|Make your first monster.|4993|15 Jul 2018 3:44:17 PM|11914|14186|83.98|Common|Bronze
673|Monster Mash-Up|Compete in a multi-player game.|4992|15 Jul 2018 3:38:35 PM|5242|14186|36.95|Uncommon|Bronze
673|I Wonder What's for Dinner|First time monster eats.|4991|15 Jul 2018 3:25:35 PM|13242|14186|93.35|Common|Bronze
2808|Diablo III: Reaper of Souls Platinum Trophy|Collected all other Diablo III: Reaper of Souls trophies.|4990|15 Jul 2018 2:32:09 PM|4051|48818|8.3|Very Rare|Platinum
2808|Up All Night To Get Lucky|Equip all Inventory slots with Legendary items that have a minimum required level of 70 or higher.|4989|15 Jul 2018 2:32:08 PM|10657|48818|21.83|Uncommon|Silver
2200|Rise Wild|Jump from the last swing in the ruptured challenge without using vertical platform|4988|14 Jul 2018 2:27:24 PM|444|1170|37.95|Uncommon|Silver
2200|Roboticist|For discovering Newton|4987|13 Jul 2018 10:05:41 PM|463|1170|39.57|Uncommon|Silver
2200|Unstoppable|10 levels in a row without dying in Act II|4986|11 Jul 2018 10:56:51 PM|356|1170|30.43|Uncommon|Gold
2200|Magtech Savant|For discovering the Mod Cube|4985|10 Jul 2018 10:06:02 PM|527|1170|45.04|Uncommon|Bronze
2200|Born Magrunner|For completing Intermediate Integration in less than 5 minutes|4984|10 Jul 2018 12:15:02 AM|480|1170|41.03|Uncommon|Silver
2200|From the Streets...|For completing Act I|4983|10 Jul 2018 12:14:46 AM|598|1170|51.11|Common|Silver
2200|Champion|For completing Introductory Fusion in less than 5 minutes|4982|10 Jul 2018 12:03:37 AM|510|1170|43.59|Uncommon|Silver
2200|Magtech Artist|For completing Platform Test in less than 5 minutes|4981|9 Jul 2018 11:53:33 PM|536|1170|45.81|Uncommon|Silver
2200|Grav Master|For completing Advanced Platform in less than 5 minutes|4980|9 Jul 2018 11:33:46 PM|522|1170|44.62|Uncommon|Silver
2200|Beam Rider|For completing Intermediate Platform in less than 5 minutes|4979|9 Jul 2018 11:28:48 PM|687|1170|58.72|Common|Silver
2200|Looking Glass|For completing Introductory Integration in less than 5 minutes|4978|9 Jul 2018 11:25:43 PM|622|1170|53.16|Common|Silver
2200|Magtech Engineer|For discovering the Cube Holder|4977|9 Jul 2018 11:25:25 PM|754|1170|64.44|Common|Bronze
2200|Competitor|For completing Intermediate Cube in less than 5 minutes|4976|9 Jul 2018 10:31:56 PM|646|1170|55.21|Common|Silver
2200|Quick Thinking|For completing Introductory Platform in less than 5 minutes|4975|9 Jul 2018 10:28:12 PM|804|1170|68.72|Common|Silver
2200|Tech Wiz|For completing Introductory Jumper in less than 5 minutes|4974|9 Jul 2018 10:26:00 PM|892|1170|76.24|Common|Silver
2200|Natural|For completing Introductory Cube in less than 2 minutes|4973|9 Jul 2018 10:20:52 PM|760|1170|64.96|Common|Silver
2645|Moving On|Collected every trophy in the game|4972|9 Jul 2018 10:08:51 PM|7404|18445|40.14|Uncommon|Platinum
2645|Collector All|Collected all of the artifacts|4971|9 Jul 2018 10:08:50 PM|7417|18445|40.21|Uncommon|Gold
2645|Ashes to Ashes|Uncovered the Ashes to Ashes ghost story|4970|9 Jul 2018 10:08:44 PM|8375|18445|45.41|Uncommon|Bronze
2645|Julia's Story|Learned about Julia's Life|4969|9 Jul 2018 9:59:43 PM|7803|18445|42.3|Uncommon|Bronze
2645|Cassandra's Story|Learned about Cassandra's Life|4968|8 Jul 2018 8:18:41 PM|9484|18445|51.42|Common|Bronze
2645|Baxter's Story|Learned about Baxter's Life|4967|8 Jul 2018 7:40:44 PM|12940|18445|70.15|Common|Bronze
2645|Codex|Discovered the meaning of the supernatural graffiti|4966|8 Jul 2018 7:16:21 PM|7494|18445|40.63|Uncommon|Silver
2645|The Witch Trials|Discovered information about the witch trials|4965|8 Jul 2018 7:13:33 PM|8548|18445|46.34|Uncommon|Bronze
2645|Terror on the Tracks|Uncovered The Terror on the Tracks ghost story|4964|8 Jul 2018 7:13:13 PM|8927|18445|48.4|Uncommon|Bronze
2645|Scorned|Helped Katy find peace|4963|8 Jul 2018 6:41:34 PM|12876|18445|69.81|Common|Bronze
2645|Man in the Box|Uncovered the Man in the Box ghost story|4962|8 Jul 2018 6:32:34 PM|10046|18445|54.46|Common|Bronze
2645|Eternal Flame|Uncovered the Eternal Flame ghost story|4961|8 Jul 2018 5:39:58 PM|8769|18445|47.54|Uncommon|Bronze
2645|The Bell Killer's Story|Learned about the Bell Killer|4960|8 Jul 2018 5:21:06 PM|7725|18445|41.88|Uncommon|Bronze
2645|Carnage|Helped Brad find peace|4959|8 Jul 2018 5:03:19 PM|11831|18445|64.14|Common|Bronze
2645|The Stalwart Specter|Uncovered The Stalwart Specter ghost story|4958|8 Jul 2018 4:05:48 PM|10455|18445|56.68|Common|Bronze
2645|Salem's History|Discovered Salem's history|4957|8 Jul 2018 3:40:33 PM|8078|18445|43.8|Uncommon|Bronze
2645|The Bell Tower Banshee|Uncovered The Bell Tower Banshee ghost story|4956|8 Jul 2018 3:32:34 PM|11185|18445|60.64|Common|Bronze
2645|The Missing Body|Helped Ingrid find peace|4955|8 Jul 2018 3:38:40 AM|14027|18445|76.05|Common|Bronze
2645|A Watery Grave|Uncovered the Watery Grave ghost story|4954|8 Jul 2018 3:34:11 AM|12541|18445|67.99|Common|Bronze
2645|Tightening the Noose|Stopped Abigail and saved Rex and Joy|4953|8 Jul 2018 2:10:02 AM|11667|18445|63.25|Common|Gold
2645|Judgement|Discovered the Bell Killer's secrets|4952|8 Jul 2018 1:55:01 AM|11768|18445|63.8|Common|Bronze
2645|Ghosts Never Die|Investigated the murder of Iris|4951|8 Jul 2018 1:29:59 AM|12026|18445|65.2|Common|Bronze
2645|Wicked Tempers|Discovered links between the witch trials and the Bell Killer murders|4950|8 Jul 2018 12:55:00 AM|12286|18445|66.61|Common|Bronze
2645|Collector 150|Collected 150 artifacts|4949|8 Jul 2018 12:38:19 AM|11391|18445|61.76|Common|Bronze
2645|Lost Causes|Learned the fate of Rose and helped Iris escape the asylum|4948|8 Jul 2018 12:34:29 AM|12537|18445|67.97|Common|Bronze
2645|Ashland|Discovered what happened to Sophia|4947|7 Jul 2018 8:49:55 PM|13006|18445|70.51|Common|Bronze
2645|The Heirloom|Uncovered The Heirloom ghost story|4946|7 Jul 2018 8:45:35 PM|9046|18445|49.04|Uncommon|Bronze
2645|Teleporter|Teleported for the first time|4945|7 Jul 2018 8:21:14 PM|13280|18445|72.0|Common|Bronze
2645|Collector 100|Collected 100 artifacts|4944|7 Jul 2018 8:00:38 PM|12922|18445|70.06|Common|Bronze
2645|Half-Truths and Whole Lies|Helped the witness escape the police station and gained an ally|4943|4 Jul 2018 4:36:31 PM|13633|18445|73.91|Common|Bronze
2645|Rex's Story|Learned about Rex's Life|4942|4 Jul 2018 2:11:06 AM|13215|18445|71.65|Common|Bronze
2645|Ronan's Story|Learned about Ronan's Life|4941|4 Jul 2018 2:08:53 AM|9571|18445|51.89|Common|Bronze
2645|Collector 75|Collected 75 artifacts|4940|4 Jul 2018 2:04:51 AM|13506|18445|73.22|Common|Bronze
2645|Collector 50|Collected 50 artifacts|4939|4 Jul 2018 1:45:22 AM|14040|18445|76.12|Common|Bronze
2645|Makeshift Sanctuary|Found the witness and learned what she knew|4938|4 Jul 2018 1:34:50 AM|14392|18445|78.03|Common|Bronze
2429|Paradise Memoirs|Unlock All Trophies in FarCry Classic.|4937|3 Jul 2018 11:46:51 PM|4173|13295|31.39|Uncommon|Platinum
2429|Carver Style|Complete the game in Hard or Realistic difficulty.|4936|3 Jul 2018 11:46:50 PM|4300|13295|32.34|Uncommon|Gold
1973|Falling star|Make a wish.|4935|3 Jul 2018 11:33:21 PM|35926|108885|32.99|Uncommon|Bronze
1973|Wishing Well|You threw someone's ball down a well… Shame on you.|4934|3 Jul 2018 11:28:27 PM|42425|108885|38.96|Uncommon|Bronze
1973|Take a Break|You took a break from adventuring.|4933|3 Jul 2018 11:08:22 PM|36470|108885|33.49|Uncommon|Bronze
2069|Mutant|Finish the game in Extreme mode|4932|3 Jul 2018 3:57:06 AM|120|2883|4.16|Ultra Rare|Gold
2069|Hard as nails|Finish the game in Difficult mode|4931|3 Jul 2018 3:56:58 AM|140|2883|4.86|Ultra Rare|Silver
2069|Specialist|Unlock every skill and upgrade in a single skill tree|4930|3 Jul 2018 2:29:37 AM|206|2883|7.15|Very Rare|Bronze
2069|Completionist|Finish all of the secondary quests in Mars: War Logs|4929|3 Jul 2018 2:28:07 AM|140|2883|4.86|Ultra Rare|Silver
2645|Possess the Cat|Possessed the cat|4928|1 Jul 2018 5:37:06 PM|14931|18445|80.95|Common|Bronze
2645|Collector 25|Collected 25 artifacts|4927|1 Jul 2018 5:34:37 PM|14895|18445|80.75|Common|Bronze
2645|Amnesia|Helped Julie find peace|4926|1 Jul 2018 4:24:45 PM|14311|18445|77.59|Common|Bronze
2645|Discover Remove|Used Remove for the first time|4925|1 Jul 2018 4:17:56 PM|15404|18445|83.51|Common|Bronze
2645|One of Us|Revisited the scene of your murder and discovered there was a witness|4924|1 Jul 2018 4:14:48 PM|15693|18445|85.08|Common|Bronze
2645|Collector 10|Collected 10 artifacts|4923|1 Jul 2018 4:07:11 PM|15807|18445|85.7|Common|Bronze
2645|Exorcist|Defeated a demon|4922|1 Jul 2018 3:42:58 PM|16798|18445|91.07|Common|Gold
2645|Poltergeist|Used Poltergeist for the first time|4921|1 Jul 2018 3:41:44 PM|16036|18445|86.94|Common|Bronze
2645|Interrogator|Interrogated a ghost for the first time|4920|1 Jul 2018 3:37:56 PM|16465|18445|89.27|Common|Bronze
2645|Discover Reveal|Used Reveal for the first time|4919|1 Jul 2018 3:33:53 PM|17042|18445|92.39|Common|Bronze
2645|Collector 1|Collected an artifact|4918|1 Jul 2018 3:33:14 PM|17079|18445|92.59|Common|Bronze
2645|Investigator|Completed the first investigation|4917|1 Jul 2018 3:31:46 PM|17379|18445|94.22|Common|Bronze
2645|Mindreader|Used Mind Read for the first time|4916|1 Jul 2018 3:19:33 PM|17518|18445|94.97|Common|Bronze
2645|The Death Wish of a Shady Man|Became a ghost and met a strange ghost girl|4915|1 Jul 2018 3:02:10 PM|17674|18445|95.82|Common|Silver
