5531|I am Mayonnaise!|Talking about life. (10 hits, follow the life)|7717|11 Jul 2018 4:36:00 AM|44137|45221|97.6|Common|Bronze
5531|Talking about life|Philosophy. (10 hits, follow the life)|7716|11 Jul 2018 4:35:53 AM|44167|45221|97.67|Common|Bronze
5531|Philosophy|Part of life. (10 hits, follow the life)|7715|11 Jul 2018 4:35:47 AM|44194|45221|97.73|Common|Bronze
5531|Part of life|Muscles. (10 hits, follow the life)|7714|11 Jul 2018 4:35:39 AM|44212|45221|97.77|Common|Bronze
5531|Muscles|Move. (10 hits, follow the life)|7713|11 Jul 2018 4:35:32 AM|44233|45221|97.82|Common|Bronze
5531|Move|Just kidding... (10 hits, follow the life)|7712|11 Jul 2018 4:35:25 AM|44258|45221|97.87|Common|Bronze
5531|Just kidding...|The Box of Love. (10 hits, follow the life)|7711|11 Jul 2018 4:35:15 AM|44366|45221|98.11|Common|Bronze
5531|Nosey Caesar|Hit 550 times!|7710|11 Jul 2018 4:35:00 AM|44863|45221|99.21|Common|Bronze
5531|Dad|Like that old time Rock and Roll! (Hit this 50 times)|7709|11 Jul 2018 4:34:31 AM|44396|45221|98.18|Common|Bronze
5531|Go eat cake|Hit 500 times!|7708|11 Jul 2018 4:34:29 AM|44898|45221|99.29|Common|Bronze
5531|Topless!|Keep wearing the leopard (Hit this 100 times)|7707|11 Jul 2018 4:34:17 AM|44439|45221|98.27|Common|Bronze
5531|Cheetah|Wear the bikini. (Hit this 50 times)|7706|11 Jul 2018 4:33:52 AM|44584|45221|98.59|Common|Bronze
5531|20th century diet|Hit 350 times!|7705|11 Jul 2018 4:33:33 AM|44933|45221|99.36|Common|Bronze
5531|Rain|Spin the yarn. (Hit this 50 times)|7704|11 Jul 2018 4:33:25 AM|44520|45221|98.45|Common|Bronze
5531|Micro downsizing|Hit 200 times!|7703|11 Jul 2018 4:32:52 AM|44977|45221|99.46|Common|Bronze
5531|The Box of Love|Something important. (10 hits, follow the life)|7702|11 Jul 2018 4:32:36 AM|44557|45221|98.53|Common|Bronze
5531|Balls of yarn|Amazing Story (150 hits)|7701|11 Jul 2018 4:32:18 AM|44989|45221|99.49|Common|Bronze
5531|Rock Star!|Young soul. (Hit this 10 times)|7700|11 Jul 2018 4:32:12 AM|44605|45221|98.64|Common|Bronze
5531|Something important|A Story About Life. (120 hits)|7699|11 Jul 2018 4:32:02 AM|45009|45221|99.53|Common|Bronze
5531|Young Boy|I am Mayonnaise (90 hits)|7698|11 Jul 2018 4:31:45 AM|45022|45221|99.56|Common|Bronze
5531|Red Bikini!|This will cheer you up! (Hit Mayo 75 times)|7697|11 Jul 2018 4:31:28 AM|45023|45221|99.56|Common|Bronze
5531|Trimmed hearts|Hit 50 times!|7696|11 Jul 2018 4:30:57 AM|45035|45221|99.59|Common|Bronze
5531|No brainer|Hit 20 times!|7695|11 Jul 2018 4:30:51 AM|45051|45221|99.62|Common|Bronze
6272|Adept Kate|In a public match, escape with Kate, using only her 3 unique perks.|7694|11 Jul 2018 3:45:29 AM|452|1487|7.19|Very Rare|Bronze
6272|Adept Clown|In a public match, achieve a merciless victory with The Clown, using only his 3 unique perks.|7693|11 Jul 2018 2:36:25 AM|319|1487|5.07|Very Rare|Bronze
5146|Family Secrets|Completed Chapter 6 of Episode 1|7692|11 Jul 2018 12:13:46 AM|96121|122729|78.32|Common|Gold
5146|Room with a View|Completed Chapter 5 of Episode 1|7691|11 Jul 2018 12:10:57 AM|96295|122729|78.46|Common|Silver
5146|World's Greatest Detective|Completed Chapter 4 of Episode 1|7690|10 Jul 2018 11:43:15 PM|97902|122729|79.77|Common|Silver
5146|Meet the Press|Completed Chapter 3 of Episode 1|7689|10 Jul 2018 11:17:30 PM|100723|122729|82.07|Common|Bronze
5146|The One that Got Away|Completed Chapter 2 of Episode 1|7688|10 Jul 2018 10:48:47 PM|103788|122729|84.57|Common|Bronze
5531|You can see the hits!|Hit the Mayo 5 times!|7687|10 Jul 2018 6:00:55 PM|45074|45221|99.67|Common|Bronze
5146|Welcome to Gotham|Completed Chapter 1 of Episode 1|7686|9 Jul 2018 5:58:35 PM|113160|122729|92.2|Common|Bronze
5316|Virginia|I never made decisions. Things always came up and made them for me.|7685|7 Jul 2018 7:30:24 AM|10085|15564|64.8|Common|Platinum
5316|Doam|Bis!|7684|7 Jul 2018 7:30:24 AM|10188|15564|65.46|Common|Gold
5316|Dead Road|Along comes the driver, Pulls the little lever. Puff, puff! Chuff, chuff! Off we go!|7683|7 Jul 2018 7:00:49 AM|10530|15564|67.66|Common|Gold
5316|Paris|A bird of the air shall carry the voice, and that which hath wings shall tell the matter|7682|7 Jul 2018 7:00:40 AM|10252|15564|65.87|Common|Gold
5316|Fever|To me the meanest flower that blows can give, thoughts that do often lie too deep for tears|7681|7 Jul 2018 7:00:26 AM|10294|15564|66.14|Common|Gold
5316|Toet|Ms. Paul didn't get to be PA to the AD by making a spectacle of herself|7680|7 Jul 2018 6:57:02 AM|10355|15564|66.53|Common|Gold
5316|Lemon|Susan's checked between the booths and under the counter, but where she left it is anyone's guess|7679|7 Jul 2018 6:48:36 AM|10502|15564|67.48|Common|Gold
5316|Ganesha|Orbed is the moon and bright, and the stars they glisten, glisten|7678|7 Jul 2018 6:41:41 AM|10418|15564|66.94|Common|Gold
5316|Iris|Do what you can for Edith Fairfax. A little kindness goes a long way.|7677|7 Jul 2018 6:33:18 AM|10918|15564|70.15|Common|Gold
5316|Aleph|Get your foot off my neck|7676|7 Jul 2018 5:59:51 AM|12267|15564|78.82|Common|Bronze
5316|Ariadne|Thank you|7675|6 Jul 2018 4:07:59 AM|13477|15564|86.59|Common|Silver
5316|Red Night|There are no passengers on spaceship earth. We are all crew.|7674|6 Jul 2018 4:07:58 AM|13291|15564|85.4|Common|Silver
5316|Benway|The true ship is the ship-builder|7673|6 Jul 2018 3:51:03 AM|10984|15564|70.57|Common|Gold
5316|Meda|Beta vulgaris|7672|6 Jul 2018 3:38:15 AM|11758|15564|75.55|Common|Silver
5316|Mausoleum|Durch die Blume gesprochen|7671|6 Jul 2018 2:54:29 AM|11472|15564|73.71|Common|Silver
5316|Madam|For closers only|7670|6 Jul 2018 2:50:21 AM|14414|15564|92.61|Common|Bronze
5316|Beatrice|Strictly for the birds|7669|6 Jul 2018 2:45:00 AM|12507|15564|80.36|Common|Silver
5316|Flea|Victories in space and time|7668|6 Jul 2018 2:37:57 AM|11709|15564|75.23|Common|Silver
6272|Campbell's Chapel Legacy|In a public match, repair the generator in the chapel and live to tell the tale.|7667|5 Jul 2018 9:26:45 PM|1263|1487|20.09|Uncommon|Bronze
5940|Jeweller|Find three talismans.|7666|4 Jul 2018 6:13:19 AM|780|2072|37.64|Uncommon|Bronze
5940|Nature Lover|Get rid of wolves without killing.|7665|4 Jul 2018 5:58:31 AM|1103|2072|53.23|Common|Bronze
5940|Frosty Relationship|Complete Gisle Lachance's vision.|7664|4 Jul 2018 5:06:29 AM|1374|2072|66.31|Common|Bronze
6011|Platinum Trophy|A full Trophy cabinet|7663|3 Jul 2018 1:11:45 AM|1464|1715|85.36|Common|Platinum
6011|Not a happy bunny|Find these weathered toys|7662|3 Jul 2018 1:11:45 AM|1477|1715|86.12|Common|Bronze
6011|Catharsis|Set Finn's emotions free|7661|3 Jul 2018 1:00:58 AM|1491|1715|86.94|Common|Silver
6011|Pull the other one|Inspect this emergency feature|7660|3 Jul 2018 12:30:53 AM|1524|1715|88.86|Common|Silver
6011|Simon Says: Don't lose|Can you beat this nostalgic game?|7659|3 Jul 2018 12:26:13 AM|1529|1715|89.15|Common|Gold
6011|Masquerade|Collect your mask from Finn|7658|2 Jul 2018 6:23:37 AM|1564|1715|91.2|Common|Gold
6011|Poster Club|Inspect all the film posters in the game|7657|2 Jul 2018 5:39:29 AM|1481|1715|86.36|Common|Gold
6011|Dark Destroyer|Acquire your Umbrakinesis Powers|7656|2 Jul 2018 5:37:25 AM|1583|1715|92.3|Common|Gold
6011|A moment captured|Inspect this instant memory maker|7655|2 Jul 2018 5:34:20 AM|1580|1715|92.13|Common|Bronze
6011|Big Cheater|Look for Finn as quickly as you can|7654|2 Jul 2018 5:32:05 AM|1495|1715|87.17|Common|Gold
6011|Pure Folly|Find this fanciful hideout|7653|2 Jul 2018 5:28:05 AM|1578|1715|92.01|Common|Bronze
6011|Alas, Poor Isaac!|Uncover Isaac's past secrets|7652|2 Jul 2018 5:26:36 AM|1570|1715|91.55|Common|Gold
6011|Who's the daddy?|An ego waiting to be found|7651|2 Jul 2018 5:25:39 AM|1583|1715|92.3|Common|Silver
6011|Redemption|Redeem your mistakes|7650|2 Jul 2018 5:22:04 AM|1546|1715|90.15|Common|Silver
6011|Fire Starter|Acquire your Pyrokinesis Powers|7649|2 Jul 2018 5:18:30 AM|1594|1715|92.94|Common|Gold
6011|Doodle dandy|Find this moment of teenage fancy|7648|2 Jul 2018 5:13:28 AM|1585|1715|92.42|Common|Bronze
6011|Life Giver|Acquire your Life Powers|7647|2 Jul 2018 4:59:31 AM|1609|1715|93.82|Common|Gold
6011|You spin me right round|Inspect this moment in space|7646|2 Jul 2018 4:55:15 AM|1589|1715|92.65|Common|Bronze
6011|Good kitty|Inspect your purrrfect pet|7645|2 Jul 2018 4:52:40 AM|1580|1715|92.13|Common|Bronze
6011|Prize draw|Inspect this shared success|7644|2 Jul 2018 4:52:19 AM|1572|1715|91.66|Common|Bronze
6011|Green Fingered|Find Grandad's refuge|7643|2 Jul 2018 4:46:35 AM|1623|1715|94.64|Common|Silver
6011|Guitar man|Inspect this once loved instrument|7642|2 Jul 2018 4:46:00 AM|1607|1715|93.7|Common|Bronze
6011|Simon Says: Good to Go|Complete your first adventure|7641|2 Jul 2018 4:31:31 AM|1675|1715|97.67|Common|Bronze
4458|Hovercat|Stay airborne for 3 seconds|7640|1 Jul 2018 11:24:57 PM|6951|9538|72.88|Common|Bronze
4458|Objective Pro|Get a score of 2,000 or more in Objective Mode|7639|1 Jul 2018 11:16:50 PM|4900|9538|51.37|Common|Silver
4458|Night at the Mewseum|Unlock and complete the mewseum in Objective Mode|7638|1 Jul 2018 11:16:50 PM|4149|9538|43.5|Uncommon|Bronze
4458|The Cat Life|Be a cat for 30 minutes straight|7637|1 Jul 2018 11:16:07 PM|5612|9538|58.84|Common|Bronze
4458|These and Those|Topple 150 unique objects|7636|1 Jul 2018 11:12:05 PM|5552|9538|58.21|Common|Silver
4458|Mess Maker|Knock over 1,000 objects|7635|1 Jul 2018 11:10:48 PM|6456|9538|67.69|Common|Bronze
4458|Mouse Catcher|Catch a mouse|7634|1 Jul 2018 11:04:05 PM|6156|9538|64.54|Common|Bronze
4458|Photo Gatherer|Collect 10 photos|7633|1 Jul 2018 10:57:24 PM|7027|9538|73.67|Common|Bronze
4458|This and That|Topple 50 unique objects|7632|1 Jul 2018 10:52:29 PM|7776|9538|81.53|Common|Bronze
4458|Seeing Red|Defeat the laser pointer|7631|1 Jul 2018 10:39:52 PM|6477|9538|67.91|Common|Bronze
4458|Cat Training Complete!|Complete the tutorial|7630|1 Jul 2018 10:34:32 PM|9353|9538|98.06|Common|Bronze
5940|Last Stand|Complete Gilles Lachance's vision.|7629|1 Jul 2018 7:44:27 PM|1503|2072|72.54|Common|Bronze
5940|Photographer|Take a picture needed for the investigation.|7628|1 Jul 2018 7:29:08 PM|1860|2072|89.77|Common|Bronze
5940|Rendezvous|Reach the General Store.|7627|1 Jul 2018 7:16:59 PM|1884|2072|90.93|Common|Bronze
5940|Sorry, eh?|In typical Canadian fashion, Carl left $10 for the cutoff chain.|7626|1 Jul 2018 7:03:49 PM|1007|2072|48.6|Uncommon|Bronze
2863|Sniper Duel|Kill a skeleton with an arrow from more than 50 meters.|7625|1 Jul 2018 3:02:02 AM|52787|336926|15.67|Rare|Bronze
