4121|Sticky Fingers|Steal an enemy's item using a weapon equipped with the Steal ability.|13056|31 Jul 2018 10:19:59 PM|6814|15114|45.08|Uncommon|Silver
4121|Teach a man to fish...|Acquire a Fishing Rod.|13055|31 Jul 2018 10:11:37 PM|9588|15114|63.44|Common|Bronze
4121|Hoarder|Check an item in at a Check-in Counter.|13054|31 Jul 2018 10:07:32 PM|8122|15114|53.74|Common|Bronze
4121|Break the Curse|Defeat the King's Curse.|13053|31 Jul 2018 9:52:12 PM|5051|15114|33.42|Uncommon|Silver
4121|Specialized Weapon|Max any attribute for a weapon without an attachment.|13052|31 Jul 2018 6:39:21 PM|4864|15114|32.18|Uncommon|Gold
5095|Photojournalist|Score at least 1,500 PP from a single photo.|13051|31 Jul 2018 3:31:37 PM|12227|18914|64.65|Common|Bronze
5095|The Artiste|Score at least 3,000 PP from a single photo.|13050|31 Jul 2018 3:31:37 PM|11746|18914|62.1|Common|Bronze
5095|Portraiture|Photograph at least 10 survivors.|13049|31 Jul 2018 3:22:31 PM|11014|18914|58.23|Common|Bronze
5095|3 Day Survivor|Survive for at least 72 hours.|13048|31 Jul 2018 5:23:52 AM|5059|18914|26.75|Uncommon|Bronze
5095|Stunt Rider|Jump a motorcycle at least 33 feet (10 meters).|13047|31 Jul 2018 3:24:09 AM|3148|18914|16.64|Rare|Bronze
2358|The Destination of Hatred|Defeat Seymour Omnis|13046|30 Jul 2018 10:25:00 PM|74203|215470|34.44|Uncommon|Bronze
2680|Demon's Roar|Cleared Episode 8 "Demon's Roar"|13045|30 Jul 2018 5:24:02 PM|1555|2799|55.56|Common|Bronze
2680|Irreconcilable Differences|Cleared Episode 7 "Irreconcilable Differences"|13044|30 Jul 2018 4:54:05 PM|1599|2799|57.13|Common|Bronze
2680|Stranger|Cleared Episode 6 "A Stranger"|13043|30 Jul 2018 4:30:35 PM|1621|2799|57.91|Common|Bronze
5095|Raining Zombies|Knock at least 30 zombies aside with a parasol.|13042|30 Jul 2018 4:01:37 PM|4591|18914|24.27|Uncommon|Bronze
5095|Costume Party|Place novelty masks on at least 10 zombies.|13041|30 Jul 2018 3:49:01 PM|3394|18914|17.94|Rare|Bronze
5095|Zombie Road|Walk over 33 feet (10 meters) on the backs of zombies using the Zombie Ride.|13040|30 Jul 2018 5:23:21 AM|3913|18914|20.69|Uncommon|Bronze
5095|Strike!|Send at least 10 zombies flying with bowling balls.|13039|30 Jul 2018 5:23:10 AM|2785|18914|14.72|Rare|Bronze
5095|Group Photo|Get 50 Target Markers with the camera.|13038|30 Jul 2018 4:51:04 AM|7876|18914|41.64|Uncommon|Bronze
5095|Zombie Genocider|Defeat at least 53,594 zombies.|13037|30 Jul 2018 4:33:05 AM|2726|18914|14.41|Rare|Gold
2680|Desired World|Cleared Episode 5 "Desired World"|13036|30 Jul 2018 1:19:27 AM|1683|2799|60.13|Common|Bronze
2680|Heresy|Cleared Episode 4 "Heresy"|13035|30 Jul 2018 12:58:49 AM|1903|2799|67.99|Common|Bronze
2680|Preternaturally Literate|You've read 30 TOi articles.|13034|30 Jul 2018 12:57:09 AM|1821|2799|65.06|Common|Bronze
5095|Stunt Driver|Jump a car at least 33 feet (10 meters).|13033|29 Jul 2018 6:07:44 PM|3797|18914|20.08|Uncommon|Bronze
5095|Zombie Killer|Defeat at least 10,000 zombies.|13032|28 Jul 2018 9:22:38 PM|3367|18914|17.8|Rare|Bronze
2680|10 Sages|Cleared Episode 3 "10 Sages"|13031|28 Jul 2018 7:46:28 PM|1992|2799|71.17|Common|Bronze
5095|Freefall|Drop from a height of at least 16 feet (5 meters).|13030|28 Jul 2018 6:16:49 PM|14174|18914|74.94|Common|Bronze
5095|Zombie Hunter|Defeat at least 1,000 zombies.|13029|28 Jul 2018 5:15:01 PM|6605|18914|34.92|Uncommon|Bronze
2680|Unforgivable Sin|Clared Episode 2 "Unforgivable Sin"|13028|27 Jul 2018 10:54:17 PM|2081|2799|74.35|Common|Bronze
2680|Staying Informed|You've read 15 TOi articles.|13027|27 Jul 2018 10:52:59 PM|2028|2799|72.45|Common|Bronze
7573|Platinum Midnight|Become a master collector|13026|26 Jul 2018 4:00:20 AM|854|919|92.93|Common|Platinum
7573|So close|Die with 35 fragments|13025|26 Jul 2018 4:00:20 AM|861|919|93.69|Common|Gold
7573|That IS bad luck|Die with 36 fragments|13024|26 Jul 2018 3:41:18 AM|865|919|94.12|Common|Gold
7573|The fastest one|Get 36 fragments in less than 6 Min|13023|25 Jul 2018 7:32:10 PM|858|919|93.36|Common|Gold
7573|Super fast|Get 36 fragments in less than 10 Min|13022|25 Jul 2018 7:32:10 PM|864|919|94.02|Common|Gold
7573|The greatest gift|Get 36 fragments|13021|25 Jul 2018 7:32:09 PM|873|919|94.99|Common|Gold
7573|Only the half left|Get 18 fragments|13020|25 Jul 2018 6:29:56 PM|897|919|97.61|Common|Gold
7573|At least you tried|Die with only 1 fragments|13019|25 Jul 2018 6:22:47 PM|914|919|99.46|Common|Gold
7573|Squared unicorn|Die by a spike|13018|25 Jul 2018 6:17:05 PM|914|919|99.46|Common|Gold
7573|Cut in half|Die by a saw|13017|25 Jul 2018 6:16:50 PM|916|919|99.67|Common|Gold
7573|Stunned|Die by a laser|13016|25 Jul 2018 6:16:30 PM|916|919|99.67|Common|Gold
7573|Baby steps|Get 1 fragment|13015|25 Jul 2018 6:14:20 PM|917|919|99.78|Common|Gold
7507|Platinum-explosion|Complete all the trophies|13014|25 Jul 2018 6:12:09 PM|899|939|95.74|Common|Platinum
7507|Kill them all|Kill 100 enemies in Arena Mode|13013|25 Jul 2018 6:12:09 PM|902|939|96.06|Common|Gold
7507|Brave|Kill your first enemy in hard mode|13012|25 Jul 2018 5:56:14 PM|901|939|95.95|Common|Gold
7507|Without any mercy|Kill 75 enemies in Arena Mode|13011|25 Jul 2018 5:46:39 PM|904|939|96.27|Common|Gold
7507|Getting used|Kill 50 enemies in Arena Mode|13010|25 Jul 2018 5:45:42 PM|904|939|96.27|Common|Gold
7507|Kill or get killed|Kill 25 enemies in Arena Mode|13009|25 Jul 2018 5:44:50 PM|905|939|96.38|Common|Gold
7507|Unlock the Arena Mode|Reach 100,000 points in Classic Mode|13008|25 Jul 2018 5:43:12 PM|905|939|96.38|Common|Gold
7507|Show them who's boss|Reach 75,000 points in Classic Mode|13007|25 Jul 2018 5:39:21 PM|911|939|97.02|Common|Gold
7507|Getting better|Reach level 10 in Classic Mode|13006|25 Jul 2018 4:44:22 PM|915|939|97.44|Common|Gold
7507|Go get them|Reach 50,000 points in Classic Mode|13005|25 Jul 2018 4:43:48 PM|914|939|97.34|Common|Gold
7507|Little by little|Reach 25,000 points in Classic Mode|13004|25 Jul 2018 4:43:21 PM|920|939|97.98|Common|Gold
7507|Leveling up|Reach level 5 in Classic Mode|13003|25 Jul 2018 4:34:05 PM|922|939|98.19|Common|Gold
7507|Overpowered|Die for the first time|13002|25 Jul 2018 4:32:07 PM|936|939|99.68|Common|Silver
7507|Getting Started|Kill your first enemy|13001|25 Jul 2018 4:32:06 PM|936|939|99.68|Common|Silver
3531|3.3|Unlock all Broken Age Trophies|13000|25 Jul 2018 3:41:48 PM|5680|94643|6.0|Very Rare|Platinum
3531|Let's Get this Good Time Over With|Complete Broken Age in under an hour, not counting loading and paused gameplay.|12999|25 Jul 2018 3:41:48 PM|5717|94643|6.04|Very Rare|Gold
3491|Robots Rule|Win 5 complete matches with each Robot Type|12998|25 Jul 2018 3:12:16 PM|8480|40478|7.77|Very Rare|Bronze
3491|The Grinder|Win a match after connecting all attacks from Leatherface's Berserker Stance in the Klassic Tower|12997|25 Jul 2018 4:40:56 AM|9447|40478|8.65|Very Rare|Bronze
3491|All I Do Is Win|Jump back and forth over your opponent 5 times during the Fatality sequence and perform a Fatality|12996|25 Jul 2018 4:37:36 AM|11819|40478|10.83|Rare|Bronze
3491|Hug It Out|Throw 5 Face Huggers during a match with Alien in the Klassic Tower|12995|25 Jul 2018 4:36:23 AM|9429|40478|8.64|Very Rare|Bronze
3491|Getting Tipsy|Perform Bo' Rai Cho's Drinking special 10 times during a match in the Klassic Tower|12994|25 Jul 2018 4:35:11 AM|7951|40478|7.28|Very Rare|Bronze
3491|Throwback|Perform a Klassic Fatality in a Klassic skin|12993|25 Jul 2018 4:31:46 AM|26675|40478|24.43|Uncommon|Bronze
3491|Fox Finish|Win the match with your opponent stepping on Caltrops|12992|25 Jul 2018 4:14:44 AM|10025|40478|9.18|Very Rare|Bronze
3491|Brutal End|Perform 1 Brutality|12991|25 Jul 2018 4:10:44 AM|158080|294430|53.69|Common|Bronze
3491|What Doesn't Kill You Makes You Still Alive|Perform a Stage Brutality with Alien in the Klassic Tower|12990|25 Jul 2018 4:10:44 AM|7083|40478|6.49|Very Rare|Bronze
3491|The Kraken|Perform the Kove Stage Fatality with Triborg in the Klassic Tower|12989|25 Jul 2018 3:42:29 AM|7117|40478|6.52|Very Rare|Bronze
2680|Encounters|Cleared Episode 1 "Encounters"|12988|25 Jul 2018 12:45:17 AM|2241|2799|80.06|Common|Bronze
2680|I guess I could give it a look...|You've read a single TIPS.|12987|25 Jul 2018 12:35:29 AM|2425|2799|86.64|Common|Bronze
2680|Plays with TOis!|You've read one TOi article.|12986|25 Jul 2018 12:28:35 AM|2542|2799|90.82|Common|Bronze
2680|OMG! They're so DREAMY...!|Opened a character's profile.|12985|25 Jul 2018 12:28:14 AM|2526|2799|90.25|Common|Bronze
2680|XBLAZE, IGNITE!|You've started your journey into the XBLAZE universe.|12984|25 Jul 2018 12:24:23 AM|2693|2799|96.21|Common|Bronze
3491|Moving Up|Reach personal level 10 in XP|12983|24 Jul 2018 3:40:59 AM|211900|294430|71.97|Common|Bronze
3491|Going the Distance|Complete the Klassic Tower with one of the Kombat Pack 2 characters|12982|24 Jul 2018 3:40:59 AM|26456|40478|24.23|Uncommon|Bronze
3491|Where It All Started|Perform the Pit Stage Fatality with Leatherface in the Klassic Tower|12981|24 Jul 2018 3:33:18 AM|7639|40478|7.0|Very Rare|Bronze
3491|Luck be a Lady|Play 7 complete Test Your Luck matches|12980|23 Jul 2018 6:31:13 PM|106088|294430|36.03|Uncommon|Bronze
3491|Terrifying Encounter|Confront a beast within the Krypt|12979|23 Jul 2018 6:12:16 PM|177166|294430|60.17|Common|Bronze
3491|It's a Gusher|Spill 1,000 pints of blood|12978|23 Jul 2018 6:07:01 PM|243613|294430|82.74|Common|Bronze
3491|Keep it Secret|Find a secret fight in the Living Towers|12977|23 Jul 2018 5:20:57 PM|41548|294430|14.11|Rare|Bronze
3491|Pledge Yourself|Reach level 5 in any faction|12976|23 Jul 2018 5:09:10 PM|239826|294430|81.45|Common|Bronze
3491|Not Dead Yet|See all Test Your Might deaths|12975|23 Jul 2018 4:53:41 PM|44488|294430|15.11|Rare|Bronze
3491|Challenge Accepted|Win a single Tower Challenge|12974|23 Jul 2018 4:35:47 PM|21739|294430|7.38|Very Rare|Bronze
3531|Unbroken|Complete Broken Age|12973|23 Jul 2018 3:51:42 PM|16867|94643|17.82|Rare|Gold
3491|BUDDY!!!|Send a Tower Challenge to a friend|12972|23 Jul 2018 3:39:56 PM|45356|294430|15.4|Rare|Bronze
3491|Tower Kompetitor|Complete a single Tower|12971|23 Jul 2018 3:39:05 PM|189858|294430|64.48|Common|Bronze
3491|Trolling|Duck 30 times during Fatality sequence|12970|23 Jul 2018 5:03:56 AM|56339|294430|19.13|Rare|Bronze
3491|Hara Kiri|Kill yourself with Kotal Kahn for 1 round and win the match|12969|23 Jul 2018 5:01:34 AM|35667|294430|12.11|Rare|Bronze
3491|Disco|Create a sun ray with Kotal Kahn and perform a flip stance 5 times while in the ray|12968|23 Jul 2018 4:57:20 AM|34839|294430|11.83|Rare|Bronze
3491|Blanche Advantage|Hit someone with the old lady Level Interaction|12967|23 Jul 2018 4:56:13 AM|209357|294430|71.11|Common|Bronze
3491|Only a Real Master|Beat an opponent while they still have 90% health and you have 10% or less health remaining|12966|23 Jul 2018 4:55:08 AM|32416|294430|11.01|Rare|Bronze
3491|Time Out|Win a match by time out|12965|23 Jul 2018 4:36:33 AM|108292|294430|36.78|Uncommon|Bronze
3491|FINISH HIM|Perform 1 Fatality in a match|12964|23 Jul 2018 4:36:33 AM|249856|294430|84.86|Common|Bronze
3491|Jumping Bean|Jump 30 times in 1 match|12963|23 Jul 2018 4:31:24 AM|235676|294430|80.04|Common|Bronze
3491|That's How You Do It|Complete Tutorial|12962|23 Jul 2018 4:21:45 AM|95670|294430|32.49|Uncommon|Bronze
3491|Hit the Dojo|Enter Practice mode|12961|23 Jul 2018 4:14:28 AM|180665|294430|61.36|Common|Bronze
3491|All the Pieces|Equip a Background, Icon and Border set|12960|23 Jul 2018 4:13:18 AM|53989|294430|18.34|Rare|Bronze
3491|So Bored|Equip a new Border|12959|23 Jul 2018 4:12:46 AM|130542|294430|44.34|Uncommon|Bronze
3491|Real Icon|Equip a new Icon|12958|23 Jul 2018 4:12:37 AM|131020|294430|44.5|Uncommon|Bronze
3491|Back It Up|Equip a new Background image|12957|23 Jul 2018 4:07:42 AM|132034|294430|44.84|Uncommon|Bronze
3491|Statistical Advantage|View Kombat Kard|12956|23 Jul 2018 4:07:13 AM|150405|294430|51.08|Common|Bronze
3491|Jump Ship|Become a member of every faction|12955|23 Jul 2018 4:06:47 AM|30204|294430|10.26|Rare|Bronze
3531|We Talked That Fight Right Out of You|Talk to the boss|12954|23 Jul 2018 3:16:14 AM|17073|94643|18.04|Rare|Bronze
3531|The Next Most Logical Course of Action|Start a group dance party|12953|23 Jul 2018 3:12:58 AM|12188|94643|12.88|Rare|Silver
3531|"Eh, eh-eh. Eh eh, eh-eh!"|Make someone strut their stuff|12952|23 Jul 2018 3:12:07 AM|7889|94643|8.34|Very Rare|Silver
3531|She Must have a Reason|Stand up for someone even though you haven't met her|12951|23 Jul 2018 3:07:07 AM|15707|94643|16.6|Rare|Silver
3531|He Must have a Reason|Stand up for someone even though you haven't met him|12950|23 Jul 2018 3:04:07 AM|12522|94643|13.23|Rare|Silver
3531|Dammed|Complete Act 2 of Broken Age|12949|22 Jul 2018 7:34:22 PM|17801|94643|18.81|Rare|Silver
3531|Go With Your Instincts|Chart a course away from danger|12948|22 Jul 2018 7:22:48 PM|18328|94643|19.37|Rare|Bronze
3531|Greetings from Obvious Town|Reconnect with some old friends|12947|22 Jul 2018 7:20:01 PM|16206|94643|17.12|Rare|Bronze
3531|Holy Smokes|Deploy a weapon of mass destruction|12946|22 Jul 2018 6:45:50 PM|18756|94643|19.82|Rare|Bronze
3531|"That kind of thing can be pretty convincing."|Get to know a stranger|12945|22 Jul 2018 5:03:33 PM|12519|94643|13.23|Rare|Bronze
3531|Turn That Frown Upside Down|Remove 8 sad faces from the Bassinostra|12944|22 Jul 2018 4:28:55 PM|18901|94643|19.97|Rare|Silver
3531|No Retreat|Execute a PERFECT escape|12943|22 Jul 2018 4:10:05 PM|7516|94643|7.94|Very Rare|Silver
3531|"Not everyone has the stomach for perfection."|Uncover an unsavory scheme|12942|22 Jul 2018 5:15:26 AM|18219|94643|19.25|Rare|Bronze
3531|"And, they do windows!"|Find a genius|12941|22 Jul 2018 5:14:46 AM|18471|94643|19.52|Rare|Bronze
3531|There Is Hope|Get to the ship's brain|12940|22 Jul 2018 5:09:05 AM|20960|94643|22.15|Uncommon|Bronze
3531|"What can I say? I know boots."|Answer some tough questions quickly|12939|22 Jul 2018 5:08:54 AM|14231|94643|15.04|Rare|Silver
3531|Get Hyper|Return a missing spaceship part|12938|21 Jul 2018 8:41:44 PM|20042|94643|21.18|Uncommon|Bronze
3531|"I'll bet the undercarriage on this baby is shot."|Get a family member's help on a big project|12937|21 Jul 2018 8:41:27 PM|20139|94643|21.28|Uncommon|Bronze
3531|How'd I Do?|Follow up on a successful performance|12936|21 Jul 2018 8:37:58 PM|11781|94643|12.45|Rare|Bronze
3531|Make Like a Tree and Laugh|Tell a great joke in one attempt|12935|21 Jul 2018 8:37:46 PM|10092|94643|10.66|Rare|Silver
3531|Are You Trying to Get Rid of Me?|Find 30 unique reactions to the Spoon|12934|21 Jul 2018 8:22:59 PM|7331|94643|7.75|Very Rare|Silver
3531|Sick of Fish|Visit someone in jail|12933|21 Jul 2018 8:21:57 PM|11640|94643|12.3|Rare|Bronze
3531|"My Lightness!"|Return a heavy duty spaceship part|12932|21 Jul 2018 8:20:28 PM|20379|94643|21.53|Uncommon|Bronze
3531|Knot Too Difficult|Clear up a tangled situation in one attempt|12931|21 Jul 2018 8:20:03 PM|11173|94643|11.81|Rare|Silver
3531|"What's up with all the feathers?"|Commission a custom garment|12930|21 Jul 2018 7:46:55 PM|20430|94643|21.59|Uncommon|Bronze
2742|Close Shave|Escape a Scrab by the skin of your loins|12929|21 Jul 2018 2:53:30 AM|33062|175238|18.87|Rare|Bronze
2742|Speed of the Mudanchee|Run from a Scrab for 25 meters and survive|12928|21 Jul 2018 2:40:33 AM|43410|175238|24.77|Uncommon|Bronze
4318|Shield Collector|Obtain all shields.|12927|20 Jul 2018 11:35:16 PM|2391|7353|32.52|Uncommon|Silver
4318|Helm Collector|Obtain all helms.|12926|20 Jul 2018 7:44:02 PM|2468|7353|33.56|Uncommon|Silver
4318|Armor Collector|Obtain all armor.|12925|20 Jul 2018 7:23:35 PM|2506|7353|34.08|Uncommon|Silver
3531|Flawless Execution|Complete all rescue missions with zero errors|12924|20 Jul 2018 3:59:17 PM|7946|94643|8.4|Very Rare|Silver
4318|Duty and Honor|Finish the game.|12923|20 Jul 2018 1:02:35 PM|2740|7353|37.26|Uncommon|Gold
4318|End of the Line III|Defeat Julius in his third form.|12922|20 Jul 2018 12:51:54 PM|2746|7353|37.35|Uncommon|Silver
2742|Oops...|Fail to observe your surroundings|12921|20 Jul 2018 12:08:02 PM|153800|175238|87.77|Common|Bronze
4318|End of the Line II|Defeat Julius in his second form.|12920|20 Jul 2018 11:43:12 AM|2762|7353|37.56|Uncommon|Bronze
4318|End of the Line I|Defeat Julius in his first form.|12919|20 Jul 2018 11:41:16 AM|2762|7353|37.56|Uncommon|Bronze
4318|Weapon Collector|Obtain all weapons.|12918|20 Jul 2018 11:38:35 AM|2451|7353|33.33|Uncommon|Silver
4318|Gold Digger|Obtain 100,000 gold.|12917|20 Jul 2018 6:08:16 AM|2920|7353|39.71|Uncommon|Silver
4318|Zombie Dragon Devastator|Defeat the Zombie Dragon.|12916|20 Jul 2018 6:00:17 AM|2790|7353|37.94|Uncommon|Bronze
3531|Please Don't Tell Anyone|Complete Act 1 of Broken Age|12915|20 Jul 2018 3:52:56 AM|25443|94643|26.88|Uncommon|Silver
4318|Red Dragon Destroyer|Defeat the Red Dragon.|12914|20 Jul 2018 3:39:15 AM|2808|7353|38.19|Uncommon|Bronze
4318|Dragon Drubber|Defeat the Dragon.|12913|20 Jul 2018 2:52:12 AM|2823|7353|38.39|Uncommon|Bronze
4318|Garuda Garrotter|Defeat Garuda.|12912|20 Jul 2018 2:46:42 AM|2829|7353|38.47|Uncommon|Bronze
3531|Doomed|Travel to a forbidden location|12911|19 Jul 2018 10:10:34 PM|30052|94643|31.75|Uncommon|Bronze
3531|Armed|Take Control of the Boom Arms|12910|19 Jul 2018 10:06:57 PM|29451|94643|31.12|Uncommon|Bronze
3531|Inhibited|Inhibit a powerful entitiy|12909|19 Jul 2018 10:03:04 PM|31685|94643|33.48|Uncommon|Bronze
3531|Gary Has His Reasons|Hear 20 reasons why Gary won't grab that|12908|19 Jul 2018 9:42:22 PM|8621|94643|9.11|Very Rare|Silver
3531|Whoops!|Disrupt Shay's daily routine|12907|19 Jul 2018 6:02:24 PM|53303|94643|56.32|Common|Bronze
4318|Item Collector|Obtain at least one of all items.|12906|19 Jul 2018 12:41:24 AM|2011|7353|27.35|Uncommon|Silver
3531|Is Something Wrong?|Make a Spoon Sweat|12905|18 Jul 2018 8:50:37 PM|17016|94643|17.98|Rare|Bronze
3531|Picky Eater|Examine all breakfast options|12904|18 Jul 2018 8:49:24 PM|39486|94643|41.72|Uncommon|Bronze
3531|Small Things Can Surprise You|Take down Mog Chothra|12903|18 Jul 2018 6:38:52 PM|27241|94643|28.78|Uncommon|Bronze
3531|Not Good with Directions|Endure a tight situation as long as you can|12902|18 Jul 2018 6:30:20 PM|11801|94643|12.47|Rare|Bronze
3531|Produce Distributor|Feed two different people a healthy snack|12901|18 Jul 2018 6:26:01 PM|12125|94643|12.81|Rare|Silver
3531|Something Not Light About Her|Leave an isolated town|12900|18 Jul 2018 6:24:24 PM|31740|94643|33.54|Uncommon|Bronze
3531|Mother and Child Reunion|Reunite a mother and child|12899|18 Jul 2018 6:21:50 PM|33615|94643|35.52|Uncommon|Bronze
3531|Make Up for Some Hygiene Demerits|Get to know someone in a precarious position|12898|18 Jul 2018 6:10:46 PM|31065|94643|32.82|Uncommon|Bronze
3531|She's Doomed Us All|Escape the Maidens Feast|12897|18 Jul 2018 4:39:20 PM|48608|94643|51.36|Common|Bronze
3531|Question Your Elders|Learn all you can about Sugar Bunting|12896|18 Jul 2018 4:36:25 PM|43098|94643|45.54|Uncommon|Silver
3725|Helping Hat|Saved a Picnic, Got a Wedzel Patch, Completed the Potion.|12895|18 Jul 2018 4:27:27 PM|7646|58770|13.01|Rare|Silver
3725|The End?|Told the Story about becoming a Knight.|12894|18 Jul 2018 4:27:22 PM|15789|58770|26.87|Uncommon|Silver
3725|Fast Feather|Defeated Whisper in the Duel of Speed.|12893|18 Jul 2018 3:55:01 PM|16275|58770|27.69|Uncommon|Bronze
3725|Strong Minded|Defeated Acorn in the Duel of Strength.|12892|18 Jul 2018 3:11:19 PM|16413|58770|27.93|Uncommon|Bronze
4318|Mantis Mangler|Defeat the Mantis Ant.|12891|17 Jul 2018 5:19:49 PM|2880|7353|39.17|Uncommon|Bronze
4318|Spell Collector|Obtain all magic spells.|12890|17 Jul 2018 4:25:55 PM|2989|7353|40.65|Uncommon|Silver
4318|Lich Liquidator|Defeat the Lich.|12889|17 Jul 2018 4:25:42 PM|2988|7353|40.64|Uncommon|Bronze
4318|Ifrit Extinguisher|Defeat Ifrit.|12888|17 Jul 2018 3:56:45 PM|2946|7353|40.07|Uncommon|Bronze
4318|Kraken Cleaver|Defeat the Kraken.|12887|17 Jul 2018 3:43:23 PM|2993|7353|40.7|Uncommon|Bronze
4318|Marilith Mauler|Defeat Marilith.|12886|17 Jul 2018 12:30:50 PM|3098|7353|42.13|Uncommon|Bronze
2742|Coming Soon...|Find an advert for some New 'n' Tasty entertainment|12885|17 Jul 2018 3:53:32 AM|54662|175238|31.19|Uncommon|Bronze
2365|Secret Moustache World|Find and complete the Secret Moustache World!|12884|17 Jul 2018 1:56:35 AM|698|3917|17.82|Rare|Bronze
5181|Grand Standing!|Buy 1000 of Everything on Earth|12883|16 Jul 2018 9:44:10 PM|12968|34581|37.5|Uncommon|Silver
3725|That's the Ticket|Presented an Eye to enter the Tournament.|12882|16 Jul 2018 9:28:33 PM|21602|58770|36.76|Uncommon|Bronze
3725|Opening Knight|Opened door to Achaka three times.|12881|16 Jul 2018 4:13:36 PM|7088|58770|12.06|Rare|Bronze
4318|Dark Lord Dethroner|Defeat the Dark Lord.|12880|16 Jul 2018 12:21:28 PM|3273|7353|44.51|Uncommon|Bronze
2365|Golden Five|Gain five extra rocks during a level.|12879|16 Jul 2018 11:37:25 AM|800|3917|20.42|Uncommon|Bronze
3725|Dead End Dancer|Danced in the Dark.|12878|16 Jul 2018 5:01:06 AM|6710|58770|11.42|Rare|Bronze
3725|Purple Badger Don't Care|A Dyed Badger ate Bees.|12877|16 Jul 2018 4:54:39 AM|6549|58770|11.14|Rare|Bronze
3725|Misteak|Fed a steak to a Wedzel Wolf.|12876|16 Jul 2018 4:43:12 AM|9116|58770|15.51|Rare|Bronze
4318|Chimera Killer|Defeat the Chimera.|12875|16 Jul 2018 1:12:55 AM|3343|7353|45.46|Uncommon|Bronze
4318|Golem Grinder|Defeat the Golem.|12874|16 Jul 2018 12:30:15 AM|3366|7353|45.78|Uncommon|Bronze
4318|Cyclops Slasher|Defeat the Cyclops.|12873|16 Jul 2018 12:11:48 AM|3369|7353|45.82|Uncommon|Bronze
4318|Crab Crusher|Defeat the Metal Crab.|12872|15 Jul 2018 11:21:50 PM|3444|7353|46.84|Uncommon|Bronze
4318|Flayer Finisher|Defeat the Mind Flayer.|12871|15 Jul 2018 11:16:55 PM|3509|7353|47.72|Uncommon|Bronze
4318|Medusa Marauder|Defeat Medusa.|12870|15 Jul 2018 10:58:28 PM|3647|7353|49.6|Uncommon|Bronze
3725|Froggy Throat|Tried to Catch a Toad, Got a Frog in Throat.|12869|15 Jul 2018 8:10:30 PM|12332|58770|20.98|Uncommon|Bronze
3725|Horn Blower|Blew on many Horns.|12868|15 Jul 2018 8:09:05 PM|8123|58770|13.82|Rare|Bronze
3725|Graham the Basilisk|Walked on Water.|12867|15 Jul 2018 6:13:59 PM|7541|58770|12.83|Rare|Bronze
3725|A Prickly Situation|Walked into the Spiniferous Thornweeds.|12866|15 Jul 2018 6:03:53 PM|9827|58770|16.72|Rare|Bronze
3725|Unicorn Snack Food|Was a Snack for a Majestic Unicorn.|12865|15 Jul 2018 5:59:53 PM|8070|58770|13.73|Rare|Bronze
3725|A Secret Entrance|Found a Mysterious Cave Entrance.|12864|15 Jul 2018 5:58:43 PM|10359|58770|17.63|Rare|Bronze
3725|In The Mouth of Danger|Walked into a Dragon's Mouth.|12863|15 Jul 2018 4:28:43 PM|13423|58770|22.84|Uncommon|Bronze
3725|Napping on the Job|Took a Brief Nap.|12862|15 Jul 2018 4:01:48 PM|12908|58770|21.96|Uncommon|Bronze
2365|You Rock!|Complete all One Rock Levels.|12861|14 Jul 2018 7:38:20 PM|1045|3917|26.68|Uncommon|Bronze
2365|Grenadier|Complete all Grenade Levels.|12860|14 Jul 2018 1:40:02 AM|1731|3917|44.19|Uncommon|Bronze
2365|Full of Diamonds|Collect all diamonds in Hall of Diamonds.|12859|14 Jul 2018 12:57:46 AM|625|3917|15.96|Rare|Gold
5181|That Achievement's Name...|Reach the “Special Relativity” Moon unlock (100 everything) - …Was Albert Einstein.|12858|13 Jul 2018 5:31:16 AM|14955|34581|43.25|Uncommon|Silver
5181|Here We Go Again!|Purchase the first angel upgrade on the Moon, “It Begins Again” - Great renewable resource, or GREATEST?|12857|13 Jul 2018 5:27:33 AM|15273|34581|44.17|Uncommon|Bronze
5181|Divine Intervention!|Reset for your first Moon Angel - Help is on the way!|12856|13 Jul 2018 5:23:29 AM|16539|34581|47.83|Uncommon|Bronze
5181|1 Small Step...|Get 1 of every Moon investment - 1 giant leap for management!|12855|13 Jul 2018 5:20:12 AM|18781|34581|54.31|Common|Bronze
5181|Ominous...|Buy 666 or more of each Earth investment - A lot of unlucky numbers.|12854|13 Jul 2018 4:54:11 AM|13794|34581|39.89|Uncommon|Bronze
5181|The Big Hundsky!|Buy 100 of Everything on Earth|12853|12 Jul 2018 11:23:24 PM|22316|34581|64.53|Common|Bronze
5181|You've Struck Oil!|Purchase Your First Oil Rig|12852|12 Jul 2018 11:23:08 PM|26916|34581|77.83|Common|Bronze
5181|Serious Citrus!|Purchase 100 Lemonade Stands|12851|12 Jul 2018 11:08:19 PM|31497|34581|91.08|Common|Bronze
5382|Favorite Color!|[Item Shop] Purchased additional character colors.|12850|12 Jul 2018 10:08:06 PM|10076|19118|52.7|Common|Bronze
5382|Click click|[Gallery] Opened up all guest illustrations.|12849|12 Jul 2018 10:07:10 PM|3100|19118|16.22|Rare|Silver
5382|Between you and me...|[Item Shop] Played back a single location test voice.|12848|12 Jul 2018 10:00:30 PM|6753|19118|35.32|Uncommon|Bronze
5382|Arrrrcade!|[Arcade] Completed the arcade mode.|12847|12 Jul 2018 9:59:09 PM|9630|19118|50.37|Common|Bronze
5382|BB Master|[Glossary] Opened up everything.|12846|12 Jul 2018 9:45:42 PM|2759|19118|14.43|Rare|Silver
5382|Don't forget the extras|[Story] Completed all sub stories.|12845|12 Jul 2018 9:45:25 PM|3816|19118|19.96|Rare|Bronze
5382|Thank you for playing|[Gallery] Played back the credits.|12844|12 Jul 2018 9:13:28 PM|4318|19118|22.59|Uncommon|Bronze
5382|And on that bombshell...|[Story] Completed the entire main story.|12843|12 Jul 2018 7:40:34 PM|7242|19118|37.88|Uncommon|Gold
5382|The Requiem|[Story] Completed episode 10.|12842|12 Jul 2018 6:44:41 PM|7372|19118|38.56|Uncommon|Bronze
5382|Nightmare Memory|[Story] Completed episode 7.|12841|12 Jul 2018 6:26:18 PM|7636|19118|39.94|Uncommon|Bronze
5382|Phantom of Labyrinth|[Story] Completed episode 4.|12840|12 Jul 2018 6:06:43 PM|8097|19118|42.35|Uncommon|Bronze
5382|The Beginning of the end|[Story] Completed episode 1.|12839|12 Jul 2018 5:34:33 PM|9753|19118|51.01|Common|Bronze
5382|It's like... Slow motion|Successfully blocked 10 overhead attacks.|12838|12 Jul 2018 5:25:00 PM|10232|19118|53.52|Common|Bronze
5382|Sudden Cancellation|Successfully used Rapid Cancel 10 times.|12837|12 Jul 2018 5:16:31 PM|7064|19118|36.95|Uncommon|Bronze
