5347|Witch Trials|Baba Yaga: Complete every Wicked Vale Score Attacks with a gold score|9849|31 Jul 2018 6:52:15 PM|8452|99946|7.33|Very Rare|Bronze
5347|Untouchable|Replay 5 different levels without taking any damage|9848|31 Jul 2018 6:13:46 PM|13415|132970|10.09|Rare|Bronze
5347|Iron Will|Complete a level in Score Attack using 5 cards|9847|31 Jul 2018 4:09:40 PM|20096|132970|15.11|Rare|Bronze
5347|Gilded|Complete a level in Score Attack with a gold score|9846|31 Jul 2018 4:09:33 PM|16028|132970|12.05|Rare|Bronze
5347|My Own Worst Enemy|Complete a level in Score Attack with a score multiplier of 2 or more|9845|31 Jul 2018 4:09:26 PM|17674|132970|13.29|Rare|Bronze
5347|These Belong in A Museum|Collect 300 Cards|9844|31 Jul 2018 1:47:59 PM|23841|132970|17.93|Rare|Bronze
5347|Paying Respects|Attend a funeral|9843|31 Jul 2018 1:37:40 PM|50886|132970|38.27|Uncommon|Bronze
5347|Chemical Warfare|Kill 5 enemies with one Poison Arrow|9842|31 Jul 2018 1:18:16 PM|26586|132970|19.99|Rare|Bronze
5347|Laying Down the Law|Kill 6 enemies with the Revolver without reloading|9841|31 Jul 2018 1:14:59 PM|29132|132970|21.91|Uncommon|Bronze
5347|A Trusty Old Friend|Kill 5 enemies within 10 seconds using any rifle|9840|31 Jul 2018 1:08:39 PM|35616|132970|26.78|Uncommon|Bronze
5347|Triple Threat|Kill 3 enemies with 1 Shotgun blast|9839|31 Jul 2018 1:04:00 PM|24261|132970|18.25|Rare|Bronze
5347|Siberian Ranger|Beat 15 combat encounters after completing the game|9838|31 Jul 2018 12:42:10 PM|22892|132970|17.22|Rare|Bronze
5347|Master Fletcher|Craft 25 of each special arrow type (Fire, Grenade, Poison)|9837|31 Jul 2018 12:01:39 PM|42647|132970|32.07|Uncommon|Bronze
5347|Quick and Painless|Shoot 15 deer in the heart|9836|31 Jul 2018 9:25:28 AM|20527|132970|15.44|Rare|Bronze
5347|No Stone Unturned|Achieve 100% game completion|9835|31 Jul 2018 9:03:08 AM|27991|132970|21.05|Uncommon|Gold
5347|Ultimate Survivor|Finish the game on Survivor difficulty|9834|31 Jul 2018 8:44:25 AM|24896|132970|18.72|Rare|Bronze
5347|The Price of Truth|Finish the game on any difficulty|9833|31 Jul 2018 8:44:24 AM|83497|132970|62.79|Common|Bronze
5347|Compulsive|Complete every Challenge|9832|31 Jul 2018 7:41:51 AM|28410|132970|21.37|Uncommon|Bronze
5347|Dead Ringer|Get 25 headshots using the Bolt-Action Rifle|9831|31 Jul 2018 7:28:04 AM|29426|132970|22.13|Uncommon|Bronze
5347|The Chosen Few|Uncover the remains of all Jacob's disciples|9830|31 Jul 2018 12:00:12 AM|44133|132970|33.19|Uncommon|Bronze
5347|Avid Shopper|Purchase all items from the supply shack|9829|30 Jul 2018 11:47:46 PM|30737|132970|23.12|Uncommon|Bronze
5347|Woman of the People|Complete every Mission|9828|30 Jul 2018 11:40:04 PM|40555|132970|30.5|Uncommon|Bronze
5347|Tomb Raider|Complete all Challenge Tombs|9827|30 Jul 2018 11:35:34 PM|50078|132970|37.66|Uncommon|Bronze
5347|The Wraith of Siberia|Baba Yaga: Kill 50 enemies while wearing the Wraithskin outfit|9826|30 Jul 2018 6:42:06 PM|27028|99946|23.45|Uncommon|Bronze
5347|Fearless|Defeat a Deathless Swordsman using only melee attacks and a finisher|9825|30 Jul 2018 6:09:44 PM|66273|132970|49.84|Uncommon|Bronze
5347|The Road Less Travelled|Unlock the path to Kitezh|9824|30 Jul 2018 4:40:27 PM|88421|132970|66.5|Common|Bronze
5347|Whatever It Takes|Rescue Jonah from Konstantin|9823|30 Jul 2018 4:24:35 PM|88819|132970|66.8|Common|Bronze
5347|Bravo's Legacy|Baba Yaga: Confuse 10 enemies with the Dreamstinger|9822|30 Jul 2018 4:07:59 PM|23299|99946|20.21|Uncommon|Bronze
5347|Vasilisa's Lanterns|Baba Yaga: Complete the Challenge in the Wicked Vale|9821|30 Jul 2018 2:50:24 PM|41309|99946|35.83|Uncommon|Bronze
5347|The Witch Bottles|Baba Yaga: Unearth all Survival Caches in the Wicked Vale|9820|30 Jul 2018 2:41:31 PM|37403|99946|32.44|Uncommon|Bronze
5347|Complete History of Witchcraft|Baba Yaga: Collect all of the Documents in the Wicked Vale|9819|30 Jul 2018 2:40:56 PM|30324|99946|26.3|Uncommon|Bronze
5347|Fond Farewell|Baba Yaga: Speak to Nadia again before leaving the Wicked Vale|9818|30 Jul 2018 2:07:47 PM|67810|99946|58.82|Common|Bronze
5347|Truth Behind the Myth|Baba Yaga: Unmask Baba Yaga|9817|30 Jul 2018 2:07:35 PM|77551|99946|67.27|Common|Bronze
5347|Self-Improvement Junkie|Purchase all skills in a single category|9816|30 Jul 2018 1:41:56 PM|67874|132970|51.04|Common|Bronze
5347|Last Ride of the Witch House|Baba Yaga: Activate the Ancient Lift|9815|30 Jul 2018 1:37:31 PM|77974|99946|67.64|Common|Bronze
5347|Amateur Chemist|Baba Yaga: Craft the Antidote|9814|30 Jul 2018 5:15:50 AM|86036|99946|74.63|Common|Bronze
4263|Diary: Our future|We made it! Schools will reopen soon. From now on, kids will live a normal life again.|9813|30 Jul 2018 4:46:59 AM|8969|89610|10.01|Rare|Gold
4263|Epilogue: We made it!|At first we hardly dared to hope we’d make it, yet we're still here. It means something… right?|9812|30 Jul 2018 4:46:56 AM|9899|89610|11.05|Rare|Gold
4263|Epilogue: War is over|The dogs of war have been raging around for so long. I survived and I hope I am not the only one.|9811|30 Jul 2018 4:46:55 AM|12617|89610|14.08|Rare|Gold
4263|Diary: We've been everywhere|We've searched everywhere, and there’s almost nothing useful left. This war can't end soon enough.|9810|30 Jul 2018 3:29:14 AM|8925|89610|9.96|Very Rare|Silver
4263|Note: The school of life|It’s crucial that kids learn to survive on their own. What if we don’t come back one night?|9809|30 Jul 2018 12:18:32 AM|5885|89610|6.57|Very Rare|Silver
4263|Diary: We have wintered|The winter's gone. The freeze is over. We made it through... everyone made it! Amazing.|9808|30 Jul 2018 12:11:18 AM|11202|89610|12.5|Rare|Silver
4263|Diary: Vexing snow|Vexing snow. Half of the city’s buried so deep we can't get there. My kingdom for a snow plow...|9807|29 Jul 2018 11:10:06 PM|18851|89610|21.04|Uncommon|Bronze
4263|Note: Everybody got to learn|Solidarity. That’s the first thing we have to teach to our children.|9806|29 Jul 2018 1:55:27 PM|7468|89610|8.33|Very Rare|Bronze
4263|Diary: Bond for life|At least the kid has a new playmate. Maybe it will even be a break from our daily routine here.|9805|29 Jul 2018 1:09:45 PM|8610|89610|9.61|Very Rare|Silver
4263|Diary: Shooting for five stars|For the first time since we wound up here all of us ate a hot meal. Let's not get used to it yet.|9804|29 Jul 2018 12:43:32 PM|36282|89610|40.49|Uncommon|Silver
4263|Diary: Our own playground|We wish we could be kids again and have fun with practically nothing.|9803|29 Jul 2018 10:53:30 AM|12505|89610|13.95|Rare|Bronze
4263|Note: Distilled gold|We managed to distill some moonshine. Under siege, food and alcohol are always in high demand.|9802|29 Jul 2018 10:27:26 AM|20655|89610|23.05|Uncommon|Silver
4263|Diary: First blood|One of us had a brush with violent death. Let’s hope there’ll be no more such encounters.|9801|29 Jul 2018 10:21:43 AM|40411|89610|45.1|Uncommon|Bronze
4263|Note: Doubled the watch|It's crucial to secure our place against intruders. Two lookouts can watch out for each other.|9800|29 Jul 2018 9:57:20 AM|29982|89610|33.46|Uncommon|Bronze
4263|Note: Better days|Kids… they sometimes seem to be far away from this war. It’s heartwarming.|9799|29 Jul 2018 9:40:52 AM|12540|89610|13.99|Rare|Silver
4263|Note: Creature comforts|Our place is starting to resemble a proper home and it keeps the spirits up.|9798|29 Jul 2018 9:11:38 AM|19625|89610|21.9|Uncommon|Silver
4263|Diary: Traces of lives|Every building we visit has a story to tell. What kind of story will we leave behind...?|9797|29 Jul 2018 8:51:26 AM|33065|89610|36.9|Uncommon|Bronze
4263|Note: Avoid the worst|Attacking a place that shelters a kid… Atrocious! We stand together to protect our little one!|9796|29 Jul 2018 8:42:44 AM|12985|89610|14.49|Rare|Gold
4263|Note: A bit of indulgence|We all indulged our addictions. It keeps the spirits up… and forget about health issues for once!|9795|29 Jul 2018 8:42:42 AM|42346|89610|47.26|Uncommon|Bronze
4263|Diary: Day 7|We’ve been holed up here for seven days, and we’ve managed to keep everyone alive - so far...|9794|29 Jul 2018 7:30:02 AM|39742|89610|44.35|Uncommon|Bronze
4263|Note: Bless the radio|The radio is useful beyond expectations. We get weather reports, important news and music too.|9793|29 Jul 2018 7:09:38 AM|34396|89610|38.38|Uncommon|Bronze
4263|Diary: Hostel's open!|We now have enough beds for everyone except the one who has to go out and scavenge.|9792|29 Jul 2018 6:19:06 AM|49737|89610|55.5|Common|Bronze
4263|Diary: Finished ransacking|We've explored every nook and cranny of our abode. Now we must venture outside for more supplies.|9791|29 Jul 2018 6:00:40 AM|40966|89610|45.72|Uncommon|Bronze
3188|We Had Fun, Didn't We?|Complete Tales From The Borderlands|9790|29 Jul 2018 4:07:37 AM|93516|171786|54.44|Common|Platinum
3188|Tales Twice Told|Completed Episode 5|9789|29 Jul 2018 4:07:37 AM|93693|171786|54.54|Common|Gold
3188|What's It Worth?|Completed Chapter 6 of Episode 5|9788|29 Jul 2018 3:50:28 AM|93743|171786|54.57|Common|Silver
3188|Time's A Wastin'|Completed Chapter 5 of Episode 5|9787|29 Jul 2018 3:24:18 AM|93852|171786|54.63|Common|Bronze
3188|Definition Of Insanity|Completed Chapter 4 of Episode 5|9786|29 Jul 2018 2:49:47 AM|93959|171786|54.7|Common|Bronze
3188|Give And Take (Mostly Take)|Completed Chapter 3 of Episode 5|9785|29 Jul 2018 2:40:27 AM|94017|171786|54.73|Common|Bronze
3188|Unforseen Consequences|Completed Chapter 2 of Episode 5|9784|29 Jul 2018 2:16:57 AM|94107|171786|54.78|Common|Bronze
3188|A Maze Of Twisty Passages, All Alike|Completed Chapter 1 of Episode 5|9783|29 Jul 2018 2:08:26 AM|94161|171786|54.81|Common|Bronze
3188|…There You Are|Completed Episode 4|9782|29 Jul 2018 1:55:49 AM|94828|171786|55.2|Common|Silver
3188|No Matter Where You Go…|Completed Chapter 6 of Episode 4|9781|29 Jul 2018 1:40:21 AM|94883|171786|55.23|Common|Silver
3188|Light This Candle|Completed Chapter 5 of Episode 4|9780|29 Jul 2018 1:34:18 AM|94924|171786|55.26|Common|Silver
3188|It's Not The Years, It's The Mileage|Completed Chapter 4 of Episode 4|9779|29 Jul 2018 1:24:38 AM|94988|171786|55.29|Common|Bronze
3188|Ain't My First Rodeo|Completed Chapter 3 of Episode 4|9778|29 Jul 2018 1:04:27 AM|95160|171786|55.39|Common|Silver
3188|Alive And Not Afraid|Completed Chapter 2 of Episode 4|9777|29 Jul 2018 12:35:41 AM|95373|171786|55.52|Common|Bronze
3188|Ain't Got Time To Bleed|Completed Chapter 1 of Episode 4|9776|29 Jul 2018 12:17:58 AM|95639|171786|55.67|Common|Bronze
3188|Angry Eyes|Completed Episode 3|9775|28 Jul 2018 11:58:14 PM|97021|171786|56.48|Common|Gold
3188|Maneater|Completed Chapter 6 of Episode 3|9774|28 Jul 2018 11:41:10 PM|97041|171786|56.49|Common|Silver
3188|Rupture|Completed Chapter 5 of Episode 3|9773|28 Jul 2018 11:24:35 PM|97178|171786|56.57|Common|Bronze
6015|I am the glorious Mr. Massagy!|Unlock all the trophies!|9772|28 Jul 2018 6:03:11 PM|10744|11109|96.71|Common|Platinum
6015|Bytes all over you!|Get a massagy with S.O.N.I.A.|9771|28 Jul 2018 6:03:11 PM|10771|11109|96.96|Common|Gold
6015|Hackerbruh!|Get three stars with S.O.N.I.A|9770|28 Jul 2018 6:01:53 PM|10771|11109|96.96|Common|Gold
6015|How does this even work?|Get a massagy with Papu-Aiye|9769|28 Jul 2018 5:57:46 PM|10820|11109|97.4|Common|Bronze
6015|Expert Datemeister|Date all dates!|9768|28 Jul 2018 5:57:39 PM|10816|11109|97.36|Common|Bronze
6015|Smooth Criminal|Get three stars with all dates!|9767|28 Jul 2018 5:57:38 PM|10774|11109|96.98|Common|Gold
6015|Real people are overrated|Get three stars with Papu-Aiye|9766|28 Jul 2018 5:57:31 PM|10803|11109|97.25|Common|Silver
6015|You'll be alone forever...|Fail 20 dates.|9765|28 Jul 2018 5:55:22 PM|10780|11109|97.04|Common|Gold
6015|Who you gonna massage?|Get a massagy with Anne|9764|28 Jul 2018 5:53:58 PM|10826|11109|97.45|Common|Bronze
6015|I hope that's ectoplasm|Get three stars with Anne|9763|28 Jul 2018 5:53:52 PM|10808|11109|97.29|Common|Silver
6015|Yo, where's your mojo?|Fail 10 dates.|9762|28 Jul 2018 5:49:26 PM|10811|11109|97.32|Common|Bronze
6015|You win some, you lose some!|Fail 5 dates.|9761|28 Jul 2018 5:48:33 PM|10882|11109|97.96|Common|Bronze
6015|Proud of your job!|Discover Johnny's true job in Sarah's date.|9760|28 Jul 2018 5:47:12 PM|10765|11109|96.9|Common|Silver
6015|What a dairy experience|Get a massagy with Dorothy|9759|28 Jul 2018 5:45:57 PM|10842|11109|97.6|Common|Bronze
6015|Moooossagy!|Get three stars with Dorothy|9758|28 Jul 2018 5:45:49 PM|10827|11109|97.46|Common|Silver
6015|That's… a lot of toys|Get a massagy with Sarah|9757|28 Jul 2018 5:44:12 PM|10843|11109|97.61|Common|Bronze
6015|Sugar daddy time!|Get three stars with Sarah|9756|28 Jul 2018 5:44:06 PM|10848|11109|97.65|Common|Silver
6015|Don't put your massage in crazy, man|Get three stars with Janein|9755|28 Jul 2018 5:41:21 PM|10819|11109|97.39|Common|Silver
6015|Average Joe|Finish with a two-star date 5 times with any character.|9754|28 Jul 2018 5:38:12 PM|10873|11109|97.88|Common|Bronze
6015|It hurts so gooood...|Get a massagy with Janein|9753|28 Jul 2018 5:36:52 PM|10890|11109|98.03|Common|Bronze
6015|It's something...|Get two stars in any date.|9752|28 Jul 2018 5:36:46 PM|11005|11109|99.06|Common|Silver
6015|Slippery everywhere|Get a massagy with Mayo|9751|28 Jul 2018 5:35:32 PM|10864|11109|97.79|Common|Bronze
6015|Watch the cholesterol|Get three stars with Mayo|9750|28 Jul 2018 5:35:27 PM|10872|11109|97.87|Common|Silver
6015|Poking around|Tap the Mayonnaise|9749|28 Jul 2018 5:33:17 PM|10836|11109|97.54|Common|Bronze
6015|Gotta love these app features|Get a massagy with Martha|9748|28 Jul 2018 5:32:07 PM|10867|11109|97.82|Common|Bronze
6015|Mother trucker!|Get three stars with Martha|9747|28 Jul 2018 5:31:59 PM|10819|11109|97.39|Common|Silver
6015|Careful with the claws|Get a massagy with Nicole|9746|28 Jul 2018 5:29:35 PM|10954|11109|98.6|Common|Bronze
6015|Awoo!|Get three stars with Nicole|9745|28 Jul 2018 5:29:28 PM|10840|11109|97.58|Common|Silver
6015|You blew it!|Fail any date|9744|28 Jul 2018 5:27:40 PM|11025|11109|99.24|Common|Bronze
6015|Duck killed!|Get killed by Nicole|9743|28 Jul 2018 5:27:33 PM|10895|11109|98.07|Common|Silver
6015|Tutorial with a happy ending|Get a massagy with Rial|9742|28 Jul 2018 5:25:34 PM|11021|11109|99.21|Common|Bronze
6015|You beat the Tuto-Rial!|Get three stars with Rial|9741|28 Jul 2018 5:25:27 PM|10938|11109|98.46|Common|Silver
6015|Moooom! Somebody likes me!|Match a date on Linger|9740|28 Jul 2018 5:23:58 PM|11059|11109|99.55|Common|Gold
6015|Nope!|Reject a date on Linger!|9739|28 Jul 2018 5:23:47 PM|11055|11109|99.51|Common|Bronze
3188|So Many Bandits, So Little Time|Completed Chapter 4 of Episode 3|9738|28 Jul 2018 5:05:52 PM|97514|171786|56.76|Common|Bronze
3188|Point Of No Return|Completed Chapter 3 of Episode 3|9737|28 Jul 2018 3:53:52 PM|98135|171786|57.13|Common|Bronze
3188|Temptation|Completed Chapter 2 of Episode 3|9736|28 Jul 2018 3:34:34 PM|98650|171786|57.43|Common|Bronze
3188|Don't Make Me Wait|Completed Chapter 1 of Episode 3|9735|28 Jul 2018 3:18:05 PM|98896|171786|57.57|Common|Bronze
6247|The Future is Clear|Seek and destroy. Again.|9734|28 Jul 2018 1:56:52 PM|3592|4173|14.59|Rare|Silver
6247|Fruit Fighter|Shoot a background UFO in Future Tense.|9733|28 Jul 2018 1:36:51 PM|4015|4173|16.31|Rare|Silver
6247|The N. Vincible Crash Bandicoot!|Collect all the Crash Bandicoot: Warped trophies.|9732|28 Jul 2018 1:09:31 PM|17822|145190|12.27|Rare|Platinum
6247|Accept No Substitutes|Shoot the imposter.|9731|28 Jul 2018 1:09:31 PM|18941|145190|13.05|Rare|Bronze
6247|Boo-yah, Grandma! Boo-yah!|Earn 30 Relics (gold or better).|9730|28 Jul 2018 1:06:48 PM|18202|145190|12.54|Rare|Gold
6247|Bringing Down the House|Earn 42 Gems.|9729|28 Jul 2018 12:34:35 PM|20995|145190|14.46|Rare|Gold
6247|Giving 102%!|Earn the Gems in the bonus levels.|9728|28 Jul 2018 2:25:11 AM|22111|145190|15.23|Rare|Silver
6247|Getting Carried Away|Discovered the Secret Exit in Dino Might!|9727|28 Jul 2018 2:11:51 AM|23584|145190|16.24|Rare|Silver
6247|The Riddle of the Sphynx|Have your bazooka ready.|9726|28 Jul 2018 1:56:52 AM|25269|145190|17.4|Rare|Bronze
6247|Trigger Clickin' Good|Shoot 5 of them in a single level.|9725|28 Jul 2018 1:04:58 AM|24369|145190|16.78|Rare|Bronze
6247|Is There a Problem, Granny?!|Earn 10 Relics (gold or better).|9724|28 Jul 2018 12:02:42 AM|24768|145190|17.06|Rare|Silver
6247|UFO Xing|Discovered the Secret Exit in Road Crash.|9723|27 Jul 2018 10:09:19 PM|32673|145190|22.5|Uncommon|Silver
6247|Cortex N. Carcerated|Defeat N. Cortex.|9722|27 Jul 2018 10:06:00 PM|43744|145190|30.13|Uncommon|Gold
6247|Buckle Up, Boys, Buckle Up!|Earn 5 Relics.|9721|27 Jul 2018 9:12:47 PM|33205|145190|22.87|Uncommon|Bronze
6247|Leave No Gem Unturned|Earn 21 Gems.|9720|27 Jul 2018 8:31:24 PM|30029|145190|20.68|Uncommon|Gold
6247|A Cut Above the Rest|Discover a Gem Path after earning a Color Gem.|9719|27 Jul 2018 8:22:58 PM|36054|145190|24.83|Uncommon|Silver
6247|Mech Wrecked, Again!|Defeat N. Gin.|9718|27 Jul 2018 6:20:42 PM|46771|145190|32.21|Uncommon|Silver
6247|Keeping Crash Under Wraps|Die.|9717|27 Jul 2018 3:18:04 PM|35725|145190|24.61|Uncommon|Silver
6247|A Stitch in Time Saves 99|Earn 99 Lives.|9716|27 Jul 2018 3:16:37 PM|22464|145190|15.47|Rare|Gold
6247|Category Five|Defeat 5 enemies with Coco's Savage Hurricane Spin.|9715|27 Jul 2018 2:51:16 PM|33753|145190|23.25|Uncommon|Gold
6247|A Nefarious Trophy|Defeat N. Tropy.|9714|27 Jul 2018 1:19:42 PM|49496|145190|34.09|Uncommon|Silver
6247|Not a Scratch (Give It Time)|Discover a Death Route.|9713|27 Jul 2018 1:07:53 PM|46146|145190|31.78|Uncommon|Silver
6247|Penta's Revenge|Defeat Dingodile.|9712|27 Jul 2018 9:19:56 AM|59420|145190|40.93|Uncommon|Bronze
6247|Your Moment of Zen|Avoid whatever he's flinging at you.|9711|27 Jul 2018 9:02:30 AM|25761|145190|17.74|Rare|Silver
6247|Warts and All|Die.|9710|27 Jul 2018 8:36:55 AM|38231|145190|26.33|Uncommon|Bronze
6247|Tiny Trounced|Defeat Tiny Tiger.|9709|27 Jul 2018 8:34:58 AM|68547|145190|47.21|Uncommon|Bronze
6247|Taking the Scenic Route|Discover a "?" Bonus Path.|9708|27 Jul 2018 7:51:18 AM|81938|145190|56.44|Common|Bronze
6246|The N. Credible Crash Bandicoot!|Collect all the Crash Bandicoot 2: Cortex Strikes Back trophies.|9707|27 Jul 2018 7:16:55 AM|15024|145722|10.31|Rare|Platinum
6246|Wumpa-Burner Engaged!|Earn 27 Relics (gold or better).|9706|27 Jul 2018 7:16:55 AM|15129|145722|10.38|Rare|Gold
6246|Laser Powered Vengence|Earn 42 Gems.|9705|27 Jul 2018 6:47:54 AM|21554|145722|14.79|Rare|Gold
6246|Crash Cubed|Fly, then die.|9704|26 Jul 2018 2:05:27 PM|52662|145722|36.14|Uncommon|Silver
6246|Light the Fires!|Earn 10 Relics (gold or better).|9703|26 Jul 2018 1:58:04 PM|18298|145722|12.56|Rare|Silver
6246|One Man's Trash|Earn 21 Gems.|9702|26 Jul 2018 1:11:32 PM|30589|145722|20.99|Uncommon|Gold
6246|Kick the Tires!|Earn 5 Relics.|9701|26 Jul 2018 12:00:51 PM|24367|145722|16.72|Rare|Bronze
6246|Island Hopping|Unlocked the Secret Exit in Bear Down.|9700|26 Jul 2018 8:28:36 AM|42576|145722|29.22|Uncommon|Silver
6246|No Bear Left Behind|Unlocked the Secret Exit in Unbearable.|9699|26 Jul 2018 4:42:27 AM|31036|145722|21.3|Uncommon|Silver
6246|Jumping the Jetboard|Unlocked the Secret Exit in Air Crash.|9698|26 Jul 2018 3:03:44 AM|37155|145722|25.5|Uncommon|Silver
6246|Cortex N. Adequate|Defeat N. Cortex.|9697|26 Jul 2018 2:53:45 AM|41045|145722|28.17|Uncommon|Gold
6246|Mech Wrecked|Defeat N. Gin.|9696|25 Jul 2018 5:18:18 PM|45111|145722|30.96|Uncommon|Silver
6246|The Flora Flop|Unlocked the Secret Exit in Diggin' It.|9695|25 Jul 2018 4:12:54 PM|29348|145722|20.14|Uncommon|Silver
6246|Buzz Off!|Die as Crash.|9694|25 Jul 2018 4:11:58 PM|51440|145722|35.3|Uncommon|Bronze
6246|Hang In There, Maybe!|Unlocked the Secret Exit in Hangin' Out.|9693|25 Jul 2018 4:03:48 PM|37825|145722|25.96|Uncommon|Silver
6246|Boom Shakalaka!|Defeat 5 enemies with Coco's Double Leg Drop.|9692|25 Jul 2018 3:41:43 PM|30270|145722|20.77|Uncommon|Gold
6246|99 Percent Perspiration|Earn 99 lives.|9691|25 Jul 2018 3:37:28 PM|25232|145722|17.32|Rare|Gold
6246|Tiny Tricked|Defeat Tiny Tiger.|9690|25 Jul 2018 3:17:37 PM|54562|145722|37.44|Uncommon|Silver
6246|A Diamond in the Rough|Discover a Gem Path after earning a Color Gem.|9689|25 Jul 2018 1:36:32 PM|44364|145722|30.44|Uncommon|Silver
6246|Komodo No Mo|Defeat the Komodo Brothers.|9688|25 Jul 2018 1:17:37 PM|61590|145722|42.27|Uncommon|Bronze
6246|Cheated Death (For the Time Being)|Discover a Death Route.|9687|25 Jul 2018 12:47:45 PM|57775|145722|39.65|Uncommon|Silver
6246|A Helping Paw|Don't feel guilty about jumping on him.|9686|25 Jul 2018 12:38:28 PM|41195|145722|28.27|Uncommon|Bronze
6246|Professor Pulverized|Defeat Ripper Roo.|9685|25 Jul 2018 12:36:55 PM|76161|145722|52.26|Common|Bronze
6246|A Road Less Traveled|Discover a "?" Bonus Path.|9684|25 Jul 2018 11:56:28 AM|92356|145722|63.38|Common|Bronze
6246|Cortex N. Furiated|Just "forget" it. Repeatedly.|9683|25 Jul 2018 11:54:24 AM|26502|145722|18.19|Rare|Bronze
6245|The N. Trepid Crash Bandicoot!|Collect all the Crash Bandicoot Trophies.|9682|25 Jul 2018 11:42:10 AM|17835|151565|11.77|Rare|Platinum
6245|Practice Makes Perfect!|Earn 26 Relics (gold or better).|9681|25 Jul 2018 11:42:10 AM|17885|151565|11.8|Rare|Gold
6245|The Ultimate Gem Path|Earn 26 Gems.|9680|25 Jul 2018 4:43:25 AM|27206|151565|17.95|Rare|Gold
6245|Could Go… All… The… Way!|Earn 10 Relics (gold or better).|9679|24 Jul 2018 3:57:19 PM|24406|151565|16.1|Rare|Silver
6245|An Ancient Antiquity|Do hard time.|9678|24 Jul 2018 2:12:39 PM|6712|17418|13.06|Rare|Gold
6245|The Crown Jewel|Seek and destroy.|9677|24 Jul 2018 6:45:17 AM|17411|17418|33.89|Uncommon|Silver
6245|Catch Me If You Can!|Earn 5 Relics.|9676|24 Jul 2018 5:20:52 AM|36260|151565|23.92|Uncommon|Bronze
6245|No Holds Barred|Defeat 5 enemies with Coco's Spin.|9675|24 Jul 2018 3:57:27 AM|88396|151565|58.32|Common|Gold
6245|Cortex N. Capacitated|Defeat N. Cortex.|9674|23 Jul 2018 6:06:35 PM|55200|151565|36.42|Uncommon|Gold
6245|More Gems Are Better Than None|Earn 13 Gems.|9673|23 Jul 2018 5:53:10 PM|31380|151565|20.7|Uncommon|Gold
6245|Nitrus Broken|Defeat N. Brio.|9672|23 Jul 2018 5:14:40 PM|57553|151565|37.97|Uncommon|Gold
6245|On Cloud 99|Earn 99 Lives.|9671|23 Jul 2018 5:08:59 PM|38015|151565|25.08|Uncommon|Gold
6245|Cortex's Terrifying Trial|Earn the Key in Jaws of Darkness.|9670|23 Jul 2018 4:55:48 PM|34006|151565|22.44|Uncommon|Silver
6245|A Hidden Gem|Discover a Gem Path after earning a Color Gem.|9669|23 Jul 2018 4:19:17 PM|54342|151565|35.85|Uncommon|Silver
6245|Pinstripe Patooey|Defeat Pinstripe Potoroo.|9668|23 Jul 2018 2:30:44 PM|71241|151565|47.0|Uncommon|Silver
6245|I See London, I See France|Die.|9667|23 Jul 2018 1:26:06 PM|71359|151565|47.08|Uncommon|Silver
6245|Koala Konked|Defeat Koala Kong.|9666|23 Jul 2018 12:41:14 PM|75222|151565|49.63|Uncommon|Silver
6245|Cortex's Crazed Contest|Earn the Key in Sunset Vista.|9665|23 Jul 2018 12:37:09 PM|44432|151565|29.32|Uncommon|Silver
6245|The Box That Broke the Bandicoot's Back|Miss a lot of boxes.|9664|23 Jul 2018 8:51:08 AM|95849|151565|63.24|Common|Bronze
6245|Ripper Ruined|Defeat Ripper Roo.|9663|23 Jul 2018 8:29:38 AM|99599|151565|65.71|Common|Bronze
6245|Papu Popped|Defeat Papu-Papu.|9662|23 Jul 2018 7:09:45 AM|132596|151565|87.48|Common|Bronze
6245|That's What Those Do!|Enter a Bonus Round after collecting 3 Character Tokens.|9661|23 Jul 2018 6:57:15 AM|142281|151565|93.87|Common|Bronze
6245|Spin Doctor|In a single level, spin an enemy into another enemy twice.|9660|23 Jul 2018 6:45:50 AM|147025|151565|97.0|Common|Bronze
6245|Feeeed Meeeee!|Die.|9659|23 Jul 2018 6:45:17 AM|122171|151565|80.61|Common|Bronze
6245|I Meant To Do That!|Spin away an Extra Life.|9658|23 Jul 2018 6:40:58 AM|111962|151565|73.87|Common|Bronze
3188|Miracle of Atlas Engineering|Completed Episode 2|9657|23 Jul 2018 6:13:42 AM|101429|171786|59.04|Common|Gold
3188|Bro or Bot|Completed Chapter 6 of Episode 2|9656|23 Jul 2018 5:55:46 AM|101628|171786|59.16|Common|Silver
3188|Classic Reflexes|Completed Chapter 5 of Episode 2|9655|23 Jul 2018 5:41:57 AM|101984|171786|59.37|Common|Bronze
2983|I've Got Box of Steel|Clear The Executioner without taking any damage.|9654|22 Jul 2018 4:11:03 PM|2747|8949|7.38|Very Rare|Silver
2983|I Might Close Early|Purchase all items in the Shop.|9653|22 Jul 2018 3:33:57 PM|2921|8949|7.85|Very Rare|Bronze
2983|Cruel and Unusual|Complete all Torments.|9652|22 Jul 2018 3:32:18 PM|2931|8949|7.87|Very Rare|Silver
2983|You Had This Coming|Get payback on the cop who took down your predecessor.|9651|22 Jul 2018 2:16:01 PM|4054|8949|10.89|Rare|Silver
2983|Nosy Parent|Collect all Daughter's Diaries in The Executioner.|9650|22 Jul 2018 1:04:12 PM|6243|8949|16.77|Rare|Bronze
2983|The Craftsman's Tools|Clear the basement of the manor house in The Executioner.|9649|22 Jul 2018 12:57:53 PM|7952|8949|21.36|Uncommon|Bronze
2983|Krimson Chainsaw Massacre|Kill 10 basic Haunted with the chainsaw.|9648|22 Jul 2018 12:19:37 PM|5370|8949|14.42|Rare|Bronze
2983|Trapper and Keeper|Kill 10 basic Haunted with environmental traps in The Executioner.|9647|22 Jul 2018 12:18:53 PM|5671|8949|15.23|Rare|Bronze
2983|Home Invasion|Clear the first and second floors of the manor house in The Executioner.|9646|22 Jul 2018 12:02:04 PM|8468|8949|22.74|Uncommon|Bronze
2983|Got to Destroy the Brain|Use Executions on 20 basic Haunted.|9645|22 Jul 2018 10:36:10 AM|8627|8949|23.17|Uncommon|Bronze
2983|None More Dark|Clear The Consequence in KURAYAMI Mode.|9644|22 Jul 2018 9:25:05 AM|2880|9388|7.55|Very Rare|Silver
2983|Where Do We Go From Here?|Clear Chapter 4, "A Ghost is Born."|9643|22 Jul 2018 7:03:06 AM|8971|9388|23.53|Uncommon|Silver
2983|Stick to the Script|Defeat Ruvik before the final showdown in The Consequence. (Ch. 4)|9642|22 Jul 2018 6:49:07 AM|5075|9388|13.31|Rare|Bronze
2983|It's All Your Fault|Collect all Research Documents in The Consequence.|9641|22 Jul 2018 6:45:25 AM|4739|9388|12.43|Rare|Silver
