3765|Le Voyage Dans la Lune.|A Trip to the Moon.|14290|31 Jul 2018 11:40:10 PM|3185|3800|18.95|Rare|Bronze
3765|Dastardly|Place a Hogtied NPC on the train tracks and wait for the train to arrive.|14289|31 Jul 2018 11:35:19 PM|2392|3800|14.23|Rare|Bronze
3765|The Big Score|Find all the trophies on the Payday Level.|14288|31 Jul 2018 11:30:35 PM|2474|3800|14.72|Rare|Bronze
3765|NERD!|Find All Collectibles|14287|31 Jul 2018 6:36:47 AM|1843|3162|12.02|Rare|Bronze
7667|Try and Counter This|Beat Street Fighter Alpha: Warriors' Dreams.|14286|30 Jul 2018 10:38:18 AM|1088|3371|32.28|Uncommon|Bronze
7667|Hyperactive|Beat Street Fighter II': Hyper Fighting.|14285|30 Jul 2018 2:51:29 AM|836|3371|24.8|Uncommon|Bronze
7667|True Champion|Beat Street Fighter II': Champion Edition.|14284|30 Jul 2018 2:07:32 AM|959|3371|28.45|Uncommon|Bronze
6287|Energy Cycle Platinum|Good job! Completed all tasks!|14283|30 Jul 2018 1:02:57 AM|7313|7615|96.03|Common|Platinum
6287|Infinity Layer #50|Passed through layer #50 in Infinite Play mode|14282|30 Jul 2018 1:02:57 AM|7398|7615|97.15|Common|Gold
6287|Infinity Layer #40|Passed through layer #40 in Infinite Play mode|14281|30 Jul 2018 1:02:51 AM|7399|7615|97.16|Common|Gold
6287|Infinity Layer #30|Passed through layer #30 in Infinite Play mode|14280|30 Jul 2018 1:02:46 AM|7402|7615|97.2|Common|Silver
6287|Infinity Layer #20|Passed through layer #20 in Infinite Play mode|14279|30 Jul 2018 1:02:41 AM|7409|7615|97.29|Common|Silver
6287|Infinity Layer #10|Passed through layer #10 in Infinite Play mode|14278|30 Jul 2018 1:02:36 AM|7435|7615|97.64|Common|Bronze
6287|Time Attack Layer #30|Passed through layer #30 in Time Attack mode|14277|30 Jul 2018 1:01:41 AM|7404|7615|97.23|Common|Gold
6287|Time Attack Layer #20|Passed through layer #20 in Time Attack mode|14276|30 Jul 2018 1:01:36 AM|7406|7615|97.26|Common|Gold
6287|Time Attack Layer #10|Passed through layer #10 in Time Attack mode|14275|30 Jul 2018 1:01:32 AM|7427|7615|97.53|Common|Silver
6287|Game Completed|Energy Cycle is complete|14274|30 Jul 2018 1:00:48 AM|7340|7615|96.39|Common|Gold
6287|Level 27 Completed|Part of the cycle is complete|14273|30 Jul 2018 1:00:18 AM|7349|7615|96.51|Common|Gold
6287|Level 24 Completed|Part of the cycle is complete|14272|30 Jul 2018 12:58:36 AM|7351|7615|96.53|Common|Gold
6287|Level 21 Completed|Part of the cycle is complete|14271|30 Jul 2018 12:56:59 AM|7354|7615|96.57|Common|Gold
6287|Level 18 Completed|Part of the cycle is complete|14270|30 Jul 2018 12:55:22 AM|7363|7615|96.69|Common|Silver
6287|Level 15 Completed|Part of the cycle is complete|14269|30 Jul 2018 12:53:29 AM|7365|7615|96.72|Common|Silver
6287|Level 12 Completed|Part of the cycle is complete|14268|30 Jul 2018 12:51:32 AM|7372|7615|96.81|Common|Silver
6287|Level 9 Completed|Part of the cycle is complete|14267|30 Jul 2018 12:50:08 AM|7392|7615|97.07|Common|Bronze
6287|Level 6 Completed|Part of the cycle is complete|14266|30 Jul 2018 12:48:50 AM|7417|7615|97.4|Common|Bronze
6287|Level 3 Completed|Part of the cycle is complete|14265|30 Jul 2018 12:46:05 AM|7474|7615|98.15|Common|Bronze
5362|Hail to the King!|Completed all trophies for the game!|14264|29 Jul 2018 9:37:02 PM|7400|13823|53.53|Common|Platinum
5362|Oomph, Uugh, Where Is It?|Find 70 secret areas.|14263|29 Jul 2018 9:37:02 PM|7931|13823|57.38|Common|Gold
5362|I'm Back, Baby|Complete "Alien World Order" on any difficulty.|14262|29 Jul 2018 9:23:04 PM|8055|13823|58.27|Common|Gold
5362|Damn I'm Good|Complete "The Birth" on any difficulty.|14261|29 Jul 2018 9:18:58 PM|7888|13823|57.06|Common|Silver
5362|Invaders Must Die!|Kill 1000 enemies.|14260|29 Jul 2018 9:09:31 PM|8128|13823|58.8|Common|Gold
5362|Roast 'Em|Burn 50 bad guys to death.|14259|29 Jul 2018 9:08:27 PM|7715|13823|55.81|Common|Silver
5362|Rage Engage|Kill 10 bad guys in 10 seconds while on steroids.|14258|29 Jul 2018 8:57:36 PM|7730|13823|55.92|Common|Gold
5362|I Never Knew This Was Here|Finish a secret level.|14257|29 Jul 2018 8:52:31 PM|8439|13823|61.05|Common|Silver
5362|Why So Serious!?!|Find Sam in "Mirage Barrage".|14256|29 Jul 2018 8:46:18 PM|7800|13823|56.43|Common|Silver
5362|Duke, Use the Force!|Find Luke in the Level "Lunar Reactor".|14255|29 Jul 2018 8:45:19 PM|7654|13823|55.37|Common|Silver
5362|Buzz Off|Kill a Firefly Trooper while it's flying small.|14254|29 Jul 2018 8:42:29 PM|8018|13823|58.0|Common|Silver
5362|I Never Inhaled|Use the hookah in "High Times".|14253|29 Jul 2018 8:40:03 PM|8337|13823|60.31|Common|Bronze
5362|Take No Prisoners|Kill every enemy on a level.|14252|29 Jul 2018 8:32:22 PM|9471|13823|68.52|Common|Gold
5362|Alien Maggots are Gonna Pay|Finish the "Hollywood Holocaust" level in under 3 minutes.|14251|29 Jul 2018 8:30:24 PM|8366|13823|60.52|Common|Silver
5362|It Happens|Step in a pile of excrement.|14250|29 Jul 2018 8:28:41 PM|8908|13823|64.44|Common|Bronze
5362|Come Get Some|Complete "Shrapnel City" on any difficulty.|14249|29 Jul 2018 8:27:00 PM|8185|13823|59.21|Common|Silver
5362|See, I'm Tough Too!|Finish any level on "Damn, I'm Good" difficulty.|14248|29 Jul 2018 8:27:00 PM|7994|13823|57.83|Common|Silver
5362|Let's Rock|Complete "Lunar Apocalypse" on any difficulty.|14247|29 Jul 2018 8:11:37 PM|8244|13823|59.64|Common|Bronze
5362|Nukem All|Kill 5 bad guys with one shot.|14246|29 Jul 2018 8:11:03 PM|8619|13823|62.35|Common|Gold
5362|Piece of Cake|Complete "L.A. Meltdown" on any difficulty.|14245|29 Jul 2018 7:12:38 PM|9152|13823|66.21|Common|Bronze
5362|Doomed Marine|Find the Doomguy in the Level "Death Row".|14244|29 Jul 2018 6:49:53 PM|9196|13823|66.53|Common|Silver
5362|Duke's Mighty Foot|Step on 40 enemies after using the Shrinker on them.|14243|29 Jul 2018 6:40:46 PM|8130|13823|58.82|Common|Silver
5362|Shake It, Baby|Tip an exotic dancer.|14242|29 Jul 2018 6:40:25 PM|11665|13823|84.39|Common|Bronze
5362|All Too Easy|Find a secret area.|14241|29 Jul 2018 6:31:39 PM|13072|13823|94.57|Common|Bronze
5362|Smoke 'Em If You Got 'Em|Use the Incinerator.|14240|29 Jul 2018 6:31:32 PM|8834|13823|63.91|Common|Bronze
5362|More Than 2 Weapons At Once?|Carry all weapons with ammo at once.|14239|29 Jul 2018 6:29:57 PM|8799|13823|63.65|Common|Bronze
5362|That's What She Said|Listen to Developer Commentary (Use at least one trigger).|14238|29 Jul 2018 6:29:13 PM|8746|13823|63.27|Common|Bronze
5362|Cheating!|Use a cheat code.|14237|29 Jul 2018 6:27:40 PM|8794|13823|63.62|Common|Bronze
7667|World Warrior|Beat Street Fighter II: The World Warrior.|14236|24 Jul 2018 4:19:37 AM|1229|3371|36.46|Uncommon|Bronze
3765|Ruler Of the Seven Skies|Blow Up All Pirate Ships|14235|24 Jul 2018 1:24:39 AM|1840|3162|12.0|Rare|Bronze
3765|Bacon Marauder|Shoot Down 30 Police Ships|14234|24 Jul 2018 12:56:06 AM|1844|3162|12.03|Rare|Bronze
3765|Be Not Afreight|Destroy All Freighters|14233|24 Jul 2018 12:40:50 AM|1856|3162|12.1|Rare|Bronze
3765|Splishy Splashy Wibbly Wobbly Timey Wimey|Visit The Badehaus|14232|24 Jul 2018 12:21:17 AM|2042|3162|13.32|Rare|Bronze
3765|Use The Sword, Goat|Pickup A Photon Sword As Father Or Good Goat|14231|24 Jul 2018 12:18:42 AM|2172|3162|14.16|Rare|Bronze
3765|The World Is Your Canvas|Tag 10 Walls|14230|23 Jul 2018 11:29:51 PM|1942|3162|12.66|Rare|Bronze
3765|Testaholic|Complete Test Chambers|14229|23 Jul 2018 11:05:25 PM|2186|3162|14.26|Rare|Bronze
3765|What Came First? The Alien Or The Egg?|Headbutt All Alien Eggs|14228|23 Jul 2018 10:09:15 PM|1991|3162|12.98|Rare|Bronze
3765|I Wanna Be A Baahlionaire|Gather $1000000|14227|23 Jul 2018 9:53:40 PM|2116|3162|13.8|Rare|Bronze
3765|Fund This!|Headbutt Lawrence S.Windler in his lair|14226|23 Jul 2018 9:46:10 PM|2359|3162|15.38|Rare|Bronze
3765|My Little Brony|Find All The Pony Horses|14225|23 Jul 2018 9:41:45 PM|2046|3162|13.34|Rare|Bronze
3765|It's Working... IT'S WORKING!|Run Wild With The Podracer|14224|23 Jul 2018 8:32:03 PM|2947|3162|19.22|Rare|Bronze
2369|Hohokum Remix: Synth Loops|Complete the mix with a splash of analog electronics.|14223|23 Jul 2018 3:40:27 AM|4613|4617|70.13|Common|Silver
2369|Hohokum Remix: Bass|Build your own bassline from this pulse.|14222|23 Jul 2018 3:40:26 AM|4616|4617|70.18|Common|Silver
2369|Hohokum Remix: Drum Kit|Can you use these dreamy drums to make a beat?|14221|23 Jul 2018 3:40:26 AM|4613|4617|70.13|Common|Silver
2369|Hohokum Remix: Drum Loops|Rearrange the drum loops to make something fresh!|14220|23 Jul 2018 3:40:26 AM|4613|4617|70.13|Common|Silver
2369|Hohokum Remix: Guitar Loops|Sculpt these ethereal guitar and bass melodies.|14219|23 Jul 2018 3:40:26 AM|4613|4617|70.13|Common|Silver
2369|Beat School: Set Phasers to 'Funk'|When the mothership is under attack, fight back with a funky loop.|14218|23 Jul 2018 3:40:26 AM|4542|4545|69.6|Common|Silver
2369|Beat School: 3001 A Bass Odyssey|Take this bassline for a spin around the galaxy!|14217|23 Jul 2018 3:40:25 AM|4545|4545|69.65|Common|Silver
2369|Beat School: Interstellar Funkonauts|May the funk be with you.|14216|23 Jul 2018 3:40:25 AM|4544|4545|69.63|Common|Silver
2369|Beat School: Something Smells Funky in Here!|Time to do the funky laundry!|14215|23 Jul 2018 3:40:25 AM|4542|4545|69.6|Common|Silver
2369|Beat School: Mission to Planet Drums|3, 2, 1... funk off!|14214|23 Jul 2018 3:40:25 AM|4542|4545|69.6|Common|Silver
2369|Beat School: Word to Your Motherboard|Dance, funk, rock and house. You will master all the robotic styles.|14213|23 Jul 2018 3:40:24 AM|4874|4877|72.1|Common|Silver
2369|Beat School: Text to Speech|How could we resist? Shout out Sound Shapes with this unique beat.|14212|23 Jul 2018 3:40:24 AM|4875|4877|72.12|Common|Silver
2369|Beat School: Machine Language|Twist synthetic singing around to make your own vocal line!|14211|23 Jul 2018 3:40:24 AM|4874|4877|72.1|Common|Silver
2369|Beat School: Artificial Ah Yeah!|Robot feels good!|14210|23 Jul 2018 3:40:23 AM|4877|4877|72.15|Common|Silver
2369|Beat School: Loop Jugglin'|Ultimate hip hop loop builder - word to your moms!|14209|23 Jul 2018 3:40:22 AM|4877|4880|72.12|Common|Silver
2369|Beat School: Does Not Compute|Start with the basics, countdown like a robot!|14208|23 Jul 2018 3:40:22 AM|4877|4877|72.15|Common|Silver
2369|Beat School: On the One's and Two's|Checka-checka-check out the scratch routine!|14207|23 Jul 2018 3:40:21 AM|4877|4880|72.12|Common|Silver
2369|Beat School: The Drummer Gets Wicked|Cut and paste drums to make your own breakbeat!|14206|23 Jul 2018 3:40:21 AM|4876|4880|72.11|Common|Silver
2369|Beat School: A Funky Introduction|Get started with this simple bass loop!|14205|23 Jul 2018 3:40:17 AM|4879|4880|72.15|Common|Silver
2369|Beat School: The Five Elements|Who got the jazz? Add some horns to your beat!|14204|23 Jul 2018 3:40:17 AM|4877|4880|72.12|Common|Silver
2369|Beat School: Synth Grime|Complete the Beat School level.|14203|23 Jul 2018 3:40:10 AM|4889|4891|72.22|Common|Silver
2369|Beat School: Filthy Bass Monster|Complete the Beat School level.|14202|23 Jul 2018 3:40:10 AM|4890|4891|72.23|Common|Silver
2369|Beat School: Half-Time Drum Loops|Complete the Beat School level.|14201|23 Jul 2018 3:40:10 AM|4886|4891|72.17|Common|Silver
2369|Beat School: All You Need is Wub|Complete the Beat School level.|14200|23 Jul 2018 3:40:10 AM|4886|4891|72.17|Common|Silver
2369|Beat School: Dubstep Drum Practice|Complete the Beat School level.|14199|23 Jul 2018 3:40:09 AM|4889|4891|72.22|Common|Silver
2369|Beat School: Jazz Hands|Swing to the beat of the cool jazzy brass riff!|14198|23 Jul 2018 3:40:08 AM|4735|4739|71.06|Common|Silver
2369|Beat School: Brass Knuckles|Put up yer dukes, and make a funky horn loop!|14197|23 Jul 2018 3:40:08 AM|4736|4739|71.07|Common|Silver
2369|Beat School: Triumph Horns|A few notes with a huge result!|14196|23 Jul 2018 3:40:02 AM|4736|4739|71.07|Common|Silver
2369|Beat School: Blow Your Own Horn|Learn the brass basics by constructing this simple trumpet loop.|14195|23 Jul 2018 3:40:01 AM|4738|4739|71.1|Common|Silver
2369|Beat School: Battle of the Saxes|Practice your sax skills by creating this cool phrase.|14194|23 Jul 2018 3:40:01 AM|4736|4739|71.07|Common|Silver
2369|Beat School: Hollywood Cop|Complete the Beat School level.|14193|23 Jul 2018 3:40:00 AM|4911|4917|72.35|Common|Silver
2369|Beat School: Fast Times|Complete the Beat School level.|14192|23 Jul 2018 3:39:59 AM|4914|4917|72.4|Common|Silver
2369|Beat School: Axe Grinder|Complete the Beat School level.|14191|23 Jul 2018 3:39:58 AM|4909|4918|72.32|Common|Silver
2369|Beat School: Big Hair Beat|Complete the Beat School level.|14190|23 Jul 2018 3:39:58 AM|4916|4917|72.43|Common|Silver
2369|Beat School: Shoulder Pads|Complete the Beat School level.|14189|23 Jul 2018 3:39:58 AM|4914|4917|72.4|Common|Silver
2369|Beat School: Driving the Autobahn|Complete the Beat School level.|14188|23 Jul 2018 3:39:58 AM|4913|4917|72.38|Common|Silver
2369|Beat School: Insert Coin|Complete the Beat School level.|14187|23 Jul 2018 3:39:57 AM|4942|4949|72.57|Common|Silver
2369|Beat School: Synth Madness 1|Complete the Beat School level.|14186|23 Jul 2018 3:39:57 AM|4917|4918|72.43|Common|Silver
2369|Beat School: Synth Madness 2|Complete the Beat School level.|14185|23 Jul 2018 3:39:57 AM|4912|4918|72.36|Common|Silver
2369|Beat School: Badd Syntax|Complete the Beat School level.|14184|23 Jul 2018 3:39:57 AM|4912|4918|72.36|Common|Silver
2369|Beat School: Pedal to the Metal|Complete the Beat School level.|14183|23 Jul 2018 3:39:57 AM|4912|4918|72.36|Common|Silver
2369|Beat School: Underworld|Complete the Beat School level.|14182|23 Jul 2018 3:39:56 AM|4943|4949|72.59|Common|Silver
2369|Beat School: 8-Bit Melody|Complete the Beat School level.|14181|23 Jul 2018 3:39:55 AM|4949|4949|72.68|Common|Silver
2369|Beat School: Danger! Danger!|Complete the Beat School level.|14180|23 Jul 2018 3:39:55 AM|4947|4949|72.65|Common|Silver
2369|Beat School: Bass Boss|Complete the Beat School level.|14179|23 Jul 2018 3:39:55 AM|4945|4949|72.62|Common|Silver
2369|Beat School: Robot Invasion|Complete the Beat School level.|14178|23 Jul 2018 3:39:48 AM|4954|4957|72.69|Common|Silver
2369|Beat School: In The Club|Complete the Beat School level.|14177|23 Jul 2018 3:39:48 AM|4951|4957|72.65|Common|Silver
2369|Beat School: Basic Rock Beat|Complete the Beat School level.|14176|23 Jul 2018 3:39:47 AM|4956|4957|72.72|Common|Silver
2369|Beat School: Groovology 101|Complete the Beat School level.|14175|23 Jul 2018 3:39:47 AM|4952|4957|72.66|Common|Silver
2369|Beat School: Lazy Day Beat|Complete the Beat School level.|14174|23 Jul 2018 3:39:47 AM|4953|4957|72.68|Common|Silver
2369|Beat School: Kalimba Magic|Complete the Beat School level.|14173|23 Jul 2018 3:39:46 AM|4961|4972|72.68|Common|Silver
2369|Beat School: Piano? PiaYES!|Complete the Beat School level.|14172|23 Jul 2018 3:39:46 AM|4960|4972|72.67|Common|Silver
2369|Beat School: Harmony Helper|Complete the Beat School level.|14171|23 Jul 2018 3:39:46 AM|4960|4972|72.67|Common|Silver
2369|Beat School: Guitar Serenity 1|Complete the Beat School level.|14170|23 Jul 2018 3:39:45 AM|4971|4972|72.83|Common|Silver
2369|Beat School: Guitar Serenity 2|Complete the Beat School level.|14169|23 Jul 2018 3:39:45 AM|4965|4972|72.74|Common|Silver
2369|You've Gone Platinum|Complete all Death Mode and Beat School levels.|14168|23 Jul 2018 3:39:39 AM|5177|9370|55.25|Common|Platinum
2369|Beat School: Muting Technique|Complete the Beat School level.|14167|23 Jul 2018 3:39:39 AM|5717|9370|61.01|Common|Silver
2369|Beat School: Cuts, Scrapes and Scratches|Complete the Beat School level.|14166|23 Jul 2018 3:39:38 AM|5719|9370|61.04|Common|Silver
2369|Beat School: Roll The Bass Dice|Complete the Beat School level.|14165|23 Jul 2018 3:39:32 AM|5719|9370|61.04|Common|Silver
2369|Beat School: It's Getting Tense In Here|Complete the Beat School level.|14164|23 Jul 2018 3:39:30 AM|5718|9370|61.02|Common|Silver
2369|Beat School: Uh Oh|Complete the Beat School level.|14163|23 Jul 2018 3:39:30 AM|5719|9370|61.04|Common|Silver
2369|Beat School: A Rolling Frolic|Complete the Beat School level.|14162|23 Jul 2018 3:39:20 AM|5718|9370|61.02|Common|Silver
2369|Beat School: Chordaby|Complete the Beat School level.|14161|23 Jul 2018 3:39:19 AM|5719|9370|61.04|Common|Silver
2369|Beat School: Chord Tweak|Complete the Beat School level.|14160|23 Jul 2018 3:39:18 AM|5719|9370|61.04|Common|Silver
2369|Beat School: Hi-Hat Spice (not very spicy)|Complete the Beat School level.|14159|23 Jul 2018 3:39:17 AM|5722|9370|61.07|Common|Silver
2369|Beat School: Lullaby|Complete the Beat School level.|14158|23 Jul 2018 3:39:17 AM|5721|9370|61.06|Common|Silver
2369|Beat School: Tiny Groove|Complete the Beat School level.|14157|23 Jul 2018 3:39:16 AM|5725|9370|61.1|Common|Silver
2369|Beat School: Straight Up|Complete the Beat School level.|14156|23 Jul 2018 3:39:15 AM|5737|9370|61.23|Common|Silver
2369|Death Mode: Spiral Staircase|Complete the Death Mode level.|14155|23 Jul 2018 3:39:14 AM|5408|9370|57.72|Common|Silver
2369|Death Mode: Cities|Complete the Death Mode level.|14154|23 Jul 2018 3:39:12 AM|5313|9370|56.7|Common|Silver
2369|Death Mode: Touch The People|Complete the Death Mode level.|14153|23 Jul 2018 3:39:12 AM|5328|9370|56.86|Common|Silver
2369|Death Mode: Invaderoids|Complete the Death Mode level.|14152|23 Jul 2018 3:39:11 AM|5213|9370|55.64|Common|Silver
2369|Death Mode: Break-a-noids|Complete the Death Mode level.|14151|23 Jul 2018 3:39:11 AM|5221|9370|55.72|Common|Silver
2369|Death Mode: Galaxanoids|Complete the Death Mode level.|14150|23 Jul 2018 3:39:10 AM|5206|9370|55.56|Common|Silver
2369|Death Mode: Extraterrestria|Complete the Death Mode level.|14149|23 Jul 2018 3:39:09 AM|5263|9370|56.17|Common|Silver
2369|Death Mode: Disasteroids|Complete the Death Mode level.|14148|23 Jul 2018 3:39:09 AM|5319|9370|56.77|Common|Silver
2369|Death Mode: Mechanica|Complete the Death Mode level.|14147|23 Jul 2018 3:39:08 AM|5224|9370|55.75|Common|Silver
2369|Death Mode: Aquatica|Complete the Death Mode level.|14146|23 Jul 2018 3:39:08 AM|5238|9370|55.9|Common|Silver
2369|Death Mode: Thermogenica #2|Complete the Death Mode level.|14145|23 Jul 2018 3:39:07 AM|5253|9370|56.06|Common|Silver
2369|Death Mode: Thermogenica #1|Complete the Death Mode level.|14144|23 Jul 2018 3:39:00 AM|5357|9370|57.17|Common|Silver
2369|Death Mode: Event Horizon #1|Complete the Death Mode level.|14143|23 Jul 2018 3:39:00 AM|5291|9370|56.47|Common|Silver
2369|Death Mode: Event Horizon #2|Complete the Death Mode level.|14142|23 Jul 2018 3:39:00 AM|5343|9370|57.02|Common|Silver
2369|Death Mode: Purgatory #2|Complete the Death Mode level.|14141|23 Jul 2018 3:38:54 AM|5582|9370|59.57|Common|Silver
2369|Death Mode: Purgatory #1|Complete the Death Mode level.|14140|23 Jul 2018 3:38:47 AM|5611|9370|59.88|Common|Silver
2369|Death Mode: Sneak n' Deke|Complete the Death Mode level.|14139|23 Jul 2018 3:38:46 AM|5572|9370|59.47|Common|Silver
2369|Death Mode: Rowdy Cloudy|Complete the Death Mode level.|14138|23 Jul 2018 3:38:46 AM|5555|9370|59.28|Common|Silver
2369|Death Mode: Sparkle Darkle|Complete the Death Mode level.|14137|23 Jul 2018 3:38:40 AM|5739|9370|61.25|Common|Silver
2369|Campaign Complete|Complete all Campaign levels.|14136|23 Jul 2018 3:38:38 AM|5941|9370|63.4|Common|Gold
2369|Death Mode: Hills n' Spills|Complete the Death Mode level.|14135|23 Jul 2018 3:38:38 AM|5703|9370|60.86|Common|Silver
2286|Hohokum Remix: Guitar Loops|Sculpt these ethereal guitar and bass melodies.|14134|23 Jul 2018 3:29:35 AM|11760|11799|46.74|Uncommon|Silver
2286|Hohokum Remix: Synth Loops|Complete the mix with a splash of analog electronics.|14133|23 Jul 2018 3:29:35 AM|11769|11799|46.77|Uncommon|Silver
2286|Hohokum Remix: Drum Kit|Can you use these dreamy drums to make a beat?|14132|23 Jul 2018 3:29:34 AM|11758|11799|46.73|Uncommon|Silver
2286|Hohokum Remix: Drum Loops|Rearrange the drum loops to make something fresh!|14131|23 Jul 2018 3:29:34 AM|11764|11799|46.75|Uncommon|Silver
2286|Hohokum Remix: Bass|Build your own bassline from this pulse.|14130|23 Jul 2018 3:29:33 AM|11776|11799|46.8|Uncommon|Silver
2286|Beat School: Set Phasers to 'Funk'|When the mothership is under attack, fight back with a funky loop.|14129|23 Jul 2018 3:29:32 AM|11587|11618|46.41|Uncommon|Silver
2286|Beat School: Mission to Planet Drums|3, 2, 1... funk off!|14128|23 Jul 2018 3:29:31 AM|11588|11618|46.41|Uncommon|Silver
2286|Beat School: Something Smells Funky in Here!|Time to do the funky laundry!|14127|23 Jul 2018 3:29:30 AM|11586|11618|46.4|Uncommon|Silver
2286|Beat School: Machine Language|Twist synthetic singing around to make your own vocal line!|14126|23 Jul 2018 3:29:29 AM|12772|12798|48.74|Uncommon|Silver
2286|Beat School: 3001 A Bass Odyssey|Take this bassline for a spin around the galaxy!|14125|23 Jul 2018 3:29:29 AM|11605|11618|46.48|Uncommon|Silver
2286|Beat School: Interstellar Funkonauts|May the funk be with you.|14124|23 Jul 2018 3:29:29 AM|11589|11618|46.41|Uncommon|Silver
2286|Beat School: Artificial Ah Yeah!|Robot feels good!|14123|23 Jul 2018 3:29:28 AM|12774|12798|48.74|Uncommon|Silver
2286|Beat School: Word to Your Motherboard|Dance, funk, rock and house. You will master all the robotic styles.|14122|23 Jul 2018 3:29:28 AM|12769|12798|48.73|Uncommon|Silver
2286|Beat School: Text to Speech|How could we resist? Shout out Sound Shapes with this unique beat.|14121|23 Jul 2018 3:29:28 AM|12769|12798|48.73|Uncommon|Silver
2286|Beat School: Does Not Compute|Start with the basics, countdown like a robot!|14120|23 Jul 2018 3:29:27 AM|12779|12798|48.76|Uncommon|Silver
2286|Beat School: Loop Jugglin'|Ultimate hip hop loop builder - word to your moms!|14119|23 Jul 2018 3:29:26 AM|12804|12837|48.78|Uncommon|Silver
2286|Beat School: The Drummer Gets Wicked|Cut and paste drums to make your own breakbeat!|14118|23 Jul 2018 3:29:25 AM|12807|12837|48.8|Uncommon|Silver
2286|Beat School: The Five Elements|Who got the jazz? Add some horns to your beat!|14117|23 Jul 2018 3:29:24 AM|12816|12837|48.83|Uncommon|Silver
2286|Beat School: On the One's and Two's|Checka-checka-check out the scratch routine!|14116|23 Jul 2018 3:29:24 AM|12813|12837|48.82|Uncommon|Silver
2286|Beat School: All You Need is Wub|Complete the Beat School level.|14115|23 Jul 2018 3:29:23 AM|13122|13180|49.34|Uncommon|Silver
2286|Beat School: A Funky Introduction|Get started with this simple bass loop!|14114|23 Jul 2018 3:29:23 AM|12828|12837|48.88|Uncommon|Silver
2286|Beat School: Dubstep Drum Practice|Complete the Beat School level.|14113|23 Jul 2018 3:29:22 AM|13164|13180|49.5|Uncommon|Silver
2286|Beat School: Synth Grime|Complete the Beat School level.|14112|23 Jul 2018 3:29:22 AM|13149|13180|49.44|Uncommon|Silver
2286|Beat School: Filthy Bass Monster|Complete the Beat School level.|14111|23 Jul 2018 3:29:22 AM|13141|13180|49.41|Uncommon|Silver
2286|Beat School: Half-Time Drum Loops|Complete the Beat School level.|14110|23 Jul 2018 3:29:22 AM|13134|13180|49.39|Uncommon|Silver
2286|Beat School: Brass Knuckles|Put up yer dukes, and make a funky horn loop!|14109|23 Jul 2018 3:29:21 AM|12168|12192|47.57|Uncommon|Silver
2286|Beat School: Triumph Horns|A few notes with a huge result!|14108|23 Jul 2018 3:29:20 AM|12171|12192|47.58|Uncommon|Silver
2286|Beat School: Jazz Hands|Swing to the beat of the cool jazzy brass riff!|14107|23 Jul 2018 3:29:20 AM|12174|12192|47.6|Uncommon|Silver
2286|Beat School: Battle of the Saxes|Practice your sax skills by creating this cool phrase.|14106|23 Jul 2018 3:29:14 AM|12173|12192|47.59|Uncommon|Silver
2286|Beat School: Hollywood Cop|Complete the Beat School level.|14105|23 Jul 2018 3:29:13 AM|13108|13152|49.34|Uncommon|Silver
2286|Beat School: Blow Your Own Horn|Learn the brass basics by constructing this simple trumpet loop.|14104|23 Jul 2018 3:29:13 AM|12179|12192|47.62|Uncommon|Silver
2286|Beat School: Driving the Autobahn|Complete the Beat School level.|14103|23 Jul 2018 3:29:12 AM|13125|13152|49.41|Uncommon|Silver
2286|Beat School: Fast Times|Complete the Beat School level.|14102|23 Jul 2018 3:29:12 AM|13119|13152|49.38|Uncommon|Silver
2286|Beat School: Shoulder Pads|Complete the Beat School level.|14101|23 Jul 2018 3:29:11 AM|13131|13152|49.43|Uncommon|Silver
2286|Beat School: Badd Syntax|Complete the Beat School level.|14100|23 Jul 2018 3:29:10 AM|13024|13079|49.16|Uncommon|Silver
2286|Beat School: Pedal to the Metal|Complete the Beat School level.|14099|23 Jul 2018 3:29:10 AM|13024|13079|49.16|Uncommon|Silver
2286|Beat School: Axe Grinder|Complete the Beat School level.|14098|23 Jul 2018 3:29:10 AM|13015|13079|49.13|Uncommon|Silver
2286|Beat School: Big Hair Beat|Complete the Beat School level.|14097|23 Jul 2018 3:29:10 AM|13144|13152|49.48|Uncommon|Silver
2286|Beat School: Underworld|Complete the Beat School level.|14096|23 Jul 2018 3:29:09 AM|13348|13430|49.72|Uncommon|Silver
2286|Beat School: Insert Coin|Complete the Beat School level.|14095|23 Jul 2018 3:29:09 AM|13349|13430|49.73|Uncommon|Silver
2286|Beat School: Synth Madness 1|Complete the Beat School level.|14094|23 Jul 2018 3:29:09 AM|13067|13079|49.32|Uncommon|Silver
2286|Beat School: Synth Madness 2|Complete the Beat School level.|14093|23 Jul 2018 3:29:09 AM|13031|13079|49.19|Uncommon|Silver
2286|Beat School: Bass Boss|Complete the Beat School level.|14092|23 Jul 2018 3:29:08 AM|13360|13430|49.77|Uncommon|Silver
2286|Beat School: Danger! Danger!|Complete the Beat School level.|14091|23 Jul 2018 3:29:07 AM|13367|13430|49.79|Uncommon|Silver
2286|Beat School: 8-Bit Melody|Complete the Beat School level.|14090|23 Jul 2018 3:29:06 AM|13413|13430|49.96|Uncommon|Silver
2286|Beat School: Groovology 101|Complete the Beat School level.|14089|23 Jul 2018 3:28:59 AM|13330|13365|49.78|Uncommon|Silver
2286|Beat School: Lazy Day Beat|Complete the Beat School level.|14088|23 Jul 2018 3:28:59 AM|13315|13365|49.72|Uncommon|Silver
2286|Beat School: Robot Invasion|Complete the Beat School level.|14087|23 Jul 2018 3:28:59 AM|13304|13365|49.68|Uncommon|Silver
