2286|Beat School: In The Club|Complete the Beat School level.|14086|23 Jul 2018 3:28:59 AM|13285|13365|49.61|Uncommon|Silver
2286|Beat School: Piano? PiaYES!|Complete the Beat School level.|14085|23 Jul 2018 3:28:49 AM|13426|13523|49.84|Uncommon|Silver
2286|Beat School: Harmony Helper|Complete the Beat School level.|14084|23 Jul 2018 3:28:49 AM|13415|13523|49.8|Uncommon|Silver
2286|Beat School: Basic Rock Beat|Complete the Beat School level.|14083|23 Jul 2018 3:28:49 AM|13352|13365|49.86|Uncommon|Silver
2286|Beat School: Kalimba Magic|Complete the Beat School level.|14082|23 Jul 2018 3:28:42 AM|13444|13523|49.91|Uncommon|Silver
2286|Beat School: Guitar Serenity 1|Complete the Beat School level.|14081|23 Jul 2018 3:28:41 AM|13517|13523|50.18|Common|Silver
2286|Beat School: Guitar Serenity 2|Complete the Beat School level.|14080|23 Jul 2018 3:28:41 AM|13462|13523|49.97|Uncommon|Silver
2286|You've Gone Platinum|Complete all Death Mode and Beat School levels.|14079|23 Jul 2018 3:28:40 AM|15447|53661|28.79|Uncommon|Platinum
2286|Beat School: Muting Technique|Complete the Beat School level.|14078|23 Jul 2018 3:28:40 AM|21160|53661|39.43|Uncommon|Silver
2286|Beat School: Roll The Bass Dice|Complete the Beat School level.|14077|23 Jul 2018 3:28:39 AM|21176|53661|39.46|Uncommon|Silver
2286|Beat School: Cuts, Scrapes and Scratches|Complete the Beat School level.|14076|23 Jul 2018 3:28:39 AM|21162|53661|39.44|Uncommon|Silver
2286|Beat School: Uh Oh|Complete the Beat School level.|14075|23 Jul 2018 3:28:38 AM|21187|53661|39.48|Uncommon|Silver
2286|Beat School: A Rolling Frolic|Complete the Beat School level.|14074|23 Jul 2018 3:28:37 AM|21199|53661|39.51|Uncommon|Silver
2286|Beat School: It's Getting Tense In Here|Complete the Beat School level.|14073|23 Jul 2018 3:28:37 AM|21195|53661|39.5|Uncommon|Silver
2286|Beat School: Chord Tweak|Complete the Beat School level.|14072|23 Jul 2018 3:28:36 AM|21233|53661|39.57|Uncommon|Silver
2286|Beat School: Chordaby|Complete the Beat School level.|14071|23 Jul 2018 3:28:36 AM|21212|53661|39.53|Uncommon|Silver
2286|Beat School: Lullaby|Complete the Beat School level.|14070|23 Jul 2018 3:28:35 AM|21259|53661|39.62|Uncommon|Silver
2286|Beat School: Hi-Hat Spice (not very spicy)|Complete the Beat School level.|14069|23 Jul 2018 3:28:34 AM|21280|53661|39.66|Uncommon|Silver
2286|Beat School: Tiny Groove|Complete the Beat School level.|14068|23 Jul 2018 3:28:33 AM|21351|53661|39.79|Uncommon|Silver
2286|Beat School: Straight Up|Complete the Beat School level.|14067|23 Jul 2018 3:28:32 AM|21483|53661|40.03|Uncommon|Silver
2286|Death Mode: Touch The People|Complete the Death Mode level.|14066|23 Jul 2018 3:28:31 AM|16742|53661|31.2|Uncommon|Silver
2286|Death Mode: Spiral Staircase|Complete the Death Mode level.|14065|23 Jul 2018 3:28:31 AM|17874|53661|33.31|Uncommon|Silver
2286|Death Mode: Cities|Complete the Death Mode level.|14064|23 Jul 2018 3:28:30 AM|16837|53661|31.38|Uncommon|Silver
2286|Death Mode: Invaderoids|Complete the Death Mode level.|14063|23 Jul 2018 3:28:29 AM|15774|53661|29.4|Uncommon|Silver
2286|Death Mode: Break-a-noids|Complete the Death Mode level.|14062|23 Jul 2018 3:28:29 AM|15987|53661|29.79|Uncommon|Silver
2286|Death Mode: Galaxanoids|Complete the Death Mode level.|14061|23 Jul 2018 3:28:28 AM|15636|53661|29.14|Uncommon|Silver
2286|Death Mode: Disasteroids|Complete the Death Mode level.|14060|23 Jul 2018 3:28:27 AM|16884|53661|31.46|Uncommon|Silver
2286|Death Mode: Extraterrestria|Complete the Death Mode level.|14059|23 Jul 2018 3:28:26 AM|16284|53661|30.35|Uncommon|Silver
2286|Death Mode: Mechanica|Complete the Death Mode level.|14058|23 Jul 2018 3:28:25 AM|15887|53661|29.61|Uncommon|Silver
2286|Death Mode: Aquatica|Complete the Death Mode level.|14057|23 Jul 2018 3:28:25 AM|16091|53661|29.99|Uncommon|Silver
2286|Death Mode: Thermogenica #2|Complete the Death Mode level.|14056|23 Jul 2018 3:28:18 AM|16207|53661|30.2|Uncommon|Silver
2286|Death Mode: Thermogenica #1|Complete the Death Mode level.|14055|23 Jul 2018 3:28:17 AM|17272|53661|32.19|Uncommon|Silver
2286|Death Mode: Event Horizon #1|Complete the Death Mode level.|14054|23 Jul 2018 3:28:17 AM|16530|53661|30.8|Uncommon|Silver
2286|Death Mode: Event Horizon #2|Complete the Death Mode level.|14053|23 Jul 2018 3:28:17 AM|16876|53661|31.45|Uncommon|Silver
2286|Death Mode: Purgatory #2|Complete the Death Mode level.|14052|23 Jul 2018 3:28:10 AM|19336|53661|36.03|Uncommon|Silver
2286|Death Mode: Purgatory #1|Complete the Death Mode level.|14051|23 Jul 2018 3:28:09 AM|20015|53661|37.3|Uncommon|Silver
2286|Death Mode: Rowdy Cloudy|Complete the Death Mode level.|14050|23 Jul 2018 3:28:08 AM|19383|53661|36.12|Uncommon|Silver
2286|Death Mode: Sparkle Darkle|Complete the Death Mode level.|14049|23 Jul 2018 3:28:07 AM|21646|53661|40.34|Uncommon|Silver
2286|Death Mode: Sneak n' Deke|Complete the Death Mode level.|14048|23 Jul 2018 3:28:07 AM|19634|53661|36.59|Uncommon|Silver
2286|Campaign Complete|Complete all Campaign levels.|14047|23 Jul 2018 3:28:06 AM|24485|53661|45.63|Uncommon|Gold
2286|Death Mode: Hills n' Spills|Complete the Death Mode level.|14046|23 Jul 2018 3:28:06 AM|21071|53661|39.27|Uncommon|Silver
2451|Hohokum Remix: Synth Loops|Complete the mix with a splash of analog electronics.|14045|23 Jul 2018 3:18:43 AM|5176|5177|77.18|Common|Silver
2451|Hohokum Remix: Guitar Loops|Sculpt these ethereal guitar and bass melodies.|14044|23 Jul 2018 3:18:42 AM|5176|5177|77.18|Common|Silver
2451|Hohokum Remix: Bass|Build your own bassline from this pulse.|14043|23 Jul 2018 3:18:41 AM|5177|5177|77.2|Common|Silver
2451|Hohokum Remix: Drum Kit|Can you use these dreamy drums to make a beat?|14042|23 Jul 2018 3:18:41 AM|5177|5177|77.2|Common|Silver
2451|Hohokum Remix: Drum Loops|Rearrange the drum loops to make something fresh!|14041|23 Jul 2018 3:18:41 AM|5176|5177|77.18|Common|Silver
2451|Beat School: Set Phasers to 'Funk'|When the mothership is under attack, fight back with a funky loop.|14040|23 Jul 2018 3:18:41 AM|5100|5102|76.61|Common|Silver
2451|Beat School: Interstellar Funkonauts|May the funk be with you.|14039|23 Jul 2018 3:18:40 AM|5102|5102|76.64|Common|Silver
2451|Beat School: Something Smells Funky in Here!|Time to do the funky laundry!|14038|23 Jul 2018 3:18:40 AM|5100|5102|76.61|Common|Silver
2451|Beat School: Mission to Planet Drums|3, 2, 1... funk off!|14037|23 Jul 2018 3:18:40 AM|5099|5102|76.59|Common|Silver
2451|Beat School: Text to Speech|How could we resist? Shout out Sound Shapes with this unique beat.|14036|23 Jul 2018 3:18:39 AM|5457|5458|79.25|Common|Silver
2451|Beat School: Machine Language|Twist synthetic singing around to make your own vocal line!|14035|23 Jul 2018 3:18:39 AM|5457|5458|79.25|Common|Silver
2451|Beat School: 3001 A Bass Odyssey|Take this bassline for a spin around the galaxy!|14034|23 Jul 2018 3:18:39 AM|5102|5102|76.64|Common|Silver
2451|Beat School: Does Not Compute|Start with the basics, countdown like a robot!|14033|23 Jul 2018 3:18:38 AM|5458|5458|79.27|Common|Silver
2451|Beat School: Artificial Ah Yeah!|Robot feels good!|14032|23 Jul 2018 3:18:38 AM|5458|5458|79.27|Common|Silver
2451|Beat School: Word to Your Motherboard|Dance, funk, rock and house. You will master all the robotic styles.|14031|23 Jul 2018 3:18:38 AM|5458|5458|79.27|Common|Silver
2451|Beat School: Loop Jugglin'|Ultimate hip hop loop builder - word to your moms!|14030|23 Jul 2018 3:18:37 AM|5458|5460|79.25|Common|Silver
2451|Beat School: On the One's and Two's|Checka-checka-check out the scratch routine!|14029|23 Jul 2018 3:18:36 AM|5458|5460|79.25|Common|Silver
2451|Beat School: The Drummer Gets Wicked|Cut and paste drums to make your own breakbeat!|14028|23 Jul 2018 3:18:36 AM|5458|5460|79.25|Common|Silver
2451|Beat School: Half-Time Drum Loops|Complete the Beat School level.|14027|23 Jul 2018 3:18:35 AM|5462|5467|79.26|Common|Silver
2451|Beat School: All You Need is Wub|Complete the Beat School level.|14026|23 Jul 2018 3:18:35 AM|5462|5467|79.26|Common|Silver
2451|Beat School: A Funky Introduction|Get started with this simple bass loop!|14025|23 Jul 2018 3:18:35 AM|5460|5460|79.28|Common|Silver
2451|Beat School: The Five Elements|Who got the jazz? Add some horns to your beat!|14024|23 Jul 2018 3:18:35 AM|5458|5460|79.25|Common|Silver
2451|Beat School: Synth Grime|Complete the Beat School level.|14023|23 Jul 2018 3:18:34 AM|5464|5467|79.29|Common|Silver
2451|Beat School: Filthy Bass Monster|Complete the Beat School level.|14022|23 Jul 2018 3:18:34 AM|5464|5467|79.29|Common|Silver
2451|Beat School: Dubstep Drum Practice|Complete the Beat School level.|14021|23 Jul 2018 3:18:33 AM|5466|5467|79.32|Common|Silver
2451|Beat School: Brass Knuckles|Put up yer dukes, and make a funky horn loop!|14020|23 Jul 2018 3:18:33 AM|5323|5328|78.24|Common|Silver
2451|Beat School: Triumph Horns|A few notes with a huge result!|14019|23 Jul 2018 3:18:32 AM|5323|5328|78.24|Common|Silver
2451|Beat School: Jazz Hands|Swing to the beat of the cool jazzy brass riff!|14018|23 Jul 2018 3:18:32 AM|5324|5328|78.26|Common|Silver
2451|Beat School: Battle of the Saxes|Practice your sax skills by creating this cool phrase.|14017|23 Jul 2018 3:18:22 AM|5325|5328|78.27|Common|Silver
2451|Beat School: Blow Your Own Horn|Learn the brass basics by constructing this simple trumpet loop.|14016|23 Jul 2018 3:18:21 AM|5327|5328|78.3|Common|Silver
2451|Beat School: Fast Times|Complete the Beat School level.|14015|23 Jul 2018 3:18:20 AM|5502|5503|79.58|Common|Silver
2451|Beat School: Hollywood Cop|Complete the Beat School level.|14014|23 Jul 2018 3:18:20 AM|5501|5503|79.56|Common|Silver
2451|Beat School: Pedal to the Metal|Complete the Beat School level.|14013|23 Jul 2018 3:18:19 AM|5495|5499|79.5|Common|Silver
2451|Beat School: Axe Grinder|Complete the Beat School level.|14012|23 Jul 2018 3:18:19 AM|5494|5499|79.49|Common|Silver
2451|Beat School: Big Hair Beat|Complete the Beat School level.|14011|23 Jul 2018 3:18:19 AM|5503|5503|79.59|Common|Silver
2451|Beat School: Shoulder Pads|Complete the Beat School level.|14010|23 Jul 2018 3:18:19 AM|5502|5503|79.58|Common|Silver
2451|Beat School: Driving the Autobahn|Complete the Beat School level.|14009|23 Jul 2018 3:18:19 AM|5502|5503|79.58|Common|Silver
2451|Beat School: Insert Coin|Complete the Beat School level.|14008|23 Jul 2018 3:18:18 AM|5525|5533|79.69|Common|Silver
2451|Beat School: Synth Madness 1|Complete the Beat School level.|14007|23 Jul 2018 3:18:18 AM|5498|5499|79.55|Common|Silver
2451|Beat School: Synth Madness 2|Complete the Beat School level.|14006|23 Jul 2018 3:18:18 AM|5496|5499|79.52|Common|Silver
2451|Beat School: Badd Syntax|Complete the Beat School level.|14005|23 Jul 2018 3:18:18 AM|5495|5499|79.5|Common|Silver
2451|Beat School: Danger! Danger!|Complete the Beat School level.|14004|23 Jul 2018 3:18:17 AM|5527|5533|79.72|Common|Silver
2451|Beat School: Bass Boss|Complete the Beat School level.|14003|23 Jul 2018 3:18:17 AM|5525|5533|79.69|Common|Silver
2451|Beat School: Underworld|Complete the Beat School level.|14002|23 Jul 2018 3:18:17 AM|5525|5533|79.69|Common|Silver
2451|Beat School: 8-Bit Melody|Complete the Beat School level.|14001|23 Jul 2018 3:18:15 AM|5532|5533|79.79|Common|Silver
2451|Beat School: Basic Rock Beat|Complete the Beat School level.|14000|23 Jul 2018 3:18:14 AM|5537|5537|79.84|Common|Silver
2451|Beat School: Groovology 101|Complete the Beat School level.|13999|23 Jul 2018 3:18:14 AM|5535|5537|79.81|Common|Silver
2451|Beat School: Lazy Day Beat|Complete the Beat School level.|13998|23 Jul 2018 3:18:14 AM|5535|5537|79.81|Common|Silver
2451|Beat School: Robot Invasion|Complete the Beat School level.|13997|23 Jul 2018 3:18:14 AM|5535|5537|79.81|Common|Silver
2451|Beat School: In The Club|Complete the Beat School level.|13996|23 Jul 2018 3:18:14 AM|5532|5537|79.76|Common|Silver
2451|Beat School: Piano? PiaYES!|Complete the Beat School level.|13995|23 Jul 2018 3:18:13 AM|5539|5549|79.78|Common|Silver
2451|Beat School: Harmony Helper|Complete the Beat School level.|13994|23 Jul 2018 3:18:13 AM|5536|5549|79.74|Common|Silver
2451|Beat School: Guitar Serenity 2|Complete the Beat School level.|13993|23 Jul 2018 3:18:12 AM|5544|5549|79.85|Common|Silver
2451|Beat School: Kalimba Magic|Complete the Beat School level.|13992|23 Jul 2018 3:18:12 AM|5542|5549|79.82|Common|Silver
2451|Beat School: Guitar Serenity 1|Complete the Beat School level.|13991|23 Jul 2018 3:18:11 AM|5549|5549|79.92|Common|Silver
2451|You've Gone Platinum|Complete all Death Mode and Beat School levels.|13990|23 Jul 2018 3:18:05 AM|5856|8687|67.41|Common|Platinum
2451|Beat School: Muting Technique|Complete the Beat School level.|13989|23 Jul 2018 3:18:05 AM|6309|8687|72.63|Common|Silver
2451|Beat School: Roll The Bass Dice|Complete the Beat School level.|13988|23 Jul 2018 3:18:04 AM|6308|8687|72.61|Common|Silver
2451|Beat School: Cuts, Scrapes and Scratches|Complete the Beat School level.|13987|23 Jul 2018 3:18:04 AM|6308|8687|72.61|Common|Silver
2451|Beat School: It's Getting Tense In Here|Complete the Beat School level.|13986|23 Jul 2018 3:17:58 AM|6308|8687|72.61|Common|Silver
2451|Beat School: Uh Oh|Complete the Beat School level.|13985|23 Jul 2018 3:17:58 AM|6308|8687|72.61|Common|Silver
2451|Beat School: Chordaby|Complete the Beat School level.|13984|23 Jul 2018 3:17:57 AM|6311|8687|72.65|Common|Silver
2451|Beat School: A Rolling Frolic|Complete the Beat School level.|13983|23 Jul 2018 3:17:57 AM|6309|8687|72.63|Common|Silver
2451|Beat School: Chord Tweak|Complete the Beat School level.|13982|23 Jul 2018 3:17:56 AM|6313|8687|72.67|Common|Silver
2451|Beat School: Lullaby|Complete the Beat School level.|13981|23 Jul 2018 3:17:55 AM|6314|8687|72.68|Common|Silver
2451|Beat School: Tiny Groove|Complete the Beat School level.|13980|23 Jul 2018 3:17:54 AM|6320|8687|72.75|Common|Silver
2451|Beat School: Hi-Hat Spice (not very spicy)|Complete the Beat School level.|13979|23 Jul 2018 3:17:54 AM|6317|8687|72.72|Common|Silver
2451|Death Mode: Touch The People|Complete the Death Mode level.|13978|23 Jul 2018 3:17:53 AM|5988|8687|68.93|Common|Silver
2451|Death Mode: Spiral Staircase|Complete the Death Mode level.|13977|23 Jul 2018 3:17:53 AM|6065|8687|69.82|Common|Silver
2451|Beat School: Straight Up|Complete the Beat School level.|13976|23 Jul 2018 3:17:53 AM|6329|8687|72.86|Common|Silver
2451|Death Mode: Break-a-noids|Complete the Death Mode level.|13975|23 Jul 2018 3:17:52 AM|5923|8687|68.18|Common|Silver
2451|Death Mode: Cities|Complete the Death Mode level.|13974|23 Jul 2018 3:17:52 AM|5991|8687|68.97|Common|Silver
2451|Death Mode: Invaderoids|Complete the Death Mode level.|13973|23 Jul 2018 3:17:51 AM|5901|8687|67.93|Common|Silver
2451|Death Mode: Disasteroids|Complete the Death Mode level.|13972|23 Jul 2018 3:17:44 AM|6010|8687|69.18|Common|Silver
2451|Death Mode: Galaxanoids|Complete the Death Mode level.|13971|23 Jul 2018 3:17:44 AM|5890|8687|67.8|Common|Silver
2451|Death Mode: Extraterrestria|Complete the Death Mode level.|13970|23 Jul 2018 3:17:43 AM|5956|8687|68.56|Common|Silver
2451|Death Mode: Thermogenica #2|Complete the Death Mode level.|13969|23 Jul 2018 3:17:40 AM|5956|8687|68.56|Common|Silver
2451|Death Mode: Mechanica|Complete the Death Mode level.|13968|23 Jul 2018 3:17:40 AM|5920|8687|68.15|Common|Silver
2451|Death Mode: Aquatica|Complete the Death Mode level.|13967|23 Jul 2018 3:17:40 AM|5924|8687|68.19|Common|Silver
2451|Death Mode: Thermogenica #1|Complete the Death Mode level.|13966|23 Jul 2018 3:17:39 AM|6071|8687|69.89|Common|Silver
2451|Death Mode: Event Horizon #2|Complete the Death Mode level.|13965|23 Jul 2018 3:17:37 AM|6057|8687|69.72|Common|Silver
2451|Death Mode: Purgatory #2|Complete the Death Mode level.|13964|23 Jul 2018 3:17:36 AM|6227|8687|71.68|Common|Silver
2451|Death Mode: Event Horizon #1|Complete the Death Mode level.|13963|23 Jul 2018 3:17:36 AM|5991|8687|68.97|Common|Silver
2451|Death Mode: Rowdy Cloudy|Complete the Death Mode level.|13962|23 Jul 2018 3:17:34 AM|6222|8687|71.62|Common|Silver
2451|Death Mode: Purgatory #1|Complete the Death Mode level.|13961|23 Jul 2018 3:17:34 AM|6266|8687|72.13|Common|Silver
2451|Death Mode: Sparkle Darkle|Complete the Death Mode level.|13960|23 Jul 2018 3:17:32 AM|6353|8687|73.13|Common|Silver
2451|Death Mode: Sneak n' Deke|Complete the Death Mode level.|13959|23 Jul 2018 3:17:32 AM|6235|8687|71.77|Common|Silver
2451|Death Mode: Hills n' Spills|Complete the Death Mode level.|13958|23 Jul 2018 3:17:31 AM|6342|8687|73.01|Common|Silver
2451|Campaign Complete|Complete all Campaign levels.|13957|23 Jul 2018 3:17:30 AM|6522|8687|75.08|Common|Gold
6056|A Little Help From My Friends|Completed Guardians of the Galaxy|13956|23 Jul 2018 12:42:19 AM|13973|21154|66.05|Common|Platinum
6056|Brothers in Arms|Completed Chapter 6 of Episode 5|13955|23 Jul 2018 12:42:19 AM|13990|21154|66.13|Common|Gold
6056|All Things Must Pass|Completed Chapter 5 of Episode 5|13954|23 Jul 2018 12:18:18 AM|14001|21154|66.19|Common|Silver
6056|Bringing It All Back Home|Completed Chapter 4 of Episode 5|13953|22 Jul 2018 11:44:29 PM|14012|21154|66.24|Common|Silver
6056|Diary of a Madman|Completed Chapter 3 of Episode 5|13952|22 Jul 2018 11:29:21 PM|14022|21154|66.29|Common|Bronze
6056|Wish You Were Here|Completed Chapter 2 of Episode 5|13951|22 Jul 2018 11:21:23 PM|14029|21154|66.32|Common|Bronze
6056|Everything Changes|Completed Chapter 1 of Episode 5|13950|22 Jul 2018 11:06:02 PM|14036|21154|66.35|Common|Bronze
7667|Find Your Match|Complete an Online Match.|13949|22 Jul 2018 9:26:43 PM|2038|3371|60.46|Common|Bronze
7667|Fighting in the Street|Beat Street Fighter.|13948|22 Jul 2018 9:17:45 PM|1003|3371|29.75|Uncommon|Bronze
6056|Bridge Over Troubled Water|Completed Chapter 6 of Episode 4|13947|22 Jul 2018 8:49:14 AM|14212|21154|67.18|Common|Gold
6056|Everybody Knows This is Nowhere|Completed Chapter 5 of Episode 4|13946|22 Jul 2018 8:39:51 AM|14222|21154|67.23|Common|Silver
6056|Obscured by Clouds|Completed Chapter 4 of Episode 4|13945|22 Jul 2018 8:19:04 AM|14252|21154|67.37|Common|Silver
6056|Out of Our Heads|Completed Chapter 3 of Episode 4|13944|22 Jul 2018 7:36:19 AM|14302|21154|67.61|Common|Bronze
6056|Darkness on the Edge of Town|Completed Chapter 2 of Episode 4|13943|22 Jul 2018 7:23:13 AM|14323|21154|67.71|Common|Bronze
6056|Women and Children First|Completed Chapter 1 of Episode 4|13942|22 Jul 2018 6:53:25 AM|14387|21154|68.01|Common|Bronze
6056|The Dark Side of the Moon|Completed Chapter 6 of Episode 3|13941|22 Jul 2018 6:39:50 AM|14921|21154|70.54|Common|Gold
6056|Blood on the Tracks|Completed Chapter 5 of Episode 3|13940|22 Jul 2018 6:01:38 AM|14998|21154|70.9|Common|Silver
6056|A Momentary Lapse of Reason|Completed Chapter 4 of Episode 3|13939|22 Jul 2018 5:38:29 AM|15106|21154|71.41|Common|Silver
6056|Masters of Reality|Completed Chapter 3 of Episode 3|13938|22 Jul 2018 5:32:32 AM|15116|21154|71.46|Common|Bronze
6056|A Kind of Magic|Completed Chapter 2 of Episode 3|13937|22 Jul 2018 5:25:53 AM|15143|21154|71.58|Common|Bronze
6056|Living in the Past|Completed Chapter 1 of Episode 3|13936|22 Jul 2018 5:15:32 AM|15173|21154|71.73|Common|Bronze
6056|Space Oddity|Completed Chapter 6 of Episode 2|13935|20 Jul 2018 8:02:29 AM|16162|21154|76.4|Common|Gold
6056|Fly By Night|Completed Chapter 5 of Episode 2|13934|20 Jul 2018 7:44:13 AM|16191|21154|76.54|Common|Silver
6056|Too Fast For Love|Completed Chapter 4 of Episode 2|13933|20 Jul 2018 7:32:30 AM|16283|21154|76.97|Common|Silver
6056|Every Picture Tells A Story|Completed Chapter 3 of Episode 2|13932|20 Jul 2018 7:18:59 AM|16364|21154|77.36|Common|Bronze
6056|Creatures of the Night|Completed Chapter 2 of Episode 2|13931|20 Jul 2018 7:02:01 AM|16498|21154|77.99|Common|Bronze
6056|Double Fantasy|Completed Chapter 1 of Episode 2|13930|20 Jul 2018 6:52:23 AM|16642|21154|78.67|Common|Bronze
6056|It's Only Rock n' Roll|Completed Chapter 6 of Episode 1|13929|20 Jul 2018 6:29:00 AM|18670|21154|88.26|Common|Gold
6056|Electric Warrior|Completed Chapter 5 of Episode 1|13928|20 Jul 2018 6:17:35 AM|18787|21154|88.81|Common|Silver
6056|We're Only In It For the Money|Completed Chapter 4 of Episode 1|13927|20 Jul 2018 6:02:07 AM|18914|21154|89.41|Common|Silver
6056|Goodbye Yellow Brick Road|Completed Chapter 3 of Episode 1|13926|20 Jul 2018 5:43:49 AM|19369|21154|91.56|Common|Bronze
6056|Permanent Waves|Completed Chapter 2 of Episode 1|13925|20 Jul 2018 5:32:01 AM|19619|21154|92.74|Common|Bronze
3765|Itsamee!|Use a cannon to travel to the Island in the Sky.|13924|17 Jul 2018 5:31:31 AM|2849|3800|16.95|Rare|Bronze
3765|Goatfellas|Gather the crew for some drive-in movies.|13923|17 Jul 2018 5:28:18 AM|2692|3800|16.01|Rare|Bronze
3765|Bounce It!|Enable the hydraulic cars.|13922|17 Jul 2018 5:22:08 AM|2737|3800|16.28|Rare|Bronze
3765|You Raise Me Up!|Use Dolph Spaghetti to lift a crewmember on top of the tallest building.|13921|17 Jul 2018 5:18:42 AM|2672|3800|15.89|Rare|Bronze
3765|What’s The Count?|Win 3 hands at a Blackjack table.|13920|17 Jul 2018 5:13:38 AM|2752|3800|16.37|Rare|Bronze
3765|The Song Of My People|Listen to the whole pan flute song.|13919|17 Jul 2018 5:08:09 AM|2603|3800|15.48|Rare|Bronze
3765|GoatBall|Show off your vehicle air control skills in the desert.|13918|17 Jul 2018 5:04:40 AM|2550|3800|15.17|Rare|Bronze
6056|Appetite for Destruction|Completed Chapter 1 of Episode 1|13917|17 Jul 2018 4:49:16 AM|20248|21154|95.72|Common|Bronze
3765|Goatipede|Lick all crew members together to form a Goatipede.|13916|17 Jul 2018 4:41:06 AM|2837|3800|16.88|Rare|Bronze
6453|I Am the Night|Completed Batman: The Enemy Within|13915|16 Jul 2018 5:25:14 AM|11313|17146|65.98|Common|Platinum
6453|The Last Laugh|Completed Chapter 6 of Episode 5|13914|16 Jul 2018 5:25:14 AM|11323|17146|66.04|Common|Gold
6453|Darkest Before the Dawn|Completed Chapter 5 of Episode 5|13913|16 Jul 2018 5:23:59 AM|11367|17146|66.3|Common|Silver
6453|Fractured|Completed Chapter 4 of Episode 5|13912|16 Jul 2018 5:16:25 AM|11371|17146|66.32|Common|Silver
6453|A Shadow Falls|Completed Chapter 3 of Episode 5|13911|16 Jul 2018 5:07:17 AM|11378|17146|66.36|Common|Bronze
6453|Defender|Completed Chapter 2 of Episode 5|13910|16 Jul 2018 4:26:33 AM|11401|17146|66.49|Common|Bronze
6453|Funny or Die|Completed Chapter 1 of Episode 5|13909|16 Jul 2018 4:00:24 AM|11417|17146|66.59|Common|Bronze
6453|The Punchline|Completed Chapter 6 of Episode 4|13908|15 Jul 2018 8:41:59 AM|12276|17146|71.6|Common|Gold
6453|Zero Sum Game|Completed Chapter 5 of Episode 4|13907|15 Jul 2018 8:22:48 AM|12288|17146|71.67|Common|Silver
6453|What Had To Be Done|Completed Chapter 4 of Episode 4|13906|15 Jul 2018 7:37:49 AM|12311|17146|71.8|Common|Silver
6453|Fortune Reversed|Completed Chapter 3 of Episode 4|13905|15 Jul 2018 7:30:59 AM|12317|17146|71.84|Common|Bronze
6453|Darkest Night|Completed Chapter 2 of Episode 4|13904|15 Jul 2018 7:18:01 AM|12333|17146|71.93|Common|Bronze
6453|Breach of Darkness|Completed Chapter 1 of Episode 4|13903|15 Jul 2018 7:03:38 AM|12363|17146|72.1|Common|Bronze
6453|Descent Into Darkness|Completed Chapter 6 of Episode 3|13902|15 Jul 2018 6:49:07 AM|13163|17146|76.77|Common|Gold
6453|In the Line of Duty|Completed Chapter 5 of Episode 3|13901|15 Jul 2018 6:21:36 AM|13194|17146|76.95|Common|Silver
6453|Hive of Villainy|Completed Chapter 4 of Episode 3|13900|15 Jul 2018 6:12:38 AM|13208|17146|77.03|Common|Silver
6453|Motley Crew|Completed Chapter 3 of Episode 3|13899|15 Jul 2018 5:41:02 AM|13254|17146|77.3|Common|Bronze
6453|Shot in the Dark|Completed Chapter 2 of Episode 3|13898|15 Jul 2018 5:29:41 AM|13286|17146|77.49|Common|Bronze
6453|Unexpected Encounter|Completed Chapter 1 of Episode 3|13897|15 Jul 2018 4:55:54 AM|13359|17146|77.91|Common|Bronze
6453|Whirlwind|Completed Chapter 6 of Episode 2|13896|14 Jul 2018 7:53:16 AM|14009|17146|81.7|Common|Gold
6453|Behind Enemy Lines|Completed Chapter 5 of Episode 2|13895|14 Jul 2018 7:43:10 AM|14040|17146|81.88|Common|Silver
6453|A Family Affair|Completed Chapter 4 of Episode 2|13894|14 Jul 2018 7:12:59 AM|14145|17146|82.5|Common|Silver
6453|Unsure Footing|Completed Chapter 3 of Episode 2|13893|14 Jul 2018 6:43:18 AM|14214|17146|82.9|Common|Bronze
6453|Strange Bedfellows|Completed Chapter 2 of Episode 2|13892|14 Jul 2018 6:16:37 AM|14300|17146|83.4|Common|Bronze
6453|A Threat Rises|Completed Chapter 1 of Episode 2|13891|14 Jul 2018 6:04:26 AM|14353|17146|83.71|Common|Bronze
6453|Riddle Me This|Completed Chapter 6 of Episode 1|13890|13 Jul 2018 7:29:04 AM|15441|17146|90.06|Common|Gold
6453|Made of Madness|Completed Chapter 5 of Episode 1|13889|13 Jul 2018 6:35:21 AM|15558|17146|90.74|Common|Silver
6453|A Friend In Need|Completed Chapter 4 of Episode 1|13888|13 Jul 2018 5:59:08 AM|15712|17146|91.64|Common|Silver
6453|Goodbye, Old Friend|Completed Chapter 3 of Episode 1|13887|13 Jul 2018 5:45:25 AM|15778|17146|92.02|Common|Bronze
6453|New Game in Town|Completed Chapter 2 of Episode 1|13886|13 Jul 2018 5:31:49 AM|15871|17146|92.56|Common|Bronze
6453|All in a Day's Work|Completed Chapter 1 of Episode 1|13885|12 Jul 2018 7:06:02 AM|16190|17146|94.42|Common|Bronze
5146|I'm Batman|Complete Batman|13884|12 Jul 2018 6:28:29 AM|80309|122729|65.44|Common|Platinum
5146|A New Day in Gotham|Completed Chapter 6 of Episode 5|13883|12 Jul 2018 6:28:29 AM|80543|122729|65.63|Common|Gold
5146|Executive Decision|Completed Chapter 5 of Episode 5|13882|12 Jul 2018 6:13:32 AM|80638|122729|65.7|Common|Silver
5146|The Legacy|Completed Chapter 4 of Episode 5|13881|12 Jul 2018 5:59:23 AM|80628|122729|65.7|Common|Silver
5146|On the Trail|Completed Chapter 3 of Episode 5|13880|11 Jul 2018 7:03:36 AM|80785|122729|65.82|Common|Bronze
5146|Revelations|Completed Chapter 2 of Episode 5|13879|11 Jul 2018 6:47:01 AM|80931|122729|65.94|Common|Bronze
5146|Loose Ends|Completed Chapter 1 of Episode 5|13878|11 Jul 2018 6:12:56 AM|81165|122729|66.13|Common|Bronze
