Dabaholics Anonymous,604
Game of Moans: The Second Coming,39
Hail to the Ping Baby,1078
Lord of the Pings,339
Mighty Morphin Trophy Rangers,2350
My Drinking Team Has A Trophy Problem,1005
My Waifu Is Still Better Than Yours,913
People Doing Casual Things,502
Professor V.J. Cornucopia's Fantastic Foodmagorium and Great American Steakery,206
Roo Kids On The Block,1614
Snakes in the Grass,3290
Started from the bottom... and still sofa king here,814
Super Gamindustri 64,914
TBC,240
Team Sleep,298
The Backdoor Bandits,439
The Leftovers,361
The Trophy Avengers,485
THS,669
To Infinity and Beyond,101
Who Needs Platinum's When You Can Get Lots of Bronzes?,539
Your Bag is Full Please Remove Some Trophies to Continue,884
