Dabaholics Anonymous,2776
Game of Moans: The Second Coming,400
Hail to the Ping Baby,3778
Lord of the Pings,1594
Mighty Morphin Trophy Rangers,8651
My Drinking Team Has A Trophy Problem,3225
My Waifu Is Still Better Than Yours,3055
People Doing Casual Things,1785
Professor V.J. Cornucopia's Fantastic Foodmagorium and Great American Steakery,1159
Roo Kids On The Block,5374
Snakes in the Grass,13508
Started from the bottom... and still sofa king here,3398
Super Gamindustri 64,2285
TBC,1994
Team Sleep,1606
The Backdoor Bandits,1568
The Leftovers,909
The Trophy Avengers,2365
THS,2329
To Infinity and Beyond,536
Who Needs Platinum's When You Can Get Lots of Bronzes?,1785
Your Bag is Full Please Remove Some Trophies to Continue,3218
