Dabaholics Anonymous,2585
Game of Moans: The Second Coming,369
Hail to the Ping Baby,3508
Lord of the Pings,1538
Mighty Morphin Trophy Rangers,7924
My Drinking Team Has A Trophy Problem,2997
My Waifu Is Still Better Than Yours,2944
People Doing Casual Things,1575
Professor V.J. Cornucopia's Fantastic Foodmagorium and Great American Steakery,1047
Roo Kids On The Block,4812
Snakes in the Grass,12231
Started from the bottom... and still sofa king here,3070
Super Gamindustri 64,2192
TBC,1848
Team Sleep,1490
The Backdoor Bandits,1413
The Leftovers,828
The Trophy Avengers,2229
THS,2216
To Infinity and Beyond,524
Who Needs Platinum's When You Can Get Lots of Bronzes?,1626
Your Bag is Full Please Remove Some Trophies to Continue,3051
