6030|Sixpence None the Wiser|You saved Reginald Sixpence. The mansion clocks are yours to command.|4494|15 Jul 2018 12:15:11 PM|4645|5139|90.39|Common|Silver
6030|The End of the Beginning|You saw everything the Bloody Girl has to show you. Time to get to work.|4493|15 Jul 2018 12:10:11 PM|4959|5139|96.5|Common|Bronze
7853|Platinum Destronaut|Get all the trophies|4492|13 Jul 2018 11:59:00 PM|2469|2509|98.41|Common|Platinum
7853|Challenge me|Complete 12 challenges|4491|13 Jul 2018 11:59:00 PM|2475|2509|98.64|Common|Gold
7853|Mastering challenges|Complete 6 challenges|4490|13 Jul 2018 11:50:07 PM|2484|2509|99.0|Common|Gold
7853|I like challenges|Complete 3 challenges|4489|13 Jul 2018 11:46:12 PM|2491|2509|99.28|Common|Gold
7853|Up for a challenge|Complete 1 challenge|4488|13 Jul 2018 11:44:41 PM|2500|2509|99.64|Common|Gold
7853|Excellent|Reach to 100K points in Classic Mode|4487|13 Jul 2018 11:44:03 PM|2479|2509|98.8|Common|Gold
7853|Working hard|Reach to 50K points in Classic Mode|4486|13 Jul 2018 11:40:17 PM|2488|2509|99.16|Common|Gold
7853|Well done|Reach to 25K points in Classic Mode|4485|13 Jul 2018 11:40:10 PM|2493|2509|99.36|Common|Gold
7853|Saving the galaxy|Reach 1K in Hardcore Mode|4484|13 Jul 2018 11:38:27 PM|2487|2509|99.12|Common|Gold
7853|The whole crew was lost|Die once|4483|13 Jul 2018 11:38:25 PM|2501|2509|99.68|Common|Silver
7853|Countdown|Reach 10K in Time Attack Mode|4482|13 Jul 2018 11:37:58 PM|2489|2509|99.2|Common|Gold
7853|Changing weapons|Kill 1 special red enemy|4481|13 Jul 2018 11:37:21 PM|2501|2509|99.68|Common|Gold
7853|Persistent|Hit one of the grey enemies|4480|13 Jul 2018 11:36:53 PM|2502|2509|99.72|Common|Gold
7853|Starter|Kill 1 enemy|4479|13 Jul 2018 11:36:25 PM|2506|2509|99.88|Common|Silver
1187|Jurassic Park: The Intruder|Complete Jurassic Park: The Intruder.|4478|13 Jul 2018 11:14:04 PM|17812|27262|65.34|Common|Bronze
1187|Life Finds a Way|Stay alive from beginning to end.|4477|13 Jul 2018 11:12:20 PM|8395|27262|30.79|Uncommon|Gold
1187|It Can't See Us If We Don't Move|Survive the tyrant king.|4476|13 Jul 2018 11:12:11 PM|17868|27262|65.54|Common|Silver
1187|World's Best Dad|Say things to Jess that no parent should ever say.|4475|13 Jul 2018 11:04:23 PM|8136|27262|29.84|Uncommon|Bronze
1187|Perfecto Español|Make your Spanish teacher proud.|4474|13 Jul 2018 10:49:45 PM|11418|27262|41.88|Uncommon|Bronze
1187|Protecting Their Young|Get out from underfoot.|4473|13 Jul 2018 10:38:56 PM|18981|27262|69.62|Common|Bronze
1187|The First Dinosaurs On Our Tour|Survive the two-crested lizard.|4472|13 Jul 2018 10:09:51 PM|20153|27262|73.92|Common|Bronze
1187|Leftovers|Find Nedry's ID badge.|4471|13 Jul 2018 9:52:11 PM|14951|27262|54.84|Common|Bronze
1187|I'm a Hacker|Show your jungle hacking chops.|4470|13 Jul 2018 9:42:33 PM|12773|27262|46.85|Uncommon|Silver
1187|Dodgson Will Be Pleased|Infiltrate the park.|4469|13 Jul 2018 9:35:49 PM|22873|27262|83.9|Common|Bronze
1187|Looking Good|See every unique location visible with the binoculars.|4468|13 Jul 2018 9:25:53 PM|17465|27262|64.06|Common|Silver
1187|Welcome to Jurassic Park|Escape the jungle.|4467|13 Jul 2018 9:19:12 PM|25486|27262|93.49|Common|Silver
6265|Puzzle Dragon|Get all trophies: Start 10 puzzles, solve 1 easy puzzle, 1 medium puzzle, 1 hard puzzle, and 2 other puzzles, improve your time by at least 1 second, and solve a puzzle in more than 2 min.|4466|13 Jul 2018 12:45:56 AM|3293|3507|93.9|Common|Platinum
6265|First Break|Improve your best result for first time.|4465|13 Jul 2018 12:45:56 AM|3304|3507|94.21|Common|Gold
6265|I am the Puzzle Starter Kappa|Start 10 puzzles|4464|13 Jul 2018 12:43:41 AM|3424|3507|97.63|Common|Silver
6265|I am the Puzzle Starter Iota|Start 9 puzzles|4463|13 Jul 2018 12:42:15 AM|3426|3507|97.69|Common|Silver
6265|Puzzle Legend|Solve 5 puzzles|4462|13 Jul 2018 12:42:08 AM|3305|3507|94.24|Common|Gold
6265|Taking Time|Solve a puzzle in more than 2 min.|4461|13 Jul 2018 12:42:06 AM|3387|3507|96.58|Common|Gold
6265|I am the Puzzle Starter Theta|Start 8 puzzles|4460|13 Jul 2018 12:39:57 AM|3429|3507|97.78|Common|Silver
6265|Puzzle Lord|Solve 4 puzzles|4459|13 Jul 2018 12:39:10 AM|3313|3507|94.47|Common|Gold
6265|Close One|Improve your best result by one or less second.|4458|13 Jul 2018 12:39:10 AM|3333|3507|95.04|Common|Gold
6265|I am the Puzzle Starter Eta|Start 7 puzzles|4457|13 Jul 2018 12:38:47 AM|3432|3507|97.86|Common|Silver
6265|Puzzle Master|Solve 3 puzzles|4456|13 Jul 2018 12:38:40 AM|3325|3507|94.81|Common|Gold
6265|It's a Start|Solve an easy puzzle.|4455|13 Jul 2018 12:38:39 AM|3412|3507|97.29|Common|Silver
6265|I am the Puzzle Starter Zeta|Start 6 puzzles|4454|13 Jul 2018 12:38:01 AM|3436|3507|97.98|Common|Silver
6265|Puzzle Solver|Solve 2 puzzles|4453|13 Jul 2018 12:36:14 AM|3355|3507|95.67|Common|Silver
6265|I am the Puzzle Starter Epsilon|Start 5 puzzles|4452|13 Jul 2018 12:36:14 AM|3442|3507|98.15|Common|Silver
6265|Getting There|Solve a medium puzzle.|4451|13 Jul 2018 12:36:07 AM|3310|3507|94.38|Common|Silver
6265|Record Hunter|Improve your best time for 2 times.|4450|13 Jul 2018 12:36:07 AM|3339|3507|95.21|Common|Gold
6265|I am the Puzzle Starter Delta|Start 4 puzzles|4449|13 Jul 2018 12:35:35 AM|3448|3507|98.32|Common|Silver
6265|Hard One|Solve a hard puzzle.|4448|13 Jul 2018 12:35:30 AM|3306|3507|94.27|Common|Silver
6265|I am the Puzzle Starter Gamma|Start 3 puzzles|4447|13 Jul 2018 12:34:33 AM|3460|3507|98.66|Common|Silver
6265|I am the Puzzle Starter Beta|Start 2 puzzles|4446|13 Jul 2018 12:33:04 AM|3471|3507|98.97|Common|Silver
6265|I am the Puzzle Starter Alpha|Start 1 puzzle|4445|13 Jul 2018 12:32:23 AM|3500|3507|99.8|Common|Silver
3695|What happens then?|Another story, kid. What else?|4444|12 Jul 2018 3:53:45 PM|11705|18761|62.39|Common|Gold
3695|Acceptance|Solved the death of Ed|4443|12 Jul 2018 3:48:11 PM|11900|18761|63.43|Common|Bronze
3695|Unfinished Story|Found the sniper rifle|4442|12 Jul 2018 3:40:41 PM|9026|18761|48.11|Uncommon|Silver
3695|Bargaining|Solved the death of Dale|4441|12 Jul 2018 3:38:40 PM|12195|18761|65.0|Common|Bronze
3695|The Curse of the Sea-Thing|The Cursed World|4440|12 Jul 2018 3:30:18 PM|12105|18761|64.52|Common|Bronze
3695|Anger|Solved the death of Missy|4439|12 Jul 2018 3:22:21 PM|12055|18761|64.26|Common|Bronze
3695|The Wish|Wish come true|4438|12 Jul 2018 3:11:25 PM|14119|18761|75.26|Common|Bronze
3695|Denial|Solved the death of Chad|4437|12 Jul 2018 3:08:33 PM|12995|18761|69.27|Common|Bronze
3695|Home|Explored the family house|4436|12 Jul 2018 2:43:03 PM|13067|18761|69.65|Common|Bronze
3695|Behind the Veil|Discovered the magic behind the potions|4435|12 Jul 2018 2:13:59 PM|13572|18761|72.34|Common|Bronze
3695|Fangs|A beast outsmarted|4434|12 Jul 2018 1:47:39 PM|14512|18761|77.35|Common|Bronze
3695|Depression|Solved the death of Travis|4433|12 Jul 2018 1:39:37 PM|13346|18761|71.14|Common|Bronze
3695|Sap|Survivor's guilt|4432|12 Jul 2018 1:26:28 PM|14448|18761|77.01|Common|Bronze
3695|The Tunnel|Walked towards the light|4431|12 Jul 2018 1:22:13 PM|11696|18761|62.34|Common|Bronze
5885|Platinum|Unlock every Trophy.|4430|12 Jul 2018 1:59:02 AM|1804|2507|71.96|Common|Platinum
5885|Game, set, match|Finish all of the Domino games!|4429|12 Jul 2018 1:59:02 AM|1823|2507|72.72|Common|Gold
5885|Equally matched|Finish half of the Domino games!|4428|11 Jul 2018 11:03:41 PM|1868|2507|74.51|Common|Silver
5885|Speed reach|Beat a domino game in under a minute!|4427|11 Jul 2018 9:24:28 PM|1875|2507|74.79|Common|Silver
5885|The story's end|Finish the bonus adventure.|4426|11 Jul 2018 8:47:03 PM|2115|2507|84.36|Common|Gold
5885|Finisher|Solve all of the puzzles without skipping even once!|4425|11 Jul 2018 8:45:46 PM|2019|2507|80.53|Common|Gold
5885|Seer|Finish all the Hidden-Object Puzzles with no hints!|4424|11 Jul 2018 8:37:42 PM|1928|2507|76.9|Common|Gold
5885|The bottom|Pass The Golden Gate of the Phoenix.|4423|11 Jul 2018 8:24:52 PM|2120|2507|84.56|Common|Silver
5885|Finally together!|Finish the game.|4422|11 Jul 2018 7:45:47 PM|2167|2507|86.44|Common|Gold
5885|The hard way|Finish the game on Expert Mode!|4421|11 Jul 2018 7:45:46 PM|1980|2507|78.98|Common|Gold
5885|The wheel turns|Approach the Abyss edge.|4420|11 Jul 2018 7:19:40 PM|2168|2507|86.48|Common|Silver
5885|I thee wed|Reveal the true nature of your enemy.|4419|11 Jul 2018 7:08:15 PM|2173|2507|86.68|Common|Silver
5885|Dungeoner|Pass the underground labyrinth.|4418|11 Jul 2018 6:18:43 PM|2189|2507|87.32|Common|Silver
5885|Cheating death|Make a salve.|4417|11 Jul 2018 5:09:27 PM|2215|2507|88.35|Common|Bronze
5885|Piercing gaze|Finish 3 Hidden-Object Puzzles in a row with no hints!|4416|11 Jul 2018 4:50:59 PM|2182|2507|87.04|Common|Silver
5885|Puzzle master|Finish a puzzle in under a minute!|4415|11 Jul 2018 4:32:43 PM|2200|2507|87.75|Common|Silver
5885|Master hunter|Track your prey to its lair.|4414|11 Jul 2018 4:30:31 PM|2248|2507|89.67|Common|Silver
5885|Don't skip|Solve 3 Puzzles in a row without skipping.|4413|11 Jul 2018 4:28:20 PM|2258|2507|90.07|Common|Silver
5885|Marksman|Finish a Hidden-Object Puzzle with barely any mistakes!|4412|11 Jul 2018 4:05:31 PM|2151|2507|85.8|Common|Bronze
5885|Quick one|Nail a Hidden-Object Puzzle in under a minute.|4411|11 Jul 2018 4:05:31 PM|2153|2507|85.88|Common|Silver
5885|3-IN-3|Find 3 Hidden Objects in just 3 seconds!|4410|11 Jul 2018 4:05:06 PM|2247|2507|89.63|Common|Bronze
5885|Strike!|Topple the trunk over the ravine.|4409|11 Jul 2018 4:01:22 PM|2330|2507|92.94|Common|Bronze
5885|Gossip queen|Chat with all the villagers.|4408|11 Jul 2018 3:55:22 PM|2292|2507|91.42|Common|Bronze
5885|Fuzzy lil' fellow|Gain the little helper.|4407|11 Jul 2018 3:47:00 PM|2383|2507|95.05|Common|Bronze
4206|Wanna Go for a Ride?|Earn all trophies.|4406|11 Jul 2018 2:25:36 AM|5047|51624|9.78|Very Rare|Platinum
4206|I Could Shoot, You Know|Obtain all weapons.|4405|11 Jul 2018 2:25:36 AM|5736|51624|11.11|Rare|Silver
4206|S is for S.T.A.R.S.|Finish the game with rank S.|4404|11 Jul 2018 2:25:13 AM|6554|51624|12.7|Rare|Silver
6208|Platinum|Unlock every Trophy.|4403|11 Jul 2018 2:05:28 AM|1693|2233|75.82|Common|Platinum
6208|Master searcher|Finish all Hidden Object Puzzles without using hints.|4402|11 Jul 2018 2:05:28 AM|1821|2233|81.55|Common|Gold
6208|Master examiner|Finish all Pair-Matching games.|4401|11 Jul 2018 12:27:40 AM|1719|2233|76.98|Common|Gold
6208|Examiner|Finish half of all Pair-Matching games.|4400|10 Jul 2018 10:50:56 PM|1732|2233|77.56|Common|Silver
6208|The Redeemed Memories|Complete the bonus adventure.|4399|10 Jul 2018 9:46:13 PM|1910|2233|85.54|Common|Silver
6208|Timber!|Complete the game.|4398|10 Jul 2018 8:48:12 PM|1967|2233|88.09|Common|Silver
6208|One of a kind|Complete the game on expert difficulty|4397|10 Jul 2018 8:48:12 PM|1819|2233|81.46|Common|Silver
6208|Puzzle Expert|Finish all Mini-Games without skipping.|4396|10 Jul 2018 8:45:56 PM|1875|2233|83.97|Common|Gold
6208|Butterfly collector|Find all Ethereal Butterflies.|4395|10 Jul 2018 8:45:28 PM|1809|2233|81.01|Common|Gold
6208|Prey bites back|Deal with the beast. Permanently.|4394|10 Jul 2018 8:44:11 PM|1967|2233|88.09|Common|Bronze
6208|Licensed PI|Perform all evidence Deductions.|4393|10 Jul 2018 8:42:02 PM|1967|2233|88.09|Common|Bronze
6208|Amnesty|Complete the relief and open the cell.|4392|10 Jul 2018 8:40:27 PM|1968|2233|88.13|Common|Bronze
6208|Proof of the crime|Collect all the Evidence.|4391|10 Jul 2018 8:32:05 PM|1969|2233|88.18|Common|Bronze
6208|Freedom!|Free yourself from captivity.|4390|10 Jul 2018 8:05:04 PM|1971|2233|88.27|Common|Bronze
6208|Recall the lost|Help recover a long-lost mind.|4389|10 Jul 2018 7:25:39 PM|1974|2233|88.4|Common|Bronze
6208|Inspector|Finish a game of Pair-Matching in less than 3 minutes.|4388|10 Jul 2018 7:11:33 PM|1831|2233|82.0|Common|Bronze
6208|Gospel truth|Find all Illusive Objects.|4387|10 Jul 2018 7:04:25 PM|1764|2233|79.0|Common|Gold
6208|Raven’s nest|Gain access to the inner manor grounds.|4386|10 Jul 2018 7:04:11 PM|1982|2233|88.76|Common|Bronze
6208|Butterfly admirer|Find 15 Ethereal Butterflies.|4385|10 Jul 2018 6:29:31 PM|1980|2233|88.67|Common|Silver
6208|Helping hand|Treat your ally's wounds.|4384|10 Jul 2018 6:06:43 PM|1992|2233|89.21|Common|Bronze
6208|Skilled searcher|Finish 6 Hidden Object Puzzles in a row without using hints.|4383|10 Jul 2018 6:06:30 PM|1889|2233|84.59|Common|Silver
6208|Lift operator|Build a stable river crossing.|4382|10 Jul 2018 5:44:00 PM|2003|2233|89.7|Common|Bronze
6208|Deductionist|Perform 3 evidence Deductions without a wrong move.|4381|10 Jul 2018 5:27:05 PM|1924|2233|86.16|Common|Bronze
6208|Truth will out|Find 15 Illusive Objects.|4380|10 Jul 2018 5:14:48 PM|1997|2233|89.43|Common|Silver
6208|I’ll be back!|Find the way back to the park grounds.|4379|10 Jul 2018 4:54:00 PM|2025|2233|90.69|Common|Bronze
6208|PI|Establish the suspect of your investigation.|4378|10 Jul 2018 4:44:18 PM|2033|2233|91.04|Common|Bronze
6208|It’s working!|Activate the cable car.|4377|10 Jul 2018 4:43:48 PM|2039|2233|91.31|Common|Bronze
6208|Bright mind|Finish 4 Mini-Games in a row without skipping.|4376|10 Jul 2018 4:39:06 PM|2017|2233|90.33|Common|Silver
6208|Eagle-eyed|Finish any Hidden Object Puzzle in less than 1 minute.|4375|10 Jul 2018 4:14:51 PM|1836|2233|82.22|Common|Bronze
6208|Flawless aim|Finish any Hidden Object Puzzle with less than 4 mistakes.|4374|10 Jul 2018 4:14:51 PM|1874|2233|83.92|Common|Bronze
6208|Instant finding|Find 3 hidden-objects within 3 seconds.|4373|10 Jul 2018 4:14:36 PM|2003|2233|89.7|Common|Bronze
6208|I see the light!|Find the way back to the surface.|4372|10 Jul 2018 4:00:36 PM|2085|2233|93.37|Common|Bronze
6208|Private Eye|Perform your first evidence Deduction.|4371|10 Jul 2018 3:28:42 PM|2094|2233|93.78|Common|Bronze
6208|Quid pro quo|Find a mysterious helping hand.|4370|10 Jul 2018 3:22:30 PM|2099|2233|94.0|Common|Bronze
6208|Faster than light!|Finish any Mini-Game in less than 1 minute.|4369|10 Jul 2018 3:20:24 PM|2048|2233|91.72|Common|Bronze
6208|Butterfly catcher|Find an Ethereal Butterfly.|4368|10 Jul 2018 3:15:23 PM|2113|2233|94.63|Common|Bronze
6208|Grain of truth|Find an Illusive Object.|4367|10 Jul 2018 3:05:12 PM|2125|2233|95.16|Common|Bronze
6079|Platinum|Unlock every Trophy.|4366|10 Jul 2018 3:01:24 AM|2436|2903|83.91|Common|Platinum
6079|Good Heart|Finish the additional Story|4365|10 Jul 2018 3:01:24 AM|2600|2903|89.56|Common|Gold
6079|Expert Gamer|Finish the game in Expert mode|4364|10 Jul 2018 2:06:39 AM|2504|2903|86.26|Common|Gold
6079|The Best Granddaughter|Save your Grandma|4363|10 Jul 2018 2:06:04 AM|2642|2903|91.01|Common|Silver
6079|Mythology Expert|Find all cards from the Bestiary|4362|10 Jul 2018 2:05:43 AM|2462|2903|84.81|Common|Gold
6079|Sharp-Eyed Investigator|Complete all Hidden Object Puzzles without hints|4361|10 Jul 2018 2:04:49 AM|2529|2903|87.12|Common|Gold
6079|Mastermind|Finish all minigames without skipping|4360|10 Jul 2018 1:59:51 AM|2572|2903|88.6|Common|Gold
6079|Rescuer|Free the Lilacus|4359|10 Jul 2018 1:56:59 AM|2644|2903|91.08|Common|Silver
6079|Botanist of the Year|Save the Fern Flower from extinction|4358|10 Jul 2018 1:50:20 AM|2645|2903|91.11|Common|Silver
6079|World-Class Botanist|Find all ethereal flowers|4357|10 Jul 2018 1:33:51 AM|2566|2903|88.39|Common|Gold
6079|Persistence|Get into the castle|4356|10 Jul 2018 1:07:02 AM|2659|2903|91.59|Common|Silver
6079|Taming of the Screw|Defeat a flying opponent|4355|10 Jul 2018 12:35:50 AM|2662|2903|91.7|Common|Silver
6079|Fast and Precise|Finish any Hidden Object Puzzle in less then 1 minute|4354|10 Jul 2018 12:28:42 AM|2672|2903|92.04|Common|Bronze
6079|Legends' Seeker|Find half of the cards from the Bestiary|4353|10 Jul 2018 12:09:31 AM|2675|2903|92.15|Common|Silver
6079|Hearth of the Forest|Find the Oldest Tree in the forest|4352|10 Jul 2018 12:00:19 AM|2686|2903|92.52|Common|Silver
6079|Plants Expert|Find half of all ethereal flowers|4351|9 Jul 2018 11:34:38 PM|2703|2903|93.11|Common|Silver
6079|Sailor|Cross the lake|4350|9 Jul 2018 11:11:09 PM|2725|2903|93.87|Common|Silver
6079|Chit-Chatter|Talk to every creature in the Museum|4349|9 Jul 2018 10:54:18 PM|2680|2903|92.32|Common|Bronze
6079|Helping Hand|Prepare the healing balm|4348|9 Jul 2018 10:49:21 PM|2727|2903|93.94|Common|Bronze
6079|Clever One|Finish three minigames in a row without skipping|4347|9 Jul 2018 10:46:22 PM|2738|2903|94.32|Common|Silver
6079|Fast as Lighting|Finish a minigame in less than 1 minute|4346|9 Jul 2018 10:35:12 PM|2765|2903|95.25|Common|Bronze
6079|Fireman|Extinguish the fire|4345|9 Jul 2018 10:33:37 PM|2756|2903|94.94|Common|Bronze
6079|Curious|Find the first card from the Bestiary|4344|9 Jul 2018 10:29:40 PM|2796|2903|96.31|Common|Bronze
6079|Fearless|Get out of the car crashed on the cliff|4343|9 Jul 2018 10:29:26 PM|2787|2903|96.0|Common|Bronze
6079|Nature Lover|Find first ethereal flower|4342|9 Jul 2018 10:29:20 PM|2793|2903|96.21|Common|Bronze
6079|Precise Targeting|Complete one Hidden Object Puzzle with no more than 5 mistakes|4341|9 Jul 2018 10:28:40 PM|2673|2903|92.08|Common|Silver
6079|Self-Sufficient Seeker|Complete any Hidden Object Puzzle without using hints|4340|9 Jul 2018 10:28:40 PM|2786|2903|95.97|Common|Bronze
6079|Hawk Eye|Find 3 Hidden Objects in 3 seconds|4339|9 Jul 2018 10:26:41 PM|2732|2903|94.11|Common|Silver
2464|Perfection|Obtain all trophies.|4338|9 Jul 2018 8:26:15 PM|5249|6617|79.33|Common|Platinum
2464|Scavenger|Obtain 500 Items.|4337|9 Jul 2018 8:26:14 PM|5265|6617|79.57|Common|Gold
2464|The Road to Wellville|Obtain 100 Health Potions.|4336|9 Jul 2018 7:05:00 PM|5297|6617|80.05|Common|Bronze
2464|Obsidian Plague|Kill 100 Obsidian Guard.|4335|9 Jul 2018 6:44:35 PM|5344|6617|80.76|Common|Silver
2464|The Queen is Dead|Defeat the Daemon Queen.|4334|9 Jul 2018 6:20:03 PM|5452|6617|82.39|Common|Gold
2464|Necromancer|Max out the levels of all the Red Magic skills.|4333|9 Jul 2018 6:08:51 PM|5303|6617|80.14|Common|Silver
2464|Green with...ENVY?!|Max out the levels of all the Green Magic skills.|4332|9 Jul 2018 6:07:36 PM|5340|6617|80.7|Common|Silver
2464|Blue Meanie|Max out the levels of all the Blue Magic skills.|4331|9 Jul 2018 6:05:49 PM|5336|6617|80.64|Common|Silver
2464|No Respecter of Persons|Kill 100 Shai Soldiers.|4330|9 Jul 2018 6:01:15 PM|5458|6617|82.48|Common|Bronze
2464|Wisdom|Reach level thirty.|4329|9 Jul 2018 6:00:34 PM|5419|6617|81.9|Common|Gold
2464|I am the King of the World|Defeat the King.|4328|9 Jul 2018 5:48:53 PM|5475|6617|82.74|Common|Gold
2464|Defender of the Kingdom|Complete Azure Cove map.|4327|9 Jul 2018 5:47:45 PM|5579|6617|84.31|Common|Bronze
2464|Heretical Barbarian|Kill 100 Dragonmen.|4326|9 Jul 2018 4:57:17 PM|5605|6617|84.71|Common|Bronze
2464|Conqueror|Kill 1000 Enemies.|4325|9 Jul 2018 4:50:34 PM|5466|6617|82.61|Common|Gold
2464|Attack on Titans|Kill 100 Titans.|4324|9 Jul 2018 4:43:54 PM|5346|6617|80.79|Common|Bronze
2464|I have become Death...AGAIN!|Kill 100 Undead.|4323|9 Jul 2018 4:31:51 PM|5359|6617|80.99|Common|Bronze
2464|Monokeros Vastator|Kill 100 Unicorns.|4322|9 Jul 2018 4:23:41 PM|5547|6617|83.83|Common|Bronze
2464|Insight|Reach level twenty.|4321|9 Jul 2018 4:20:11 PM|5512|6617|83.3|Common|Silver
2464|Thoroughly Rune-ed|Equip a Rune for the first time.|4320|9 Jul 2018 4:00:53 PM|5491|6617|82.98|Common|Bronze
2464|A Titan-ic Accomplishment|Have the titan runemaster Vallos join your cause.|4319|9 Jul 2018 3:59:41 PM|5533|6617|83.62|Common|Bronze
2464|Protector of the Kingdom|Complete Desert map.|4318|9 Jul 2018 3:58:54 PM|5547|6617|83.83|Common|Bronze
2464|Artistic Merit|Extract Item attributes to a Scroll.|4317|9 Jul 2018 3:23:23 PM|5514|6617|83.33|Common|Bronze
2464|Let's Horse Around!|Have Usoph the Unicorn Elder join your cause.|4316|9 Jul 2018 3:22:09 PM|5594|6617|84.54|Common|Bronze
2464|Abolitionist|Complete Mines map.|4315|9 Jul 2018 3:21:28 PM|5607|6617|84.74|Common|Bronze
2464|No Rest for the Wicked...or the Undead|Complete Burial Grounds map.|4314|9 Jul 2018 2:47:33 PM|5588|6617|84.45|Common|Bronze
2464|Awakening|Reach level ten.|4313|9 Jul 2018 2:24:55 PM|5823|6617|88.0|Common|Bronze
2464|Skeleton King|Kill 100 Skeletons.|4312|9 Jul 2018 2:24:10 PM|5596|6617|84.57|Common|Bronze
2464|ABRACADABRA!|Use a Chroma-Skill for the first time.|4311|9 Jul 2018 2:15:31 PM|6115|6617|92.41|Common|Bronze
2464|Dead...ARISE!|Unlock the "Raise Dead" skill.|4310|9 Jul 2018 2:06:20 PM|5948|6617|89.89|Common|Bronze
2464|Tower of Power|Enter the Tower of the Gods.|4309|9 Jul 2018 2:05:41 PM|5992|6617|90.55|Common|Bronze
2464|This Land is MY Land...!|Kill General Tiel and complete the Island map.|4308|9 Jul 2018 2:04:47 PM|6000|6617|90.68|Common|Bronze
2464|Insurgent|Kill 100 Kingdom Soldiers.|4307|9 Jul 2018 2:01:27 PM|5939|6617|89.75|Common|Bronze
2464|Good Job, Harry Winston!|Add a Gem to an Item.|4306|9 Jul 2018 2:01:11 PM|5873|6617|88.76|Common|Bronze
2464|Zero Sum Escape|Kill Captian Rivers and complete the Dungeon map.|4305|9 Jul 2018 1:52:26 PM|6127|6617|92.59|Common|Bronze
2464|Vengeance is MINE, sayeth...me?!|Kill Purifier Brooks.|4304|9 Jul 2018 1:44:23 PM|6275|6617|94.83|Common|Bronze
2464|I Feel...Drained...|Absorb the color from a power stone.|4303|9 Jul 2018 1:38:42 PM|6473|6617|97.82|Common|Bronze
2464|Army of One|Have Kinna join your party.|4302|9 Jul 2018 1:38:26 PM|6489|6617|98.07|Common|Bronze
1711|Perfect Aim|Earn all trophies.|4301|9 Jul 2018 2:47:20 AM|4252|7688|55.31|Common|Platinum
1711|Earning Credit|Watch the credits to completion.|4300|9 Jul 2018 2:47:19 AM|4660|7688|60.61|Common|Bronze
1711|One and Done|Only hit a ball once and then never again in Midnight Breakout.|4299|9 Jul 2018 2:40:18 AM|4455|7688|57.95|Common|Silver
1711|They're all mine!|Hit 20 different balls in Block Breakout Assault.|4298|9 Jul 2018 2:37:11 AM|5567|7688|72.41|Common|Silver
1711|Quick Spotlight|Turn on all of the spotlights in Paratrooper Scooper in less than five seconds.|4297|9 Jul 2018 2:33:27 AM|4386|7688|57.05|Common|Silver
1711|4-in-a-Row, All-in-One-Go!|Break all the plane plates in a single pass in Moving Target Madness.|4296|9 Jul 2018 2:30:06 AM|4999|7688|65.02|Common|Bronze
1711|Thunderous Blue|Shoot all of the blue helicopters in Wayward Whirlybirds of Wonderment.|4295|9 Jul 2018 2:28:20 AM|4363|7688|56.75|Common|Silver
1711|A Dish's Worst Enemy|Shatter 100 plates in Skeet Shoot.|4294|9 Jul 2018 2:23:06 AM|5233|7688|68.07|Common|Bronze
1711|Doing the Dishes|Break 25 stick targets in Plate Break.|4293|9 Jul 2018 2:19:55 AM|5408|7688|70.34|Common|Bronze
1711|The truck on the Left|Shoot all of the trucks on the left side of the screen in Shoot Camp.|4292|9 Jul 2018 2:18:26 AM|4427|7688|57.58|Common|Silver
1711|Finger Lickin' Good|Don't let any large chicken eggs fall to the ground in Fall-ing Eggs.|4291|9 Jul 2018 2:14:18 AM|4448|7688|57.86|Common|Silver
1711|Eggless Victor|Don't catch any eggs in It's an Egg Drop Spring.|4290|9 Jul 2018 2:08:26 AM|4410|7688|57.36|Common|Silver
1711|Penguin Pusher|Knock down 50 penguins in Ice-berrrger and Fries.|4289|9 Jul 2018 1:52:56 AM|4406|7688|57.31|Common|Bronze
1711|Bird Feeder|Knock down 50 corn stalks in Farm Raising Fury.|4288|9 Jul 2018 1:49:21 AM|4525|7688|58.86|Common|Silver
1711|Pleased Plesiosaurs|Knock down 25 plesiosaurs in The Jurassic Shore.|4287|9 Jul 2018 1:47:13 AM|4375|7688|56.91|Common|Bronze
1711|Hyper Hydra-sis|Shoot the Hydra target 8 times in Dino-Rama.|4286|9 Jul 2018 1:43:26 AM|4373|7688|56.88|Common|Bronze
1711|Bow Ow!|Hit the dog 3 times in Bacon and Eggs.|4285|9 Jul 2018 1:39:56 AM|4554|7688|59.24|Common|Bronze
1711|Streakin' Squeekin'|Hit the 5000 Point Mouse in Hamm and Eggs.|4284|9 Jul 2018 1:36:28 AM|5317|7688|69.16|Common|Bronze
1711|My Hero!|Never miss hooking a sheep in Rescuing Fields of Sheep.|4283|9 Jul 2018 1:34:50 AM|4429|7688|57.61|Common|Silver
1711|Rescuing Machine|Rescue more than 25 sheep in Flock of Sheep to Rescue.|4282|9 Jul 2018 1:32:33 AM|5678|7688|73.86|Common|Bronze
1711|Pretty Red Balloons|Pop 100 balloons in Balloon Blast.|4281|9 Jul 2018 1:29:13 AM|5182|7688|67.4|Common|Bronze
1711|Double Up|Destroy 20 targets with the Double Points power up in a single shooting gallery.|4280|9 Jul 2018 1:26:52 AM|5629|7688|73.22|Common|Bronze
1711|Cloudy Night|In Garden Grow, change the level from day to night.|4279|9 Jul 2018 1:26:39 AM|4702|7688|61.16|Common|Bronze
1711|Flower Power|Pop every pink flower balloon at least once in Flight of the Balloons.|4278|9 Jul 2018 1:21:54 AM|5085|7688|66.14|Common|Bronze
1711|Basket Case|Score 15,000 points by popping basket balloons in Hot Air Balloon Show.|4277|9 Jul 2018 1:18:25 AM|5116|7688|66.55|Common|Silver
1711|Lead Air Balloon|Pop a hot air balloon in Pop Party.|4276|9 Jul 2018 1:16:00 AM|5501|7688|71.55|Common|Bronze
1711|Slow Mo Joe|Destroy 20 targets while using the Slow motion power up in a single shooting gallery.|4275|9 Jul 2018 1:13:29 AM|5587|7688|72.67|Common|Bronze
1711|Bouquet Bonanza|Get the Big Flower to appear in Baaa-loon Pop.|4274|9 Jul 2018 1:12:39 AM|5489|7688|71.4|Common|Bronze
1711|Hack And Slash|Hit a multi-slash asteroid 20 times in Cosmic Slash n' Defense.|4273|9 Jul 2018 1:07:18 AM|5192|7688|67.53|Common|Bronze
1711|Bombs Away|Do not hit any bombs in Planetary Slash n’ Defense.|4272|9 Jul 2018 12:46:10 AM|4487|7688|58.36|Common|Silver
1711|Score Abduction|Ring a 5000 point UFO in Space Rescue.|4271|9 Jul 2018 12:40:17 AM|5368|7688|69.82|Common|Bronze
1711|Spread the Love|Destroy 20 targets with the Spread Shot power up in a single shooting gallery.|4270|9 Jul 2018 12:38:40 AM|6208|7688|80.75|Common|Bronze
1711|Crack Shot|Take out the meteor and the UFO with a single rocket in Invasion of the Space Raiders.|4269|9 Jul 2018 12:37:42 AM|4338|7688|56.43|Common|Gold
1711|Master Terraformer|Terraform all terrain at the same time using the TNT Powerup in Terraformal Event.|4268|9 Jul 2018 12:23:25 AM|4316|7688|56.14|Common|Silver
