6613|Seppuku|Kill yourself with your own weapon.|5384|31 Jul 2018 11:17:02 PM|476|651|73.12|Common|Bronze
6613|I Am > Than Mechs|Beat the second boss.|5383|31 Jul 2018 10:51:34 PM|445|651|68.36|Common|Gold
6613|Oops! Yea that's a bug.|Level 19, crash the game.|5382|31 Jul 2018 9:48:42 PM|449|651|68.97|Common|Silver
6613|2 Stones 1 Bird|Attempt a level 25 times.|5381|31 Jul 2018 9:42:22 PM|558|651|85.71|Common|Silver
6613|Off to the Slammer|Level 11, go to "prison".|5380|31 Jul 2018 9:33:15 PM|477|651|73.27|Common|Bronze
6613|Smiley|Level 9, see a smiley face.|5379|31 Jul 2018 9:29:05 PM|472|651|72.5|Common|Bronze
6613|Controls Reversed|Beat level 4 with controls reversed.|5378|31 Jul 2018 9:26:15 PM|458|651|70.35|Common|Silver
6613|You fell for it!|Fall for it on level two.|5377|31 Jul 2018 9:20:07 PM|570|651|87.56|Common|Bronze
6613|Teachers Pet|Beat a level with an A+ time.|5376|31 Jul 2018 9:16:10 PM|508|651|78.03|Common|Bronze
6613|Upgraded!|Get a knife modification.|5375|31 Jul 2018 9:10:38 PM|448|651|68.82|Common|Silver
6613|Living On a Prayer|Beat half the levels.|5374|31 Jul 2018 9:07:08 PM|464|651|71.27|Common|Bronze
6613|God Like|Kill 50 enemies.|5373|31 Jul 2018 8:59:54 PM|502|651|77.11|Common|Silver
6613|You're good at dying.|Die 100 times.|5372|31 Jul 2018 8:57:45 PM|536|651|82.33|Common|Bronze
6613|You have found a bug.|Complete one secret.|5371|31 Jul 2018 8:53:27 PM|543|651|83.41|Common|Bronze
6613|Spontaneous Combustion|Explode 50 times|5370|31 Jul 2018 8:48:44 PM|525|651|80.65|Common|Silver
6613|Eat My Dust|Beat the first boss.|5369|31 Jul 2018 8:40:56 PM|527|651|80.95|Common|Gold
7462|Top Gun|Sooner or later, this moment would come.|5368|31 Jul 2018 6:33:26 PM|380|615|61.79|Common|Gold
7462|Infinity War|Destroy all the turrets in Mission 5 of the Renegade Campaign.|5367|31 Jul 2018 6:31:21 PM|377|615|61.3|Common|Silver
7462|Destruction King|Destroy 100 enemies in Mission 5 of the Renegade Campaign.|5366|31 Jul 2018 6:26:27 PM|383|615|62.28|Common|Gold
7462|Total Recall|Almost done, one step more to achieve it.|5365|31 Jul 2018 6:14:37 PM|385|615|62.6|Common|Gold
7462|Out of space|Destroy all the supplies in Mission 4 of the Renegade Campaign.|5364|31 Jul 2018 5:52:15 PM|376|615|61.14|Common|Silver
7462|The new Starfighter|Your resolve made you the person you are.|5363|31 Jul 2018 5:13:19 PM|391|615|63.58|Common|Gold
7462|2490: Odyssey in space|Complete Mission 3 of the Renegade Campaign in less than 18 minutes.|5362|31 Jul 2018 5:11:51 PM|390|615|63.41|Common|Silver
7462|The Dark Side of Phobos|Destroy a Secutor unit for the first time.|5361|31 Jul 2018 5:09:04 PM|397|615|64.55|Common|Gold
7462|Thriller|Face reality and follow your path.|5360|31 Jul 2018 5:01:33 PM|399|615|64.88|Common|Gold
7462|Open your eyes|Defeat Agent 115.|5359|31 Jul 2018 4:59:50 PM|413|615|67.15|Common|Gold
7462|Outland|Destroy all the supplies in Mission 2 of the Renegade Campaign.|5358|31 Jul 2018 4:55:27 PM|380|615|61.79|Common|Silver
7462|Arcade time|Start the game, your survival is at stake.|5357|31 Jul 2018 4:39:35 PM|427|615|69.43|Common|Gold
7462|No TANK, no VICTORY|Destroy every mine in Mission 1 of the Renegade Campaign.|5356|31 Jul 2018 4:37:21 PM|413|615|67.15|Common|Silver
7462|Born in the 80s'|Destroy the first Sentinel.|5355|31 Jul 2018 4:36:07 PM|485|615|78.86|Common|Gold
2251|Death Mode: Extraterrestria|Complete the Death Mode level.|5354|31 Jul 2018 3:03:41 PM|15210|38294|39.72|Uncommon|Silver
2251|Death Mode: Aquatica|Complete the Death Mode level.|5353|31 Jul 2018 2:49:53 PM|15075|38294|39.37|Uncommon|Silver
2251|Death Mode: Mechanica|Complete the Death Mode level.|5352|31 Jul 2018 1:59:05 PM|14982|38294|39.12|Uncommon|Silver
2251|Death Mode: Thermogenica #2|Complete the Death Mode level.|5351|31 Jul 2018 1:50:34 PM|15289|38294|39.93|Uncommon|Silver
7751|Dream job|Get all other trophies|5350|31 Jul 2018 3:43:46 AM|42|97|43.3|Uncommon|Platinum
7751|Not afraid to ask|Use a hint|5349|31 Jul 2018 3:43:46 AM|63|97|64.95|Common|Gold
7751|A broken dream|Free the alchemist in the real world|5348|31 Jul 2018 3:40:56 AM|42|97|43.3|Uncommon|Gold
7751|The dream is still alive|Wake up from the dream|5347|31 Jul 2018 3:31:37 AM|44|97|45.36|Uncommon|Gold
7751|Sweet dreams|Defeat the alchemist once and for all|5346|31 Jul 2018 3:25:14 AM|44|97|45.36|Uncommon|Gold
7751|Intrepid|Complete the game without using hints|5345|31 Jul 2018 3:25:13 AM|43|97|44.33|Uncommon|Gold
7751|Things get steamy|Reach the final levels|5344|31 Jul 2018 3:03:54 AM|45|97|46.39|Uncommon|Bronze
5361|To the Promised Place|100% Completed Steins;Gate 0.|5343|31 Jul 2018 1:25:20 AM|2823|4435|63.65|Common|Platinum
5361|Enki the All-Knowing|Saw all TIPS.|5342|31 Jul 2018 1:25:20 AM|2842|4435|64.08|Common|Gold
5361|Milky-way Crossing|Cleared “Milky-way Crossing”.|5341|31 Jul 2018 1:23:43 AM|2947|4435|66.45|Common|Gold
5361|100% CG Unlocked|Saw all CG.|5340|31 Jul 2018 1:23:43 AM|2910|4435|65.61|Common|Gold
5361|Gehenna's Stigma.|Cleared “Gehenna's Stigma”.|5339|31 Jul 2018 1:05:08 AM|3120|4435|70.35|Common|Silver
5361|Promised Rinascimento|Cleared “Promised Rinascimento”.|5338|31 Jul 2018 12:39:29 AM|3033|4435|68.39|Common|Gold
5361|Twin Automata|Cleared “Twin Automata”.|5337|31 Jul 2018 12:33:23 AM|2998|4435|67.6|Common|Silver
5361|Message of Oblivion Renvoir|Read and ignored a message.|5336|31 Jul 2018 12:25:07 AM|2961|4435|66.76|Common|Bronze
5361|Recursive Mother Goose|Cleared “Recursive Mother Goose”.|5335|31 Jul 2018 12:25:06 AM|2983|4435|67.26|Common|Silver
5361|75% CG Unlocked|Saw 75% of CG.|5334|31 Jul 2018 12:24:15 AM|2990|4435|67.42|Common|Silver
5361|Antinomic Dual|Cleared “Anitomic Dual”.|5333|31 Jul 2018 12:21:52 AM|3067|4435|69.15|Common|Silver
5361|The Orbital Eclipse|Cleared “The Orbital Eclipse”.|5332|31 Jul 2018 12:12:13 AM|3122|4435|70.39|Common|Silver
5361|A Stray Sheep|Cleared “A Stray Sheep”.|5331|31 Jul 2018 12:04:45 AM|3159|4435|71.23|Common|Silver
5361|Resonating Reaction Renvoir|Answered a message from someone.|5330|30 Jul 2018 11:42:53 PM|3645|4435|82.19|Common|Bronze
5361|Those Who Seek History|Opened Clear List.|5329|30 Jul 2018 11:13:45 PM|3206|4435|72.29|Common|Bronze
5361|Metis, Studying That Which Lies Beneath|Opened TIPS List.|5328|30 Jul 2018 11:11:40 PM|3956|4435|89.2|Common|Bronze
5361|Those Who Seek Sound|Opened Sound Library.|5327|30 Jul 2018 11:11:14 PM|3194|4435|72.02|Common|Bronze
5361|Those Who Seek Movement|Opened Movie Library.|5326|30 Jul 2018 11:11:06 PM|3200|4435|72.15|Common|Bronze
5361|Those Who Seek Art|Opened CG Library.|5325|30 Jul 2018 11:10:57 PM|3205|4435|72.27|Common|Bronze
5361|Vega and Altair|Cleared “Vega and Altair”.|5324|30 Jul 2018 11:09:50 PM|3019|4435|68.07|Common|Gold
5361|50% CG Unlocked|Saw 50% of CG.|5323|30 Jul 2018 11:06:33 PM|3095|4435|69.79|Common|Bronze
5361|Presage or Recognize|Cleared “Presage or Recognize”.|5322|30 Jul 2018 11:04:12 PM|3023|4435|68.16|Common|Silver
5361|Pandora's Box|Cleared “Pandora's Box”.|5321|30 Jul 2018 10:59:52 PM|3208|4435|72.33|Common|Silver
5361|X-Day Protocol|Cleared “X-Day Protocol”.|5320|30 Jul 2018 10:52:37 PM|3251|4435|73.3|Common|Silver
5361|25% CG Unlocked|Saw 25% of CG.|5319|30 Jul 2018 10:48:29 PM|3386|4435|76.35|Common|Bronze
5361|Closed Epigraph|Cleared “Closed Epigraph”.|5318|30 Jul 2018 10:46:39 PM|3438|4435|77.52|Common|Silver
5361|Missing Link|Cleared “Missing Link”.|5317|30 Jul 2018 10:38:45 PM|3713|4435|83.72|Common|Silver
5361|Open the NewGate|Began Steins;Gate 0.|5316|30 Jul 2018 10:36:28 PM|4075|4435|91.88|Common|Bronze
7751|Master alchemist|Learn all powers|5315|30 Jul 2018 9:46:37 PM|46|97|47.42|Uncommon|Gold
7751|Senior alchemist|Complete 30 levels|5314|30 Jul 2018 9:46:36 PM|46|97|47.42|Uncommon|Silver
7751|Clumsy|Die outside levels|5313|30 Jul 2018 9:37:15 PM|47|97|48.45|Uncommon|Bronze
7751|I might need a keyring|Beat both secret levels|5312|30 Jul 2018 9:23:00 PM|45|97|46.39|Uncommon|Gold
7751|Snow or never|Complete the first ice level|5311|30 Jul 2018 8:26:43 PM|53|97|54.64|Common|Bronze
7751|What's this key for ?|Beat a secret level|5310|30 Jul 2018 8:11:12 PM|45|97|46.39|Uncommon|Silver
7751|Apprentice alchemist|Complete 15 levels|5309|30 Jul 2018 7:30:29 PM|51|97|52.58|Common|Bronze
7751|Let's do it again|Replay a level|5308|30 Jul 2018 7:25:08 PM|64|97|65.98|Common|Bronze
7751|Sailing past the Pillars of Hercules|Complete the first block of levels|5307|30 Jul 2018 6:50:29 PM|68|97|70.1|Common|Bronze
7751|Trap-door murderer|Kill a monster with a door|5306|30 Jul 2018 6:48:46 PM|61|97|62.89|Common|Gold
7751|Unmistaken|Complete five levels without using undo|5305|30 Jul 2018 6:42:58 PM|52|97|53.61|Common|Gold
7751|A good start|Complete the first level.|5304|30 Jul 2018 6:30:13 PM|91|97|93.81|Common|Bronze
6801|Alteric Platinum|Good job! Completed all tasks!|5303|30 Jul 2018 5:50:35 PM|394|584|67.47|Common|Platinum
6801|You’re incredible!|Complete Chapter 3|5302|30 Jul 2018 5:50:35 PM|395|584|67.64|Common|Gold
6801|Meeting an old friend|I found you, Tommy|5301|30 Jul 2018 5:00:53 PM|395|584|67.64|Common|Gold
6801|Jumper III|Jump up to 4000 times|5300|30 Jul 2018 4:53:23 PM|446|584|76.37|Common|Gold
6801|Defector III|Swap worlds 400 times|5299|30 Jul 2018 2:04:27 AM|493|584|84.42|Common|Gold
6801|Is it hard?|Complete Chapter 2|5298|30 Jul 2018 2:01:28 AM|453|584|77.57|Common|Gold
6801|Jumper II|Jump up to 2000 times|5297|30 Jul 2018 1:35:01 AM|485|584|83.05|Common|Gold
6801|Lucky guy|Complete Chapter 12 without deads|5296|30 Jul 2018 12:44:13 AM|427|584|73.12|Common|Gold
6801|Good runner|Complete Chapter 6 without deads|5295|30 Jul 2018 12:40:10 AM|436|584|74.66|Common|Gold
6801|Defector II|Swap worlds 200 times|5294|30 Jul 2018 12:22:17 AM|526|584|90.07|Common|Gold
6801|Dead man|Die 100 times|5293|30 Jul 2018 12:21:09 AM|515|584|88.18|Common|Silver
6801|Jumper I|Jump up to 1000 times|5292|30 Jul 2018 12:18:11 AM|515|584|88.18|Common|Silver
6801|Defector I|Swap worlds 100 times|5291|30 Jul 2018 12:01:54 AM|551|584|94.35|Common|Silver
6801|Good start!|Complete Chapter 1|5290|30 Jul 2018 12:01:13 AM|543|584|92.98|Common|Gold
5149|21st 15 Points|Correctly point your attention in the proper direction.|5289|29 Jul 2018 10:41:06 PM|514|586|87.71|Common|Bronze
5149|20th 15 Points|Correctly point your attention in the proper direction.|5288|29 Jul 2018 10:40:30 PM|514|586|87.71|Common|Bronze
5149|19th 15 Points|Correctly point your attention in the proper direction.|5287|29 Jul 2018 10:39:24 PM|514|586|87.71|Common|Bronze
5149|18th 15 Points|Correctly point your attention in the proper direction.|5286|29 Jul 2018 10:38:40 PM|514|586|87.71|Common|Bronze
5149|17th 15 Points|Correctly point your attention in the proper direction.|5285|29 Jul 2018 10:38:02 PM|514|586|87.71|Common|Bronze
5149|16th 15 Points|Correctly point your attention in the proper direction.|5284|29 Jul 2018 10:37:10 PM|514|586|87.71|Common|Bronze
5149|15th 15 Points|Correctly point your attention in the proper direction.|5283|29 Jul 2018 10:36:31 PM|515|586|87.88|Common|Bronze
5149|14th 15 Points|Correctly point your attention in the proper direction.|5282|29 Jul 2018 10:35:35 PM|515|586|87.88|Common|Bronze
5149|13th 15 Points|Correctly point your attention in the proper direction.|5281|29 Jul 2018 10:34:43 PM|515|586|87.88|Common|Bronze
5149|12th 15 Points|Correctly point your attention in the proper direction.|5280|29 Jul 2018 10:33:54 PM|515|586|87.88|Common|Bronze
5149|11th 15 Points|Correctly point your attention in the proper direction.|5279|29 Jul 2018 10:33:06 PM|516|586|88.05|Common|Bronze
5149|10th 15 Points|Correctly point your attention in the proper direction.|5278|29 Jul 2018 10:32:33 PM|516|586|88.05|Common|Bronze
5149|9th 15 Points|Correctly point your attention in the proper direction.|5277|29 Jul 2018 10:31:45 PM|516|586|88.05|Common|Bronze
5149|8th 15 Points|Correctly point your attention in the proper direction.|5276|29 Jul 2018 10:31:01 PM|516|586|88.05|Common|Bronze
5149|7th 15 Points|Correctly point your attention in the proper direction.|5275|29 Jul 2018 10:30:04 PM|517|586|88.23|Common|Bronze
5149|6th 15 Points|Correctly point your attention in the proper direction.|5274|29 Jul 2018 10:29:18 PM|518|586|88.4|Common|Bronze
5149|5th 15 Points|Correctly point your attention in the proper direction.|5273|29 Jul 2018 10:27:22 PM|520|586|88.74|Common|Bronze
5149|4th 15 Points|Correctly point your attention in the proper direction.|5272|29 Jul 2018 10:25:49 PM|523|586|89.25|Common|Bronze
5149|3rd 15 Points|Correctly point your attention in the proper direction.|5271|29 Jul 2018 10:23:34 PM|526|586|89.76|Common|Bronze
5149|2nd 15 Points|Correctly point your attention in the proper direction.|5270|29 Jul 2018 10:19:39 PM|532|586|90.78|Common|Bronze
5149|First 15 Points|Correctly point your attention in the proper direction.|5269|29 Jul 2018 10:14:48 PM|549|586|93.69|Common|Bronze
7367|Platnum|Get all the trophies|5268|29 Jul 2018 9:01:18 PM|286|340|84.12|Common|Platinum
7367|Ascend!|Step away from Alan|5267|29 Jul 2018 9:01:18 PM|297|340|87.35|Common|Gold
7367|It's Over|Kill Alan|5266|29 Jul 2018 8:59:16 PM|300|340|88.24|Common|Gold
7367|Core|Get to the Core|5265|29 Jul 2018 8:58:33 PM|300|340|88.24|Common|Gold
7367|Jingle Bells|Complete Bells Puzzle|5264|29 Jul 2018 8:41:04 PM|300|340|88.24|Common|Gold
7367|No Respect for Privacy|Read every email|5263|29 Jul 2018 8:31:26 PM|287|340|84.41|Common|Gold
7367|Felling Thirsty?|Drink from every cooler|5262|29 Jul 2018 8:23:13 PM|292|340|85.88|Common|Gold
7367|Into the Belly of the Beast|Complete Institution 02 Scene|5261|29 Jul 2018 8:22:51 PM|302|340|88.82|Common|Gold
7367|Santa's Little Helper|Complete Office Quest|5260|29 Jul 2018 8:21:39 PM|302|340|88.82|Common|Gold
7367|I'll Shoot This Sheriff|Grab the gun|5259|29 Jul 2018 8:19:24 PM|302|340|88.82|Common|Gold
7367|There is No Escape|Complete Crackhouse Scene|5258|29 Jul 2018 8:10:09 PM|304|340|89.41|Common|Gold
7367|Murderer!|Kill everybody at Simon's Shop (ex. Kill Calvin)|5257|29 Jul 2018 8:07:49 PM|304|340|89.41|Common|Silver
7367|It's My First Day!|Complete Diner Scene|5256|29 Jul 2018 8:06:18 PM|304|340|89.41|Common|Silver
7367|The Stench of Fresh Air|Complete Institution 01 Scene|5255|29 Jul 2018 8:03:39 PM|305|340|89.71|Common|Silver
7367|Die Hard|Fall into the vent in Alice's lab|5254|29 Jul 2018 7:53:17 PM|306|340|90.0|Common|Silver
7367|The End|Complete Simon's Shop Scene|5253|29 Jul 2018 7:28:53 PM|328|340|96.47|Common|Silver
6844|Slasher|Collect all trophies to unlock the platinum trophy.|5252|29 Jul 2018 5:14:31 PM|783|1256|62.34|Common|Platinum
6844|Slay It Again, Sam|Unlock the gorepack called C-flat Face.|5251|29 Jul 2018 5:14:31 PM|858|1256|68.31|Common|Bronze
6844|Gory-gami|Unlock the gorepack called Origami'd.|5250|29 Jul 2018 5:14:02 PM|882|1256|70.22|Common|Bronze
6844|Cannonball? Run!|Unlock the gorepack called Ball'd Faced Lier.|5249|29 Jul 2018 5:13:34 PM|862|1256|68.63|Common|Silver
6844|The Bees|Unlock the gorepack called Not the Bees.|5248|29 Jul 2018 5:13:11 PM|904|1256|71.97|Common|Bronze
6844|Blow Out|Unlock the gorepack called Puffed Up.|5247|29 Jul 2018 5:12:53 PM|827|1256|65.84|Common|Silver
6844|Day of the Dead|Unlock the gorepack called Cinco de Slayo.|5246|29 Jul 2018 5:12:11 PM|846|1256|67.36|Common|Silver
6844|Nailed It!|Unlock the gorepack called Pincusioned.|5245|29 Jul 2018 5:11:52 PM|876|1256|69.75|Common|Bronze
6844|Lawnmower Man|Unlock the gorepack called Party's Over.|5244|29 Jul 2018 5:11:32 PM|826|1256|65.76|Common|Silver
6844|Blend It Like Beckham|Unlock the gorepack called Juiced.|5243|29 Jul 2018 5:09:38 PM|869|1256|69.19|Common|Bronze
6844|Sheer Terror|Unlock the gorepack called Pruned.|5242|29 Jul 2018 5:08:56 PM|883|1256|70.3|Common|Silver
6844|Hellraiser|Unlock the gorepack called Demonized.|5241|29 Jul 2018 5:08:37 PM|853|1256|67.91|Common|Silver
6844|Firestarter|Unlock the gorepack called Charbroiled.|5240|29 Jul 2018 5:08:21 PM|826|1256|65.76|Common|Bronze
6844|Milton's Revenge|Unlock the gorepack called Face Stapled.|5239|29 Jul 2018 5:08:03 PM|836|1256|66.56|Common|Silver
6844|Little Shop of Horrors|Unlock 13 Gore Packs.|5238|29 Jul 2018 5:07:47 PM|943|1256|75.08|Common|Gold
6844|The Texas Pitchfork Massacre|Unlock the gorepack called Spronged.|5237|29 Jul 2018 5:07:41 PM|874|1256|69.59|Common|Bronze
6844|The Silencer|Unlock the gorepack called Grenade!.|5236|29 Jul 2018 5:07:08 PM|879|1256|69.98|Common|Bronze
6844|My Bloody Valentine|Unlock the gorepack called Broken Heart.|5235|29 Jul 2018 5:06:44 PM|892|1256|71.02|Common|Bronze
6844|Child's Play|Unlock one new psycho killer using the Mystery Box.|5234|29 Jul 2018 5:05:37 PM|1031|1256|82.09|Common|Bronze
6844|Number of the Best|Kill 666 victims across all Slayaway Camp movies.|5233|29 Jul 2018 4:57:05 PM|810|1256|64.49|Common|Gold
6844|Final Destination|Get a score of 25 in Faces of Killed 3.|5232|29 Jul 2018 4:20:28 PM|862|1256|68.63|Common|Silver
6844|I Am Legend|Get a score of 20 in Faces of Killed 3.|5231|29 Jul 2018 4:20:22 PM|928|1256|73.89|Common|Bronze
6844|The Purge|Get a score of 13 in Faces of Killed 3.|5230|29 Jul 2018 4:18:06 PM|965|1256|76.83|Common|Bronze
6844|The Grudge|Get a score of 10 in Faces of Killed 3.|5229|29 Jul 2018 4:18:05 PM|974|1256|77.55|Common|Bronze
6844|Grindhouse|Get a score of 5 in Faces of Killed 3.|5228|29 Jul 2018 4:18:04 PM|977|1256|77.79|Common|Bronze
6844|Pupper Master|Unlock 13 Killers using the Mystery Box.|5227|29 Jul 2018 4:14:04 PM|883|1256|70.3|Common|Silver
6844|Creepshow|Unlock 5 Killers using the Mystery Box.|5226|29 Jul 2018 4:06:45 PM|919|1256|73.17|Common|Bronze
6844|Galaxy of Terror|Complete Slayaway Camp X "Space Camp".|5225|29 Jul 2018 4:01:30 PM|877|1256|69.82|Common|Silver
6844|Frankenweenie|Complete Slayaway Camp 8 "Manhattan Manslaughter".|5224|29 Jul 2018 3:45:39 PM|888|1256|70.7|Common|Bronze
6844|Graveyard Shift|Complete Slayaway Camp 7 "Office Hours".|5223|29 Jul 2018 3:13:41 PM|907|1256|72.21|Common|Bronze
6844|Shocker|Kill a victim by scaring them into an electric fence.|5222|29 Jul 2018 2:59:30 PM|925|1256|73.65|Common|Bronze
6844|Flatliners|Complete Slayaway Camp 6 "Fatality Ward".|5221|29 Jul 2018 2:57:56 PM|930|1256|74.04|Common|Bronze
6844|Prince of Darkness|Kill a victim when the lights are off.|5220|29 Jul 2018 2:45:43 PM|953|1256|75.88|Common|Bronze
6844|Deep Rising|Complete Slayaway Camp 5 "Bloodbath Beach".|5219|29 Jul 2018 2:42:54 AM|957|1256|76.19|Common|Bronze
6844|Killer of the Elite|Kill a swat cop.|5218|29 Jul 2018 2:42:04 AM|959|1256|76.35|Common|Bronze
6844|Psycho Cop|Kill 30 dumb cops across all Slayaway Camp movies.|5217|29 Jul 2018 2:40:01 AM|967|1256|76.99|Common|Bronze
6844|The Faculty|Complete Slayaway Camp 4 "Slash'em High".|5216|29 Jul 2018 2:29:34 AM|978|1256|77.87|Common|Bronze
6844|Carnival of Souls|Complete Slayaway Camp 3D "The Abusement Park".|5215|29 Jul 2018 2:13:57 AM|1010|1256|80.41|Common|Bronze
6844|House of 100 Corpses|Kill 100 victims across all Slayaway Camp movies.|5214|29 Jul 2018 2:08:51 AM|1043|1256|83.04|Common|Bronze
6844|Faster, Pussycat!|Get through a level with a cat without killing it.|5213|29 Jul 2018 2:07:52 AM|1020|1256|81.21|Common|Bronze
6844|Rest in Pieces|Kill a victim with a Landmine.|5212|29 Jul 2018 1:59:45 AM|1123|1256|89.41|Common|Bronze
6844|The Mummy|Complete Slayaway Camp 2.5 "Another Return to Slayaway Camp".|5211|29 Jul 2018 1:58:27 AM|1116|1256|88.85|Common|Bronze
6844|The Hunger|Kill a victim by knocking over a fridge onto them.|5210|29 Jul 2018 1:52:22 AM|1161|1256|92.44|Common|Bronze
6844|Part II|Complete Slayaway Camp 2 "Return to Slayaway Camp".|5209|29 Jul 2018 1:46:22 AM|1197|1256|95.3|Common|Bronze
6844|The Deep|Kill a victim by scarin them into water.|5208|29 Jul 2018 1:38:39 AM|1217|1256|96.89|Common|Bronze
6844|Maniac Cop|Kill a dumb cop.|5207|29 Jul 2018 1:38:13 AM|1219|1256|97.05|Common|Bronze
6844|Needful Things|Unlock 1 Gore Pack.|5206|29 Jul 2018 1:35:11 AM|1231|1256|98.01|Common|Bronze
6844|See No Evil|Unlock the gorepack called Double Blind.|5205|29 Jul 2018 1:35:04 AM|894|1256|71.18|Common|Bronze
6844|Cabin in the Woods|Complete Slayaway Camp.|5204|29 Jul 2018 1:33:04 AM|1231|1256|98.01|Common|Bronze
6844|Six Feet Under|Kill a victim by scaring them into a hole.|5203|29 Jul 2018 1:32:58 AM|1230|1256|97.93|Common|Bronze
6844|Fire Walk With Me|Kill a victim by scaring them into a fire.|5202|29 Jul 2018 1:31:03 AM|1239|1256|98.65|Common|Bronze
5888|The Reincarnation of a Sinner|Acquired all trophies.|5201|29 Jul 2018 12:47:02 AM|2349|2618|89.72|Common|Platinum
5888|Let You Suffer as Much as I Suffered|Completed Section 6.|5200|29 Jul 2018 12:47:02 AM|2412|2618|92.13|Common|Gold
5888|Now, do you know everything?|Acquired all memos.|5199|29 Jul 2018 12:44:04 AM|2351|2618|89.8|Common|Gold
5888|Mathew, what on earth have you done?|Used the mechanism to pierce her in Section 6.|5198|29 Jul 2018 12:43:19 AM|2414|2618|92.21|Common|Silver
5888|Remember my word, recall your FAULT.|Watched all of the TVs.|5197|29 Jul 2018 12:42:31 AM|2414|2618|92.21|Common|Gold
5888|It is Time to Face Your Mistakes|Completed Section 5.|5196|29 Jul 2018 12:30:52 AM|2421|2618|92.48|Common|Gold
5888|Mathew, a true Detective.|Unlocked all of the password puzzles.|5195|29 Jul 2018 12:28:43 AM|2422|2618|92.51|Common|Gold
5888|Maybe I Should Give You a Trophy?|Recovered the broken trophy in Section 5.|5194|29 Jul 2018 12:27:20 AM|2418|2618|92.36|Common|Silver
5888|I Will Always Remember This Day|Completed Section 4.|5193|28 Jul 2018 11:47:38 PM|2430|2618|92.82|Common|Gold
5888|Very Good, You Opened It|Opened the kitchen coffer in Section 4.|5192|28 Jul 2018 11:41:54 PM|2427|2618|92.7|Common|Silver
5888|Because This is Not Mathew's Fault|Completed Section 3.|5191|28 Jul 2018 11:35:08 PM|2440|2618|93.2|Common|Gold
5888|Do Not Hesitate to Eat|Opened the bar refrigerator in Section 3.|5190|28 Jul 2018 11:32:18 PM|2441|2618|93.24|Common|Silver
5888|But You Never Helped Her|Completed Section 2.|5189|28 Jul 2018 11:26:32 PM|2466|2618|94.19|Common|Gold
5888|Like my little puzzle?|Opened all the lockers at the front desk in Section 2.|5188|28 Jul 2018 11:24:19 PM|2447|2618|93.47|Common|Silver
5888|I've Always Been Near You|Watched a man and a woman on the TV.|5187|28 Jul 2018 11:16:13 PM|2500|2618|95.49|Common|Bronze
5888|I Want to Play a Game with You|Completed Section 1.|5186|28 Jul 2018 11:08:23 PM|2526|2618|96.49|Common|Gold
5888|Mother's Favorite Melody|Used the piano to play the correct melody in Section 1.|5185|28 Jul 2018 11:03:18 PM|2528|2618|96.56|Common|Silver
5888|This was Prepared Especially for You|Acquired a memo for the first time.|5184|28 Jul 2018 11:01:49 PM|2568|2618|98.09|Common|Bronze
5888|Mathew, You're Smart|Successfully combined items for the first time.|5183|28 Jul 2018 11:01:36 PM|2547|2618|97.29|Common|Bronze
5888|Welcome to Harbour Town|Game launched.|5182|28 Jul 2018 10:59:06 PM|2590|2618|98.93|Common|Bronze
5362|Hail to the King!|Completed all trophies for the game!|5181|28 Jul 2018 10:27:25 PM|7400|13823|53.53|Common|Platinum
5362|Why So Serious!?!|Find Sam in "Mirage Barrage".|5180|28 Jul 2018 10:27:25 PM|7800|13823|56.43|Common|Silver
5362|Duke, Use the Force!|Find Luke in the Level "Lunar Reactor".|5179|28 Jul 2018 10:25:40 PM|7654|13823|55.37|Common|Silver
5362|Doomed Marine|Find the Doomguy in the Level "Death Row".|5178|28 Jul 2018 10:22:13 PM|9196|13823|66.53|Common|Silver
5362|Invaders Must Die!|Kill 1000 enemies.|5177|28 Jul 2018 10:18:45 PM|8128|13823|58.8|Common|Gold
5362|Rage Engage|Kill 10 bad guys in 10 seconds while on steroids.|5176|28 Jul 2018 9:50:00 PM|7730|13823|55.92|Common|Gold
5362|Nukem All|Kill 5 bad guys with one shot.|5175|28 Jul 2018 9:47:06 PM|8619|13823|62.35|Common|Gold
5362|Buzz Off|Kill a Firefly Trooper while it's flying small.|5174|28 Jul 2018 9:35:14 PM|8018|13823|58.0|Common|Silver
5362|I Never Knew This Was Here|Finish a secret level.|5173|28 Jul 2018 9:32:44 PM|8439|13823|61.05|Common|Silver
5362|I Never Inhaled|Use the hookah in "High Times".|5172|28 Jul 2018 9:29:24 PM|8337|13823|60.31|Common|Bronze
5362|Alien Maggots are Gonna Pay|Finish the "Hollywood Holocaust" level in under 3 minutes.|5171|28 Jul 2018 9:26:09 PM|8366|13823|60.52|Common|Silver
5362|Oomph, Uugh, Where Is It?|Find 70 secret areas.|5170|28 Jul 2018 9:23:17 PM|7931|13823|57.38|Common|Gold
5362|Shake It, Baby|Tip an exotic dancer.|5169|28 Jul 2018 8:54:37 PM|11665|13823|84.39|Common|Bronze
5362|It Happens|Step in a pile of excrement.|5168|28 Jul 2018 8:49:58 PM|8908|13823|64.44|Common|Bronze
5362|Roast 'Em|Burn 50 bad guys to death.|5167|28 Jul 2018 8:46:22 PM|7715|13823|55.81|Common|Silver
5362|Duke's Mighty Foot|Step on 40 enemies after using the Shrinker on them.|5166|28 Jul 2018 8:22:55 PM|8130|13823|58.82|Common|Silver
5362|Smoke 'Em If You Got 'Em|Use the Incinerator.|5165|28 Jul 2018 8:03:20 PM|8834|13823|63.91|Common|Bronze
5362|I'm Back, Baby|Complete "Alien World Order" on any difficulty.|5164|28 Jul 2018 7:51:22 PM|8055|13823|58.27|Common|Gold
5362|All Too Easy|Find a secret area.|5163|28 Jul 2018 7:50:18 PM|13072|13823|94.57|Common|Bronze
5362|Damn I'm Good|Complete "The Birth" on any difficulty.|5162|28 Jul 2018 7:46:17 PM|7888|13823|57.06|Common|Silver
5362|See, I'm Tough Too!|Finish any level on "Damn, I'm Good" difficulty.|5161|28 Jul 2018 7:40:34 PM|7994|13823|57.83|Common|Silver
5362|Come Get Some|Complete "Shrapnel City" on any difficulty.|5160|28 Jul 2018 7:36:02 PM|8185|13823|59.21|Common|Silver
5362|Take No Prisoners|Kill every enemy on a level.|5159|28 Jul 2018 7:36:02 PM|9471|13823|68.52|Common|Gold
5362|Let's Rock|Complete "Lunar Apocalypse" on any difficulty.|5158|28 Jul 2018 7:27:40 PM|8244|13823|59.64|Common|Bronze
5362|More Than 2 Weapons At Once?|Carry all weapons with ammo at once.|5157|28 Jul 2018 7:26:33 PM|8799|13823|63.65|Common|Bronze
