462|Blown To Bits|Blow Up 1 000 Zombies|13832|31 Jul 2018 9:37:27 PM|161983|431349|37.55|Uncommon|Bronze
2533|In a hole in the ground...|Complete "Bag End"|13831|31 Jul 2018 7:55:45 AM|5828|6877|84.75|Common|Bronze
2533|A city turned to ash|Complete "The Mines of Erebor", "The Coming of Smaug" and "The Sickness of Thrór"|13830|31 Jul 2018 7:41:39 AM|6007|6877|87.35|Common|Bronze
526|People Watcher|Initiate 10 battles by using first-person mode.|13829|30 Jul 2018 9:26:46 PM|7921|49277|16.07|Rare|Bronze
526|Lau Ka Long Defeated|Defeat Lau Ka Long in Chapter 8.|13828|29 Jul 2018 9:56:53 AM|24754|49277|50.23|Common|Bronze
526|Marathon Runner|Run 42.195km.|13827|29 Jul 2018 9:24:50 AM|19616|49277|39.81|Uncommon|Bronze
526|Compulsive Vandal|Break 100 weapons picked up in battles.|13826|29 Jul 2018 9:18:44 AM|17982|49277|36.49|Uncommon|Bronze
526|Majima Defeated Again|Defeat Majima again in Chapter 7.|13825|29 Jul 2018 7:44:54 AM|25132|49277|51.0|Common|Bronze
526|Kanda Defeated|Defeat Kanda in Chapter 6.|13824|28 Jul 2018 6:43:49 AM|26988|49277|54.77|Common|Bronze
4049|Thermal Destruction|Kill 5 enemies with a single thermal detonator.|13823|26 Jul 2018 2:56:41 PM|988|17945|5.51|Very Rare|Silver
4049|Master Jedi|Beat the game on Jedi difficulty without losing any lives.|13822|26 Jul 2018 8:36:40 AM|565|17945|3.15|Ultra Rare|Gold
4049|Right Out of the Sky|Kill 20 Mynocks while they are diving at you.|13821|25 Jul 2018 4:26:52 PM|1065|17945|5.93|Very Rare|Silver
526|Mysterious Foreigner Defeated|Defeat man in black suit in Chapter 5.|13820|24 Jul 2018 7:58:13 PM|28410|49277|57.65|Common|Bronze
526|Hasebe Defeated|Defeat Hasebe in Chapter 4.|13819|24 Jul 2018 7:33:07 PM|28883|49277|58.61|Common|Bronze
4049|Hot Shot|Destroy 20 TIE fighters in the X-wing trench level.|13818|24 Jul 2018 4:03:52 PM|1625|17945|9.06|Very Rare|Silver
526|Blogging Debut|Have your first Revelation.|13817|23 Jul 2018 10:08:35 PM|29111|49277|59.08|Common|Bronze
526|Substory Dabbler|Complete 10 substories.|13816|22 Jul 2018 1:33:51 PM|26723|49277|54.23|Common|Bronze
3992|Master Assassin|Earn every other trophy.|13815|22 Jul 2018 10:18:05 AM|43032|213521|20.15|Uncommon|Platinum
3992|Phantom|Learn every Stealth Skill as Evie.|13814|22 Jul 2018 10:18:05 AM|117289|213521|54.93|Common|Silver
3992|Bartitsu|Learn every Fight Skill as Jacob.|13813|22 Jul 2018 10:17:45 AM|118111|213521|55.32|Common|Silver
402|Team Veteran|Complete "Hydroponics" in Co-op Assault.|13812|21 Jul 2018 10:28:32 PM|3370|16213|20.79|Uncommon|Bronze
3992|Bare-Knuckle Champion|Win three different Fight Clubs.|13811|21 Jul 2018 7:24:10 AM|103417|213521|48.43|Uncommon|Bronze
4049|Not a Bad Bit of Rescuing|Rescue Princess Leia with Han Solo.|13810|20 Jul 2018 4:10:25 PM|1350|17945|7.52|Very Rare|Bronze
3992|Most Unsporting|Shoot fifty enemies before they shoot at you.|13809|19 Jul 2018 11:13:19 PM|48382|213521|22.66|Uncommon|Bronze
3992|No Ticket|Kick fifty enemies off of trains.|13808|19 Jul 2018 10:46:56 PM|45331|213521|21.23|Uncommon|Bronze
3992|Without a Grudge|Destroy 5000 destructibles with your carriage|13807|19 Jul 2018 10:14:03 PM|44724|213521|20.95|Uncommon|Bronze
3992|Guardian Angel|Successfully escort ten friendly cargo shipments.|13806|19 Jul 2018 9:40:44 PM|56831|213521|26.62|Uncommon|Bronze
402|Deadly|Kill 5 aliens with one shot (or witness another player doing this).|13805|19 Jul 2018 9:15:37 PM|7424|16213|45.79|Uncommon|Silver
402|Shocking|Stun 5 aliens with one stun grenade (or witness another player doing this).|13804|19 Jul 2018 9:04:12 PM|7423|16213|45.78|Uncommon|Silver
402|Tooling Up|Purchase an upgrade (or witness another player doing this).|13803|19 Jul 2018 8:03:15 PM|11046|16213|68.13|Common|Bronze
402|Vandal|Break the glass in a window (or witness another player doing this).|13802|19 Jul 2018 7:58:51 PM|14453|16213|89.14|Common|Bronze
3992|You Wouldn't Steal a Policeman's Helmet|Hijack twenty police vehicles.|13801|19 Jul 2018 12:04:00 AM|48159|213521|22.55|Uncommon|Bronze
3992|Keys to the City|Acquire all of the Gang Upgrades.|13800|18 Jul 2018 11:48:40 PM|78766|213521|36.89|Uncommon|Silver
3992|Godlike|Unlock all of the Secrets of London.|13799|18 Jul 2018 11:45:24 PM|67267|213521|31.5|Uncommon|Silver
3992|Treasure Hunter|Complete ten Raids of any type with Jacob or Evie.|13798|18 Jul 2018 9:42:18 PM|93192|213521|43.65|Uncommon|Bronze
3992|WHAT IS WRONG WITH YOU|Flip five vehicles by shooting their horses.|13797|18 Jul 2018 9:38:15 PM|88621|213521|41.5|Uncommon|Bronze
3992|Blade from Above|Air Assassinate twenty enemies from a zipline.|13796|18 Jul 2018 9:37:21 PM|63454|213521|29.72|Uncommon|Bronze
3992|A Quarter-Furlong at a Time|Finish first in 3 different Street Races.|13795|18 Jul 2018 9:21:04 PM|66150|213521|30.98|Uncommon|Bronze
3992|A Life in Letters|Collect all of the Royal Letters.|13794|18 Jul 2018 8:42:54 PM|54565|213521|25.55|Uncommon|Bronze
3992|Street Sweeping|Conquer all the boroughs in London|13793|18 Jul 2018 8:34:44 PM|97470|213521|45.65|Uncommon|Gold
3992|Multitalented|Acquire ten Perks.|13792|18 Jul 2018 8:03:06 PM|83054|213521|38.9|Uncommon|Bronze
3992|Furious|Destroy twenty vehicles by ramming them.|13791|18 Jul 2018 6:01:11 PM|76276|213521|35.72|Uncommon|Bronze
3992|Student of History|Collect all of the Historical Posters.|13790|18 Jul 2018 5:50:01 PM|59254|213521|27.75|Uncommon|Bronze
3992|Language of Flowers|Collect all of the Pressed Flowers.|13789|18 Jul 2018 5:12:06 PM|63914|213521|29.93|Uncommon|Bronze
3992|A Broad Base|Reach Loyalty level 1 with all Associates.|13788|18 Jul 2018 4:59:56 PM|80022|213521|37.48|Uncommon|Bronze
3992|Bedfellows, Strange or Otherwise|Reach maximum Loyalty with any Associate.|13787|18 Jul 2018 4:51:16 PM|109110|213521|51.1|Common|Silver
3992|The War at Home|Complete the World War I simulation.|13786|18 Jul 2018 4:51:15 PM|86575|213521|40.55|Uncommon|Bronze
4049|Han Shot First!|Play as Han Solo in the Cantina and shoot Greedo. (Yes, it's possible!)|13785|18 Jul 2018 7:59:28 AM|888|17945|4.95|Ultra Rare|Bronze
3992|Chimney Sweep|Synchronize every Viewpoint in London.|13784|17 Jul 2018 12:17:32 AM|85885|213521|40.22|Uncommon|Bronze
3992|Whirlwind of Death|Perform fifty Multi-Finishers.|13783|16 Jul 2018 11:58:46 PM|84656|213521|39.65|Uncommon|Bronze
3992|Cerevisaphile|Sample every beer brand in London.|13782|16 Jul 2018 10:34:52 PM|64093|213521|30.02|Uncommon|Bronze
3992|Mentor|Reach 100% Sync in the Main Memories|13781|16 Jul 2018 10:21:59 PM|49085|213521|22.99|Uncommon|Gold
3992|Artisan|Craft a Level 10 Item.|13780|16 Jul 2018 8:34:23 PM|94673|213521|44.34|Uncommon|Bronze
3992|Shall We Dance?|Complete Memory Sequence 9.|13779|16 Jul 2018 8:29:18 PM|106709|213521|49.98|Uncommon|Gold
3992|Wonder of the Age|Reach Level 10.|13778|16 Jul 2018 7:07:57 PM|107024|213521|50.12|Common|Silver
3266|Savior of Decima|Save all humans on Decima|13777|16 Jul 2018 12:45:15 PM|9534|40982|23.26|Uncommon|Bronze
3266|Savior of Ceres|Save all humans on Ceres|13776|16 Jul 2018 12:22:01 PM|10640|40982|25.96|Uncommon|Bronze
3992|The Joys of Freedom|Complete Memory Sequence 8.|13775|16 Jul 2018 9:59:11 AM|110937|213521|51.96|Common|Bronze
3992|All Is Fair in Politics|Complete Memory Sequence 7.|13774|15 Jul 2018 9:19:30 AM|113771|213521|53.28|Common|Bronze
3992|Friends at My Back|Recruit a gang of 5 allies.|13773|15 Jul 2018 6:50:00 AM|126663|213521|59.32|Common|Bronze
3992|Ordinary Criminal|Complete twenty Crowd Events.|13772|15 Jul 2018 6:43:48 AM|125732|213521|58.89|Common|Bronze
3992|Children's Aid Society|Complete five Child Liberation memories.|13771|15 Jul 2018 6:40:43 AM|139590|213521|65.38|Common|Bronze
3992|Flawless Conqueror|Secure three Gang Strongholds and complete their optional constraints.|13770|14 Jul 2018 11:01:27 AM|117193|213521|54.89|Common|Bronze
3992|A Run on the Bank|Complete Memory Sequence 6.|13769|14 Jul 2018 8:55:58 AM|122352|213521|57.3|Common|Bronze
3992|Needle in a Haystack|Kill five enemies from within the same haystack.|13768|11 Jul 2018 9:02:05 PM|58411|213521|27.36|Uncommon|Bronze
3992|The Perils of Business|Complete Memory Sequence 5.|13767|10 Jul 2018 9:39:14 PM|131568|213521|61.62|Common|Bronze
3992|Unqualified Success|Complete three Templar Hunts and their challenges.|13766|10 Jul 2018 8:16:26 PM|142063|213521|66.53|Common|Bronze
6015|I am the glorious Mr. Massagy!|Unlock all the trophies!|13765|10 Jul 2018 7:51:36 PM|10744|11109|96.71|Common|Platinum
6015|Average Joe|Finish with a two-star date 5 times with any character.|13764|10 Jul 2018 7:51:36 PM|10873|11109|97.88|Common|Bronze
6015|It's something...|Get two stars in any date.|13763|10 Jul 2018 7:50:43 PM|11005|11109|99.06|Common|Silver
6015|Proud of your job!|Discover Johnny's true job in Sarah's date.|13762|10 Jul 2018 7:49:57 PM|10765|11109|96.9|Common|Silver
6015|Bytes all over you!|Get a massagy with S.O.N.I.A.|13761|10 Jul 2018 7:47:31 PM|10771|11109|96.96|Common|Gold
6015|Hackerbruh!|Get three stars with S.O.N.I.A|13760|10 Jul 2018 7:46:59 PM|10771|11109|96.96|Common|Gold
6015|Duck killed!|Get killed by Nicole|13759|10 Jul 2018 7:43:02 PM|10895|11109|98.07|Common|Silver
6015|You'll be alone forever...|Fail 20 dates.|13758|10 Jul 2018 7:41:50 PM|10780|11109|97.04|Common|Gold
6015|Yo, where's your mojo?|Fail 10 dates.|13757|10 Jul 2018 7:39:59 PM|10811|11109|97.32|Common|Bronze
6015|You win some, you lose some!|Fail 5 dates.|13756|10 Jul 2018 7:39:03 PM|10882|11109|97.96|Common|Bronze
6015|You blew it!|Fail any date|13755|10 Jul 2018 7:38:13 PM|11025|11109|99.24|Common|Bronze
6015|How does this even work?|Get a massagy with Papu-Aiye|13754|10 Jul 2018 7:36:48 PM|10820|11109|97.4|Common|Bronze
6015|Expert Datemeister|Date all dates!|13753|10 Jul 2018 7:36:41 PM|10816|11109|97.36|Common|Bronze
6015|Smooth Criminal|Get three stars with all dates!|13752|10 Jul 2018 7:36:35 PM|10774|11109|96.98|Common|Gold
6015|Real people are overrated|Get three stars with Papu-Aiye|13751|10 Jul 2018 7:36:35 PM|10803|11109|97.25|Common|Silver
6015|Who you gonna massage?|Get a massagy with Anne|13750|10 Jul 2018 7:34:52 PM|10826|11109|97.45|Common|Bronze
6015|I hope that's ectoplasm|Get three stars with Anne|13749|10 Jul 2018 7:34:47 PM|10808|11109|97.29|Common|Silver
6015|What a dairy experience|Get a massagy with Dorothy|13748|10 Jul 2018 7:33:17 PM|10842|11109|97.6|Common|Bronze
6015|Moooossagy!|Get three stars with Dorothy|13747|10 Jul 2018 7:33:11 PM|10827|11109|97.46|Common|Silver
6015|It hurts so gooood...|Get a massagy with Janein|13746|10 Jul 2018 7:31:42 PM|10890|11109|98.03|Common|Bronze
6015|Don't put your massage in crazy, man|Get three stars with Janein|13745|10 Jul 2018 7:31:37 PM|10819|11109|97.39|Common|Silver
6015|Gotta love these app features|Get a massagy with Martha|13744|10 Jul 2018 7:28:38 PM|10867|11109|97.82|Common|Bronze
6015|Mother trucker!|Get three stars with Martha|13743|10 Jul 2018 7:28:37 PM|10819|11109|97.39|Common|Silver
6015|That's… a lot of toys|Get a massagy with Sarah|13742|10 Jul 2018 7:25:57 PM|10843|11109|97.61|Common|Bronze
6015|Sugar daddy time!|Get three stars with Sarah|13741|10 Jul 2018 7:25:54 PM|10848|11109|97.65|Common|Silver
6015|Slippery everywhere|Get a massagy with Mayo|13740|10 Jul 2018 7:23:18 PM|10864|11109|97.79|Common|Bronze
6015|Watch the cholesterol|Get three stars with Mayo|13739|10 Jul 2018 7:23:12 PM|10872|11109|97.87|Common|Silver
6015|Poking around|Tap the Mayonnaise|13738|10 Jul 2018 7:22:11 PM|10836|11109|97.54|Common|Bronze
6015|Careful with the claws|Get a massagy with Nicole|13737|10 Jul 2018 7:21:15 PM|10954|11109|98.6|Common|Bronze
6015|Awoo!|Get three stars with Nicole|13736|10 Jul 2018 7:21:09 PM|10840|11109|97.58|Common|Silver
6015|Tutorial with a happy ending|Get a massagy with Rial|13735|10 Jul 2018 7:17:10 PM|11021|11109|99.21|Common|Bronze
6015|You beat the Tuto-Rial!|Get three stars with Rial|13734|10 Jul 2018 7:17:00 PM|10938|11109|98.46|Common|Silver
5139|Platinum|Unlock every Trophy|13733|10 Jul 2018 5:49:27 PM|2946|4503|65.42|Common|Platinum
5139|Tile time|Finish a game of Mah-jong in less than 1 minute.|13732|10 Jul 2018 5:49:27 PM|3015|4503|66.96|Common|Gold
5139|Mah-jong Master and Commander|Finish all the games of Mah-jong.|13731|10 Jul 2018 5:26:47 PM|3107|4503|69.0|Common|Silver
5139|Mah-jong first mate|Finish half of all the games of Mah-jong.|13730|10 Jul 2018 3:50:52 PM|3219|4503|71.49|Common|Silver
5139|Triple-played|Finish 3 games of Mah-jong without reshuffling.|13729|10 Jul 2018 12:38:25 PM|3431|4503|76.19|Common|Silver
5139|Ruler o' the seas|Complete the Bonus Chapter (Any Difficulty).|13728|10 Jul 2018 12:02:17 PM|3641|4503|80.86|Common|Gold
5139|Seadog|Complete the game (Normal Difficulty).|13727|10 Jul 2018 10:56:43 AM|3780|4503|83.94|Common|Gold
5139|Aye, Captain!|Complete the game (Expert Difficulty).|13726|10 Jul 2018 10:56:43 AM|3293|4503|73.13|Common|Gold
5139|Unburied treasure|Collect all the Cursed Coins.|13725|10 Jul 2018 10:43:19 AM|3782|4503|83.99|Common|Gold
5139|Nay, Skipper|Finish all mini-games without using the ‘SKIP’ option.|13724|10 Jul 2018 10:43:05 AM|3504|4503|77.81|Common|Gold
5139|Self-guided tour|Finish all Hidden Object scenes without using any hints.|13723|10 Jul 2018 10:40:46 AM|3173|4503|70.46|Common|Gold
3992|Opium Scourge|Affect at least four enemies simultaneously with the Hallucinogenic Dart.|13722|9 Jul 2018 9:22:56 PM|80551|213521|37.73|Uncommon|Bronze
3992|A Quick and Reliable Remedy|Complete Memory Sequence 4.|13721|9 Jul 2018 7:14:29 PM|147838|213521|69.24|Common|Bronze
5139|Clocked|Finish any Hidden Object scene in less than 1 minute.|13720|9 Jul 2018 1:13:48 PM|3774|4503|83.81|Common|Silver
5139|Skulduggery|Finish 3 Hidden Object scenes without using any hints.|13719|9 Jul 2018 12:49:34 PM|3959|4503|87.92|Common|Gold
5139|Lucky roll|Finish 3 mini-games without using the ‘SKIP’ option.|13718|9 Jul 2018 12:45:59 PM|4088|4503|90.78|Common|Bronze
5139|Sureshot|Finish any Hidden Object scene with less than 5 mistakes.|13717|9 Jul 2018 12:29:49 PM|3799|4503|84.37|Common|Gold
4049|The Walking Carpet|Defeat three bosses with Chewbacca.|13716|9 Jul 2018 9:03:52 AM|1158|17945|6.45|Very Rare|Silver
4049|No Match for a Good Blaster|Obtain the highest level blaster.|13715|8 Jul 2018 1:50:52 PM|3108|17945|17.32|Rare|Bronze
4049|Saw it Coming|Beat the Dune Sea level without getting hit by a sandworm.|13714|8 Jul 2018 12:50:28 PM|3563|17945|19.86|Rare|Bronze
3992|Thieftaker|Bring three Bounty targets back alive.|13713|8 Jul 2018 9:02:20 AM|152400|213521|71.37|Common|Bronze
5128|Does not play well with others|Complete a kitchen in versus mode|13712|8 Jul 2018 7:43:36 AM|13893|33024|42.07|Uncommon|Bronze
2430|The Dark Soul|Acquire all trophies|13711|7 Jul 2018 9:08:59 AM|24920|159399|15.63|Rare|Platinum
2430|Master of Miracles|Learn all miracles|13710|7 Jul 2018 9:08:58 AM|27766|159399|17.42|Rare|Silver
1927|Saddle up, partner|Beat Mad Dog in multiplayer.|13709|7 Jul 2018 9:01:23 AM|128|441|29.02|Uncommon|Silver
1927|Still got it|Hit all 3 practice targets. ( single player )|13708|7 Jul 2018 8:46:45 AM|251|441|56.92|Common|Bronze
1927|Fool's Gold|Get the "good" ending. ( single player )|13707|7 Jul 2018 8:44:42 AM|148|441|33.56|Uncommon|Gold
1927|Snake oil sales are up|Get to the treasure with the Professor. ( single player )|13706|7 Jul 2018 8:35:08 AM|176|441|39.91|Uncommon|Bronze
1927|Bonnie and...|Get to the treasure with Buckskin Bonnie. ( single player )|13705|7 Jul 2018 8:09:33 AM|202|441|45.8|Uncommon|Bronze
1927|Old Dog, same tricks|Defeat Mad Dog. ( single player )|13704|7 Jul 2018 7:57:50 AM|189|441|42.86|Uncommon|Gold
1927|Cowboys and Indians|Get to the treasure with shooting beaver. ( single player )|13703|7 Jul 2018 7:46:53 AM|198|441|44.9|Uncommon|Bronze
1927|Bang! Bang!|Hit 12 shots in a row without missing or reloading. ( single player )|13702|7 Jul 2018 7:43:45 AM|118|441|26.76|Uncommon|Silver
1927|Bang!|Hit 6 shots in a row without missing or reloading. ( single player )|13701|7 Jul 2018 7:43:11 AM|245|441|55.56|Common|Bronze
1810|Crack shot|Shoot 3 bottles out of the air without missing. ( single player )|13700|7 Jul 2018 7:32:03 AM|273|1159|23.55|Uncommon|Silver
4049|Ootini|Kill 20 Jawas in one sandcrawler level.|13699|6 Jul 2018 2:10:51 PM|5587|17945|31.13|Uncommon|Bronze
4049|If Only I'd Gone to Tosche Station!|Run out of landspeeder fuel when you are not facing Mos Eisley or the Sandcrawler.|13698|6 Jul 2018 2:10:04 PM|2607|17945|14.53|Rare|Bronze
3266|Pilot of Ferox|Complete the game with Ferox|13697|6 Jul 2018 9:07:20 AM|7643|40982|18.65|Rare|Bronze
1810|Mad Dog|Defeat Mad Dog. ( single player )|13696|5 Jul 2018 10:13:15 PM|382|1159|32.96|Uncommon|Gold
1810|My mistake, twelve coffins|Shoot twelve enemies in a row without missing or reloading. ( single player )|13695|5 Jul 2018 9:59:18 PM|336|1159|28.99|Uncommon|Gold
1810|Hey, Stranger!|Save the prospector from the bandits. ( single player )|13694|5 Jul 2018 9:34:39 PM|589|1159|50.82|Common|Bronze
1810|Come here often?|Get the keys from the barmaid. ( single player )|13693|5 Jul 2018 9:29:52 PM|435|1159|37.53|Uncommon|Silver
1810|Get six coffin's ready|Shoot six enemies in a row without missing or reloading. ( single player )|13692|5 Jul 2018 9:23:34 PM|621|1159|53.58|Common|Silver
1810|Cheap Shot|Get shot by the hidden shooter in the window. ( single player )|13691|5 Jul 2018 9:15:12 PM|834|1159|71.96|Common|Bronze
1810|Didn't shoot the deputy|Try to save the sheriff without the keys. ( single player )|13690|5 Jul 2018 9:13:58 PM|574|1159|49.53|Uncommon|Bronze
992|Choice is Good|Receive both endings.|13689|5 Jul 2018 9:00:29 PM|8319|52468|15.86|Rare|Gold
992|Complete The Game|Rescue Alissa and complete the game.|13688|5 Jul 2018 9:00:17 PM|8446|52468|16.1|Rare|Silver
992|Accelerate Your Hero|Complete Episode 3.|13687|5 Jul 2018 8:59:25 PM|8500|52468|16.2|Rare|Silver
992|Buddha Says|Complete Episode 2.|13686|5 Jul 2018 7:59:35 PM|9431|52468|17.97|Rare|Bronze
992|Points III|Score 50,000 points.|13685|5 Jul 2018 7:40:40 PM|10189|52468|19.42|Rare|Silver
2677|Determination|I will succeed!|13684|5 Jul 2018 10:56:11 AM|8302|16083|51.62|Common|Bronze
2677|Cowboy|Clint would be proud!|13683|5 Jul 2018 10:12:55 AM|8647|16083|53.76|Common|Bronze
2677|The End|To another world...|13682|5 Jul 2018 10:01:45 AM|6932|16083|43.1|Uncommon|Gold
2677|Last battle|Invincible!|13681|5 Jul 2018 9:54:10 AM|6978|16083|43.39|Uncommon|Bronze
2677|Gladiator|The glory was short.|13680|5 Jul 2018 9:52:53 AM|6992|16083|43.47|Uncommon|Bronze
2677|Free fall|Splashhhhh!|13679|5 Jul 2018 9:22:30 AM|7248|16083|45.07|Uncommon|Silver
2677|Escape water|Quite a sprinter!|13678|5 Jul 2018 8:55:25 AM|10514|16083|65.37|Common|Bronze
2677|Warrior|Armed to the teeth!|13677|5 Jul 2018 8:42:10 AM|11948|16083|74.29|Common|Bronze
2677|Explorer|Vertigo from beyond the grave.|13676|5 Jul 2018 8:33:31 AM|13119|16083|81.57|Common|Silver
2677|Secret UFO|Espace it!|13675|5 Jul 2018 8:25:30 AM|7067|16083|43.94|Uncommon|Silver
2677|First shield|Protect from lasers!|13674|5 Jul 2018 8:25:10 AM|13566|16083|84.35|Common|Bronze
2677|Mega shoot|Destroy any obstacle!|13673|5 Jul 2018 8:25:04 AM|13112|16083|81.53|Common|Bronze
2677|Survivor|From bad to worse.|13672|5 Jul 2018 8:24:18 AM|14323|16083|89.06|Common|Bronze
992|Points II|Score 30,000 points.|13671|4 Jul 2018 10:50:22 PM|15509|52468|29.56|Uncommon|Silver
992|Points I|Score 10,000 points.|13670|4 Jul 2018 9:46:10 PM|28182|52468|53.71|Common|Bronze
992|Unknown Territory|Finish the first page.|13669|4 Jul 2018 9:44:11 PM|31683|52468|60.39|Common|Bronze
992|Orange Bull|Use the Iced Tea to restore your health.|13668|4 Jul 2018 9:42:40 PM|34692|52468|66.12|Common|Bronze
992|Rats!|Rescue and pick up Roadkill.|13667|4 Jul 2018 9:39:32 PM|48027|52468|91.54|Common|Bronze
992|3rd Grade|Use a paper airplane.|13666|4 Jul 2018 9:35:41 PM|15834|52468|30.18|Uncommon|Bronze
992|Boo-Ya!|Use the dynamite.|13665|4 Jul 2018 9:35:05 PM|36541|52468|69.64|Common|Bronze
2112|Money Bags|Find all the Magic Diamonds.|13664|4 Jul 2018 9:24:54 PM|7524|69468|10.83|Rare|Silver
2112|Masters of Illusion|Complete all Castle Statues.|13663|4 Jul 2018 9:23:57 PM|8848|69468|12.74|Rare|Silver
2112|Quackshot|Collect all of Donald's Chili Peppers.|13662|4 Jul 2018 8:30:21 PM|9948|69468|14.32|Rare|Silver
2112|World of Illusion|Collect all the Magic Playing Cards.|13661|4 Jul 2018 7:25:20 PM|11290|69468|16.25|Rare|Silver
2112|Superbounce|Bounce on 7 enemies in a row without touching the ground.|13660|4 Jul 2018 7:18:54 PM|11987|69468|17.26|Rare|Bronze
2601|Trophy of Gaia|Unlock all God of War® II Trophies|13659|4 Jul 2018 4:18:23 PM|5605|21014|26.67|Uncommon|Platinum
2601|Feel the Urn|Collect and use at least 2 Urns of Power|13658|4 Jul 2018 4:18:23 PM|7104|21014|33.81|Uncommon|Gold
2601|Eye Sore|Collect 20 Cyclops Eyes|13657|4 Jul 2018 4:15:28 PM|6270|21014|29.84|Uncommon|Silver
2601|Stoner|Stone and Shatter 30 Enemies|13656|4 Jul 2018 3:38:09 PM|8586|21014|40.86|Uncommon|Bronze
2601|Bleeding Thumbs|Beat the Challenge of the Titans|13655|4 Jul 2018 3:30:57 PM|5783|21014|27.52|Uncommon|Gold
2112|Tick Tock|Complete a stage in Time Attack.|13654|3 Jul 2018 11:15:53 PM|23479|69468|33.8|Uncommon|Bronze
2112|Masters of Illusions|Defeat Mizrabel and rescue Minnie.|13653|3 Jul 2018 10:43:33 PM|18907|69468|27.22|Uncommon|Gold
2112|Illusion Breaker|Break the illusion of 25 enemies with projectiles.|13652|2 Jul 2018 10:59:59 PM|35765|69468|51.48|Common|Bronze
2112|Fortune Hunter|Find 50% of all Magic Diamonds.|13651|2 Jul 2018 10:59:18 PM|26421|69468|38.03|Uncommon|Bronze
2112|Disillusioned|Break the illusion of 75 enemies.|13650|2 Jul 2018 10:04:36 PM|43349|69468|62.4|Common|Bronze
2112|Castle Decor|Complete a Castle Statue.|13649|2 Jul 2018 9:43:23 PM|27430|69468|39.49|Uncommon|Bronze
2112|Pretty Picture|Collect 50 Diamonds to unlock your first Painting in the Castle|13648|2 Jul 2018 9:38:07 PM|58046|69468|83.56|Common|Bronze
4710|Thy Flesh Consumed|Earn all Trophies|13647|2 Jul 2018 9:04:06 PM|19525|152576|12.8|Rare|Platinum
4710|Shareware|Create and publish a SnapMap|13646|2 Jul 2018 9:04:06 PM|30355|152576|19.9|Rare|Bronze
4710|Entryway|Complete the SnapMap Basic and Advanced Tutorials|13645|2 Jul 2018 8:58:23 PM|27509|152576|18.03|Rare|Bronze
4710|No Rest for the Living|Play 5 published SnapMaps|13644|2 Jul 2018 8:12:42 PM|36057|152576|23.63|Uncommon|Bronze
1768|Skirt Destroyer|As Candy unequip armor each Arcade stg or break her lower armor after 10 straight wins in Offline VS|13643|2 Jul 2018 7:25:42 PM|4264|9673|44.08|Uncommon|Gold
1768|Who needs armor?|Unequip armor in Arcade Mode or Offline Versus (quickly input →←→←+P+K+D)|13642|2 Jul 2018 7:06:54 PM|4479|9673|46.3|Uncommon|Bronze
1768|Ranking Mode|Play Ranking Mode in Arcade Mode (hold down P+K+D+START button during Attract Mode)|13641|2 Jul 2018 6:25:39 PM|5201|9673|53.77|Common|Bronze
1768|Kids Mode|Select game settings in Arcade Mode or Offline Versus while holding L1 button+R1 button to activate Kids Mode|13640|2 Jul 2018 6:16:26 PM|5420|9673|56.03|Common|Bronze
1768|Class of '95|Select game settings in Arcade Mode while holding the □ button to enter Attract Mode|13639|2 Jul 2018 6:13:08 PM|5216|9673|53.92|Common|Bronze
1768|Perfect|Win a round without receiving any damage in Arcade Mode (any difficulty)|13638|2 Jul 2018 6:09:46 PM|6423|9673|66.4|Common|Silver
1768|Stage 4 Complete|Complete Stage 4 of Arcade Mode (any difficulty)|13637|2 Jul 2018 5:59:52 PM|7032|9673|72.7|Common|Bronze
1768|Stage 3 Complete|Complete Stage 3 of Arcade Mode (any difficulty)|13636|2 Jul 2018 5:58:45 PM|7340|9673|75.88|Common|Bronze
1768|Stage 2 Complete|Complete Stage 2 of Arcade Mode (any difficulty)|13635|2 Jul 2018 5:57:49 PM|8141|9673|84.16|Common|Bronze
1768|Wall Breaker|Destroy a stage wall in Arcade Mode or Offline Versus|13634|2 Jul 2018 5:56:55 PM|7787|9673|80.5|Common|Bronze
1768|Stage 1 Complete|Complete Stage 1 of Arcade Mode (any difficulty)|13633|2 Jul 2018 5:56:48 PM|8864|9673|91.64|Common|Bronze
1768|Armor Destroyer|Break an opponent's armor in Arcade Mode or Offline Versus|13632|2 Jul 2018 5:56:40 PM|8415|9673|86.99|Common|Bronze
1768|Mahler|Use Mahler in Arcade Mode or Offline Versus (move cursor left of Grace during character selection)|13631|2 Jul 2018 5:55:56 PM|6109|9673|63.16|Common|Bronze
5235|Playing House|Use all available options for developing Corvo Bianco.|13630|2 Jul 2018 5:43:27 PM|9372|13183|39.45|Uncommon|Bronze
5235|Hasta la Vista™|Kill a frozen opponent with a crossbow bolt.|13629|2 Jul 2018 5:41:27 PM|4167|13183|17.54|Rare|Bronze
4456|OCD|Get all other trophies in the game|13628|2 Jul 2018 4:56:35 PM|30301|76236|39.75|Uncommon|Platinum
4456|Mental Patience|Play the whole game without skipping a cutscene|13627|2 Jul 2018 4:56:35 PM|33344|76236|43.74|Uncommon|Bronze
4456|...Take on the Words!|Sit through the end credits|13626|2 Jul 2018 10:59:21 AM|34328|76236|45.03|Uncommon|Bronze
4456|Yesterday's News|Defeat Purple Tentacle yesterday|13625|2 Jul 2018 10:55:07 AM|35568|76236|46.66|Uncommon|Gold
4456|Music Appreciation Award|Reach yesterday without turning the stereo off|13624|2 Jul 2018 10:47:28 AM|31045|76236|40.72|Uncommon|Bronze
4456|Flush|Acquire a diamond|13623|2 Jul 2018 10:46:49 AM|35778|76236|46.93|Uncommon|Silver
4456|Master Plumber|Flush 50 objects through time|13622|2 Jul 2018 10:44:00 AM|31790|76236|41.7|Uncommon|Bronze
4456|Number One|Power Hoagie's Chron-o-John|13621|2 Jul 2018 10:38:05 AM|35906|76236|47.1|Uncommon|Silver
4456|That Should Have Worked|Hoagie uses battery with Chron-o-John instead of plug|13620|2 Jul 2018 10:37:49 AM|31956|76236|41.92|Uncommon|Bronze
4456|Rap Sheet: Adventure Gamer|Pick up 45 things that don't belong to you|13619|2 Jul 2018 10:33:19 AM|35840|76236|47.01|Uncommon|Bronze
4456|Behind Every Great Man Is a Quality Roadie|Red makes a super battery with only a little help from Hoagie|13618|2 Jul 2018 10:33:00 AM|36114|76236|47.37|Uncommon|Bronze
